id;arrêt;date;juridiction;lien;id
189207240;"« Le Tribunal ;   « Attendu que Chaumeil et Verdié, créanciers envers   la commune d'Agen en une somme de 56,804 fr. 59 c,  sauf accessoires, en vertu d'une décision rendue par le  Conseil de préfecture de Lot-et-Garonne, ont pris ins- cription d'hypothèque judiciaire sur tous les biens im- meubles constituant le domaine privé de la commune,  à la date du 7 janvier 1891 ;   « Attendu que suivant contrat au rapport de Me Bar-  rère, notaire à Agen, en date du 7 avril dernier, la ville  d'Agen ayant vendu à messieurs Chaumeil jeune et ne- veu un immeuble désigné avec détail audit contrat et  dépendant de son domaine privé, l'inscription ci-dessus  rappelée du 7 janvier 1891, révélée par l'état hypothé- caire délivré sur la transcription de cet acte, a mis  obstacle au payement entre les mains de M, le maire de- là ville d'Agen du prix de la vente quittancé au con- trat;   « Attendu que c'est dans ces circonstances que MM.   Chaumeil et Verdié ont, par exploit séparé, fait com- mandement à M. le maire de la commune d'Agen, pris  en cette qualité, et à MM. Chaumeil jeune et neveu pris  comme tiers détenteurs, d'avoir à leur payer le montant  de leur créance sur la ville d'Agen, à concurrence tou- tefois pour ces derniers du prix de leur acquisition ac- cepté par MM. Chaumeil et Verdié;   « Attendu que MM. Chaumeil jeune et neveu ont fait  opposition au commandement qui leur a été signifié et  ont en même temps appelé la commune d'Agen. dans  l'instance pour s'entendre condamner à prendre leur  fait et cause et, en outre, à rapporter la main-levée de  l'inscription prise au profit de MM. Chaumeil et Verdié,  et grevant l'immeuble par eux acquis ;   « Attendu que, de son côté, la ville d'Agen a fait op-  position au commandement dirigé contre elle et a assi- gné tant les sieurs Chaumeil et Verdié que Chaumeil  jeune et neveu, pour voir dire par un jugement commun  à toutes parties que c'est sans droit que MM. Chaumeil  et Verdié ont pris inscription d'hypothèque judiciaire  contre la ville d'Agen, que ladite inscription est nulle,  et en outre pour avec les sieurs Chaumeil jeune et ne- veu entendre dire que nul obstacle ne peut être mis par  eux au retrait des 32,000 francs formant le prix de la  vente du 7 avril dernier, ni à leur emploi suivant leur   affectation ;   « Attendu que les actions ainsi introduites s agitent   entre les mêmes parties; qu'elles ont le même objet;  qu'il y a donc lieu de les joindre pour statuer sur le tout   par un seul et même jugement;   « Attendu que l'inscription prise par MM. Chaumeil   et Verdié résulte d'un arrêté rendu par le Conseil de  préfecture de Lot-et-Garonne, et qu'aux termes de l'ar- ticle 49 de la loi des 22 et 24 juillet 1889, ces arrêtés sont  exécutoires et emportent hypothèque ;   « Attendu qu'aux termes de l'article 2118 du Code   civil, sont susceptibles d'hypothèques tous les biens  immobiliers qui sont dans le commerce ; que les im- meubles dépendant du domaine privé des communes  sont susceptibles d'être grevés de droits réels, d'être  prescrits et même d'être aliénés, en suivant les forma- lités exigées par la loi ; qu'ils peuvent donc être consi- dérés comme appartenant à la catégorie des biens qui  sont dans le commerce et sont par suite susceptibles  d'être grevés d'hypothèques ;   « Que ces principes ne sont d'ailleurs pas contestés   par la commune d'Agen qui reconnaît qu'elle est par- faitement libre de conférer sur les biens de son domaine  privé une hypothèque conventionnelle, mais qu'elle  soutient que les mêmes biens ne sauraient être grevés  d'hypothèques judiciaires, par cette raison que les rè- gles particulières du droit administratif qui régissent le  patrimoine des communes ne permettent pas à leurs  créanciers de poursuivre contre elles le payement de  leurs créances par les voies ordinaires,et que ces créan- ciers sont toujours obligés de s'adresser à l'autorité  administrative nour obtenir l'inscription de leur créance  administrative pour obtenir l'inscription de leur créance  au budget,d'où la commune d'Agen conclut à l'inutilité  absolue d'une hypothèque judiciaire et même à l'impos-  sibilité de son existence ;   « Mais attendu que, en indiquant les règles d'après   lesquelles les communes doivent disposer de leurs res- sources, la loi du 5 avril 1884 prévoit également le cas  où une commune refuserait de faire droit aux réclama- tions de ses créanciers et donne à ces derniers porteurs  d'un titre exéeutoire, eertains moyens de coercition,  tel que le droit de demander à l'autorité supérieure  l'inscription d'office de leurs créances au budget com- munal et même le droit de provoquer la vente des biens  de la commune en s'adressant au chef de l'Etat;   « Qu'il est également de principe constant, en droit  administratif, que l'on peut demander aux tribunaux et  obtenir des condamnations contre les communes ; que  la seule chose qui ne soit pas permise à un particulier,  c'est de poursuivre contre la commune par les voies de  droit commun l'exécution de la condamnation obtenue,  (Avis du Conseil d'Etat du 12 août 1807 et 26 mai  1813.)   « Que s'il est permis d'obtenir condamnation contre   une commune, et si le domaine privé de cette com- mune est susceptible d'hypothèque, on ne voit pas  pour quelle raison juridique un créancier porteur d'un  jugement de condamnation emportant hypothèque ju- diciaire serait privé du droit de prendre inscription sur  les biens dépendant du domaine privé de sa débitrice ;  Qu'en effet, l'hypothèque est susceptible de produire  divers effets juridiques :   « Que si les règles du droit administratif paralysent   entre les mains du créancier le droit de provoquer la  vente des biens de la commune en ce sens qu'il ne peut  employer les voies ordinaires et doit recourir àl'interven- tion du chef de l'Etat, il ne saurait s'en suivre que l'hy- pothèque judiciaire ne peut exister puisque indépen- damment du droit qu'elle donne au créancier de pour- suivre la vente des immeubles dont elle est grevée,  l'hypothèque en tant que droit réel assure au créan- cier le double avantage d'être préféré sur le prix des  immeubles grevés et de pouvoir suivre ces immeubles  en quelques mains qu'ils passent ;   « Que l'objection tirée par la commune d'Agen, de   l'impossibilité où se trouve tout créancier de provoquer  par les voies ordinaires la vente des immeubles grevés  s'appliquerait aussi bien à l'hypothèque convention- nelle qu'à l'hypothèque judiciaire, que cependant la  commune est bien obligée de reconnaître que ses biens  privés sont susceptibles d'être grevés d'hypothèque  conventionnelle.   < Qu'on ne voi t pas pour quelle raison un créancier   qui aurait obtenu d'un Tribunal administratif ou judi- ciaire la reconnaissance de ses droits contestés par une  commune, serait privé de la garantie accessoire qui as- sortit tout jugement de condamnation, alors que le  créancier porteur d'un titre conventionnel, pourrait en  vertu d'une hypothèque volontairement conférée, exer- cer un droit de préférence sur le prix des immeubles  vendus.   «. Que la doctrine reconnaît d'ailleurs à tout créan- cier, porteur d'un jugement emportant hypothèque ju- diciaire, le droit de prendre inscription sur les biens dé- pendant du domaine privé d'une commune par cette  raison évidente que l'hypothèque, en même temps  qu'elle peut devenir un moyen d'exécution, est avant  tout, un acte conservatoire destiné à assurer a son bé- néficiaire un droit de préférence sur le prix des biens  immeubles de son débiteur lorsqu'ils seront vendus.   (Rousseau et Lainé, voir exécution des jugements et   actes numéros 200 ; Cormenin, tome 1, page 424, nu- méro 1 ; Chauveau, procédure administrative, nu- méro 867).   « Qu'ainsi donc, si un jugement emportant hypothè-  que judiciaire, n'a point autant d'utilité quand il est'  rendu contre une commune que lorsqu'il est rendu  contre un particulier, il n'en est pas moins certain qu'il  a une efficacité incontestable, celle d'assurer au créan- cier un droit de préférence sur le prix des immeubles  appartenant à sa débitrice ;   <r Que l'on ne voit dans l'exercice de ce droit aucune  incompatibilité avec les règles spéciales qui régissent la  disposition des ressources des communes ; que l'hypo- thèque prise par Messieurs Chaumeil et Verdié, a donc  pu valablement frapper le terrain dépendant du domaine  privé de la commune d'Agen, qui a été vendu à Mes- sieurs Chaumeil jeune et neveu ;   « Qu'il importe peu qu'en aliénant ce terrain, la com-  mune ait indiqué dans une délibération de son conseil  municipal régulièrement approuvée, l'emploi qu'elle  voulait faire du prix à en provenir ; qu'en effet, si l'hy- pothèque prise par MM. Chaumeil et Verdié, a valable- ment frappé l'immeuble dont s'agil, il n'a pu dépendre  de la commune d'en détruire l'effet en disposant par  avance du prix des immeubles sur lesquelles elle  portait ;   « Qu'il est manifeste qu'en indiquant au point de vue   administratif les règles d'après lesquelles les communes  doivent disposer de leurs ressources, la loi du 5 avril  1884, n'a pu vouloir les autoriser à régler leur budget  sans tenir compte des droits de leurs créanciers; qu'un  pareil résultat serait contraire aux règles les plus élé- mentaires ; — qu'un budget communal est d'ailleurs  essentiellement révisable ; — qu'il sera facile à la com- mune d'Agen de modifier son budget et d'affecter par  une nouvelle délibération régulièrement approuvée, soit  le prix de l'immeuble vendu, soit tout autre ressource  au paiement de sa dette ;   « Que la vente volontairement consentie à MM. Chau-  meil jeune et neveu, dispensait d'ailleurs MM. Chaumeil  et Verdié de recourir à l'intervention du chef de l'Etat,  conformément à l'article 110, de la loi du 5 avril 1884,  et qu'en s'adressant à MM. Chaumeil jeune et neveu,  pris en qualité de tiers détenteurs à défaut de paiement  par la commune sur le commandement à elle signifié,   MM. Chaumeil et Verdié, n'ont procédé à aucun acte  d'exécution contre la commune ;   « Attendu, enfin, que la commune d'Agen doit ga-  rantie à MM. Chaumeil jeune et neveu ses acquéreurs,  qu'elle a d'ailleurs pris formellement l'engagement de  rapporter main-levée de toutes inscriptions que l'ac-  complissement des formalités hypothécaires pourrait  révéler :   « Par ces motifs,   « Déclare valable l'inscription d'hypothèque judi- ciaire, pris au profit de MM. Chaumeil et Verdié, sur les  biens immeubles dépendant du domaine privé de ladite  commune d'Agen, le 7 janvier 1891 ;   « Dit en conséquence que ladite commune sera tenue   de rapporter la main levée de ladite inscription dans le  délai de trois mois à compter de ce jour, faute de quoi,   dit que la commune d'Agen,devrareleveret garantir MM.  Chaumeil jeune et neveu, des réclamations formulées  contre eux par MM. Chaumeil et Verdié;   « Condamne la commune d'Agen en tous les dé-  pens. »";18 juillet;COUR D'APPEL D'AGEN lr« ch;http://www.enap.justice.fr/ARCHIVE/ENAP_GAZETTE_TRIBUNAUX_18920724.pdf;189207240
189207250;"« Le Tribunal ;   « Sur la demande principale :   « Attendu que suivant assignation du 21 novembre   1891, Soupeaux a formé contre Lalé et Sintier une de- mande en remboursement de 3,069 francs, pourprix de  4 actions de chasse et en payement de 3,000 francs à  titre de dommages-intérêts ;   « Attendu qu'il résulte des documents de la cause et   de la correspondance échangée entre les parties que  Lalé et Sintier, affirmant et garantissant qu'ils étaient  conjointement locataires du droit de chasse sur la ferme  de Passy, commune de Chevry-Cassigny (Seine-et- Marne), et Sintier affirmant et garantissant de son côté  qu'il était seul locataire de la chasse dans le bois de  Passy, ont mis en commun leurs deux chasses et  formé une Société, divisée en huit parts ou actions,  pour l'année 1891-1892, commençant en septembre  même année ;   « Attendu que Soupeaux est devenu l'un des socié-  taires, avec 4 actions, et après qu'il eût été respective- ment arrêté et convenu : 1° que Lalé et Sintier garan- tissaient, chacun dans la proportion de ses droits, aux  actionnaires le droit exclusif de chasse sur la ferme et  le bois de Passy ; 2"" qu'on ne chasserait pas les diman- ches et jours fériés, sauf accord contraire des action- naires ; 3° que toute décision ou modification concer- nant la chasse ne pourrait avoir lieu sans l'assentiment  des actionnaires, et enfin 4° qu'un sieur Marest ne ferait  en aucune l'açon partie de la chasse ;   « Attendu que, malgré ces stipulations et conven-  tions, il est établi et non dénié que, dès l'ouverture de  la chasse, soit le dimanche 20 septembre 1891, Marest  fut surpris chassant dans le bois de Passy, en compa- gnie d'un autre chasseur et de deux rabatteurs, que  procès-verbal fut dressé contre lui ; et que dès le 22 du   même mois, par acte judiciaire de Saint-Martin, huis- sier à Paris, Soupeaux protesta, sous toutes réserves,  contre l'inexécution des conventions ; qu'il renouvelo  cette protestation par acte du 11 novembre sui- rant ;   Attendu, déplus, que Marest éleva la prétention qu'il   était, conjointement avec Sintier, locataire du droit de  chasse dans le bois de Passy ;   « Attendu que les prétentions soulevées par Marest,   et les explications confuses et contradictoires fournies  par Sintier ont mis Soupeaux dans l'impossibilité  d'exercer utilement son droit de chasse, et lui ont oc- casionné une gêne et un dommage dont réparation lui  est due ;   « Attendu que Lalé ne conteste pas les faits ci-des-  sus mentionnés et s'en rapporte à justice, en ce qui  concerne le remboursement des actions, concluant à  une réduction sur le chiffre des dommages-intérêts ;   Que Sintier, au contraire, soutient que la présence   de Marest, les jours de chasse, n'a pas été une cause de  trouble pour l'exercice des droits appartenant à Sou- peaux ; qu'il ajoute qu'il n'a jamais été convenu entre  les actionnaires que Marest ne ferait pas partie de la  chasse ;   « Que sur le premier point, les sommations dûment   signifiées à la requête de Soupeaux les 22 septembre et  11 novembre 1891, ainsi que tous les éléments de la  cause établissent que la personnalité de Marest et ses  agissements étaient un obstacle à ce paisible exercice  du droit de chasse des actionnaires, et que sur le  deuxième point, Sintier est contredit par sa propre cor- respondance, dans laquelle, notamment, à la date du  20 octobre 1891, il était d'accord pour déclarer que Ma- rest ne devait pas faire partie de la chasse, et pour re- connaître que Soupeaux n'avait pris ses quatre actions  que sous cette condition ;   « Attendu en l'état que l'offre de preuve et l'articula-  tion des faits proposées par Sintier sont sans effet et  doivent être écartées; que d'ailleurs les faits cotés sous  le numéro 1 et suivant lesquels, une certaine quantité  de gibier aurait été abattu dans huit parties de chasse,  auxquelles Soupeaux et Lallé ont pris part, ne sont pas  contestés, et que les faits cotés sous le numéro 2 et sui- vant lesquels Marest aurait pris part à six de ces chas- ses, sans protestation, sont contredits dès maintenant  par les actes extrajudiciaires ci-dessus rappelés ;   « Attendu que Lalé et Sintier ayant conjointement   garanti à Soupeaux le droit exclusif de la chasse dont  s'agit, sont tenus des conséquences de l'inexécution  des conventions arrêtées entre les parties;   « Attendu toutefois que Soupeaux ayant joui pour   partie de son droit de chasse, il n'y a pas lieu de lui ac- corder le remboursement intégral du prix de ses ac- tions; que le Tribunal a les éléments d'appréciation  nécessaires pour fixer à 500 fr. par action le montant  du remboursement, ensemble 2,000 fr.; que d'autre  part il échet d'évaluer à 500 fr. le préjudice causé à  Soupeaux pour trouble dans l'exercice de son droit de  chasse, et de lui accorder la dite somme à titre de dom- mages-intérêts ;   « Attendu enfin qu'il est justifié par Soupeaux et non   dénié par les défendeurs, qu'il a fait des fournitures de.  vin, s'élevant à 177 francs, dont le prix lui est dû;   « Attendu que Soupeaux réclame une condamnation   I. SUR";4 juin;TRIBUNAL CIVIL DE LA SEINE 3° ch;http://www.enap.justice.fr/ARCHIVE/ENAP_GAZETTE_TRIBUNAUX_18920725.pdf;189207250
189207270;"« Le Tribunal;  « Attendu que ia police, en date de Londres du 16   avril 1880, sur laquelle Talon base sa demande, énonce  savoir :   « Article 2. — La prime doit être payée d'avance   pour l'année.Les primes successives doivent être payées  à l'époque fixée par la police, comme échéance de la  prime, ou, au plus tard, dans le délai de trente jours,  mais faute de payement de la prime avant l'expiration  de ce délai, la police devient nulle et cette annulation  prend date du jour de l'échéance. Ces dispositions sont  applicables aux polices à primes semestrielles ou tri- mestrielles; le défaut de payement d'une de ces frac- tions de la prime annuelle entraîne la déchéance de la  police....; l'annulation de la police aura lieu de plein  droit et sans aucune mise en demeure ou demande en   justice ;   Article 12 : « La propriété des polices est transmissi-  ble, mais à la condition que la Compagnie soit avertie  de la cession. La Compagnie accusera réception, de  Londres, de l'avis de transfert sans contracter pour cela  une obligation spéciale »";14 avril;COUR D'APPEL DE PARIS 6° ch;http://www.enap.justice.fr/ARCHIVE/ENAP_GAZETTE_TRIBUNAUX_18920727.pdf;189207270
189207280;"« La Cour,  « Adoptant les motifs des premiers juges tant sur le   fond que sur la fin de non-recevoir tirée de l'autorité  de la chose jugée et tous autres moyens de non-rece- vabilité, notamment celui relatif à la prescription édic- tée par l'article 1304 du Code civil ;   « Attendu, en outre, que la loi des 7-11 mai 1849 a  eu pour but, de même que la loi du 12 mai 1835, d'a- bolir, sous réserves de mesures transitoires, les majo- rats pour l'avenir, afin de rétablir dans les familles  l'entière égalité en détruisant un privilège contraire à  l'esprit de notre législation ; que la loi des 7 et 11 mai  1849 a modifié celle du 12 mai 1535 en apportant par  son article 2 une nouvelle restriction aux effets des  majorats et en statuant que, pour l'avenir, la trans- mission n'aurait lieu qu'en faveur des appelés déjà nés  ou conçus lors de sa promulgation ;   « Attendu qu'en ce qui concerne le mode de dévolu-  tion des majorats la loi des 7 et 11 mai 1849 ne diffère  aucunement de celle de 1835; que, de même que la loi  du 12 mai 1835, elle a limité à deux degrés la transmis- sion des majorats de biens particuliers à partir du pre- mier titulaire ; que l'article 1er de la loi des 7-11 mai  1849 n'est, à cet égard, que la reproduction de l'article 2  de la loi de 1835; qu'il résulte formellement du rapport  de M. Valette lu à l'Assemblée constituante, dans sa  séance du 6 janvier 1849, qu'en maintenant celte dis- position le législateur de 1849, comme celui de 1835, a  entendu concilier en cette matière l'intérêt public avec  l'intérêt privé ;   « Attendu que l'interprétation des termes susvisés est   claire et précise ; que la loi de 1849, aussi bien que celle   , de 1835, a entendu par le mot degré, non pas les de-  grés de génération, mais ceux de transmission ; qu'il ne   saurait exister aucun doute à cet égard ; que la loi des  7-11 mai 1849 précise avec la plus grande clarté le sens  du mot degré ;   ■ « Attendu que l'appelé ne vient pas en qualité d'hé-  ritier, mais en vertu d'un droit inhérent qu'il occupe  de mâle en mâle par rang de primogéniture dans la  descendance du fondateur du majorât ; que la volonté  du législateur est manifeste sur ce point ; qu'il résulte  en toute évidence de la discussion qui a eu lieu, soit à  la Chambre des pairs en 1835, soit à l'Assemblée cons- tituante en 1849, que l'opinion du comte Sirnéon, rap- porteur de la loi de 1835, a été entièrement partagée  par M. Valette, rapporteur de la loi de 1849 ;   « Que l'un et l'autre des rapporteurs constatent que   les majorats, par suite de la législation nouvelle, sont  réduits à l'état de simples substitutions limitées à deux  degrés seulement, ce qui est, d'après les termes mêmes  du rapport de M. Valette, une reproduction évidente de  l'ancien droit français et notamment de l'ordonnance  d'août 1747 sur les substitutions. (Titre 1er articles 30  et 31) ; qu'il importe donc afin de déterminer exac- tement la volonté du législateur, de remonter aux  sources mêmes dont il s'est inspiré ;   « Attendu que Pothier dans son Traité des Sîibsli- tulions (section 1 à 4), en interprétant l'ordonnance de  1747, s'exprime ainsi : « Ou ne compte que les degrés  « de substitution qui ont eu effet. — Un degré de subs- « titution a effet lorsque la personne appelée au degré  « a recueilli avec effet les biens substitués. Au contraire,  « le degré de substitution est censé n'avoir pas eu effet  « lorsque la personne appelée au degré n'a pas recueilli  « les biens substitués, soit qu'elle soit prédécédée avant  « l'ouverture, soit parce qu'elle a répudié la substitu- « tion »";14 avril;COUR D'APPEL DE DIJON ;http://www.enap.justice.fr/ARCHIVE/ENAP_GAZETTE_TRIBUNAUX_18920728.pdf;189207280
189207290;« La Cour,   vention... *   CHA;5 mai;COUR D'APPEL DE PARIS 3e ch;http://www.enap.justice.fr/ARCHIVE/ENAP_GAZETTE_TRIBUNAUX_18920729.pdf;189207290
189207300;"« La Cour,  « joint les causes à raison de la connexité, et sta-  tuant sur le tout par un seul et même arrêt :   « Sur la demande à fin de défenses à l'exécution   provisoire du jugement du 15 décembre 1891 ;   « Considérant que cette demande devient sans objet   à raisonde ce qui va être statué sur l'appel dudit juge- ment ;   « Sur l'appel dudit jugement :   « Considérant que d'Heursel a saisi le Tribunal de   la Seined'une demande en nullité du commandement  à lui signifié le 20 novembre 1888 à la requête de Du- plantier, notaire à Gray, en vertu d'un exécutoire de  frais délivré par le Tribunal de la dite ville ;   « Considérant que cet exécutoire a été délivré non  contre d'Heursel, mais contre la société anonyme le   « Diamant noir »";6 juillet ;COUR D'APPEL DE PARIS 4° ch;http://www.enap.justice.fr/ARCHIVE/ENAP_GAZETTE_TRIBUNAUX_18920730.pdf;189207300
