id;arrêt;date;juridiction;lien;id
189201010;"« Le Tribunal ;  « Attendu qu'une contribution a été ouverte sur la   somme de 30,161 fr. 80, provenant de la vente publi- que de divers objets mobiliers ayant appartenu à  Charles Mouvet ;   « Que le règlement provisoire de cette contribution   a été frappé de contredit par plusieurs créanciers col-  oqués;   « En ce qui concerne Casanova ès-noms (représen-  tant du collège Sainte-Barbe) :   « Attendu que la déconfiture de Charles Mouvet est   devenue notoire par l'ouverture de la contribution,  le 27 décembre 1888;   « Que si les maîtres de pension ont un privilège  pour les fournitures des subsistances par eux faites  au débiteur et à sa famille, ce privilège, aux termes  des dispositions de l'article 2101, § 5, du Code civil,  ne s'étend qu'aux fournitures faites pendant la der - nière année ;   '< Que, dès lors, les fournitures dont le montant   est réclamé par Casanova ès-noms, ayant eu lieu an- térieurement au 27 décembre 1887, ne sont pas ga- ranties parce privilège;   « En ce qui touche Durozoy :  « Attendu qu'aux termes d'un jugement rendu par   le Tribunal civil de Laon, le 7 août 1888, la créance a  été fixée en principal à la somme de 9,924 fr. 35, et  que, par conclusions en date du 19 juin 1890, Duro- zoy déclare consentir à ce que sa créance soit réduite   à cette somme ;   « En ce qui touche Auguste Mouvet :  « Attendu qu'il demande à être colloqué par privi-  lège pour les frais de la défense personnelle de Char- les Mouvet, pour les dépenses de nourriture de la  famille de ce dernier, les frais de pension des enfants  Mouvet et les gages par lui payés à la domestique   Annette Beulens;   « Sur le premier point :  « Attendu, d'une part, que si la loi du 5 septembre   1807 a établi virtuellement un véritable privilège en  faveur des sommes dues pour la défense personnelle  du condamné, ce privilège profite exclusivement aux  défenseurs et conseils pour le remboursement de   leurs honoraires ;   « Qu'Auguste Mouvet, ne rapportant pas une   preuve quelconque établissant qu'il est subrogé aux  droits des défenseurs et conseils de son neveu, ne  peut pas se prévaloir de ce privilège spécial ;   « Attendu,d'autre part,que les frais de justice qui   jouissent du privilège édicté par l'article 2101, § 1,   sont ceux qui ont été faits dans l'intérêt commun des  créanciers et qu'il suit de là qu'Auguste Mouvet ne  saurait bénéficier de ce privilège pour des frais qui  ont été exposés,non pour la conservation et la liqui- dation du gage, mais bien dans l'intérêt personnel   de Charles Mouvet ;   « Sur le second point :  « Attendu que les dispositions de ce même article   2101 § 5 sont relatives aux fournitures faites par les   marchands en détail ou en gros ;   « Que les privilèges sont du droit étroit et qu'il   faut conclure de l'expression même employée dans  ce texte que le privilège ne peut point s'étendre aux   fournitures faites par un propriétaire non marchand ;   « Qu'il s'en suit qu'Auguste Mouvet n'étant pas   marchand ne peut invoquer le bénéfice de ce privi-  lège ;   « Sur le troisième point :  < Attendu que si ce même article 2101 édicté un   privilège pourles fournitures de subsistances faites  par les maîtres de pension et pour les salaires des  gen<5 de service, ce privilège profite personnellement  à ces créanciers ;   « Que, dès lors, Mouvet ne pourrait en exciper que   s'il était subrogé aux droits des maîtres de pension  et de la domestique Annette Beulens, mais qu'il ne  justifie pas d'une subrogation soit légale, soit con- ventionnelle;   « En ce qui touche la Banque Parisienne :  c Quant au point de départ des intérêts;  « Attendu que sa production à la contribution pour   la somme de 300,000 francs a été faite le 8 mars 1889;  que c'est donc à dater de cette époque que cette  somme produit intérêts, puisque l'acte de produit  constitue une véritable demande en just'ce;   « Quant au chiffre de la créance pour frais de jus-  tice :   « Attendu qu'à la suite de poursuites au criminel,   Charles Mouvet a été condamné par arrêt de la Cour  d'Assises de la Seine, du 11 décembre 1888, aux dé- pens avancés par la Banque parisienne, comme partie  civile, liquidés à 15.321 fr. 10; que c'est donc à tort  et par suite d'une erreur matérielle que cette Société  a seulement été collcquée de ce chef pour 13.321 fr.  10 centimes ;   « Quant au privilège :  « Attendu que la Banque parisienne demande à   être colloquée par privilège pour 15.321 fr. 10, mon- tant des frais avancés par elle, comme étant subrogée  aux droits'du Trésor public par suite de la consigna- tion de fonds par elle effectuée au début des pour- suites exercées contre Charles Mouvet ;   « Mais attendu qu'il est constant qu'elle est créan-  cière de cette somme en vertu de la condamnation  prononcée à son profit par la Cour d'Assises de la  Seine, aux termes de l'arrêt du 11 décembre 1888,   précité ;   « Que le Trésor public n'ayant pas fait l'avance de   ces frais, ainsi qu'il appert de ce même arrêt, n'a pu  avoir à un moment quelconque une créance de ce  chef contre Mouvet, et que, dès lors, cette Société n'a  pu, comme elle le prétend, avoir été légalement sub- rogée aux droits et privilège du Trésor public ;   « Qu'en tous cas, la condamnation à ces frais ayant   été prononcée envers la partie civile, ces frais de jus- tice ne sauraient être garantis par le privilège édicté  par la loi du 5 septembre 1807 ;   «c Qu'en effet, aux termes de l'article l°r de cette loi,   les frais pour le remboursement desquels le Trésor  public a un privilège sur les biens meubles du con- damné sont ceux pour lesquels il a obtenu une con- damnation ;   « Que les privilèges,étant de droit étroit et de stricte   application, ne peuvent pas être étendus au-delà des  limites tracées par le législateur, et que, conséquem- ment, ces frais de justice ne rentrent pas dans la ca- tégorie de ceux qui bénéficient de ce privilège ;   « Attendu que le syndic de la faillite Durozoy sou-  tient que l'arrêt, dont il a été parlé, ayant été rendu  contre Mouvet qui est en état de contumace, n'est pas  définitif et que, dans ces circonstances, la Banque  parisienne ne pouvant pas touchôr les sommes qui  lui seront atiribuées en vertu de la collocation établie  à son profit, ces sommes devront être déposées à la  caisse des Consignations jusqu'à ce que cet arrêt soit  devenu définitif et ne puisse être annulé, ou que, tout  au moins, cette Société ne pourra toucher ce divi-  dende qu'à la condition de fournir des garanties pour  en assurer le remboursement dans le cas où elle  serait tenue de restituer ;   « Mais attendu, d'une part, en ce qui touche les   frais de justice dont elle a fait l'avance, que cette  Société est créancière pure et simple de Mouvet   puisqu'aux termes de l'article 478 du Code d'instruc- tion criminelle, le contumaxqui, après s'être repré- senté, obtiendrait son renvoi de l'accusation, doit  toujours être condamné aux frais occasionnés par sa  contumace ;   « Attendu,d'autre part, en ce qui concerne la somme   de 300,000 francs, que, même en admettant que cette  créance fût affectée d'une condition résolutoire, cette  condition n'aurait pas pour effet de suspendre l'exé- cution de l'obligation ;   « Que la Banque Parisienne ayant la possession et   la propriété de cette créance jusqu'à l'accomplisse- ment de la condition, a le droit d'être non seulement  colloquée dans la contribution, mais même de rece- voir le dividende qui lui sera attribué, et qu'on ne  saurait lui imposer l'obligation de fournir une garan- tie quelconque pour assurer la restitution dont elle  pourrait être tenue, dans le cas où l'événement se  réaliserait, en l'absence de tout texte de loi prescri-  vant une telle mesure ;   « Par ces motifs,  « Déclare Casanova ès-noms mal fondé dans sen  contredit, l'en déboute et laisse à sa charge les frais   exposés par lui ;   de Durozoy;   « Réduit en principal à 9,924 fr. 35 la collocation   « Fixe à 15,321 fr. 10 la collocation de la Banque   Parisienne pour frais de justice avancés par elle an- térieurement à l'arrêt précité et au 8 mars 1889 le  point de départ des intérêts produits par la somme   de 300,000 francs ;   « Déclare Boussard, syndic de la faillite Durozoy;  la Banque Parisienne et Mouvet (Auguste) mal fondés  dans le surplus de leurs contestations, fins, moyens  et conclusions, les en déboute; fait masse du surplus  des dépens,qui seront supportés un tiers par la Ban- que Parisienne, un tiers par Auguste Mouvet et un   tiers par Boussard, etc. *•   OBS";1™ décembre;TRIBUNAL CIVIL DE LA SEINE 2e ch;http://www.enap.justice.fr/ARCHIVE/ENAP_GAZETTE_TRIBUNAUX_18920101.pdf;189201010
189201020;"« Le Tribunal ;  « Attendu que Gérard Millot a pendant un long  espace d'années vendu des cotons à Thévenot pour  les besoins de son industrie de fllateur; qu'il avait  avec lui à ce sujet un compte courant où Gérard était  porté créditeur de ses fournitures et Thévenot des  remises qn'il faisait en billets et valeurs; que les  divers éléments de ce compte produisaient intérêt à  six pour cent; qu'il était balancé tous les six mois  avec capitalisation des intérêts à chaque balance au  profit du créancier du solde ;   « Attendu que le compte a constitué Gérard créan- cier d'une somme de 437,406 fr. 70 au 24 janvier 1872,  date du décès de la dame Thévenot ; que les époux  Thévenot étant mariés sous le régime de la commu- nauté^et la dame Lasneret, seule héritière de la dame  Thévenot sa mère, ayant accepté la communauté, la  dette se divisai', de plein droit entre l'époux survivant  et la succession ; que néanmoins les opérations se  sont continuées entre Gérard et Thévenot sans ar- rêté de compte au jour du décès et sans déduction de  la part de dette de la succession et qu'elles ont duré  jusqu à la faillite de Thévenot déclarée le 8 octobre  1886 ; que Gérard a produit et a été admis à la faillite  pour une créance de 991, 207 fr. 05, sur laquelle il n'a  touché qu'un dividende de 18 pour cent environ ;  qu'il réclame aux époux Lasneret le payement de  218,703 fr. 35 formant la moitié de sa créance au jour  du décès de la dame Thévenot ;   « Attendu que les défendeurs soutiennent que la   dette est éteinte par novation, compensation ou impu- tation de payements ;   « Attendu que la novation n'est pas établie ; qu'il   est vrai, le maintien au compte de Thévenot, après   , le décès de sa femme, de la totalité de la créance à  | cette date et la production de Gérard à la faillite pour   l'intégralité du reliquat de compte sembleraient dé- montrer que Gérard avait accepté Thévenot pour uni-  que débiteur, mais qu'ils ne suffisent pas à prouver  qu'il avait en môme temps voulu décharger la dame  Lasneret de son obligation; qu'une manifestation  formelle de celte volonté eût été indispensable ;   « Attendu qu'on ne saurait admettre davantage la  compensation de ia créance de Gérard au jour du dé- cès de la dame Thévenot avec les sommes qu'il a tou- chées depuis de Thévenot: que le compte entre Gé- rard et Thévenot a eu de tout temps les caractères  d'un compte courant; que les caractères résultent  très nettement des circonstances déjà spécifiées ; qu'il  n'importe que Gérard ait toujours été créancier et  Thévenot toujours débiteur ; que le fait n'est pas  contraire au but ni à l'utilité du compte courant;   « Attendu qu'il est de doctrine et de jurisprudence   que les sommes qui entrent en compte courant ne  peuvent se compenser ; que le solde seul est sujet à  compensation après l'arrêlé définitif du compte ou sa  clôture forcée ;   « Attendu que le compte a été clos de plein droit   une première fois par la mort de la dame Thévenot,  mais que le report du solde dans un autre compte a  immédiatement fait renaître l'impossibilité de com- pensation ;   <r Attendu que si les règles sur l'imputation des  payements sont aussi d'une façon générale inappli- cables aux comptes courants, les conventions des  parties ou la volonté du créancier peuvent déroger   au principe ; que, dans une lettre du 3 janvier 1873,  Gérard écrivait à Thévenot: « Mes factures ne sont  « donc réglées qu'après quatorze mois, au lieu de six  « mois, joli terme déjà et qui n'est accordé par nul  « autre que moi »";13 juillet;COUR D'APPEL DE PARIS 2° ch;http://www.enap.justice.fr/ARCHIVE/ENAP_GAZETTE_TRIBUNAUX_18920102.pdf;189201020
189201021;"« La Cour ;   tant du compte ;   « Considérant, etc.   « Sur l'extinction de la dette de Gérard Millot pré-  tendue par les époux Lasneret :   « En ce qui concerne le moyen tiré de la novation :  « Considérant qu'au 24 janvier 1872, jour de la dis-  solution, par suite de la mort de la dame Thévenot,  de la communauté ayant existé entre elle et son  mari, le compte courant entre Thévenot et Gérard  Millot présentait, à la charge de Thévenot, un solde  débiteur, non pas de 437,406 fr. 70 centimes, comme  l'ont dit par erreur les premiers juges, mais de  403,043 francs ; que ce solde constituerait une dette   , de communauté, dont la moitié, soit 201,521 fr. 50   centimes, était à la charge de la succession de la  dame Thévenot qui en était, par suite, débitrice   [ envers Gérard Millot ;   B III";13 juillet;COUR D'APPEL DE PARIS 2° ch;http://www.enap.justice.fr/ARCHIVE/ENAP_GAZETTE_TRIBUNAUX_18920102.pdf;189201021
189201040;"« La Cour;  « Considérant que les demandeurs à l'incident fon-  dent leur demande sur l'article 14 du Code de com- merce ; que les défendeurs soutiennent que ledit ar- ticle n'est pas applicable en matière de liquidation  judiciaire ;   « Considérant qu'aux termes de l'article 24 de la loi   du 4mars 1889,toutes les dispositionsduCode de com  mereequi ne sont pas modifiées par ladite loi doivent  recevoir leur application en cas de liquidation judi  ciaire comme en cas de faillite ;   « Considérantquelaloi dont s agit n'a pas touchéàla   dispositiondel'articlel4; qu'elle a, il est vrai, autorisé  les créanciers à élire parmi eux un ou deux contrô  leurs spécialement chargés de vérifier les livres et de  surveiller les opérations des liquidateurs, mais qu'il  n'apparaît, en aucune façon, que le législaceur ait  voulu par là apporter une restriction aux droits des  créanciers ; que la faculté qu'il leur a ainsi accordée  procède, au contraire, de la préoccupation qu'il a eue  de les mettre en mesure de protéger leurs intérêts  contre les périls que le rôle laissé au liquidé judi  ciaire pouvait leur faire courir ; qu'il serait du reste  difficile de comprendre que la communication des  livres d'une maison de commerce, que Ja loi a voulu   permettre, le cas échéant, dans les affaires de suc- cession, de communauté, de partage de société et de  faillite, c'est-à-dire dans les affaires qui peuvent ren-  dre nécessaire la connaissance par les co intéressés  de l'ensemble des opérations d'un commerçant, se  trouvât prohibée dans le cas de liquidation judi- ciaire, où des intérêts du même ordre peuvent la ren- dre particulièrement utile; que les défendeurs à l'in- cident sont donc mal fondés en droit à opposer un  refus absolu de toute communication à la demande  formulée par Valadon et consorts ;   « Mais considérant qu'il appartient au juge d'ap-  précier si la communication doit ou non être or- donnée ;   « Considérant, en fait, que, dans la liquidation en   litige, deux contrôleurs ont été élus par les créan- ciers et choisis parmi les plus importants d'entre  eux ; qu'aucune circonstance ne donne lieu de penser  que ces contrôleurs ont négligé leur mission, ou ont  été empêchés de la remplir ; que l'utilité de la com- munication réclamée ne ressort ni de l'examen du   rapport du liquidateur, ni des observations présen-  tées par les demandeurs;   « Qu'il y a lieu de reconnaître qu'en l'état il n'est   pas justifié de motifs suffisants pour que cette com- munication soit ordonnée par la Cour;   « Par ces motifs,  « Donne acte à Bernard ès-qualités de ce qu'il s'en   rapporte à justice ;   « Déclare les demandeurs à l'incident mal fondés   dans leurs conclusions, les en déboute ;   « Les condamne aux dépens desdits incidents. »";28 novembre;COUR D'APPEL DE PARIS 46 ch;http://www.enap.justice.fr/ARCHIVE/ENAP_GAZETTE_TRIBUNAUX_18920104.pdf;189201040
189201060;"« Le Tribunal ;  « Attendu que, le 17 novembre 1889, vers cinq   heures quarante du soir, Médéric Lebrasseur, char- retier, conduisait, boulevard de Belle ville, un| tombe- reau, lorsque, vers le numéro 31, il fut atteint à la  tête par un brancard de l'avant-train d'une tapissière  qui s'était détaché du corps de la voiture et que le  cheval qui s'était emporté traînait à sa suite ;   « Que Lebrasseur est décédé quelques heures   après , qu'une femme Bisson, au nom d'Ernest Cons- tant et de Médéric Lebrasseur, enfants naturels re- connus de Lebrasseur, dont elle est tutrice dative,  aux termes d'une délibération du conseil de famille  du 15 février 1890, a assigné Robin, propriétaire du  cheval et de la voiture qui ont occasionné l'accident,  comme responsable du préjudice causé aux deux mi- neurs par la mort de leur père ;   « Attendu que des documents soumis au Tribunal,   etnotammentde l'enquête faite par le commissaire de  police, il résulte qu'à la hauteur du n° 37 du boule- vard de Belleville, la cheville ouvrière qui retenait   2, RUE";27 novembre;TRIBUNAL CIVIL DE LA SEINE 4- ch;http://www.enap.justice.fr/ARCHIVE/ENAP_GAZETTE_TRIBUNAUX_18920106.pdf;189201060
189201080;"« Le Tribunal ;  « Attendu que Harry-Smith Homans, sujet améri-  cain, a épousé à Paris, le 29 décembre 1880, Célestine  de Bruslé, de même nationalité; que leur mariage a  été célébré successivement, ledit jour, devant l'offi- cier de l'état civil du premier arrondissement, dans  les formes prescrites par la loi française, et devant le  pasteur compétent, selon les formes du droit améri- cain ;   « Attendu que Smith Homans est décédé à Paris,   le 12 janvier 1889 ; que sa veuve, prétendant qu'à dé- faut de contrat ayant précédé leur union et en ayant  réglé les conditions civiles, les conjoints étaient pla- cés sous le régime de la communauté légale, a pris  la qualité de commune en biens en l'intitulé d'inven- taire du 21 janvier du même mois, et aassigné Harry  Homans, la dame Damburam et William Homans,  tous trois issus du premier mariage de feu Smith  Homans avec Margaretta Pasmelée, et seuls héritiers  légitimes du détunt (qualité qu'ils n'ont acceptée que  sous bénéfice d'inventaire seulement), en partage de  la communauté qui aurait existé entre les conjoints   du second mariage ;   « Attendu que les défendeurs lui contestent la qua-  lité dont elle se prévaut à cette fin, et soutiennent  qu'elle était mariée, à défaut de contrat, sous le ré- gime de la séparation de biens ;   « Qu'ils revendiquent pour la cohérie tous les objets   et valeurs trouvés au domicile du défunt ;   « Attendu que les parties ne déclinent pas la com-  pétence de ce Tribunal ; que la seule question du  débat est celle de savoir quel a été le régime matri- monial que les conjoints Homans de Bruslé ont  entendu adopter ; qu'il appartient au Tribunal de le  déterminer;   « En droit :   « Attendu qu'au cas où deux étrangers se marient   en France sans contrat, la règle de l'article 1393  du Code civil, suivant laquelle les époux doiveot  être considérés comme mariés sous le régime de la  communauté, ne s'applique pas nécessairement à eux  comme elle s'appliquerait entre Français ;   « Qu'à leur égard il convient de discerner, pour le   règlement de leurs intérêts civils, la mutuelle inten  tion des parties, et de la rechercher dans les diverses  circonstances contemporaiues du mariage ; et que,  dès lors, si les époux ont manifesté, lors de leur  union, la volonté de rester régis par leur statut per-  sonnel, il y aura lieu de décider qu'ils sont s soumis   au régime de droit commun établi par leur loi natio   IîcLlG 'y   « En fait, attendu qu'il est constant que, lors de   leur mariage devant l'officier de l'état civil fran- çais, Smith Homans et Célestine de Brusiô ont in- voqué, en qualité de sujets américains, leur statut  personnel ;   « Que, pour mieux affirmer leur nationalité, ils ont   lait procéder, comme il a été énoncé ci-dessus, à leur   umon suivant les formes et solennités usitées aux  ûtats-Unis ; que la présence du ministre de la nation  et le choix des témoins impriment à cet acte le ca- ractère significatif que les parties ont attendu y  attacher ; J   «***^en^a que par ses déclarations expresses et   réitérées dans divers actes publics ou privés où il s'est   présenté comme résidant temporairement en France,  Homans a proclamé sa patrie américaine et indiqué  la persistance de son esprit de retour en Amérique ;   « Que ne considérant pas comme définitive son  installation en France, il n'y a acquis aucun immeu- ble, ni fondé d'établissement qui lui fût propre ; qu'il  n'y était retenu que pour le service de la compagnie  amérieaineLaNew-York dont il était le représentant ;   « Que ces démonstrations ne peuvent porter utile-  ment que sur les faits contemporains du mariage;!   « Que s'il est vrai que Homans a été admis à domi-  cile en France, le 24 octobre 1888, cette circonstance  se pioduisant huit ans après son mariage, ne saurait  influer sur le régime matrimonial que les époux sont  réputés avoir adopté pour le règlement de leurs  intérêts ;   « Qu'au surplus, l'effet de l'autorisation est d'ac-  corder à l'étranger, exclu par son extranéité de la  participation aux droits civils, l'exercice de ceux de  ces droits qui lui sont profitables, sans que son état  soit changé;   « Que les actes et circonstances susrappelés, loin   de révéler l'intention des parties de se soumettre à la  loi française, démontrent leur accord de s'en référer  à la loi de leur statut personnel;   « Que, conséquemment, il n'échet de faire droit à   la demande initiale de la veuve Homans en tant  qu'elle réclame à son profit le bénéfice de l'article  1393 du Code civil;   « Attendu que par des conclusions subsidiaires,   elle invoque les dispositions de la loi de l'Etat de Ca- lifornie, comme étant celle du statut de son défunt  mari, au temps de leur union par mariage;   « Attendu que les défendeurs, de leur côté, sou- tiennent que le statut applicable à la matière est ce- lui de l'Etat de New-York, qui, selon eux, était le  statut légal de Smith Homans, et qu'il aurait con- servé lors de son mariage;   « Attendu que les divers Etats qui composent,   sous le lien du gouvernement fédéral, l'union améri- caine, ont chacun une législation spéciale et leur  droit particulier ;   « Que les parties sont d'accord pour reconnaître   que la jouissance des droits civils est attachée au  statut personnel et que la loi du statut du futur de- vient, par l'effet du mariage, la loi commune des  époux ;   « Attendu qu'il appert des textes officiels et certi-  ficats de coutume dûment légalisés produits en la  cause que le statut des citoyens américains est dé- terminé par leur domicile légal ;   « Qu'il importe dès lors de fixer le véritable domi-  cile de Smith Homans à l'époque de son mariage  avec la demanderesse;   « Attendu qu'il n'échet de faire état, à cet effet, des   divers documents invoqués par les parties, dans le- quel le défunt a été indiqué, tantôt comme étant de  New-York, tantôt comme étant de San Francisco ;  que les énonciations sont opposées entre elles ;  qu'elles sont contradictoires et ne sauraient consti- tuer des éléments de décision ;   « Attendu que Smith Homans, fils de James Ho™   mans et Elisabeth Key, son épouse, tous deux ci- toyens américains, est né à Erié, dans l'Etat de Pen- sylvanie, le 8 janvier 1838, au cours d'un voyage en-  trepris par ses père et mère ;   « Que cette circonstance due au has&rd de la nais-  sance n'est pas attributive du domicile ;   « Qu'il est constant que James Homans, officier de  marine des Etats-Unis, était à cette époque domicilié  à New-York, Etat de New-York, où il avait son prin- cipal établissement, et le siège de ses intérêts, de ses  relations et de ses affections ;   « Qu'ainsi Smith Homans, enfant légitime du sus-  nommé, a eu pour domicile durant sa minorité le  domicile de son père à New-York, où il a été élevé et  où il est demeuré jusqu'à son départ, en 18515, pour la   Californie ;   « Attendu que, de 1855 à 1869, il a habité San Fran-  cisco, où, devenu majeur, il s'est fixé et établi d'une  manière permanente, en y occupant successivement  divers emplois, notamment celui de directeur de la  « Company Mutual Life Assurance »";30 décembre;COUR D'APPEL DE PARIS l'e ch;http://www.enap.justice.fr/ARCHIVE/ENAP_GAZETTE_TRIBUNAUX_18920108.pdf;189201080
