id;arrêt;date;juridiction;lien;id
189209151;"« La Cour ;   « En ce qui touche la déposition de Louise Boudon ;  « Considérant que, sur la demande de l'appelant   Pouderoux tendant, 1° à une prorogation d'enquête,  2° à la Commission du Président du Tribunal civil de  Clermont-Ferrand pour entendre le dit témoin, unjuge- ment contradictoirement rendu le 13 mars 1890, par le   Tribunal de Murât et actuellement exécuté par toutes   £ diverses parties de son immeuble pour y   (Correspondance particulière de la Gazette des Tribunaux.)   les parties, a ordonné la prorogation d'enquête sollicitée   par Pouderoux et renvoyé ce dernier, pour l'audition de  de Louise Boudon, à se pourvoir devant le juge com- missaire conformément à l'art. 266 du code de procédure  civile.   « Qu'à la suite de cette décision laquelle a été signi-  fiée le 19 avril 1890, le juge-commissaire a, le 24 du  même mois, a la requête de l'appelant, et par une pre- mière ordonnance, autorisé l'assignation des témoins  et après avoir mentionné sur le procès-verbal l'accom- plissement de celte formalité, a, en outre, le même   jour et par une seconde ordonnance, d'ailleurs régu- lière en la forme, donné, à raison de l'éloignement et de  l'état de maladie de Louise Boudon, mission du prési- dent du Tribunal civil de Clermont-Ferrand, de re- cueillir les déclarations dudit témoin.   «Qu'enfin, à la date du 16 mai, jour fixé pour ce  magistrat, les avoués des parties ont comparu devant   lui et Me Carvès a déclaré protester au nom de Misson-  nier, auteur des intimés, contre l'audition de Louise  Boudon par le double motif : 1° Que c'était au juge- commissaire et sur le procès-verbal même de l'enquête  édifiée à Murât qu'aurait dû être donnée la commis- sion rogatoire pour l'audition du témoin absent; 2"" que  l'ordonnance du 24 avril avait été rendue après l'expi- ration des délais de l'enquête.   « Considérant, en premier lieu, que la commission   rogatoire délivrée dans les termes de l'article 266 du  Code de procédure civi'e, constitue une véritable déci- sion et que c'est, dès lors, avec raison que lejuge-com- missaire l'a formulée par voie d'ordonnance, c'est-à-dire  dans la forme ordinaire de ses décisions, alors, d'ail- leurs, que ledit article ne contient aucune indication  contraire ;   « Considérant, d'autre part, qu'aucune décision de la   loi ne prescrit l'assignation préalable devant le magis- trat enquêteur du témoin dont l'éloignement et le dé- faut justifieraient ensuite la commission du président  du Tribunal de son domicile ; que l'exigence d'une telle  formalité ne répond à aucune nécessité ni à aucun in- térêt ;   « Que l'objet d'une citation dans un pareil cas, serait   en contradiction avec le sens et le caractère essentiel de  cet acte ; et qu'en l'absence d'un texte impératif, il est  inadmissible que la loi ait pu, implicitement et cepen- dant à peine de nullité, imposer aux parties les frais  d'une procédure dont l'observation n'aurait ouverte- ment d'autre but que d'en faire judiciairement recon- naître l'utilité ;   « Qu'il résulte, au surplus, de la combinaison des   articles 25b et 266 du Code de procédure civile,lesquels  n'édictent expressément aucune nullité, que la dési- gnation du juge devant qui l'enquête devra être effec- tuée doit émaner du Tribunal tout entier, lorsqu'il  s'agit d'entendre l'ensemble des témoins, et que la loi  laisse entièrement à l'appréciation du juge-commis- saire le soin de donner une commission rogatoire lors- qu'il s'agit seulement d'entendre un ou plusieurs té- moins éloignés ;   « Considérant, en second lieu, qu'alors qu'il est   con«tant en fait, que cinq jours après la signification,  le 19 avril 1890, du jugement précité du 13 mars pré- cédent, et à la date du 24 avril 1890, l'ouverture du  procès-verbal de prorogation d'enquête a été régulière- ment effectuée par la mention de la réquisition de Pou- deroux et de l ordonnance permettant d'assigner les  témoins, c'est évidemment à tort que les intimés ont  pu alléguer la tardivité de la commission rogatoire dé- livrée le même jour ; et qu'au surplus, les intimés ne  paraissent pas avoir reproduit ce grief devant les pre- miers juges.   « Considérant toutefois qu'ils soutiennent encore que   Louise Boudon n'ayant point comparu aux enquêtes des  28 février, 8 mars et 8 mai qui ont eu lieu à Murât, et  les procès-verbaux de ces enquêtes ne constatant ni  la représentation de l'assignation donnée à Louise Bou- don ni le défaut qui aurait été prononcé contre elle,  ces divers actes se trouvent entachés de nullité, et que,  par suite, le dit témoin est devenu étranger à l'en- quête ;   « Considérant que la Cour n'est aucunement saisie   de la connaissance et de l'examen des procès-verbaux  d'enquêtes portant les dates sus-énoncées ; et qu'il s'a- git uniquement, dans la cause, de rechercher si Louise  Boudon a pu être utilement entendue, le 16 Mai, par le  Président du Tribunal civil de Clermond-Ferrand.   « Considérant qu'il importe peu à cet égard, que son  absence ait été ou non constatée par les procès-verbaux  des 28 février et 8 mars ; alors surtout que, postérieu- rement à ces dates, le jugement du 13 mars 1890 a or- donné une prorogation d'enquête et a, d'ailleurs, ex- pressément prévu la déposition dudit témoin.   « Considérant que cette décision n'entraînant pas la  nécessité d'assigner Louise Boudon à comparaître, le 8  mai, à Murât, lieu dont elle était éloignée, il n'est pas  contesté qu'en ce qui concerne l'enquête effectuée à  Clermont-Ferrand, toutes les formalités légales ont été  scrupuleusement observées ;   « Par ce motifs :   « Réforme pour partie le jugement dont est appel, et,   en conséquence, rejelte les reproches et griefs formulés  contre l'audition dans l'enquête du 16 mai 1890, à Cler- mont-Ferrand, de Louise Boudon, et déboute à cet  égard les intimés de toutes leurs demandes, fins et  conclusions ;   « Confirme pour le surplus les dispositions non con-  traires de ladite décision et ordonne que, dans cette  mesure, elle sortira effet ;   <t Déboute respectivement les parties de toutes leurs   autres demandes, fins et conclusions ;   « Ordonne la restitution de l'amende;   « Condamne les intimés aux dépens de l'instance et   d'appel. »";24 mai;COUR D'APPEL DE RIOM lre ch;http://www.enap.justice.fr/ARCHIVE/ENAP_GAZETTE_TRIBUNAUX_18920915.pdf;189209151
189209152;"« Le Tribunal ;  « En la forme ;   i Donne acte à Lemarquis ès-qualités de sa reprise   d'instance au lieu et place de Hue, décédé;   « Attendu que David justifiant être porteur de polices   de l'Assurance Financière, a intérêt et qualité pour in- tervenir dans l'instance ; qu'il est recevable en son in- tervention ;   « Attendu que les désistements signifiés les 12 et 16   février 1891 au nom et à la requête de David et Hozana  n'ont pas été acceptés par Hue ès-qualités; qu'il y a lieu  de les maintenir dans la cause ;   < Au fond ;   « Attendu que Hozana, Bellemère et David se sont   unis pour demander l'annulation des accords conclus  par Hue avec la Société La Capitalisation et réclament  des dommages-intérêts à fixer par état pour le préjudice  qu'ils auraient éprouvé de la transmission du fonds de  commerce de l'Assurance Financière, telle qu'elle a été  opérée par le liquidateur ;   « Attendu que selon eux le traité qu'ils attaquent se-  rait intervenu ferme le 3 mai 1888 entre Hue ès-noms  et Chalvet et Colombel agissant et contractant pour le  compte de la Société en formation La Capitalisation;   « Mais attendu que le traité dont s'agit n'a été for-  mulé à cette date qu'à l'état de combinaison projetée,  soit mis à l'appréciation des associés de l'Assurance Fi- nancière, dans l'Assemblée du 7 mai même mois ;   « Que si les statuts de la nouvelle Société, rédigés   par ses fondateurs, Chalvet et Colombel, qui n'y contre- disent pas, ont fait état de ce traité, ç'a été de leur part  une simple sollicitation sans obliger la Société de l'As- surance Financière ;   « Qu'il n'y a lieu de s'arrêter à ce chef de conclusions   des demandeurs ;   « En ce qui touche les critiques dirigées contre la   gestion du liquidateur ;   « Attendu que le fonds de commerce de l'Assurance   Financière, cousistant dans sa clientèle, ne comportait,  lors de sa déconfiture, arrivée en 1888, aucune valeur  vénale appréciable ou réalisable ;   « Qu'il est manifeste qu'elle ne pouvait plus fonc-  tionner avec les éléments qui la composaient, puisque  la situation financière de la Société s'opposait à la con- tinuation de ses opérations ; que sa reconstitution ne  pouvait s'opérer qu'avec des éléments nouveaux ;   « Qu'en cet état Hue, s'inspirant de son mandat et   de l'intérêt des associés, a cherché à faciliter leur ad- mission dans une Société nouvelle en stipulant en leur  fayeur les conditions les plus avantageuses ;   « Attendu que c'est en vain qu'on arguerait de nul- lité la délibération de l'assemblée du 7 mai 1888, appe- lée seulement à émettre son avis sur la cession du  fonds de commerce ;   « Attendu, en effet, que les accords intervenus entre   Hue ès-noms et Chalvet et Colombel, fondateurs de la  Société La Capitalisation, n'ont été définitivement arrê- tés et réalisés que par la constitution de cette Société  le 21 juillet 1888, c'est-à-dire après la dissolution pro- noncée le 17 mai précédent de l'Assurance financière  et non, comme le prétendent les demandeurs, alors  qu'elle était encore in bonis.   « Attendu que Hue, nommé liquidateur par le juge-  ment de ce siège du 17 mai 1888 et confirmé dans sa  qualité par autre jugement du 26 juillet suivant, était  investi des pouvoirs les plus étendus « pour la consta- « tation et la réalisation amiable ou judiciaire de l'actif  « social »";27 juillet;TRIBUNAL CIVIL DE LA SEINE lr° ch;http://www.enap.justice.fr/ARCHIVE/ENAP_GAZETTE_TRIBUNAUX_18920915.pdf;189209152
189209160;"« La Cour ;   « Statuant sur l'appel interjeté par la veuve Itenez  un jugement rendu par le Tribunal de commerce   ue ^ Semé le 13 février 1892 ;   « Sur la recevabilité de l'appel :   pl>onsi(iérant que Caussade soutient que l'appel ne  Dr hV>as recevable Par ce motif que, en déduisant du   S   Y?nte des 130 douzaines de plumes non pas   mai   18  L   °1°'   taux d'escompte que Caussade pré-  16 OTO";5 mai;COUR D'APPEL DE PARIS 6« ch;http://www.enap.justice.fr/ARCHIVE/ENAP_GAZETTE_TRIBUNAUX_18920916.pdf;189209160
189209161;"« Le Tribunal ;   « Joint l'instance introduite par Albert Petit contre   Courtier, Blanchet, Fouquet et Prig à celle introduite  contre les mêmes défendeurs par les frères Duchêne et  les époux Coulon ;   « Reçoit également Gautron ès-qualité intervenant ;  « Et statuant par un seul jugement à l'égard de tou-  tes les parties susnommées ;   « Attendu que Félix Petit est décédé en son domicile   ER octobre 1890, laissant pour héritiers à ré-  à Paris, le 1 serve : 1° la demoiselle Marie Petit ; 2° Albert Petit,  tous deux nés de son mariage avec la dame Daminville  prédécédée ; et 3"" par représentation de la dame Caro- line Petit, épouse Duchêne, issue du même mariage,  les trois enfants de cette dernière, Auguste Duchêne,  Roger Duchêne et la dame Coulon ;   « Attendu que lesdits héritiers ont accepté les suc- cessions de leur père et grand-père, mais sous bénéfice  d'inventaire seulement ; que, lors de l'inventaire, il n'a  été trouvé au domicile du défunt que des valeurs de  peu d'importance eu égard à la fortune dont il avait no- toirement joui de son vivant;   « Attendu qu'il est constant qu'à la suite d'un procès   de séparation de corps remontant à une date très an- ciene, Félix Petit avait cessé toutes relations avec les  enfants issus de son mariage, et manifesté clairement  son intention persévérante de ne leur rien laisser après  sa mort ; qu'il avait même détruit tous les registres, pa- piers domestiques et documents émanés de lui et de  nature à fournir des indications sur la consistance de  sa fortune soit en capital, soit en revenus;   « Que, pour récupérer ce que la loi ne permettait pas   de leur enlever, les héritiers n'avaient en leur posses- sion qu'un écrit, remis par le domestique du défunt,  Lebrun, qui prétendait l'avoir copié sur une pièce ori-  2, RUE";23 juin;TRIBUNAL CIVIL DE LA SEINE 2e ch;http://www.enap.justice.fr/ARCHIVE/ENAP_GAZETTE_TRIBUNAUX_18920916.pdf;189209161
189209170;"« Le Tribunal ;   « Attendu que Hastron déclare en ses conclusions   déférer le serment à Morel ès-qualités sur la question  de savoir s'il ne lui a pas offert de lui rendre les deux   journaux financiers et si Morel ne lui a pas demandé  de les conserver comme ne pouvant constituer que des  charges pour sa faillite ;   « Et attendu que le Tribunal estime que la solution   du débat peut, dans une certaine mesure, être influen- cée par le serment ainsi requis ;   « Qu'il y a lieu de faire droit à cette demande ;  « Par ces motifs,  « Jugeant en premier ressort :  « Dit que Morel ès-qualités sera tenu de prêter le   serment à lui déféré ;   « Continue à cet effet la cause au mercredi 11 mars   prochain, et dit que sommation sera faite à Morel ès- qualités de se présenter à l'audience susvisée, à l'effet  de prêter le serment déféré, d'office, avec Tiollicr, dé- faillant ;   « Surseoit à statuer sur le fond du débat, tant à l'é-  gard de Hastron qu'à l'égard des autres parties ;   « Dépens réservés. »";12 mai;COUR D'APPEL DE PARIS 4° ch;http://www.enap.justice.fr/ARCHIVE/ENAP_GAZETTE_TRIBUNAUX_18920917.pdf;189209170
189209171;"« La Cour,  « Considérant qu'à l'appui de son appel Morel sou-  tient que les premiers juges ont ordonné la prestation  du serment décisoire déféré par LLastron, dans les ter- mes précisés par ledit Hastron en ses conclusions, et que  cette délation doit être annulée parce qu'elle ne satis- fait pas aux conditions prévues par le premier paragra- phe de l'art. 1,357 du Code civil, le serment déféré  n'ayant pas, d'après le jugement lui-même, un carac- tère nettement et absolument décisoire ;   »";12 mai;COUR D'APPEL DE PARIS 4° ch;http://www.enap.justice.fr/ARCHIVE/ENAP_GAZETTE_TRIBUNAUX_18920917.pdf;189209171
189209180;"« Le Tribunal;   « Att'A021 francs pour accidents :   n   c  U q""e pour s'opposer au payement de la   reclamee. la Caisse Générale des Familles sou-  somme PA„I tient g lesqùek Tribunal ° .es les deux jugements rendus par le  desdits ,   ecHonnel de la Seine> et les considérants   ^ uCon.clusions motivées, que les faits sur   Gnients ^affranchiraient de tous recours en   Article n Ji i demandeur par application de   °°ûtractép o, ,i pollce d'assurance que ce dernier a   wee avec elle; qu'en effet, ledit article excepte   êaranu  e d  10  p  de l'assurance les accidents provenant notamment de  l'imprudence volontaire de l'assuré ou de ses préposés,  et ceux causés par l'inobservation des lois, règlements,  et ordonnances de police ; que les deux accidents fai- sant l'objet du procès rentrent dans ces catégories d'ex- ception ; que, dès lors, la demande devrait être re- jetée ;   « Mais, attendu que, si l'article 13 dont excipe « la   Caisse générale des Familles »";13 mai;COUR D'APPEL DE PARIS 3° ch;http://www.enap.justice.fr/ARCHIVE/ENAP_GAZETTE_TRIBUNAUX_18920918.pdf;189209180
189209181;"« Le Tribunal, jugeant en premier ressort ;  « Condamne La Caisse Générale des Familles, par les   voies de droit, à payer à Delacquis, la somme princi- pale de 2,821 fr. avec les intérêts de droit ;   « Déclare Delacquis mal fondé en la surplace de ses   demandes, fins et conclusions ;   « L'en déboute ;  « Et condamne La Caisse Générale des Familles aux   dépens. »";13 mai;COUR D'APPEL DE PARIS 3° ch;http://www.enap.justice.fr/ARCHIVE/ENAP_GAZETTE_TRIBUNAUX_18920918.pdf;189209181
189209182;"« Le Tribunal;   « Attendu que Martin est opposant à un jugement de   cette chambre du 2 mars 1891 qui l'a condamné à ser- vir à sa femme une pension alimentaire de 60 francs par  mois ;   « En la forme, attendu que cette opposition est régu-  lière, qu'il y a lieu de recevoir Martin opposant au  jugement dont s'agit ;   « Au fond, attendu que Martin, après avoir signifié   des conclusions dans lesquelles il conteste le bien  fondé de sa demande, excipe ultérieurement de ce que  la dame Martin a introduit une instance sans l'autori- sation maritale ; qu'il prétend dès lors qu'aux termes  de l'arlicle215 du Code civil, elle doit être déclarée non  recevable ;   « Attendu, en effet, sur ce dernier point, que la loi,   en exigeant que la femme soit autorisée par son mari  pour ester en justice n'a fait aucune exception pour  les cas où c'est contre son mari que l'épouse veut  plaider ;   « Que l'obligation qui lui est imposée actuellement   prend sa source dans un devoir de déférence vis-à-vis  de l'autorité du mari, et qu'elle n'en est relevée quo  dans les cas prévus par un texte positif ; que l'obser- vation de cette formalité a un caractère d'ordre public ;  attendu que la dame Martin prétend vainement que  Martin, en concluant au fond sur la demande, aurait  donné tacitement son autorisation ;   « Attendu que si le mari peut sans doute accorder   une autorisation tacite, on ne saurait en trouver les  éléments dans ce fait isolé, dégagé de toute autre cir- constance, à savoir qu'il s'est d'abord défendu par des  raisons de fond au lieu d'opposer une fin de non rece- voir ; qu'assimiler à un consentement tacite une inad- vertance de sa part ou un défaut de logique dans la  production de ses moyens, ce serait transformer à son  détriment une exception d'ordre public en une de ces  exceptions d'intérêt privé dont le sort est à la merci  d'un erreur de procédure ;   « Mais attendu que la nécessité de l'autorisation ma-  ritale est une garantie trop fondamentale du bon ordre  dans l'association conjugale pour pouvoir être aussi lé- gèrement écartée ;   « Attendu, au surplus, que si Martin n'a pas dès le   début fourni ses moyens à l'appui de sa fin de non-re- cevoir, il ne l'en avait pas moins formulée dès l'origine,  puisque, dans ses premières conclusions, il a demandé  non seulement que =a femme fût déclarée mal fondée,  mais encore non recevable ; qu'ainsi et en tout cas il  s'est mis, au moyen de cette formule, à l'abri de la dé- chéance que la dame Martin veut lui opposer ;   « Par ces motifs,   « Le Tribunal reçoit Martin en la forme opposant au   jugement par défaut dont s'agit ; au fond le déclare bien  fondé en ladite opposition ; dit que la dame Martin,  faute d'autorisation maritale, est non recevable en l'é- tat à introduire une demande en pension alimentaire  contre son mari, et le condamne aux dépens. »";8 février;TRIBUNAL CIVIL DE LA SEINE 6e ch;http://www.enap.justice.fr/ARCHIVE/ENAP_GAZETTE_TRIBUNAUX_18920918.pdf;189209182
189209190;"« Le Tribunal,   « Sur l'intervention de Ludot :   « Attendu qu'elle est recevable en vertu des dispo-  sitions de l'article 443 du Code de commerce ;   « Sur la fm de non recevoir opposée par Ludot et   uiarlot ès-qualités, et basée sur l'article 16 des charges   c?Qditions de l'entreprise générale; qu'aux termes de   j article sus-visé, le marché, en cas de faillite de l'en-  ^epreneur est résilié de plein droit trois mois après la  ^eclaration de la faillite, sauf au ministre à accepter,   U le IUD";19 mai;COUR D'APPEL DE PARIS 69 ch;http://www.enap.justice.fr/ARCHIVE/ENAP_GAZETTE_TRIBUNAUX_18920919.pdf;189209190
189209191;"« La Cour ;   « Attendu qu'aux termes de l'article 1382 du Code ci- vil, la responsabilité d'un fait dommageable, impliquant  nécessairement une faute, celui qui ne fait qu'user de  son droit, sans intention de nuire, ne saurait être tenu  à réparer le préjudice que l'exercice de ce droit peut  avoir occasionné ;   « Attendu en faits qu'à la suite d'un incendie sur-  venu à sa maison de Vichy, le 5 février 1890, Ferdi- nand Desbret, par exploit du 7 du même mois a sommé  l'appelant d'avoir à assister à l'expertise qui aurait lieu  le 10 février pour évaluer les dégâts causés par le sinis- tre ; — qu'il dit dans cet exploit en termes formels ;  « qu'en vertu des articles 1733 et 1734 du Code civil, le  « sieur Desbret et la compagnie le Phénix se croient   « fondas à PTowcr nnntrp. lp. sipiir Vp.rjiis. linp flptinn   « en garantie pour le montant des dits dommages. »";12 mai;COUR D'APPEL DE RIOM 2' ch;http://www.enap.justice.fr/ARCHIVE/ENAP_GAZETTE_TRIBUNAUX_18920919.pdf;189209191
189209192;"« Le Tribunal ;   « Attendu que Sirot, créancier, en vertu d'un titre  authentique, de la mère de la demanderesse, pour une  somme de 1,000 francs, a pratiqué à la date du 13   juin 1890 une saisie-arrêt sur la demoiselle Clerc, prise   comme héritière pour moitié de la débitrice ;   « Que la demoisellp fibucc, «^ipont do oa renoncia-  tion a la succession maternelle, renonciation faite au  greffe du tribunal de Clamecy, le 2 juillet 1889 de-  ges-intérêts contre le saisissant ;   « Mais attendu que, dès le mois de décembre 1888, la   demoiselle Clerc, conjointement avec sa sœur, adressait  à Aubery, notaire à Corbigny, le brevet d'une procura- tion notariée en date du 7 décembre 1888, à l'effet de   « vendre à l'amiable ou aux enchères une maison sise  « à la Chapelle de Sarre, commune de Corbigny, et ap- « partenant aux constituants indivisément avec Mme  « Brideau, leur sœur »";14 mars;TRIBUNAL CIVIL DE LA SEINE 6e ch;http://www.enap.justice.fr/ARCHIVE/ENAP_GAZETTE_TRIBUNAUX_18920919.pdf;189209192
189209220;"« Le Tribunal ;  « Attendu qu'il est constant en fait que par bail sous   seings privés, enregistré, du 30 janvier 1886, Peytral  est devenu locataire, moyennant 4,500 francs pour  quatre ou six ans, au choix respectif, d'un hôtel avec  jardin sis à Paris-Passy, avenue Jules-Janin, non loin  de l'encoignure de ladite avenue et de la rue de la  Pompe, et appartenant à Foulquier;   « Attendu que le bail originaire a été remplacé par   un nouveau bail en date du 11 novembre 1889, enre- gistré, fait pour quatre ans du 1er avril 1890 au l8r avril  1894, au prix de 5,000 francs, donnant à Peytral la  faculté de souslouer;   « Attendu que le terrain vague à l'encoignure de la  rue de la Pompe et de l'avenue Jules-Janin, et qui était  séparé de l'hôtel loué à Peytral, par un mur de clôture,  appartenait à Foulquier ;   « Attendu que ce terrain ayant été acheté à Foul- quier par Hurbain, ce dernier a, en Avril 1891, com- mencé des constructions qui ont nécessité la démoli- tion du mur de clôture du jardin de l'hôtel de Peytral  pour les constructions nouvelles et son remplacement  par un mur pignon à toute hauteur;   « Attendu que Peytral, locataire, se fonde sur l'édi-  fication par Hurbain de ce mur, pour demander au  Tribunal de prononcer la résiliation, à dater du premier  avril 1891, du bail du onze novembre 1889, la condam- nation de Foulquier, pour préjudice causé par la rési- liation, en cinq mille francs de dommages intérêts et à  lui restituer tout loyer qu'il aura indûment payé de- puis le premier avril 1891 :   ; « Attendu qu'il est constant que les travaux exécu-  tes par Hurbain sur son terrain, conformément à son  droit, ont eu pour effet, en substituant au mur de clô- ture qui existait jadis, et dont la hauteur était de deux  Piètres soixante et un centimètres, un mur pignon à  «Rte hauteur, de nuire à l'aspect de l'hôtel et surtout à  celui du passage à ciel ouvert, avec grille servant d'en- wee audit hôtel et de faire en sorte que ce passage,  d une largeur de trois mètres soixante centimètres sur  avenue Jules Janin, de trois mètres vers le milieu et   bo mètres soixante quinze centimètres à son dé- 1 Vt i   sur ^e Jarctin, se trouve enserré à gauche par   ^otel Peytral qu'il dessert, et à droite par le mur pi-  ënon de Hurbain sur une longueur de douze mètres en- viron ;   sa"" A""tt(^n<w <Iue le mur édifié par Hurbain, à raison de   ^, e hauteur, borne d'une façon désagréable la   Vll  i  bu   fenêtres> d'ailleurs fort peu nombreuses, qui le   ree H rnpo ' ^ue' ^e Plus, il diminue, dans une certaine  l'écl ■?e' la *umiere du passage et, par conséquent,   sur l H^  ge des Pièces de l'hôtel qui ont des ouvertures   p Passage, savoir : au rez-de-chaussée, le vesti-  ter-of ement et 1,escalier ; au premier étage, les wa- au'd une petite chambre à coucher et l'escalier;  serval!?me étage' les water-closets et une lingerie  ce m, Salle debam ; qu'on peut même craindre que  danci i ' eQ ProJetant à certaines heures son ombre   «A« pafage' v fasse naître quelque humidité ;   l'expto- n j1 que ces inconvénients divers résultant de  joSC ?droitd'Hurbain altèrent et diminuent la  matérip1}?6 la chose louée> 9ui bien que n'etant pas  valeur î rnt atteinte> se trouve amoindrie dans sa  auanpi ~u -ve.et est devenue moins propre à l'usage   TAH";2 août;COUR D'APPEL DE PARIS 7° ch;http://www.enap.justice.fr/ARCHIVE/ENAP_GAZETTE_TRIBUNAUX_18920922.pdf;189209220
