id;arrêt;date;juridiction;lien;id
189204011;"« La Cour ;   « Statuant sur le pourvoi formé par le sieur Cy-  prien Laville, contre un jugement rendu par le juge  de paix de Lussan (Gard), le 25 février 1892 ;   « Ouï, en l'audience publique de ce jour, M.le con-  seiller Ruben de Couder en son rapport, M. l'avocat  général Desjardins en ses conclusions, et après en  avoir délibéré en chambre du Conseil ;   « Attendu que Laville n'ayant point eu de contra-  dicteur dans l'instance, le jugement attaqué n'était  point susceptible de notification ;   « Que par suite le délai du pourvoi a commencé à   courir dès ledit jugement, c'est-à-dire le 25 février  1^92 ;   « Qce cependant le pourvoi n'a été formé que le 8   mars suivant, date de la réception de la requête au   greffe de la Cour de Cassation, et par conséquent   après l'expiration du délai de dix jours, imparti par  l'article 23 du décret organique du 2 février 1852 ;   « Qu'il n'y a pas lieu de s'arrêter à l'assertion du   demandeur en cassation, non plus qu'à l'attestation  donnée après coup par le greffier de la justice de  paix ;   « Par ces motifs,   « Déclare le pourvoi non recevableetc... »";29 mars;COUR DE CASSATION ch;http://www.enap.justice.fr/ARCHIVE/ENAP_GAZETTE_TRIBUNAUX_18920401.pdf;189204011
189204030;"« La Cour ;   « Considérant que Raveneau a été chargé par la   Banque des Provinces, le 20 février 1890, de ven- dre pour son compte 640 pesetas de rente espagnole  4 p. 100 dite « Dette extérieure »";14 janvier;COUR D'APPEL DE PARIS 6° ch;http://www.enap.justice.fr/ARCHIVE/ENAP_GAZETTE_TRIBUNAUX_18920403.pdf;189204030
189204040;"« Le Tribunal ;   « Attendu qu'un arrêté du maire de La Gorgue du  13 mars 1861, dûment approuvé par l'autorité admi- nistrative, a concédé à Madame veuve Vankempen  un terrain d'une contenance de 36 mètres carrés, dans  le cimetière de cette commune, pour y fonder à per- pétuité sa sépulture et celle de sa famille ; qu'en ver- tu d'une délibération du conseil municipal du 7 no- vembre 1885, approuvé par arrêté préfectoral du 21  décembre de la même année, le cimetière dans lequel  cette concession avait été accordée a été fermé pour  cause d'exiguitéet de salubrité publique ; qu'à la suite  de la désaffectation de ce cimetière, la commune a   mis à la disposition du demandeur dans le nouveau  cimetière un terrain d'égale grandeur à titre de con- cession à perpétuité et qu'elle s'est déclarée prête à  y faire transporter à ses frais les restes inhumés dans  la première concession ;   « Que Charles Vankempen a alors assigné la   commune à l'effet de la contraindre, en outre de ses  offres, à réédifier à ses frais dans le nouveau cime- tière le monument existant dans l'ancien ; que pour  justifier sa prétention, il allègue que l'acte du 13 mars  1861 ne contenant aucune réserve, la commune,  comme tout contractant ordinaire, ne peut rien faire  qui nuise aux droits du concessionnaire et doit, en  cas de translation du cimetière, réparer complète- ment le préjudice que lui cause le nouvel état de  choses ;   « En droit :   « Attendu qu'un acte de concession de terrain   dans un cimetière est un contrat d'une nature parti- culière, dont les effets, à défaut de stipulations con- traires arrêtées entre les parties, sont réglées par le  décret du 23 prairial an XII";8 mars;"COUR D'APPEL DE DOUAI 1"" ch";http://www.enap.justice.fr/ARCHIVE/ENAP_GAZETTE_TRIBUNAUX_18920404.pdf;189204040
189204080;"« Le Tribunal ;  « En ce qui touche veuve Durand :  « Sur le renvoi opposé par Buguet à la demande   principale :   « Attendu que la traite dont veuve Durand réclame   le montant à Buguet a été acceptée par ce dernier  au bénéfice de Plattet qui l'a lui-même passée à veuve  Durand en couverture d'un débit né en suite d'opéra- tions de Bourse ayant un caractère commercial ; que  la cause est donc commerciale et ce Tribunal com- pétent pour en connaître ;   « Par ces motifs, retient la cause ;  « Au foad :  « Attendu que veuve Durand se présente porteur   d'une traite de 6,995 francs, payable au 5 juillet 1889,  acceptée par Buguet, proteslée défaut de payement à  échéance ;   « Attendu que, accepteur, Buguet se doit à sa si-  gnature ; que toutefois il échet, ainsi que le recon- naît veuve Durand, de le créditer de 2,000 francs,  acompte par lui versé; que, si pour se refuser au  payement à lui réclamé, l'opposant soutient que  veuve Durand ne serait q:ie le prête-nom de Plattet,  lequel lui aurait promis terme et délai, il n'apporte  aucune preuve de ses allégations ; qu'il échet en con- séquence, tant de l'obliger au payement des 4,995  francs réclamés que de le débouter de sa demande  reconventionnelle à fin. de dommages-intérêts fondée  sur les motifs déduits ci-dessus, lesquels viennent  d'être écartés ;   « En ce qui concerne Plattet :   « Attendu que si Buguet croit avoir à poursuivre  contre Platiet réparation du préjudice qu'il lui aurait  causé, il lui appartient de le faire par voie de de- mande directe et non au moyen de demande recon- ventionnelle, alors que le jugement auquel il est  formé opposition n'a pas été obtenu à la requête de  Plattet ; qu'il échet, en conséquence, d'office, de ren- voyer Buguet en ce qui concerne Plattet, à mieux  procéder ;   « Par ces motifs,  « Jugeant en premier ressort ;  « Déboute Buguet drf son opposition au jugement   dudit jour 26 juillet dernier ;   «c Ordonne que ce jugement sera exécuté selon sa   forme et teneur nonobstant ladite opposition;   « Déclare Buguet mal fondé en sa demande recon-  ventionnelle contre dame veuve Durand, l'en dé- boute ;   « D'office, renvoie Buguet à mieux procéder à l'é-  gard de Plattet ;   tous les dépens ;   « Et condamne Buguet par les voies de droit en   « Ordonne que le présent jugement sera exécuté   selon sa forme et teneur. »";9 février;COUR D'APPEL DE PARIS 7e ch;http://www.enap.justice.fr/ARCHIVE/ENAP_GAZETTE_TRIBUNAUX_18920408.pdf;189204080
189204090;"« Le Tribunal ;   « Sur la demande principale de l'enregistrement ;  « Attendu que par exploits des 12 et 16 février 1887,   Escande et la Société Bréville et Cie ont formé oppo- sition aune contrainte décernée contre eux, par l'ad- ministration des Domaines et de l'Enregistrement, le  7 du même mois; que l'Administration demande la  validité de cette contrainte et la condamnation des  défendeurs à la somme de 4,331 fr. 25, montant de  cette contrainte ;   « Attendu, en fait, que par acte reçu, Gatine no-  taire à Paris le 25 mai 1886, Escande, tant en son  nom personnel que comme liquidateur de la société  Escande et Cie, a vendu à la société Bréville et Cie:  1° « Les objets mobiliers, matériel et outillage se  trouvant d ms l'usine de Creil, lui appartenant, ainsi  qu'à la société Escande et Cie ; 2° Les constructions  composant ladite usine, »";43 novembre;TRIBUNAL CIVIL DE LA SEINE 2« ch;http://www.enap.justice.fr/ARCHIVE/ENAP_GAZETTE_TRIBUNAUX_18920409.pdf;189204090
189204100;"« Le Tribunal ;   « Vu la connexité joint les causes et statuant sur le   tout par un seul et même jugement ;   « Sur la demande principale :   « Attendu que Saint frères prétendent que Caget et   Devien, qui se sont substitués au Comptoir d'Es-  compte pour effectuer l'encaissement d'un billet de   600 francs, par eux remis à cet effet audit établisse-  ment, n'ont pas observé les formalités prescrites par   les articles 162 et 165 du Code de commerce, et que   par suite de cette négligence, ils ont été déclarés dé-  chus de tout recours contre les endosseurs ; et   qu'ainsi le Comptoir d'Escompte et ses mandataires   substitués devraient être rendus responsables soli-  dairement du préjudice qu'ils ont éprouvé de ce fait,   en principal,intérêts et frais;   « Mais attendu que de l'examen du billet dont il   s'agit, il résulte qu'il était payable dans une petite   localité éloignée de tout centre où les établissements   de crédit ont des correspondants et privée d'huissier,   ee qui n'a pas permis de remplir les formalités pres-  crites par ies articles sus-visés ; que d'ailleurs, étant   donné le lieu de payement du billet, il appartenait   aux demandeurs de prendre des précautions, et de se   faire remettre une dispense de protêt pur leur cédant,   alors surtout que d'après les conditions générales qui   règlent les rapports du Comptoir national d'escompte   avec ses clients, lesquelles ont été portées à la con-  naissance des demandeurs, le Comptoir est dispensé   des formalités de protêt, notamment pour les eflets   payables dans les bourgs, villages et autres localités   privées d'huissiers, ce qui est le cas dans l'espèce ;   « Qu'il s'en suit qu'aucune faute n'est imputable   aux défendeurs, et que Saint frères ne peuvent s'en   prendre qu'a eux-mêmes du préjundice qu'ils ont   subi, en perdant leur recours, par suite du non ac-  complissement des formalités prescrites par la loi;   c Sur la demande en garantie :   « Attendu qu'à raison des motifs qui précèdent   cette demande devient sans objet;   « Par ces motifs,   « Déclare Saint frères mal fondés en leur demande,   « Dit sans objet la demande en garantie ;   « Et condamne Saint frères en tous les dépens. »";9 avril;TRIBUNAL CIVIL DE LA SEINE 1- ch;http://www.enap.justice.fr/ARCHIVE/ENAP_GAZETTE_TRIBUNAUX_18920410.pdf;189204100
189204130;"« Le Tribunal ;   « Attendu que suivant acte reçu par M"" Renault,   notaire à Auneau, le 27 août 1883, le sieur Berthelot   a consenti aux époux Rabier un prêt d'une somme de  20,000 francs, avec une garantie hypothécaire, la- quelle est libellée audit acte ainsi qu'il suit: « A la  « sûreté et garantie du remboursement du capital de  « la présente obligation, du payement des intérêts et  « de tous frais et accessoires, M et Mme Rabier  « affectent et hypothèquent au profit de M. Berthelot  « qui accepte : généralement tous les immeubles leur  « appartenant en nature de bâtiments, d'habitation  « et, d'exploitation, terres labourables, prés et bois,  « situés dans les arrondissements de Chartres et de  « Rambouillet, et plus spécialement les partie et  « portions(le cinquième) appartenant à M. Rabi er, dans  « les immeubles ci-après [situés commune de Louville- « la-Chenard, canton deVoves, et même latotalitédes  « dits immeubles pour le cas où il en deviendrait  < propriétaire par licitation, partage ou autrement,  « savoir : premièrement, un lot de terres laboura- « bles contenant 30 hectares 56 ares 30 centiares  « environ, affermé à M. Barré-Hy, par bail passé de- « vaut M"" Levassor, notaire à Louville-la-Ghenard,  « le 18 novembre 1867 ; deuxièmement, un autre lot  « de terres labourables d'une contenance de 23 hec- « tares 88 ares 91 centiares, affermé à Mme Meunier,  « suivant bail passé devant le même notaire, le même  < jour, 18 novembre 1867 ; troisièmement, et la ferme  « d'Herville, comprenant bâtiments d'habitation et  « d'exploitation, jardin, terre et bois, d'une conte- « nance totale de 124 hectares 57 ares 6 centiares,  « loués à M. Marchon aux termes d'un bail passé   * devant Me Thomain, notaire à Louville la-Chenard,   « le 8 mai 1876, ainsi quelesdits immeubles sepour- « suivent et comportent avec toutes leurs dépendan- « ces sans exception, et sur lesquels il sera pris in- « scription au nom du créancier contre les débiteurs ;  « et attendu l'insuffisance reconnue des biens ci- « dessus hypothéqués, M. et Mme Rabier consen- « tent que tous les biens qui, à quelque titre que ce  « soit, viendront à leur appartenir, par la suite,   « soient et demeurent affectés à la garantie des cau-  « ses de la présente obligation au fur et à mesure  « qu'ils en deviendront propriétaires, et ils autori- « sent dès maintenant M. Berthelot à prendre sur  « lesdits biens toutes inscriptions nécessaires »";11 février;COUR D'APPEL DE PARIS 2° ch;http://www.enap.justice.fr/ARCHIVE/ENAP_GAZETTE_TRIBUNAUX_18920413.pdf;189204130
189204140;"« La Cour ;  « Sur l'appel principal :   « Attendu qu'en principe l'hypothèque légale de la   femme dotale peut être purgée aussi bien que celle de  la femme mariée sous un régime libre ; qu'en orga- nisant dans l'intérêt du Crédit foncier un système  spécial de purge des hypothèques légales, ni le dé- cret du 28 février 1852, ni la loi du 10 juin 1853 n'ont  fait aucune exception concernant la femme dotale ;  qu il résulte au contraire du texte de l'ancien article  20 du décret de 1852, des nouveaux articles 19, 20, 21,  25 et des travaux préparatoires de la loi de 1853, que  l'hypothèque légale de la femme peut être purgés par  le Crédit foncier, quel que soit le régime sous lequel  le mariage a été contracté ;   « Que le doute à cet égard paraît si peu possible   que l'intimée, renonçant à défendre la théorie du ju- gement déféré, se borne à soutenir qu'en sa qualité  de femme sarde, mariée avant l'annexion et ayant  pris inscription en 1856, elle bénéficiait d'une hypo- thèque inscrite et ayant par suite échappé à la purge  du Crédit foncier ;   « Attendu que la législation sarde qui assujétis-  sait l'hypothèque légale à la formalité de l'inscription  la dispensait, en même temps, de renouvellement  pendant toute la durée de la vie de la femme ; que la  prétention de la dame Rieux pourrait donc être fon- dée si ses droits n'avaient été modifiés par une loi  postérieure à l'annexion ; mais que la loi du 9 juin   1865, par son article 1er, a imposé aux créanciers à   hypothèques légales inscrites sur les registres des  conservateurs dans les territoires annexés l'obliga-  tion de renouveler leuri inscriptions avant le ltr jan-  vier 1866, si elles avaient plus de quinze ans de date,  et que, par son article 2, elle enjoint aux conserva- teurs de ne porter sur les états qu'ils délivreront à  l'avenir que les inscriptions d'hypothèques légales,  conventionnelles ou judiciaires, dont la date ou le  renouvellement ne remontera pas au-delà de quinze  ans s'il s'agit d'inscriptions prises ou renouvelées  avant le 25 août 1860, ou au-delà de dix ans s'il s'agit  d'inscriptions prises ou renouvelées depuis cette  époque ;   « Qu'il suit de la combinaison de ces deux articles   que l'inscription primitive de l'hypothèque légale de   la femme sarde est périmée si elle n'a pas été renou- velée, soit avant le 1"" janvier 1866, soit dans les  quinze ans de sa date et ensuite tous les dix ans ;  que, sans doute, les droits que cette inscription avait  conservés jusqu'au moment de sa péremption ne  sont pas perdus, mais qu'ils ne sont désormais ga- rantis que par une hypothèque non inscrite, sem- blable à celle de la femme française, jouissant des  mêmes avantages et soumise aux mêmes règles ;   « Que cette transformation de l'hypothèque autre- fois publique en une hypothèque occulte et son assi- milation à celle de la femme française sont démon- trées non seulement par les travaux préparatoires de  la loi de 1865, mais encore par les termes de son ar- ticle 3, qui, en indiquant les moyens à prendre pour  conserver les droits résultant de l'hypothèque légale  sarde, vise les articles 2195 du Code civil, 692, 717,  772 du Code de procédure civile, exclusivement ap- plicables aux hypothèques non inscrites ;   « Attendu que rien n'autorise à penser que la loi   de 1865 soit inapplicable en cas de conflit entre le  Crédit foncier et la femme sarde ; qu'il est inadmis- sible que l'hypothèque légale de cette dernière soit  publique vis-à vis du Crédit foncier, et son inscrip- tion conservée, alors que vis-à-vis de tous autres  l'inscription est périmée et l'hypothèque occulte ;   qu'une telle exception peut d'autant moins s'induire  du silence de la loi, qu'elle serait dirigée contre un  établissement considéré comme étant d'un intérêt  général et, à ce titre, entouré par le législateur d'une  faveur spéciale ;   « Attendu que si f'article 3 de la loi ne dit pas ex- pressément comment doit procéder la femme sarde  qui veut défendre son hypothèque contre la purge du  Crédit foncier, l'argument que la dame Rieux tire de  cette lacune pour en conclure que la purge est impos- sible n'est pas plus fondé que celui que pourrait en   , tirer en sens contraire le Crédit foncier s'il soutenait  que vis-à-vis de lui la péremption de l'inscription a  entraîné la perte du rang hypothécaire et que, par  suite, la purge est inutile ;   « Que la seule interprétation juridique que com-  porte la rédaction de l'article 3, c'est que le législa- teur s'étant préoccupé de eo quod plerumque fit, son  énumération des cas de purge n'est pas limitative ;  que, par identité de motifs et par application du dé-  BUR";15 mars;COUR DE CASSATION ch;http://www.enap.justice.fr/ARCHIVE/ENAP_GAZETTE_TRIBUNAUX_18920414.pdf;189204140
