id;page;arrêt;date;juridiction;lien;id
1840072;77;    En ce qui touche la fin de non recevoir proposée par Simon Morlet  partie de Rouher  aîné  contre le moyen de nullité de l'enquête    7 Considérant que  quoique l'avoué des époux Gémois ait comparu à l'enquête   ait exercé des reproches contre les témoins  et ait consenti à leur audition  il n'en résulte pas qu'il ait renoncé par là aumoyen de nullité qu'il avait fait valoir et consigner dans le procès verbal d'enquête  avantque les témoins fussent entendus   que l'enquête a été continuée à son égard  sans détruire l'effet d'une protestation qui était soumise à l'appréciation du juge} et qui n'était pas effacée par sa comparution  qui ne peut êlre considérée que comme intervenue dans le cas ou le moyen de nullité serait rejelé  Considérant que la nullité dont excipent les époux Gémois  parties de Bernet père  et qui résulte de l'inobservation des délais prescrits par les articles combinés 261 et 1033  C  proc  pour l'assignation donnée aux époux Gémois pour être présens à l'enquête  est reconnue par Morlet  Considérant qu'après le jugement du 2 déc  i 835  prononçant la jonction de la demande principale et de la demande en garantie  les époux Gémois avaient intérêt  comme les autres parties de la cause  à ce que rien ne fût ordonné sans leur participation pour le jugement de la demande principale   Considérant  d'ailleurs  que leur intérêt  pour être appelé à l'enquête  était reconnu par Morletlui même qui les avait assignés à cet effet   et que leur présence était d'autant plus nécessaire  que certains faits se rattachant à lapreuve offerte par Morlet  les concernaient indirectement comme leur étant personnels   Considérantque l'enquête ordonnée devait portersur des faits qui se rattachaient principalement à la possession ou à l'exercice prétendu du droit de servitude de la part des parties de Tailhand  que l'enquête faite valablement à leur égard  doit  par suite du principe d'indivisibilité  êlre admise pour que le juge puisse y puiser des élémens de conviction pour rendre son jugement   qu'en se décidant pour la validité de l'enquête plutôt que pour la nullité  oh obtient l'avantage d'une justice prompte  obtenue à l'aide de moyens d'instruction sûrs et faciles  moyens qui manqueraient au juge dans le cas de nullité de l'enquête prononcée contre toutes les parties    Considérant  d'ailleurs  que l'intérêt des époux Gémois appelés en garantie  se confondant avec celui des parties de Tailhand  demandeurs en garantie  la validité de l'enquête à l'égard de ces derniers doit faire admettre  ses effets et ses conséquences à l'égard de toutes  les parties   r Par ces motifs  sans qu'il soit besoin d'«xaminer la fin de non recevoir proposée par la partie de Rouher aîné contre le moyen de nullité de l'enquête  dit qu'il a été mal jugé par le jugement dont est appel  bien appelé   émendant  déclare l'enquête du 13 nov  1837 régulière et valable  etc          ; 15 janv. 1840.r;Cour roy. de Riom.;https://gallica.bnf.fr/ark:/12148/bpt6k5541626x/f77.image;1840072
1840073;80;    Attendu qu'il suit des termes de la citation  que les propos incriminés auraient été proférés pendant la messe  alors que le sieur Mauran était en cliaire et revêlu de ses habits sacerdotaux  que de ces circonstances il résulte que le sieur Mauran  quand il a proféré les paroles qu'on lui impute  était dans l'exercice du culte  •'      '  Attendu  en droit  que l'art  6 de la convention du 26 mess  an 9  insérée dans la loi du 18 gémi  an 10  déclare  cas d'abus   toute entréprise ou tout procédé qui  dans l'exercice du culle  peut compromettre l'honneur dés citoyens  troubler arbitrairement leur conscience  dégénérer contre eux en oppressioh ou en injures  ou en scandale public  que cet article soumet ^appréciation des cas d'abus au conseil d'Etat qui  selon l'art  8 de la convention déjà citée  termine définitivement lé procès dans la forme administrative  ou renvoie  selon l'exigence des  cas  aux autorités compétentes   Attendu qu'à ces termes  le fait reproché au sieur Mauran serait un cas d'abus qui aurait dû être porté d'abord devant le con' séild'Etat  et que le tribunal correctionnel ne pouvaitpas juger   Annulië le jugement  du 3 féy   dernier  du tribunal correctionnel d'Agen  comme ineompétemmentrendu etc            ; 27 féy. 1840.;Cour roy. d'Agen.;https://gallica.bnf.fr/ark:/12148/bpt6k5541626x/f80.image;1840073
1840074;81;  Attendu que lesnuilites sont de droit étroit  que si en général l'application doit en être resli einle  celte réserve est surtout commandée quant aux actes destinés à constatérl'état des familles   Que la loi d'organisation du  notariat est étrangère aux actes de cette espèce  etqu'ils'sont exclusivement régis parles dispositions du Gode civil   Attendu que l'art  39  Cod  civ   eh réglant ceriaines formalités nécessaires pour la constatation des actes de l'état civil  n'a pas déclaré d'une manière absolue que leur inaccompjissement dût entraîner la nullité  des actes de naissance  et de décès  ni même des actes de mariage   'Qu' on ne saurait en conclure qu'un acte de mariage fût néanmoins   valable  même au cas où on n'y trouverait aucune/des signatures prescrites  surtout ceiie de l'officier de l'état civil   ^ Mais qu  on ne  saurait non plus annuler tout acte de'mariage qui manquerait de l'une des signatures des témoins ou des parties ialôrs quel'absence de cette signature peut'n'être que le résultat d'une inadvertance ou d'une erreur  Que la loi a laissé aux tribunaux le soin de décerner le cas où le vice reproché à l'acte est substantiel et doit le faire déclarer non existant  '■ •'  Attendu que  dans l'espèce  l'acte de mariage a été signé par l'une des parties comparantes  par tous' les témoins et par l'officier de l'état civil qui l'a reçu en sa qualité   que  si l'une des parties comparantes a omis de le signer  ce défaut de signature qui  d'après les circonstances delà cause 'a été purement accidentel  n' empêehe pas l'acte de subsister et de prouver que les parties ont été unies par mariage  Qu'on trouve'dahslediracte renonciation de toutes les'formalités prescrit'espar les à'rt   75 ét 76  plus spécialement applicables aux'actes dû mariage  et notamment'la déclaration des parties faite'devant l'offiëier dé l'état civil qu'elles veulent se prendre pour mari et femme  que  lorsqu'à làWit'é' de celle déclaration l'officier de l'état civil' a proclamé au nom de la loi l'union des'époux  on ne saurait prétendre que le mariage n'a pas eu lieu par le seul fait de l'absence de l'une des signatures des comparans    Attendu que si le défaut de celte signature eût été invoqué comme viciant le consentement de l'époux non signataire  il eût été seul recevable à l'attaquer sur ce fondement  aux termes de l'art  180    Que l'action ne pourrait êlre admise de la part de ceux là même qui ont assisté au mariage   Qu'enfin il résulte des actes de la cause que les demandeurs en nullité en ont eux mêmes reconnu l'existence  que  sous ce rapport encore  ils sont non receyables dans leur action   Confirme  etc          ■  ; 4 fév. 1840.;Cour roy.:de Montpellier.;https://gallica.bnf.fr/ark:/12148/bpt6k5541626x/f81.image;1840074
1840075;81;"   Attendu que  s'il est constant que l'individu pourvu d'un conseil judiciaire ne perd pas la faculté et ledroit de contracter mariage  il ne s'ensuit pas que s'il se rencontré à l'exercice de ce droit des obstacles qui l'obligent d'avoir reeburs'à l'autorité de la  justice  il puisse se dispenser dé l'assistance dé ce conseil   éh vain dirait on que ce serait gêner la liberté îa plus précieuse  que le (t) F  en ce'sens  Caen  19 mars 1839 (tom  39 2 275)  et la note   Tom  XL  ¥■ Cah   conseil judiciaire n'est établi que pour garantir le prodigue de sa propre faiblesse et de ses penchansàla dissipation de ses'biens  que le législateur en laissant au prodigue le droit de disposer de sa personne n'a misa ce droitaucunerestrielion   Mais  attendu que l'art  513  Cod  civ   est positif  absolu  etqu'ilen résulte que le pourvu du conseil judiciaire ne'péùt plaider sans l'assistance de ce conseil 'que  dès lors  pour citer ladame'Massoc  sa'mère qui avait formé opposition au mariage de son'fils  celui ci devajt  aux termes de cet art  513  avoir l'assistance de son conseil  Les premiers juges  ont confondu Ië droitlitcohteslable de se marier avec ^exercice de ce droit  qui obligeait Mass oc fi s denlaider pour obtenir la mainlevée de l'opposition formée par sa mère  ^Que c]e st     dès lors  le cas de réformer le jugement dont est appel  et de déclarernulles et irrégulières les poursuites de Màss'oc'contre sa mère   Réforme  etc  •  • ' ""  "; 2déc. 1839. ; Cour roy. de Toulouse;https://gallica.bnf.fr/ark:/12148/bpt6k5541626x/f81.image;1840075
1840076;81;      Considérant que l'opposition' formée'par Girin et Avril à la saisie pratiquée par l'appelante sur les marchandises qui   se trouvaient dans le magasin de' Girin  est fondée sur l'existence d'une prétendue société qui  aurait  existé entre lesdits opposans pour la venté des marchandises  saisies    Considérant qu'il est constant  en fait que Jèsformalités prescrites par le'Code de commerce pour  la publication dés actes de société' en'nom collectif  n'ont point été accomplies  qu'ain'si l'association dé Girin et d'Avril doit être considérée  comm'e n'existant pas à l'égard des tiers intéressés   Considérant que'là femme Girin  exérçant'contre son mari des droits à'elle 'personnêls'résùllant'de'sbri'contrat de ma  ' riage  est un tiers à l'égard de'Girin  qu'elle peut en celte Qualité invoquer la nullité dé l'association dont il s'agit  sans qu'il soit   163    Lois el Décisions diverses  16$ ■  possible de lui opposer la connaissance qu'elle aurait eue de ladite société   '  En ce qui touche les  conclusions de Doyon   Considérant que si Doyon est également un tiers intéressé exerçant  un droit personnel différent de ceux des associés  sa présence dans la causé ne peut ni anéantir ni modifier le droit qui résulte pour la femme des dispositions de l'art  42  Cod  comm    Infirme   au principal  fait mainlevée de l'opposition  ordonne que les poursuites d'exécution seront continuées  etc   ; 4 mars 1840.;Cour roy. de Paris.;https://gallica.bnf.fr/ark:/12148/bpt6k5541626x/f81.image;1840076
1840079;83;"    Attendu qu'il existe dans Ja procédure de saisie immobilière  deux phases principales que le législateur a soigneusement distinguées  et qui embrassent  l'une tous les actes de la poursuite antérieure à l'adjudication préparatoire  contre tous les acles compris entre cette adjudication et l'adjudication définitive    Attendu que le législateur a voulu assurer irrévocablement la validité delà première partie de là procédure ainsi divisée  ayant qu'il pût être procédé aux actes compris dans la seconde  comme aussi des précautions ont'été prises par lui pour que celte seconde partie dé ^procédure elle même se trouvât irrévocablement validée et mise à l'abri de toute attaque  avant que l'adjudication définitive à laquelle tendent tous les actes de la poursuite  fût prononcée    Qu'à cet effet  d'une part  l'art  733  Cod  proc  a exigé que les moyens de nullité contre la procédure antérieure à l'adjudication préparatoire  fussent proposés et jugés avant ladite adjudication   et d'autre part  l'art  735 dudit Code et l'art  2 du décret du 2 fév  1811 ""ont assujéir la partie saisie à l'obligation de proposer les moyens de nullité oontferla procédure postérieure à l'adjudication provisoire  quarante jours avant celui indiqué pour l'adjudication définitive   Attendu que la""sagesse du législateur a ainsi rendu impossible l'annulation rétroactive d'une procédurelongue et dispendieuse  qui aurait pu sans cela être renversée après que tout aurait été consommé     Qu'il importe donc de maintenir et d'ap   pliquer  conformément à cet esprit général de la loi  les dispositions „  (1) Suivant un arrétdela Cour decassation du 25 avril 1814 (tom  14 1  259   la partie saisie  est recevable  dans ce cas   i fa ire statuer  même après le jugement d'adjndication  sur les moyens denullité  d'où Ja conséquence  que la yalidilé decetteadjudication dépendrait de la décision à intervénir  sur ces moyens          j *     '   •   ■             f    11   167 ' Lois el Décisions diverses  168  précitées    Attendu qu'en exigeant impérieusement que les moyens de nullité proposés contre la procédure antérieure à l'adjudication préparatoire  fussent jugés avant la dernière adjudication  et en disposant que ladite adjudication serait prononcée par le même jugement qui rejetterait les moyens  l'art  733  Cod  proc  a frappé de nullité le jugement  qui prononcerait l'adjudication sans statuer préalablement surlesdils moyens proposés el non abandonnés   Attendu qu'il résulterait du système contraire  que les dispositions impéralives de la loi pourraient êlre éludées  el que les moyens de nullité pourraient être encore jugés et accueillis après j l'adjudication préparoire prononcée  de manière à faire annuler cetteadjudication  par où le texte et l'esprit de la loi se trouveraient également violés    Qu'il en résulterait encore que le juge de qui serait émané le jugement d'adjudication définitive pourrait accueillir postérieurement les moyensde nullité qui feraient tomber ledit jugement  et se réformer ainsi lui même    Attendu  en fait  que la dame Larrlez fit signifier le 4 nov  1835  veille du jour fixéalors pour l'adjudication préparatoire de l'étang de Marseillette  une requête contenant ses moyens denullité contre la procédure antérieure  Attendu que la requête étant le mode régulier et légal de former les incidens en matière de saisie immobilière  les moyens ainsi signifiés se sont trouvés dès lors valablement proposés         Attendu qu'en cet élat les intimés poursuivans devaient faire juger les derniers moyens avant de provoquer l'adjudication préparatoire   Que cependant l'adjudication préparatoire a été requise par eux' et prononcée par le tribunal  sans qu'il ait même été question dèsdits moyens proposés el réservés    De tout quoi il suit qu'il y a lieu d'annuler le jugement ainsi rendu     Par ces motifs  annullc le jugement d'adjudication préparatoire dont s'agit  etc    "; 31 déc. 1839.;Cour roy. de Montpellier.;https://gallica.bnf.fr/ark:/12148/bpt6k5541626x/f83.image;1840079
