id;page;arrêt;date;juridiction;lien;id
184000;4;LA COUR  Attendu qu'il résulte du jugement dont est appel  que Rogier  présent à sa prononciation  a demandé  par son défenseur  un délai pour plaider au fond  ce qui était  de sa part  un acquiescement formel à ce jugement  et le rendait  par conséquent  non recevable à en appeler par la suite  Déclare l'appel non recevable  etc   ; 27 mars 1838. ; Cour roy. d'Amiens. ;https://gallica.bnf.fr/ark:/12148/bpt6k5541626x/f4.image;184000
184001;4;LA COUR   Considérant que Villaret  en consentant à ce que la cause fût remise à quinzaine pour plaider au fond  a acquiescé au jugement dont était appel   Déclare l'appel non recevable  etc   ; 22 janv. 1839. ; Cour roy. d'Amiens.;https://gallica.bnf.fr/ark:/12148/bpt6k5541626x/f4.image;184001
184002;4;"   Considérant que l'opposition formée par Baudelaire ne s'appuie en principe que sur des inductions qu'il tire du mot pourra employé dans l'art  114  Cod  inst  crim     Qu'il soutient que cette expression pourra ne se rapporte qu'au droit accordé au prévenu de demander sa liberté provisoire sous caution  et que cela résulte de ce que la loi donne au juge le droit de fixer le chiffre du cautionnement  ce qui serait  selon lui  exclusif du droit de refuser la liberté   Considérant que le point à examiner en droit est celui de savoir s'il résulte de l'emploi du mot pourra une faculté pour la chambre du conseil d'accorder ou de refuser la liberté provisoire   Considérant que  pour que le système de Baudelaire eût quelque apparence de fondement  il faudrait qu'on lût dans l'art  114  9 Lois et Décisions diverses  10  comme cela se trouve dans les lois sur la presse et dans celles sur les contributions indirectes   «Le prévenu obtiendra sa mise en liberté sous caution   « Considérant qu'il suffit de rapprocher la rédaction du Code d'instruction criminelle de la législation antérieure  pourvoir que ce Code contient de nombreuses modifications  toutes empreintes de l'esprit de restriction de la liberté des prévenus  qui régnait à l'époque de sa promulgation   Que  d'un autre côté  en se renfermant même dans le texte de l'art  114  on est forcé de reconnaître que les mots   la chambre du conseil pourra  etc   impliquent l'idée d'une faculté  d'un droit d'examen et de discussion  exclusifs d'une obligation de souscrire à la demande du prévenu  que cela est  démontré jusqu'à la dernière évidence dans le second paragraphe du même article  où il est dit « que la mise en liberté pourra être demandée et accordée   » car s'il est vrai  comme le soutient le prévenu  que ce qui est demandé peut être accordé  il ne l'est pas moins que celui qui peut accorder peut refuser    Considérant que cette opinion prend une nouvelle force lorsque l'on considère que l'art  114 contient une autre innovation dans l'obligation où est la chambre du conseil d'entendre le procureur du roi  ce qu'on peut considérer à la fois comme une garantie pour la société et pour le prévenu   Considérant que le législateur  en créant une nouvelle juridiction  en prescrivant l'intervention du ministère publie  en abaissant le chiffre du"" cautionnement  selon les circonstances  a nécessairement conféré aux juges l'importante mission de rechercher dans la cause et dans les antécédens des prévenus la conséquence de la demande qui leur est faite  et le droit de l'accorder ou de la rejeter  droit sans lequel tout examen serait entièrement inutile    Que cela est enfin démontré par l'exposé des motifs de la loi où l'on trouve que ce projet laisse le juge  libre d'admettre ou de refuser la demande en liberté provisoire    Considérant enfin que Baudelaire  déjà poursuivi pour plusieurs délits  aurait le plus grand intérêt à user de sa liberté pour paralyser la marche de la justice   Déclare ledit Baudelaire mal fondé dans son opposition à l'ordonnance rendue le 28 novembre par la chambre du conseil  et l'en déboute   "; 7 déc. 1839. ; Cour roy. d'Orléans. ;https://gallica.bnf.fr/ark:/12148/bpt6k5541626x/f4.image;184002
184003;5;   Attendu qu'il n'est pas établi que Jeanne d'Hériette ait réclamé le paiement de la somme de 8 000 fr  comme créancière hypothécaire  de son mari failli   mais que  quand il en serait ainsi    elle né serait pas déchue du droit de se présenter en qualité de simple créancière chirographaire  Attendu que l'art  560 de la loi du 28 mai 1838 sur les faillites impose bien à la femme l'obligation de faire ses justifications par des actes authentiques  mais c'est lorsqu'il s'agit de reprendre en nature les effets mobiliers qui lui appartiennent  que l'art  563 de la même loi  qui veut que la femme ait pour titres des actes avec dates certaines  n'est applicable qu'au cas ou elle réclamé une hypothèque légale sur les biens de son mari   Attendu que  si la loi du 28 mai 1838 avait placé la femme du failli en dehors du droit commun  et si Jeanne d'Hériette était assujétie à établir sa créance de 8 000 fr  contre son mari par acte ayant date certaine  elle devrait encore être admise au passif de la faillite pour cette somme  parce qu'il résulte des actes d'une instance devant le tribunal de Chambon  d'un jugement rendu par ce tribunal  dans lequel l'intimée a figuré  aussi d'écritures devant la Cour  et d'un arrêt où était partie Jeanne d'Hériette  le tout à l'occasion d'un procès remontant à 1813  et où il s'agissait d'une rente créée en faveur de celle ci par le sieur Peyroux  que le mari de l'intimée avait reçu pour elle 8 000 fr   et que ces actes de procédure  jugement et arrêt ont des dates certaines     Attendu enfin que la somme de 8 000 fr  pour laquelle Jeanne d'Hériette demande à concourir avec les autres créanciers chirographaires de son mari n'est pas entrée dans la communauté qui a existé entre elle et François Southon  Confirme  etc   ; 29 juin 1839. ; Cour roy. de Limoges. ;https://gallica.bnf.fr/ark:/12148/bpt6k5541626x/f5.image;184003
184005;6;    Attendu  sur la fin de non recevoir  qu'en demandant une prorogation pour la contre enquête  Joly n'a fait qu'user d'une faculté que la loi lui accorde et que commandait son droit de défense     Que cet acte ne peut donc pas être considéré comme une enquête  d'autant plus que  par une déclaration insérée au procès verbal  Joly a fait des réserves à cet égard   Attendu  sur le moyen de nullité  que le juge de paix délégué par la Cour pour  procéder à l'enquête agissait non en vertu de son pouvoir ordinaire et dans le cercle de ses attributions spéciales  mais bien en vertu d'une délégation dont l'effet est de conférer au juge délégué les pouvoirs du juge qui délègue  que  par suite aussi  la forme de procéder en matière ordinaire est celle tracée par le lit  12 du Cod  proc  civ     Que la qualité de juge délégué ne peut ni changer la nature de l'instance   ni faire substituer une forme de procéder à une autre  ni exempter le juge ou les parlies de l'accomplissement des formalités destinées à garantir les  ; 17 août 1839.;Cour roy. d'Orléans.;https://gallica.bnf.fr/ark:/12148/bpt6k5541626x/f6.image;184005
184006;6;  Considérant que les dispositions du Code civil relatives 43 Lois et Décisions diverses  14  traités    Considérant qu'il est vrai que l'on a  sous ce rapport  assimilé les quasi contrats aux contrats proprement dits  mais  qu'il serait exorbitant  détendre cette assimilation aux crimes et délits  qu'il serait inique et même immoral que la femme qui  par un fait coupable  a causé à des tiers un préjudice dont ceux ci n'avaient aucun moyen de se préserver  pût  à l'aide de la dotalite  se dispenser de réparer ce préjudice  qu'au surplus  telle est la jurisprudence constante de la Cour de Caen  et qu'en ce cas on n'examine point si la dot est plus que suffisante pour la subsistance de la femme et de sa famille   elle devient aliénable pour le tout et sans distinction   Considérant que  dans l'espèce  la condamnation qu'il s'agit d'exécuter a été prononcée contre la femme Travers pour cause du dommage par elle occasionné à Dieu Avant de Nerval  en faisant sciemment usage de pièces déclarées fausses   Considérant qu'à la vérité  traduite devant la Cour d'assises à raison de ce crime  la femme Travers a été acquittée  mais que les tribunaux n'en ont pas moins pule réputer constant  quant aux intérêts privés sur lesquels ils avaient à statuer  et ordonner  comme ils l'ont fait  la réparation du préjudice qui en a été la suite   Considérant au surplus qu'il résulte de la procédure criminelle  qui a été produite dans le procès actuel  que le lait qui a servi de base à la condamnation de l'exécution de laquelle il s'agit a été l'oeuvre personnelle et volontaire de la femme Travers   Infirme le jugement dont est appel   en conséquence  dit à tort l'opposition de la femme Travers aux poursuites dirigées par Dieu Avant de Nerval sur la rente dont elle est propriétaire  etc   ; 17 août 1839.;Cour roy. de Caen.;https://gallica.bnf.fr/ark:/12148/bpt6k5541626x/f6.image;184006
184007;7;   Considérant qu'aux ternies de l'art  23 de la loi du 17 avr  1832  le débiteur ne peut se soustraire à la contrainte par corps   de même qu'il ne peut obtenir son  élargissement  qu'en payant le capital  les intérêts et les frais liquidés par les jugemens ou arrêts     Déboute Heydeloff de son opposition à l'arrêt par défaut du 8 août dernier  lequel sera exécuté selon la forme et teneur   et néanmoins réduit  d'après les paiemens faits  à 226 f   la somme ; 17 sept. 1839. ; Cour roy . de Paris.;https://gallica.bnf.fr/ark:/12148/bpt6k5541626x/f7.image;184007
184008;8;LA COUR     Attendu que  lors de la cession consentie à Antoine Chazal fils par Delphine Michelon  aucun procès n'existait entre Delphine Michelon et les époux Redon   qu'ainsi les droits cédés à Chazal fils n'étaient point litigieux  et qu'il n'y a lieu  par suite  à accorder la subrogation demandée en vertu de l'art  1699  Cod  civ     Sur la question de savoir si la donation faite  le 28 juin 1820  par Thérèse Vernerie à Marguerite Vernerie  femme Redon  doit  quoique non transmise  prévaloir sur la cession du 10 juill  1836    Attendu que la jurisprudence est bien fixée sur ce point  et qu'il est superflu désormais d'élever aucune contestation à cet égard  que les donations doivent être transcrites pour avoir effet contre les tiers   que ces tiers sont les créanciers et les tiers acquéreurs    Qu'ils ne sont point ici les ayans cause du donateur  n'étant pas responsables de ses faits  ayant traité avec lui dans l'ignorance des donations qu'il aurait pu faire   Que les ayans cause du donateur sont ses héritiers universels  ou à litre universel  et ses donataires postérieurs en date à la donation non transcrite     Attendu que  sous l'ordonnance de 1731  art  29  les tiers acquéreurs pouvaient opposer le défaut d'insinuation   que  sous la loi du 11 brum  an 7  la transcription était une condition essentielle de la validité de la donation à l'égard des tiers   que la donation  mentionnée en l'art  1070  doit être transcrite pour pouvoir être opposée aux créanciers et tiers acquéreurs   qu'il n'y a pas de raison suffisante de distinction entre la donation mentionnée en l'art  1070 et les autres do(1)  do(1) en ce sens  Riom  11 mai 1839  tom  39 2 483  et la note   nations   que l'art  939  Cod  civ   serait une surperfétation  s'il ne renfermait pas une autre disposition que les art  2181 et 2182     Que les appelans opposent  il est vrai  que Chazal fils a eu connaissance de la donation du 28 juin 1820  et que la transcription ne lui a urait rien appris   mais que la transcription est le seul mode légal de connaissance que le donataire puisse opposer aux tiers   que cela est encore écrit dans l'art  1071  Cod  civ   Par ces motifs  confirme  etc   ; 16 mai 1839. ; Cour roy. de Limoges. ;https://gallica.bnf.fr/ark:/12148/bpt6k5541626x/f8.image;184008
184009;8;  En ce qui touche la recevabilité de l'opposition    Attendu que  suivant l'art  158  Cod  proc  civ   l'opposition est recevable jusqu'à l'exécution du défaut   que  suivant l'art  159  le défaut n'est réputé exécuté par une saisie d'objets mobiliers que lorsque ces objets ont été vendus  et que  dans l'espèce  l'opposition de Peyrot à l'arrêt de défaut du 15 février dernier a été formée pendant les actes préliminaires de la saisie brandon  et avant la vente des récoltes saisies   que  conséquemment  elle est recevable   Sur la fin de non recevoir proposée contre l'application du dernier ressort     Attendu  en droit  que  aux termes de l'art  5 du lit  4 de la loi du 24 août 1790  les tribunaux de première instance ont le pouvoir de statuer en dernier ressort sur toutes affaires personnelles jusqu'à la valeur de 1 000 fr  de principal   Attendu  en fait  qu'il s'agit  dans la cause  d'une action en résiliation de bail et en dommages intérêts  action de nature personnelle     Que la valeur  du litige  en ce qui concerne la demande en résiliation  se trouve déterminée par les clauses du bail du 19 fév  1837  qui a fixé le prix annuel de la ferme à 36 fr   et sa durée à cinq années   en sorte que  en cumulant les cinq années de ferme le litige  sur ce point  se réduit à la somme de 180 fr   et que en ajoutant à cette somme celle de 600 fr   montant des dommages intérêts réclamés  la réunion des deux demandes laisse encore la valeur du litige audessous du taux du dernier ressort  Statuant sur l'opposition de Peyrot  la déclare recevable  et  statuant sur l'appel  le déclare non recevable  etc   ; 22 juill. 1839. ; Cour roy. de Limoges. ;https://gallica.bnf.fr/ark:/12148/bpt6k5541626x/f8.image;184009
1840011;12;"    Considérant que  par ces expressions pourront être reprochés  etc   employées dans l'art   283  Cod  proc  civ   le législateur a entendu accorder une facullé aux parties et non aux magistrats ' puisque le droit  de reproches n'appartient qu'à ia partie ou à son avoué  aux termes dé l'art  270 du même Code  que  s'il eût voulu laisser un libre arbitre aux juges   il se serait servi d'une autre rédaction  et aurait fait tomber la faculté de  rejet'pu d'admission surles dépositions et non sur'les personnes   Considérant qu'on ne peut argumentera bon droit de l'art  284 qui porte   « que le témoin reproché sera entendu dans sa déposition  » pour  en tirer une faculté aux magistrats  parce que le commissaire aux enquêtes n'est pas  juge de la validité des reproches  et que s'il arrivait que des reproches  ne fussent pas reconnus par le tribunal être au nombre des cas spécifiés par l'art  283  il y aurait lieu de lire la déposition du témoin mal à propos reproché   Considérant qu'on ne peut pas davantage invoquer l'art  29 i  et dire que par ces mots sont admis  on a implicitement entendu la faculté de ne pas admettre  parce que ces expressions portent toujours sur les personnes et nonsur les dépositions   et qu'étant combinées avec celles des articles précédens  il en résulte évidemment qu'on n'a  voulu conférer que le droit d'examiner si les reproches se trouvaient dans les limites posées par l'artr 283  mais qu'une fois cet examen effectué et la reconnaissance posée parle juge  le prescrit dudit art  291 rie lui permet plus d'ordonner la lecture de la déposition  rriêriie en restreignant la confiance qu'on doit lui accorder  autrement"" lé but de la loi ne serait pas atteint  puisqu'on entendraitdes témoins dont elle  a présumé là partialité      Considérant  en fait /que les occupations non contestées   auxquelles se livraient chez"" Dajon les témoins reprochés  doivent les faire regarder comme dé véritables serviteurs   Considérant d'ail   leurs  que ces témoins  né peuvent êtrerarigés dans la classe des témoins nécessaires pour lesquels il à""été apporté une exception à l'art  283   Confirmé  elc     "; 22 août 1839.;Cour roy. de Caen;https://gallica.bnf.fr/ark:/12148/bpt6k5541626x/f12.image;1840011
1840012;12;  Attendu que  par jugement du 22 juin 1812  François Suidiraux avait été admis à faire valoir  dans la liquidation de la succession  les paiemens par lui faits  soit pour frais funéraires el de dernière maladie de'Marie Certes  leur mère  soil pour acquitter les créances Bourgeois el Desbordes  a la charge par lui d'affirmer par serment que ces paiemens avaient été faits de ses deniers    Attendu que François Suidiraux est décédé en 1833  sans avoir prêléle serment ordonné   mais qu'on ne saurait  ainsi que l'ont fait les premiers juges  assimiler l'inexécution de celle disposition du jugement à un refus de prestation du serment  surtout si l'on considère que ses'cohérilièrs n'ont fait aucune diligence pour en pourri) Ha mémecélé jugé que le jugement qui ordonnait un serment supplétif pouvait être rétracté plus tard par les juges auxquels on représentait des pièces décisives qui en rendaient la prestation inutile  sans que  dans ce cas  on pût'leur reprocher de violer l'autorité de la chose jugée  (F  arrêt de la Cour de cassation du 10 Jéc  1823 (tom  24 1 141) £ et arrêt de la Cour de Toulouse du 3 juill  1827 (tom  28 2 110)      25 * Lois et Décisions diverses  26   suivre l'exécution  quoiqu'ils y eussent le principal intérêt puisque François Suidiraux était détenteur de tous les biens de la succession   Que la seule conséquence qui résulte de cette inexécution  c'est que les répétitions du sieur Suidiraux  au sujet desquelles le jugement de 1812 avait ordonné le serment supplétif  doivent être appréciées seulement d'après lesdocumens acquis au procès      Met l'appellation au néant  etc  _  ; 12 mars 1839.;Cour roy .;https://gallica.bnf.fr/ark:/12148/bpt6k5541626x/f12.image;1840012
1840013;14;"LA COUR    Considérant que le procès intenté à Delabruyère   avait pour objet de faire décider  qu'il était  payé de la somme de 1 037 fr   pour laquelle il avait requis une inscription hypothécaire surles biens de Bidel  et que 'par suite  il devait donner mainlevée de celle inscription   qu'ainsi l'action  portant directement et prinicipalement  sur le paiement de ladite somme de 1 037 fr   élail p'er sonnelleiet'mobilière  etdevaiiêlre jugée en dernier ressort parie tribunal civil  aux termes de l'art  1er de la loi du 11 avr  1838    Considérant que celte fin de non recevoir contre l'appel  étant d'ordre public  doit être prononcée  quoiqu'elle n'ait été proposée qu'en plaidoirie  sans être consignée dans les conclusions   Considérant qu'il en est autrement à l'égard de Louis Herpin  quéla mainlevée de son inscription lui était demandée parce qu'il était sou tenu que l'hypothèque né lui avait éléaceordée que pour le garantir du trouble auquel pouvait l'exposer la nature dotale des immeubles qu'il avait acquis de la dariie Bidél ' tandis qu'ilprétendait""  lui  qu'elle  avait eu  pour cause toute espèce de possibilité d'éviction   ' que la contestation portait donc directement et uniquement sur l'étendue du droit hypothécaire  que d'ailleurs  sil'nv script ion avait provisoirement été prise pour une ""somme moindre del  500 fr   rien n'empêchait le créaricier de l'élever à une somme plus forte  qu'ainsi l'action était à son égard tout à la fois réelle et   indéterminée  et ne pouvait par conséquent être jugée en première l instance qu'à la charge d'appel   '  Considérant que Tari  49  Cod  préc  a énuméré les demandes qui  de leur nature  sont considérées comme urgentes  et à ce titre dispensées du préliminaire de la conciliation  qu'il n'a pas compris dans ce nombre les demandes en mainlevée d'inscription "" que'dès lors elles ne pourraient être regardées  comme requérant célérité qu'à raison des circonstances particulières'  et qu'il n'est pas prouvé qu'il en existât dans l'espèce qui ne permissent pas à la veuve et aux héritiers Bidel de suivre la marche ordinaire  ~qu'ils l'ont re^ connu eux mêmes en ne recourant pas à la voie ouverte en pareil cas par l'art   72   Cod  ""proc      Considérant qu'à la vérité  l'action était dirigée contre plus de deux parties   mais que les intérêts des défendeurs étaient parfaitement indéperidans les uns des autres    qu'ils  n'avaient été compris dans'Ie mêmeprocès  que pour^éviter Ies'iràis d'actions séparées  qii une transaction  pouvait avoir lieu avec l'un sans"" la participalion des autres  et que tel  n'est pas le cas pour lequel a élé faite là disposition dun° 6 de l'art  49    Déclare  non recevable' i'ap'pël porté contre Delabruyère  et sans avoir égard à la fin de non reeevoïr proposée par Louis Herpin  confirméà son'respect  ainsi qù'au  respect d'Etienne Herpin et de Thorel  le jugement dont est appel   etc   ";l3nov. 1839.;Cour roy. de Caen.;https://gallica.bnf.fr/ark:/12148/bpt6k5541626x/f14.image;1840013
