id;page;arrêt;date;juridiction;lien;id
18400145;154;"  ConsidéraMMiu'aux termes de l'art  2195   C  civ   et de l'avis du conseil d'Eiat du lor juin  1807  lorsque   dans le cours des deux mois de la publication faite conformément à l'art  683  Cod  proc  'civ   il n'a pas été pris d'inscription du chef des femmes sur les immeubles vendus  ils passenrà l'acquéreur sans aucune charge   Qu'il'suit delà que l'hypothèque légale de la femme sur les immeubles est éteinte   Que cette conséquence ressort d'ailleurs de l'art  2180 qui dispose que les privilèges ""et hypothèques s'éteignent par l'accomplissement des formalités prescrites aux tiers détenteurs pour purger les biens'par eux acquis    Que l'effet de  cette extinction est d'enlever à la femme le droit de  suite sur ces biens  et par conséquent celui de se faire colloquer sur le prix' qui en est la représentation     Que l'art   2166 n'accorde en effet le droit de suite et de collocation qu'à ceux des créanciers hypothécaires qui sont inscrits    Qu'à la vérité   l'art   2135 déclare que l'hypothèque de la femme existe sur les biens de son mari  indépendamment de toute inscripl ion     Mais que cette exception doit être îesireinte au cas où ces biens ne sont pas sortis du domaine du mari/puisque  s'il les aliène  l'art  2194 soumet l'hypothèque   de'la femme à la formalité de l'inscription  Qu'aussi  l'ail  2166  qui n'admet à l'ordre que les créances  hypothécaires inscrites  ne fait il aucune distinction entre ceux qui ont une hypothèque ordinaire el ceux auxquels il appartient une hypothèque légale   Que la  nature des choses  résiste d'ailleurs à ce qu'une hypothèque éteinte quant à l'immeuble  conservé sa force quant au prix qu'i ne représente l'immeuble qu'au regarâdes créanciers qui'ont conservé leurs droits hypothécaires conformément aux prescriptions ■ de là loi    Que c'est pour cela que le législateur a cru devoir déclarer  par une disposition formelle et exceptionnelle au'dhoit comjmun  que le créancier dont l'inscription avait été omise dans'le certificat du conservateur \ pouvait se présenter à l'ordre  quoique l'immeuble fût déclaré affranchi de son hypothèque dans les mains  du tiers délenteur     Considérant que pendanlles deux mois qui ont suivi la publication faite aux termes de l'art  683vi Co""d  proc  l'hypothèque légale de la dame Fillion n'a pas été inscrite   qu'elle est donc éteinte   que de Ribes el Lebréton né peuvent dés lors    s'en prévaloir comme subrogés dansses effets pour demander leur 'collocation dans l'ordre  c    _ Que vainement prétendent ils faire résulter l'inscription de celte hypothèque delà mention deleur subrogation faite sur le registre du conservateur  Quecettementionne  constitué ni par ses termes  ni par son objet  une inscription  d'hypothèque légale   qu'elle n' en a aucun des caractères  que de Ribes et Lebreton  en requérant du coriserva{eur qu'il mentionne  sûr ses registres leur subrogation dans l'effet des inscriptions prises ou à prendre par la dame Fillion  ont eux mêmes reconnu que cette formalité n]etait pas destinée à suppléera ces inscriptions   Par ces motifs  etc   "; 14août 1839.;Cour roy. d'Apriens.;https://gallica.bnf.fr/ark:/12148/bpt6k5541626x/f154.image;18400145
18400146;154;"     Sur l'exception d'incompétence opposée     Attendu que le jugemenidu 3 fév  '1829 a été tout à la fois infirmé et confirmé dans plusieurs de ses dispositions  Que  dans ce cas  rien ne s'opposait à ce que la Cour put conserver l'exécution de  spn arrêt  alors surtout qu'il yvavait connexilé entre les dispositions infirmées et celles confirmées  Qu en renvoyant les parties devant un notaire désigné pour procéder à la liquidation de leurs droits  d'après les bases fixées par l'arrêt et par le jugement de première instance  aux chefs maintenus  la Çour'a évidemment entendu qu'il serait procédé ~au règlement de toutes  les réclamations réciproquement élevées et souverainement jugées  Attendu 1 que'Iescliffiéullés qui pouvaient surgir à l'occasion de l'exécution dudil arrêi  devaient rentrer dans les attributions de la Cour et être soumises à son appréciation  qu'en effel  il n'est pas possible 1 de diviser l'exécution des décisions intervenues  pour en attribuer ' (1) Cette dernière circonstance justifie suffisamment la décision  Mais  en son absence   et si les chefs confirmés étaient indépendans de ceux  infirmés  l'exécution de l'arrêt ""sûr le tout appartiendrait elle également à la  Cour royale  G'est là une question controversée  La Cour de cassation l't  '  résolue pour la négative par un arrêt du 16 mai 1834 (tom  35 1 122)  F  en    note de cet arrêt l'indication des divers arrêts rendus sur ce point   309C   Lois et Décisions diverses    ' 310 i  une partie à la juridiction idu tribunal de première 'instance  et l'autre partie à la Cour*   Que cette division est d'autant plus inadmissible  que Jés réclamations respectives se liaient et' s'enchaînaient de manière à donner lieu a cenaines^comperisations îqu'aiiisï^ l'arrêi de la Cour  eh  renvoyant les parties* devant un notaire  a évidemment eniendu'''que'îe compte  'embrasserait la totalité dësréclà malions  ' que c'est dans ce sens qu'a agi M  '  lui même en ■ faisant laremise à N ï  du ^comptegénéral dont il va être parié  ""•  Sur la fin  deiion^ recevoir subsidiairemeni opposée""  et fondée sur ce qu'en exécutiondeTarrêl'du 5 mai 1829 "" les parties doivent préalablement se retirer devant un notaire pour y faire procéder àla liquidation de leurs droits   'Attendu que les choses hé sont plus entières   queues parties ont volontairement abandonné l'er   ïement indiquépar'la justice   ^'QW  par une lettre du 22fé'v ' 1836y^nrégistrée à'Rouen le ler'juiri 1840  {N    adéclaré commu  niquer à sa  partie' adverse le compte générai qu'il avait dressé    en' engageant M'/J  à sîgnàlehes erreurs' ou omissions que pourrait' renfermer ledit compte    Que les pièces à l'appui de ce compté'  ■ont été examinées etvérifiées par les parties  en présenee d'untiers     Que le montant de^chacune des sommes portées au crédit et au ' débit diidit com'pten'a pas été critiqué par  M      que sa demande «n rectification  adressée à N     n'a porlé'que sur quelques questions en dehors des chiffres   Que  M    '  a proposé certaines bases  qui devaient être fixées avant qu'on pût en revenir au règlement définitifdu compte     ^ Attendu' que  dans cet état de choses  il est inutile de  renvoyer préalablement les parties devant un notaire "" puisque les mêmes «prétentions y seraient soulevées  et qu'il y aurait  dès lors v nécessité demies faîrevider'pàr Ja Cour avanld'ar  1 river à la fixation et à là liquidation du reliquat dufcompte     At1 tendu  que N    n'a pas pris de conclusions sur Je mérile des 1 rectifications formulées''par son adversaire  ' Rèjéité ""l'exception d'incompétence et la fin de  non recevoir subsidiairemeni opposée ^ordonne  en  conséquence  qu'il soit conclu au fond  etc    "; 2 juin 18jO..;Cour roy. de Rouen.;https://gallica.bnf.fr/ark:/12148/bpt6k5541626x/f154.image;18400146
18400148;157;"    Attendu que  devenue veuve après  dix mois dé mariage  la dame Créssent s'était retirée chez la dame Lemonnier  sa sçeur  où elle accouclia • d'une'fille peu de temps après     Que  par suite du décès aussi prématuré qu'imprévu du sieurlemonnier ^ son beau frère  qu'elle avait nommé tuteuridé sa fille par un tes    làment olographe du 20 avr  1837  enregistré  la dame Créssent    atteinte d'une maladie de'poitrine qu'elle savait êiremorlelle 'avaU' nommé'tuteur de sa fill& Je siéur Selle  son cousin  par un second testament olographe du  22  mars 1838  par elle déposé le 28 mai suivant en l'élude' de Me Bïigny  notaire     Attendu quel'enfant  qui est aujourd'hui l'objet du litige  avait environ deux ans  lorsque  le 24 juillet de la même année  elle perdit sa mère   Attendu que  par son testament du 22 mars  l'a dame Créssent  dont la sollicitude"" maternelle était justement alarmée  avait voulu que la dame Lemonnier  quiavait prodigué les soins'les plus tendres à Ja mère et à l'enfant  fûl seule chargée de veiller à la santé délicate et à l'édu    ' cation de l'orpheline  Attendu qu'investi définitivement de la lu   telle dative  par suite de la révocation du  tuteur testamentaire  le • sieur Cressënt avait d'abord  el avec raison  respecté les dernières volontés de sahru  d'ailleurs si conformes au bien être de l'enfant  ■à peine âgée de quatre^ns  puisqu'il est manifesté que la dame Le ' ■ mohnier  tante de la mineure  lui lient lieu d'une secondemère      ' Attendu que Ja tutelle a élé éiablie dans l'intérêt exclusif des mineurs  que c'est  en eette matière  la considération prédominante     querien  dans la seet  8  chap  2 de la tutelle  ne met obstacle à  la continuation d'un élat de choses créé par la volonté dernière d'une  ■ mère tendre' et prévoyante     Que l'admission de la demandé du sieur Créssent ne pourrait que contrarier  dans ses effets  J'affec    tion que lui même porte à sa petite fille  et ainsi compromettre la   santé délicate de la mineure et son éducation 'si bien jcommencéè par sa tante  dontles soins intelligens et'empressés ne laissent rien à désirer     Par ces motifs réformant  déclare valableel exécutoire  comme par le passé  la disposition du testament du 22mars1838 qui confie la mineure Créssent aux soinsde la dame veuvelemonnier sa tante  dit qu'elle continuera de lui donner tous ses   soins  dit  en outre  que la pension lui sera payée par l'intimé  ainsi qu'elle a été fixée par le testament prédâlc au furet à mesure de l'échéance des ternies  etc  ' '  "; 8mail840.;^Courroy.deRouen.;https://gallica.bnf.fr/ark:/12148/bpt6k5541626x/f157.image;18400148
18400149;158;"     Attendu que ^opposition formée le 3 sept  1838 ""envers le commandement du 31 août précédent  fut signifiée iau nom du sieur Bros  assisté  porte  l'explojl  de son conseil  judi   ciaire   qu'ainsi ladite oppositionne pourrait être considérée comme émanée du sieur Bros  seul   Attendu  au surplus  que dans le cas même où le conseil judiciaire serait resté'étranger à la signification de cet explo it  sa validité ne saurait être contestée  s'agissajit d'un acte conservatoire que le prodigue pourrait faire seul  sauf à requérir l'assislance de sonditxonseil  pour  y donner suite  et ester en justice dans  l'instance   r  Et attendù qu'il résulte des qualilés du jugement dont est appel  qu'un avoué s'est constitué  a occupé el a conclu tant au nom du sieurbros  qu'au nom de son conseil judi' ciaire  qu'il faut donc tenir pour conslanv en  l'absence de tout désaveu  qiié l'instanee a été poursuivie et le jùgerrïent'dont est appel obtenu   avec l'assistance dé ce  dernier  par où la première fin de non recevoir doit être rejetée   Attendu  quant  à la seconde  que ni sous l'ancienne législation'   ni même sous la législation nouvelle   la publicité du jugement portant interdiction ou dation d'un   conseil  judiciaire n'a' jamais  été considérée comme  une formaliléi substantielle dont l'omission pût faire considérer l'inlerdiclion^omme non avenue  Attendu  d'ailleurs  en fait  qu'il est suffisamment établi que Je jugement du 7 mess  an 7 par  lequel Bros fut interdit pour causeide prodigalité  reçut toute la publicité nécessaire     Qu'ainsi  ce second moyen' préjudiciel doil encore êtrerejèié  )  Au 'fond     Attendu que le contrat de mariage dans lequel est contenue la constitution de dol qu'il s'agit d'apprécier  fut passé le 9 juin 1812sous Pempiredu Code civil  que dès lors la question de savoir si ladite constitution doilqu non être annulée pour incapacité du constituant  doit être jugée conformément aux dispositions dudit Code  élant de principe constant que la capacité des parties contractantes est toujours réglée par la loi en vigueur au moment du contrat  Attendu que l'application  de ce principe ne porteau r cune  atteinte à la chose jugée  résultant du jugement du 7 mess  an 7  qu'en effet  ce jugement conserve sa force et son aulorité en ce  qu'il a d'essentiel  savoir   la déclaration dé prodigalité et l'incapacité qui doiten résulter   mais que  quant aux effets actuels'de cette incapacité/ils ont été modifiés par la loi inouvelle   laquelle a de plein droilir ansforméirinterdiction en  assistance de conseil  et limite les pouvoirs du curateur à ceux du conseil judiciaire   Attendu  au surplus  que la question de savoir si la constitution dont s'agit doit être appréciée d'après l'ancien ou le nouveau droit  présente au fond peu d'intérêt  l'art  513  Cod  civ   inhibant au prodigue d'aliéner sans l'assistance de son conseil  en quoi sa position est semblable à celle dp l'interdit pour cause d eprodigalité sous l'ancienne législation   Attendu que celte défense d'aliénalionicomprend dans sa généralité tous les actes par lesquels lé prodigue se dépouille d'une partie de sa fortune mobilière ou immobilière  et que le législateur n'y a fait aucune exception   ^  Que i'actépar lequel  un père constitue à sa fille une dotpayable de son vivant  soit en immeubles  soit en argent  a évidemment ce caractère d'aliénation  et rentre dans la défense générale  puisque les objets constitués cessent de lui appartenir  et sont soustraits àsonavoir personnel     Qu'il importé peu qu'un tel acte ait un principe légitime  qu'il puisse être considéré comme l'accomplissement d'unéobligation naturelle  et qu'au lieu d'en chercher la cause dans les habitudes de dissipation du constituant  on doive là trouver dans l'affectior paternelle et dans lejlésir de faciliter un établissement par mariage  vu favorablement par la loi  en effet  ces sentimens peuvent aussi avoir leur exagération  et dans l'accomplissement de cette obligation naturelle  le prodigue peul apporter l'entraînement d'une libéralité  libéralité el céder à ses habitudes de profusion   et c'est   précisément pour prévenir les effets de ces enlraînemens que la justice  lui 'impose l'assistance 'd'un  conseil   Qu'il importe peu aussi que les objets donnés à titre de constitution de dot  soient  soumis  au rapport de ia part de la  fille donataire   et qu'au décès  du 'donateur ils 9 doivent  rentrer dans la' compoisiiion 'deson palrimoine  sojt'réellement  soit 'fictivement  qu'ils •  n'en  ont  pas moins cessé de lui appartenir dès lèjour de la donation  et qu'il n'en a pas moins été dépouillé de son vivant  ■  Que les incapacités formulées par la loi contre les prodigues ne 1 l'ont pas été seulement dans l'intérêt de leurs familles  mais aussi dans leur propre intérêt et pourles proléger contre les passions  les faiblesses d'esprit et de coeur qui pourraient les conduire à leur • ruine  Qu'il serait d'ailleurs difficile de séparer entièrement l'intérêt des familles de celui de leurs chefs   etqu'il est impossible que le chef se ruine ou se mettedans la gêne^'sans  que les membres soient exposés à  s'en  ressentir   et sans que l'économie du patrimoine général  en souffre  Attendu d'ailleurs 'qu'il ne serailpas   exact de dire que les inlérèlsde la famille seraient suffisamment garantis par l'obligation  de rapport imposée à la fille donataire  et que légère pût  sans inconvénient pour ses autres en fans   lui faire ■ ' des donations hbrs deproporlion avec lavalèur de ses biens et l'état de sa fortune  en effet  l'action en retranchement elles réserves des autres héritiers pourraient devenir illusoires par l'insolvabilité du gendre et l'absence de garanties «agement stipulées  d'aulre part  la fille ainsi avantagée pourrait renoncer à la succession pour s'en tenir à sa donation  et absorber l'entière quotité disponible au préjudice d'autres enfans investis d'une partie de cette quotité par des dispositions régulièrement faites avec l'assistance du conseil   Attendu  enfin  que si l'on m'appliquait pas d'une manière absolue aux donations à litre de' constitution de dot les prohibitions générales faites'par l'art  '513  Cod  civ     el que leur validité ou leur invalidité fût subordonnée au  point de savoir s'il y à eu ou  non cxcès dans la libéralité  cette  'matière'serait livrée à un arbitraire indéfini  que les élémens d'une'pareille dëcision'seraienl toujours difficiles à recueillir et à apprécier   qu'il est des motifs de convenance de situation personnelle  des considérations d'intérêt ' actuel ou futur  qui ne peuvent être bien appréciées qu'au moment même où se passent les aetes  el par des personnes initiées aux secrets de la famille    qu'il pourrait y avoir inconvénient à lès livrer à une discussion publique  et que le juge ne pourrait chercher à les pénétrer sans s'exposer à des err eurs   que Ja meilleure et la seule garantie de la sagesse ei'de Futilité des actes émanés d'un prodigue est dans le' concoùrs'du conseil que lajusiice lui a donné  et que l'absence de ce conseil  vicie par l'effet de la présomption légale  tout ce qui a été fait par lé prodigue seul   Par ces motifs  a démis el démet'l'appelant de son appel  etc   "; 1er juill. 18'<0.;Cour roy. de Montpellier.;https://gallica.bnf.fr/ark:/12148/bpt6k5541626x/f158.image;18400149
18400150;159;"  Vu les art  601 et 1094  >G6d  civ      Et attendu qu'en léguant à son mari l'usufruit de la moitié de ses biens  meubles et immeubles  avec àt'spense'détfournirca'utidn  la dame Lhuintre'a usé d'un/droit qui lui appartenait  qu'on ne rencontre dans"" le Code civil aucune disposition exceptionnelle au principe posé"" dans l'art  601 ci dessus visé  Attendu  qu'on  argumente vainement de ce que le père usufruitier   dispensé de  fournir  caution  pourrait devenir insolvabje après avoirdissipé  au préjudice de ses"" enfans  la chose dont il n'avait que la jouissance   que cette argumentation n'a pas plus dé valeur dans l'espèce^ qu'elle n'en aurait dans le cas de l'usufruit légal d^une fortune mobilière  quelquefois '   fortimponante  que  s'il est vrai que  dans l'exécution des dispo  ' sitions législatives les mieux'empreinles de sagesse  il y a  parfois desinconvéniens 'cesinconvéniens inhérens aux lois humaines se    trouvent compensés par les avantages qui résultent d'une intelligente application   ■ Et adoptant  au surplus  les molifs qui'ont déterminé les premiers juges  Confirme  etc  '  "; 13 juin 1840.;Cour roy. de Rouen.;https://gallica.bnf.fr/ark:/12148/bpt6k5541626x/f159.image;18400150
18400151;159;"    Attendu que 1CA28 sept  1835  Jean Bichou écrivait à Rivière qu'Andrieu s'était chargé de le payer  à suite de la   ventejpte lui avaientfaite ledit Jean Bichou et ses soeurs des biens de leur mère  par  police du l^de ce mois   Que Jes premiers juges ont  il est vrai  cru vo ir dans la promesse de vendre ces mêmes biens  faite par Andrieu à Moulis et 'Lafont  par l'acte du 25 août 1837  un fait exclusif de l'assertion exprimée dans la lettre précitée j mais quîalors que Jean Bichou avait écrit que l'aliénation avait été consentiez Andrieu dans un  acte sous seing privé  il est facile •de concevoir que celui ci  quand il a voulu transmettre à un ""tiers  une propriété dont la mutation n'avàitpas eu lieu  devait  pour épargner des frais '^d'enregistrement  faire intervenir son propre vendeur pour faire cette vente  comme il avait continué à être le vrai propriétaire    Quetel esi l'usage  en effet  dans les situations  analogues   Qu'aussi  on voit Andrieu s'engager à payer  en cas d'inexécution de sa promesse  600 fr   pour sûreté desquels il affecte hypothécairement dés immeubles"" ' ce qui prouve qu'il avait les mo yens de contraindre sûrement les Bichou à la réaliser en ce qui les concernait  el sert ainsi  à confirmer la vérité de la lettre du 28 sept  1835   Que la pensée des parties se manifeste dans la clause finale'  où l'on stipule que les  acquéreurs seront substitués aux Bichou pour se faire subroger aux droits que Rivière a acquis de Goderich   leur frère     Qu'alors donc que Jean Bichon agit  en son nom  on peul néanmoins le considérer comme plaidant dans l'intérêtdeceux à qui appartiennent'les droits successifs  qu'il a vendus à Andrieu   Mais  attendu qu'un cohéritier peut seul  en vertu  de  de qui le défunt a disposé de ses biens >en ne lui faisant qu'un legs parliciir lier  Au contraire  on est généralement d'accord sur ce point que 'le légataire universel  ou même à titre universel  peut exercer île retrait  F  en ce sens  Toullier  tom  i   n  441   ";rantbn, tom. 7, ^;186*;https://gallica.bnf.fr/ark:/12148/bpt6k5541626x/f159.image;18400151
18400153;161;     En ce'qui touche la sentence d'adjudication pré  pré    Attendu qu'une sentence d'adjudication est un vérita  '    île jugement susceptible d'appel cônïme tous les autres  que dès lors ce n'est point devant Jes juges quil'oht rendu  mais seulement  • devant la Cour et par la voie dé l'appel que les parties pouvaient en    demander Ja réformation et la nullité     Qu'ainsi les parties ont   iien valablement procédé en saisissant la Cour delà connaissance   ■ 1834 (tom  34 2 683)  F  aussi Thomine Dësmazures  n  7 43  et ;ranf/on, iom. 21, n.;"13. . """;https://gallica.bnf.fr/ark:/12148/bpt6k5541626x/f161.image;18400153
18400154;161;"   En ce qui touche le rapport de Ï28 fr  payés par suite du procès correctionnel contre Dennelière  à  litre de frais et de réparations civiles   T Attendu que le mari  maître de la communauté  peut  en règle générale  perdre et dissiper  les biens qui Ja composent  et qu'il n'est dû d'indemnité à la femme que relativement aux sommes qu'il à prises sur ces mêmes biens pour acquitter une dette personnelle  Que si l'art  1425 décide que les condamnations prononcées contre le mari pour crimes emportant mort civile  ne frappent que sa part de la communauté dissoute  ce qui comprend nécessairement les réparations civiles et les frais auxquels il a été condamné par suite d'un tel crime  celle exception admise par l'ancienne jurisprudence et fondée sur une raison d'é(1)  323 l Lois el Décisions diverses  r  '""324   qùité   ne peut êlre étendue au delà du cas prévu par la loi   Que  quand la condamnation qui frappe le  mari n'emporte pas mort civile  elle peut se poursuivre sur la communauté tout entière qui continue à exister  et que l'art  1424 n'accorde  en ce cas  de récompense à la femme que relativement aux amendes encourues par le mari  Qu'en admettant que ce dernier arlicle s'applique aussi Meri au cas de condamnation pour délit que pour crime  il faut reconnaître qu'il n a pas étendu Ja récompense de la femme aux'réparations civiles et aux dépens payés ayec les biens de la  communauté    Que c'est ce qui résulte  1° du texte de cet arlicle  qui ne parle que des amendes'et qui aurait employé l'expression générale condamnation  qu'on lit dans l'article suivant  si sa disposition eûtdû s'appiiquer  à toutes lès réparations pécuniaires dù criméou du délit commis par le mari   2° De la comparaison de éel âriiele   avec"" l'ancien droit   ^Qu'en effet  en présence d'une'jurisprudence ■ constante  suivant laquelle toutes les condamnations pécuniaires des amendes  réparations civiles ""et dépens prononcés contre le maripour crimes ou délits n'emportant pas mort civile  s'exécutaient sur toute la communauté sans que la femriie pût en demander la récompense  oh ne peut admettre que le législateur qui voulait y apporter ûne modification  eût employé l'expression restrictive  les amendes  s'il eût entendu que l'indemnité de la' femme s'étendît à 'toutes les condamnations pécuniaires encourues par'le mari    3° El  de ce que d'ailleurs  il n'y a pas même raison d'accorder àfla femnietécompensé pour lès réparations civiles et les dépens   que  pour l' amende  puisque celle ci  étant une'peine  constitue  une dette personnelle du mari  il ne peùi l'acquitter avec les biens de la communauté sans tomber sous l'application du principe général  de l'art  1437  tandis que les autres réparations sont des dettes de ' communauté 'contractées sans doute par abus de Ja puissance maritale  mais dont Ja femme ne doit pas moins supporter sa  part  ' comme elle souffre'de la dissipation ou de la perte de l'avoir commun  par^suite des prodigalités  de la négligence ou de la faute de  son mari  Met le jugement dont est appelaunéant  du chef qui ordonne le rapport par Hache à la communauté  de  la somme de' ""428 fr  82 cent  qu'il a payée par suite du procès  correctionnel ' contre Dennelièrè   emendant  quant à ce  déclare l'intjmée mal fondée dans sa demande en rapport dé ladite'somme  etc   "; 30 janv. 1840.; Cour roy. de Douai.;https://gallica.bnf.fr/ark:/12148/bpt6k5541626x/f161.image;18400154
