id;page;arrêt;date;juridiction;lien;id
18400200;205;"     Considérant qu'aux termes de l'art  2101  Cod  civ   les frais de justice sont privilégiés   Qu'il faut entendre par frais de justice ceux qui ont pour objet la liquidation du gage commun ou sa conservation    Considérant qu'aux termes de l'art  2186  Cod  civ   l'acquéreur qui a fait régulièrement transcrire et  notifier son contrat   est autorisé  à défaut de surenchère  à consigner le prix irrévocablement fixé de son acquisition  sans autres offres préalables que celles déjà faites  conformément à l'art  2184  Cod  civ    Considérant que cette faculté de consigner a été accordée tout à'la fois dans l'intérêt de l'acquéreur et des créanciers  Qu'en effet  si la consignation fournit au premier le moyen de se libérer  elle assure aux autres la conservation de leur gage  en le plaçant dans un dépôt public  à l'abri des chances auxquelles pourrait l'exposer l'insolvabilité éventuelle de l'acquéreur  ( enfin elle tend à faire lever les obstacles qui rendent pour les créanciers le prix indisponible  Considérant néanmoins que pour arriver à ce doublebul la consignation seule ne suffirait pas puisque aucun conservateur ne consentirait  sur le vu de la seule quittance du receveur des consignations  à rayer des inscriptions hypothécaires qui  ■ d'après l'art  2157  Cod  civ   ne peuvent être rayées que du con  ' sentement des parties intéressées ou en vertu d'un jugement inattaquable   Qu'il y a donc nécessité pour l'acquéreur qui consigne  de faire connaître d'abord aux vendeurs el aux créanciers inscrits   le dépôt du prix auquel ils ont droit  et de les mettre ainsi en demeure de retirer ce prix  en donnant mainlevée de leurs hypothè' ques dont l'effet subsiste d'ailleurs sur la somme consignée jusqu'à la clôture de l'ordre amiable ou judiciaire à faire entre eux   Qu'à défaut par les vendeurs ou les créanciers  dé donner ces mainlevées  il devient ensuite indispensable pour l'acquéreur de faire juger  Ml Lois el Décisions diverses  412   conlradictoïrement avec eux la validité du dépôt  afin d'obtenir  de l'autorité de la justice  avec la  preuve certaine de sa libération  la mainlevée  «t par suite'la radiation réelle des inscriptions dé privilèges ou d'hypothèques dont sa propriété resterait sans cela matériellement grevée   Que cette procédure est d'ailleurs une conséquence nécessaire de l'inexécution de l'obligation du vendeur  qui n'a  droit au prix qu'après avoir livré la chose à l'acquéreur  Que celui ci doit donc retenir sur son prix et par privilège les frais de cette procédure    Que les créanciers n'ayant pas plus de droits que le vendeur dont ils sont les ayans caus""e  peuvent d'autant moins s'en plaindre  qu'ils auraient pu éviter ces frais en donnant leurs  mainlevées   Que le système contraire tendrait le plus souvent à •la violation du contrat de vente  en augmentant le prix stipulé du montant des frais de consignation que le vendeur serait hors d'état de rembourser  Que^i aux*termes de l'art  1248  l'acquéreur  doit supporter les frais de la quittance  qui contient la  preuve de sa libération  d'un autre côté  le vendeur est tenu de faire les frais ' àe la délivrance de la chose vendue  et de fournir à l'acquéreurles moyens de se libérer  qu'ainsi  lorsque les  moyens lui sont refusés  la loi vientàson aide par la disposition de l'art  1260  Cod  «iv   qui met à la charge du créancier les frais des offres réelles et de la consignation  si elles sont valables   Que si aucun texte de loi ne déclare expressément privilégiés les frais d'une demande en ■validité derconsignation  c'est que ces frais ayant la même cause ■et le même'but que ceux de radiation d'inscription  se trouvent virtuellement compris dans l'art  1759  Cod  proc  civ    Qu'ainsi  soit  comme frais de justice  soit comme conséquences des obligations du vendeuret de la libération due à l'acquéreur  soit comme accessoires indispensables de la radiation des inscriplionshypothécaires  Jes dépens de la demande en validité de consignation doivent êlre privilégiés et prélevés comme tels    Et  attendu que les premiers juges  tout en reconnaissantrégu   ïières en la forme et fondées en droit  soit la consignation faite par Hicher  soit la demande en validité de cette consignation  ont néanmoins refusé le prélèvement par privilège des frais de cette procédure    Qu'ils ont ainsi méconnu les dispositions des art  1260  2101  2102  § 3 2186  Cod  civ   759 et suiv   G  proc  civ    Par ces motifs  etc   "; 13 août 1840.;Cour roy. d'Orléans.;https://gallica.bnf.fr/ark:/12148/bpt6k5541626x/f205.image;18400200
18400201;206;LA COUR  Attendu que des conclusions tendantes à la séparation de corps constituent toujours une demande principale  même quand elles sont prises sous forme reconventionnelle par l'époux  contre lequel une action aux mêmes fins est dirigée par son conjoint   que cette demande ne peut pas êlre formé e pour la première fois en appel   Attendu que les faits dont l'appelant demande à faire  preuve  considérés sous le second rapport qu'il leur donne dahs ses conclusions tendraient à établir des torts graves de sa femme  de nature à atténuer ceux qui lui sont attribués à lui même par les enquêtes  et qui ont fait prononcer contre lui la séparation   mais que  dans cette acception  c'était par voie de contre enquête qu'ils étaient susceptibles d'être justifiés  qu'ilssont antérîeurs a l'action etétaient généralement connusde l'appelant  même d'après ses propres dires  qu'ils rentraient naturellement dans la preuve contraire à laquelle l'appelant a été admis par le jugement interlocutoire du 28 déc  1835  où il était partie comparante   que faute d'y avoir procédé  II a encouru la forclusion prononcée par l'art  257  Cod  proc   Bar ces motifs  etc  •  ; 8 avr. 1840.;Cour roy. d'Angers.;https://gallica.bnf.fr/ark:/12148/bpt6k5541626x/f206.image;18400201
18400202;207;"T~"" LA COUR  Attendu que l'état de la cause a été définitivement fixé à l'audience du 17 de ce mois   qu'elle y a été plaidée eontra""dictoiremeni   eontra""dictoiremeni  ministère publie entendu   que la circonstance du partage d'opinions déclaré ensuite de ce délibéré  a seule empêché qu'elle ne fût jugée   que renvoyée à ce jour pour vider le partage  avec le concours de trois magistrats appelés à cet effet  elle doit nécessairement se présenter au même état  el que les nouvelles conclusions de l'appelant tendantes à faire prononcer la séparation sut sâ demande et contre l'intimée  ne peuventêlre reçues dans une telle situation  Par ces molifs  vidant le partage d'opinions  sans  ' s'arrêter aux demandes reconventionnelles de l'appelant qui sont déclarées non recevables""  etc   "; 24 août 1839. ; Gourroy. d'Angers. ;https://gallica.bnf.fr/ark:/12148/bpt6k5541626x/f207.image;18400202
18400203;207;"   Attendu qu'il résulte du contrat de mariage des appelans  que les futurs époux ont déclaré se marier avec exclusion de communauté et sans entendre se soumettre  att régime (ï) Une telle demande  d'après l'arrêt qui précède  ne peut même en ËUcutt cas  «tre formée pour la première fois devant la Cour royale     détournée de sa destination   Par ces molifs  annulle la saisie arrêt faile au nom du sieur Gaudon intimé  entre les mains des mariés Rossignol  etc  """" ' '  •    "; 18 juin 1840.;Cour roy. de Montpellier.;https://gallica.bnf.fr/ark:/12148/bpt6k5541626x/f207.image;18400203
18400204;207;415 Lois et Décisions diverses  4U5  sieur N     et se chargea de servir  en  diminution du prix stipulé  ime rente de 300 fr  à'la damen     ces sortes de transactions étaient autorisées par l'administration supérieure  afin de favoriser la mesure générale de la suppression d'une partie des emplois de  percepteurs     Considérant que la présomption légale doit faire supposer que la destitution du sieur N    est le résultat de sa faute et de ses faits personnels   Considérant en tous cas que la convention intervenue n'a' stipulé la cessation du service de la renie que dans le  cas de suppression de l'emploi   Par ces motifs  confirme  etc   ■; 13 juill. 1840. ; Cour roy. de Rennes. ;https://gallica.bnf.fr/ark:/12148/bpt6k5541626x/f207.image;18400204
18400205;208;"LA COUR   Attendu que les appelans ne prétendent plus au droit de mettre actuellement en aclion celte hypothèque par la voie de la saisie immobilière  qu'ils demandent seulement qu'elle soit maintenue pour être éventuellement exercée  dans le cas où l'envoi de Georges Antoine Leroy en possession provisoire des biens de l'absent  deviendrait définitif    Attendu que cette demande n'a rien que de juste et de conforme à la loi  que si  aux termes des art  126  128 et 2126  Cod  civ   l'envoi en possession provisoire n'est qu'un dépôt  qui ne donne à l'héritier présomptif de l'absent  le droit ni d'aliéner  ni d'hypothéquer les biens de celui ci  ces prescriptions sonl évidemment relatives et personnelles à l'absent  qui seul a iniérêl et droit d'exciper de la nullité des actes d'aliénation ou d'hypothèque des biens dont il ne cesse pas d'être propriétaire  qu'il serait étrange  surtout  que celte nullité pût être relevée par celui là même qui a élé partie au contrat  par un acquéreur qui  comme le sieur Lenoble  viendrait  en vertu d'un litre nul  demander de son chef la nullité de l'hypothèque d'un créancier  procédant à un litre du mêmegenre  du chef du même auteur  soumis  enfin  comme lui  aux mêmes chances éventuelles dé ré   solution  Allendu qu'entre les tiers   et sauf le droit de l'absent   le vrai caractère des actes  soit ""de vente  soit d'hypothèque  consentis par l'envoyé en possession provisoire est celui que définit l'art  2125  Cod  civ   qu'ils sont  non pas nuls  mais incertains  conditionnels  suivant que l'absent reparaîtra ou non 'qu'en un mot  ils suivent toutes les chances du droit [de celui dont ils procèdent   Attendu qu'il en doit êlre ainsi  surtout quand il s'agit  non d'hypothèques volontaires et consenties par l'envoyé en pos    session provisoire  mais d'hypothèques légales et judiciaires  que le système contraire ouvrirait une large porte à la fraude  en facili   tant  par l'envoyé provisoire  des ventes au mépris des droits de ses légitimes créanciers    Que  dès lors  l'hypothèque légale de la dame Leroy sur l'immeuble vendu par  son mari à Lenoble  frappe sur  cet immeuble et doit être maintenue    Réformant  déclare valables et régulières les inscriptions hypothécaires des époux Surget  sur l'immeuble faisant l'objet de l'acte de vente  ' du 4 juin 1829  en ordonne le maintien  pour êlre  par eux  exercées en temps utile  c'est à dire lorsqu'après le délai de trente ans/  _' l'envoi en possession définitive aura été prononcé au profit des bi'  bi' de Jeân Baptisie Antoine Leroy  absent   "; 22 juill. 1840. ; Cour roy. de Rouen. ;https://gallica.bnf.fr/ark:/12148/bpt6k5541626x/f208.image;18400205
18400206;208;"  Considérant  en droit  qu'aux termesdel'art  15 delà   loi du  30 avr  1790  il est permis  en tout temps non seulement au   propriétaire  mais encore au fermier  de détruire le gibier dans ses"" i récolles  en se servant à cet effet de filets et autres engins  et que"""" t celte faculté ainsi réduite à l'emploi des moyens propres à protëj ger les récolles est tout à faii distincte du droit de chasse attribué s au' propriétaire exclusivement par  1'arl  1er de la même loi   • Considérant  en fait  qu'il est reconnu enlre les parties et parle    bail verbal consenti au profit du cédant de Gallet  le comte de Tal   417   Lois et Décisions diverses  jils  Jeyrand s'est surabondamment réservé sur la pièce louée le droit ' dédiasse  qu'illenait déjà de son titre de propriétaire  et a stipulé  \ en outre  que pour toute espèce de dégâis que le gibier aurait'fails   sur ladite pièce  le locataire ne pourrait réclamer aucune indemnité  mais que ces stipulations n'interdisent ni expressément ni implicitement à celui ci l'emploi des moyens autorisés par l'art  15 précité  pour prévenir ou atténuer les""dégâls résultant pour se» récoltes de l'invasion de ce  même gibier    Qu'à défaut de celle in ter   ' diction  Gallet a pu  à la date du 15 juin dernier  tendre des collets ' sur sa pièce de terre  alors couverte de récoltes  et qu'en agissant i ainsi il a usé d'une faculté légale et n'a pas commis le délit de chasse   qui lui est imputé    Met ^appellation au'néant  ordonne que ce jdont est appel sortira son plein et entier effet  etc   "; 21 août 1840. ; Cour roy. de Paris. ;https://gallica.bnf.fr/ark:/12148/bpt6k5541626x/f208.image;18400206
18400207;209;"  Considérant  sur la premier» question  que l'art 5 ler de la loi du 17 avr  1828  relative à la pêche fluviale  dispose  que le droit de pêche sera exercé au profit de l'Elat dans tous les ilftuves  rivières et canaux navigables   Considérant que l'art  3 de  lamêmploidii encore que des ordonnances royales détermineront quelles sont les parties de ces fleures  rivières et canaux où la petite sera exereée au profil de l'Etat   Considérant que l'art  "" de l'ordonnance du 10 juill  1835 est ainsi conçu   « La pêche sera exercée au profit de l'Etat dans les « fleuves  rivières  canaux et portions de fleuves et rivières désia gués  par le tableau joint à la présente  » Or  dans ce tableau sont comprises la rivière de Madeleine  depuis la chaussée de Baupte jusqu'à son embouchure  et la rivière de Sève  depuis le pont de Baupte jusqu'à son embouchure   d'où suit qu'au moins à partir de ladite ordonnance  ces deux rivières ont été dans la classe des rivières navigables quant aux portions de leurs cours y désignées  et que pour ces mêmes portions  elles ont été réputées propriétés de l'Etat     Considérant qu'il ne peut y avoir de difficulté «urée dernier point  puisque le marquis d'Auvers et joints 1ère     connaissent formellement aujourd'hui    Considérant qu'il est aussi par eux déclaré dans leurs conclusions devant la Coui'  qu'ils n'entendent soulenirmaintenant qu'ils étaient propriétaires  antérieurement au 10 juill  1835  des portions de rivière dont il s'agit  que pour tirer de ce fait l'unique conséquence de leur droit à  "; 16 mai 1840,;Cour roy. de Caen. ;https://gallica.bnf.fr/ark:/12148/bpt6k5541626x/f209.image;18400207
18400209;211;"  En cequi touche Hopposition pratiquée par Mondor de l'Aigle  sur Pelletan  entre les mains de Manès   Adoptant les motifs des premiers juges'  ' En ce qui touche l'inscription prise par Mondor de I  Aigle  au bureau  des hypothèques de Marennes    Considérant que l'art  2123  Cod  civ   accordehypothèqueauxcréances résultant deconr damnalions judiciaires soit contradictoires  soit par défaut    Qu'aucune disposition ne subordonne la validité de l'inscription à îa signification préalable du jugement qui confère l'hypothèque   Que  si l'art  155  God proc  défend d'exécuter les jugemens par défaut avant l'échéance de la huitaine de îa signification  cette prohibition ne peut s appliquer à une inscription  hypothécaire qui n'est point un acte d'exécution  mais unacte purementconservatoire   Qu'ainsi Mondor del'Àiglè a pu valablement prendre  le 30 août  1829  une inscription  hypothécaire sur les  biens de Pelletan  en"" Vertu du jugement du 3 août précédent   Infirme  en ce que Pin   scription d'hypothèque a   été annulée   emendant quant à ce  dépare laditeinscripiion régulière etvalable  etc   "; 23 juill. 1840,;Cour roy. de Paris.;https://gallica.bnf.fr/ark:/12148/bpt6k5541626x/f211.image;18400209
18400210;211;"  Attendu que  si le contrat d'assurances est de droit étroit  il est également un contrat de bonne foi   Attendu qu'il est  dejioioriélé publique  el qu'il est constant pour la Cour  comme pour le tribunal de commerce  que  nonobstant la clause insérée dans les polices et dans les billets de"" primes  la compagnie française du Phénix est dans l'usage habituel de réclamer le paiement ";" 11 mai 1840"".'";Cour roy: de Bordeaux. ;https://gallica.bnf.fr/ark:/12148/bpt6k5541626x/f211.image;18400210
18400211;211;423 Lois et Décisions diverses  421   celles qui précèdent  aurait  été suffisante pour autoriser le conservateur à refuser la radiation   Par ces motifs  réforme  etc   ;.26 mars 1840. ; Cour roy. de Dijon. ;https://gallica.bnf.fr/ark:/12148/bpt6k5541626x/f211.image;18400211
18400212;212;"   En ce qui touche le'moyen de prescription invoqué par le prévenu    En fait    Attendu que C    est prévenu d'avoir abusé d'un blanc seing à lui confié en écrivant frauduleusementaudessus de la signature de l'abbé S  '  un acte de vente à son profit   Attendu que cet acte  portant la date du 29 déc  1827  écrit en entier parC     esl resté secret jusqu'après la mort du signataire  et que le prévenu n'en a fait usage que le 2 mars 1837  en le déposant dans l'élude d'un notaire    En droit     Attendu qu'aux fermes des art  637 et 638  Cod  inst  crim   la prescription de l'action publique résultant des crimes el délits ne commence à' courir que du jour où ils ont été commis   Attendu que  le délit d'abus de blanc seing ne consiste pas seulement dans le fait matériel d'avoir écrit au dessus de la signature librement confiée une obligation pouvant compromettre la fortune du signataire  ""qu'il faut encore qu'à ce fail se joigne la preuve de l'intention frauduleuse de celui quia écrit la convention fausse     Que l'usage de celle convention  en révélant l'intention frauduleuse de celui qui l'a écrite  en réalisant le préjudice à l'égard du signataire trompé dans sa confiance  est véritablement l'acte qui donne l'existence au délit jusqu'alors imparfait    Que le législateur a si bien considéré l'usage comme un élément constitutif du délit d'abus de blanc seing  et non comme un délit principal et distinct  qu'il n'en a fait l'objet d'aucune ^disposition spéciale  [et n'a prononcé  dans le cas prévu par l'art  407  Cod  pén   aucune peine contre le simple fait d'usage    Qu'on peut d'autant moins considérer le silence du législateur comme un oubli  qu'il avait pu le soin  dans les art  148 et 151 du même Code  de distinguer formellement l'usage du faux de la fabrication du faux lui même  el que dans le second paragraphe de l'art  407  sa pensée s'est reportée sur le crime de faux      Attendu  d'ailleurs  qu'en 'admettant même que le délit fût consommé par le fait seul de l'inscription de la fausse convention audessus du blanc seing  il resterait encore à prouver l'époque précise de cétle inscription   Attendu que cette preuve doit êtreà la charge du prévenu  puisque la prescription est une exception qui doit êlre justifiée par celui qui l'oppose ^ Qu'en matière d'abus de blancseing  cette preuve ne peut pas résulter seulement de la date donnée par le prévenu à l'acte attaqué  autrement ce serait lui permettre de se faire un titre à lui même  ou de s'assurer l'impunité  soit en antidatant l'acte  soit en n'en faisant usage qu'après trois ans à partir du jour où il aurait élé écrit    Qu'il faut donc que le moment de la perpétration du délit soit constaté par des preuves extrinsèques à l'acte lui même  ou par des faits indépendans du prévenu   Que  jusquelà  la présomptionriaturelle et légale estque l'acte a élé écrit au moment où l'on avait intérêt de s'en servir  el par conséquent à une époque contemporaine de l'usage qui en a  été fait  Et attendu que  dans la cause/aucune circonstance extrinsèque  à l'acte ne prouve qu'il ait eu  réellement une origine antérieure à l'usage que le prévenu en à fait en le déposantle 2 mars 1837 dans l'étude de Me H     notaire à P     Attendu que l'action du ministère public a élé intentée le 27 août 1839  par conséquent moins de  trois  âns après le dépôt dé l'acte argué et la perpétration"" du délit   D'où il suit que l'action n'est pas prescrite et qu'elle esî recevablè      Par ces molifs  etc       "; 24 août 1840. ; Cour roy. d'Orléans. ;https://gallica.bnf.fr/ark:/12148/bpt6k5541626x/f212.image;18400212
18400213;212;"   Considérant que si  d'après le contrat d'union  les syndics sont chargés de poursuivre la liquidation des dettes activeset passives du failli  sous la surveillance du juge commissaire  ilsne sont autorisés par aucune disposition de loi à traiter directement au nom des créanciers avec le débiteur failli  même à litre d»    transaction   Que l'art  521  Cod  comm   frappe au contraire denullité îout traité intervenu enlre le failli et ses créanciers  lors~ que l'examen de ses actes  livres et papiers  donne quelque présomption de banqueroute    Qu'à la vérité  aux termes de l'art  ""563   l'union peut en tout état de cause   avec l'autorisation du tribunal de commerce  traiter à forfait des droits et actions dont te recouvrement n'aurait pas été opéré  et les aliéner   mais que cet article n'est applicable qu'aux traités qui peuvent intervenir entre l'union et les tiers dàris l'intérêt de la masse des créanciers   et non   à ceux qui seraient arrêtés enlre une partie dés' créanciers et le   failli lui même  Que des conventions de cette nature ne peuvent   lier que les créanciers qui les ont consenties  et ne sauraient en i aucun cas devenir obligatoires pour ceux qui ont refusé d'y atllié  rer   Considérant que  d'après ces principes  la transaction proposée par le tuteur de Paul Dulin à ses créanciers  le 30 janv  denu» 1 (t)T  en sens contraire  Cass  17 déc  1833 (vol  1831 1 14)   425   Lois et Décisions divers'en 428'  et par  suite de laquelle remise lui  serait faite de'dix huit mois d'in^  lérêls  n'est pas obligatoire pour les créanciers qui ont refusé à'y consentir  et ne peut leur êlre opposée  Infirme  '   '  "; 2juill. 1840.;Cour roy. de Paris.;https://gallica.bnf.fr/ark:/12148/bpt6k5541626x/f212.image;18400213
18400214;213;"LA COUR   Considérant  en droit  que ^obligation de îa part des  enfans de fournir des alimens à leurs père et mère  lorsqu'ils' sont dans le besoin   est une obligation naturelle  imposée dès fors '"" pour la filiation naturelle comme en cas de filiation ""légitime  Que l'art  206  Cod  civ    pose en principe que le gendre doit  comme l'enfant son conjoint  auquel il est assimilé par la loi  des alimens  à son beau^pèrë età sa belle mère  et que cette obligation ne cesse que lorsquela' belle mère a convolé en secondes noces  ou lorsque' celui des époux qui produisait l'affinité et les enfans issus de son  union avec l'autre époux s'ont décédés  f  Considérant que  dans' l'espèce  il existe trois éitfans nés du légitime ""mariage de B    avec la fille"" L     Infirme  fixe la pension alimentaire à 300 fr  ete  ' ' "; 28 mars 1840.;Cour roy. de Parisi;https://gallica.bnf.fr/ark:/12148/bpt6k5541626x/f213.image;18400214
18400215;214;I LA COUR    Cbnsidérantquelës premiers juge&se sont conformés tout à la fois àJ'équiléicGnime awa  principes du droîl^m recherchant l'intention de la donatrice par Interprétation des dis*  positions de Pacte du 13 juin 1820   Que c est en faisant une juste apprécation des termes de cet acte  qu'il a  été  reconnu et décida par eux que l'intention de ladite donatrice n'avait pas été de donner toutelatportion disponible de la succession  mais qu'elle avait entendu faire porter le quart dont  elle  disposait  uniquement SUE les biensrrieubles et immeubles qui  possédés  par elle â l époque de son décès  lui appartiendraientalors  et non sur ceuxde cesbïens dontelle n'étaitplus saisie  comme en ayant disposé avant la dona  tion dont il s'agtt  et qui ainsi ne pouvaient  suivant l'intention ma  nifeslée par elle  être censés lui appartenir encore  Adoptant en conséquenceles molifs  des premiers juges   Confirme  eic   ; 7 mars 1840.;Cour royl de Paris.;https://gallica.bnf.fr/ark:/12148/bpt6k5541626x/f214.image;18400215
18400217;215;"   =  Considérant qu'aux termes de  Fart  166  Cod  proc   l'étranger demandeur principal ou intervenant est tenu de fournir la camion judicatum solvi  si le défendeur la requiert avant toute exception   Que i appelant  par la contestation qu'il a formée sur le procès verbal de contribution   s'est constitué demandeur principal  qu'en effet  c'est cette contestation'qui a créé le procès  quia ouvert l'instance par le renvoi auquel elle a donnélieu   Que  d'ailleurs  l'appel est le principe d'une instance nouvelle qui doit donner lieu à dés frais nouveaux  et qu' en demandant la caution devant la Cour  avant toute exception  les intimés usent du droit que leur confère l'acte précité   Ordonné que    dans le délai d'un mois  Samuel Mosès donnera caution de la somme de 500 fr  pour  sûreté des frais delà cause d'appel  et des dommages intérêts auxquels il pourrait être condamné  ""  "; 22 juill. 1840.;Cour roy. de;https://gallica.bnf.fr/ark:/12148/bpt6k5541626x/f215.image;18400217
