id;page;arrêt;date;juridiction;lien;id
18281109;86;LA COUR     Considérant que les nombreuses dispositions contenues au titre 12  livre 5 du Code de procédure  prouvent qu'il contient la législation spéciale pour les saisies immobilières   qu'on ne doit donc pas recourir en cette matière aux règles du droit commun    Considérant qu'on ne peut assimiler les actes ordinaires de poursuite   au nombre desquels est l'adjudication préparatoire  à des jugemens  puisque le juge n'est appelé à prononcer sur aucune contestation  et qu'on ne peut les regarder que comme de simples formalités employées pour arriver à l'adjudication définitive  qui est le complément de cette procédure    Considérait que le dernier acte est le seul jugement qui intervienne dans la poursuite  et qu'ainsi il est le seul qui doive être revêtu de la formule exécutoire et du mandement de justice    Considérant que l'adjudication préparatoire n'est qu'une simple formalité  à moins qu'elle ne prononce en même temps sur des nullités  et qu'alors les formes à suivre sont tracées par les art  733 et 734 du Code de procédure   •  Considérant que le Code n'ordonne point que la notification en soit faite lorsqu'elle est isolée   que si elle eût dû être faite  le législateur en eût donné la forme  et eût indiqué le délai pour se pourvoir contre ou en obtenir la réformation   que le silence à cet égard de la loi  qui prononce par ailleurs/beaucoup de nullités  fait induire qu'eUe â considéré cette notification comme vaidect inutile   Considérant que le saisi est suffisamment prévenu par les affiches  les insertions des journaux et autres formalités voulues par la loi  du jourauquel on doit procéder à l'adjudication préparatoire  qu'il doit en être de même pour l'adjudication définitive puisque les mêmes formes sont indiquées et suivies    Considérant que Pari  147 du Code de procédure n'est pas applicable à l'adjudication préparatoire   que cet acte de procédure  fût il qualifié jugement  n'est susceptible d'aucune exécution puisqu'il ne prononce point de condamnation et que les actes qui le suivent sont prescrits non par lui mais bien par la loi  en exécution de laquelle ils ont lieu    Considérant qu'il résulte de Part  1 u du tarif de 1807  que l'époque indiquée pour la première publication avertit les parties de s'y présenter  et les met à même de connaître les publications subséquentes   que toute dulrc notification est formellement interdite par cet article   Considérant enfin que'toutes les nullités sont prévues parla loi et qu'U est défendu aux juges d'en introduire de nouveues    Par ces motifs dit bien jugé par le jugement dont appel (lequel décide qu'il n'est pas né   cessaire de signifier le jugement d'adjudication préparatoire )  ; iSlévricr 1828.;C.r. Rennes.;https://gallica.bnf.fr/ark:/12148/bpt6k57755019/f86.image;18281109
18281110;87;    Attendu que Rose Crebassa ne pourrait aujourd'hui   se prévaloir de l'hypothèque légale que la loi accorde à la femme  puis    qu'elle a laissé consommer l'expropriation des biens de son mari sans   prendre inscription   Attendu que la jurisprudence de la Cour de   cassation est aujourd'hui fixée sur celte question  et qu'il résulte de | ses derniers arrêts que l'expropriation purge l'hypothèque légale  tant i vis à vis l'adjudicataire  qu'à l'égard des créanciers  et que la femme | non pourvue d'inscription ne peut pas plus se présenter à l'ordre  qu'elle ne pourrait agir contre le tiers détenteur    Attendu que cette doctrine est conforme à l'économie de la loi qui  imposant l'obligation d'appeler à l'iirdre les créanciers inscrits  exclut par voie de suite les créanciers non pourvus d'inscription  et que  du reste  les formalités nombreuses qui précèdent l'adjudication ne permettent pas de supposer que la femme n'en ait pas été avertie    Attendu  dès lors  que c'est sa faute si elle ne prend pas inscription  et qu'ici Rose Crebassa peut d'autant moins se plaindre  qu'elle était veuve lors de l'expropriation de son mari  et que dès lors elle devait veiller elle même à la conservation de ses droits    Attendu  d'un autre côté  que Rose Crebassa ayant reçu sept immeubles en paiement de sa dot  et ayant laissé comprendre quatre de ces sept immeubles dans l'expropriation des biens de son mari  ne peut pas prétendre qu'elle ail ignoré cette expropriation   qu'elle aurait  dune pas négliger de former une demande en distraction  et que si  par cette négligence  elle éprouvait un'préjudice  elle ne pouvait s'en prendre qu'à elle  étant d'ailleurs constant au procès qu'eUe a eu une connaissance légale  par la notification qui lui a été faite de l'exemplaire du placard imprimé    Par ces motifs  disant droit à l'appel  rejette la collocation faite au profit de Rose Crebassa   ordonne que les deniers provenant de l'adjudication seront distribués aux autres créanciers  etc  ; 16 août 1827. ; C. r. Montpellier. ;https://gallica.bnf.fr/ark:/12148/bpt6k57755019/f87.image;18281110
18281111;87;    Sur le premier grief proposé par la veuve Mauret  qui a été pris de ce que la collocation par elle demandée sur les biens de François Mauret  son beau père  a été rejetée  sous le prétexte qu'eUe n avait pas d'hypotèque spéciale sur lesdits biens     Considérant que  par son contrat de mariage avec Pierre Mauret  du 26 messidor an 10   Jean Baptiste Mouteil  son père  et Jeanne Andraud  sa mère  lui constituèrent  à titre de dot  en avancement d'hoirie  la somme de 16 000 fr   dont 9 700 fr  furent payés comptant à François Mauret père  qu'à la suite des conventions stipulées audit contrat de mariage  et par la clause qui le termine   il est dit qu'à l'exécution des présentes les parties ont respectivement obligé tous leurs biens présens et à venir  savoir  ceux du futur époux  qui lui sont échus par le décès de sa mère  situés au lieu defontange  arrondissement du bureau des hypothèques de Mauriac  et les pères des futurs  ceux situés dans l'étendue de la commune de leur domicile  dans l'arrondissement de Murât    Considérant que cette dernière stipulation a évidemment constitué  de la part de François Mauret père  en faveur de Jeanne Mouteil  sa bru  une hypothèque spéciale sur tous les biens qu'il possédait dans la commune de Saint Saturnin  lieu de son domicile  nominativement déclaré en tête du eonlrat de mariage    Que l'inscription que ladite Jeanne Mouteil a prise  le 26 juin i8i3   en vertu du même contrat  a été requise sur les biens immeubles de François Mauret père  situés dans la commune de SaintSaturnin  arrondissement de Murât     Qu'ainsi  soit d'après les termes dans lesquels l'hypothèque a été constituée sur les biens de François Mauret  soit d'après ceux qui ont été employés dans l'inscription [irise sur les mêmes biens  il était impossible de ne pas reconnaître une désignation suffisante pour indiquer que tous les biens qui appartenaient à François Mauret  dans la commune de Saint Saturnin  étaient soumis à l'hypothèque de Jeanne Mouteil  d'où il suit que celte dernière avait  non seulement une hypothèque valablement constituée sur les biens de François Mauret  mais encore une inscription valable  et qui a rempli suffisamment le voeu des art  4 et 17 de la loi du 11 brumaire an 7  ainsi que des art  2129 et 2148 du Code civil  de manière que tous ceux qui ont voulu traiter dans la suite avec François Mauret étaient nécessairement instruits que tous les biens de François Mauret étaient assujettis à l'hypothèque de Jeanne Mouteil  pour raison de la dot qui lui avait été constituée  et que  sous ces différons rapports  Jeanne Mouteil devait être colloquée sur les biens de François Mauret    En ce qui louche le grief proposé par Real contre Jeanne Mouteil  consistant à dire que l'hypothèque légale était éteinte   pour n'avoir pas été inscrite avant l'adjudication sur expropriation forcée faite sur les biens de Mauret père et fils     Considérant qu'il faut distinguer  à l'égard de l'hypothèque légale  de la femme  l'intérêt de l'acquéreur des immeubles soumis à cette hypothèque  de l'intérêt des créanciers qui ont des hypothèques sur ces mêmes biens     Que si  relativement à l'acquéreur d'un immeuble soumis à l'hypothèque légale de la femme  cette hypothèque se trouve purgée  lorsqu'il n'a été pris aucune inscription de son chef  pendant la durée des formalités prescrites par Part  2194 du Code civil  dans le cas d'une vente volontaire  ou pendant celles qu'exige la saisie immobilière  dans le cas d'une expropriation forcée   ce n'est uniquement que dans l'intérêt de l'acquéreur ou de l'adjudicataire   et pour fixer le sort de la propriété immobilière     Mais de ce que l'immeuble se trouve affranchi de l'hypothèque légale de là femme dans les mains du tiers détenteur  il ne s'ensuit pas que celle ci soit sans droit sur le prix   que  tant que l'ordre n'est pas clos  ou  s'il n'y a pas d'ordre ouvert  tant que le prix est entre les mains de l'acquéreur  la femme conserve  en vertu de son hypothèque légale  et indépendamment de toule inscription  le droit de venir en concurrence avec les créanciers inscrits  pour le recouvrement de sa dot  de ses reprises et convention» matrimoniales    Qu'U n'y a d'autre règle à suivre à cet égard que celle établie par les art  2134 et 2135 du Code civil  qui ont précisément pou» objet les droits respectifs des créanciers   que si  pour les créances ordinaires  Part  2134 exige une inscription  et ne leur donne rang qu'à sa date  Part  2i35 dispense de toute inscription l'hypothèque légale de la femme  et veut qu'elle prenne rang en vertu de la nature seule de sa créance  et du jour où clic a pris naissance    Qu'il suffit  pour l'exercice de ses droits sur le prix de l'immeuble vendu  qu'elle se présente à l'ordre  et y produise ses titres  que c'est ce qui a été fait par la veuve Mauret  et que le jugement dont est appel  en la colloquant  en vertu de son hypothèque légale  sur les biens de son mari  pour ses reprises et conventions matrimoniales  n'a fait que reconnaître et accueiuir un droit qui ne pouvait lui être refusé    Dit qu'il a été mal jugé  au chef qui I déclare nuue l'inscription prise sur les biens de Mauret père  bien jugé ' au chef qui accorde l'hypothèque légale sur les biens de Mauret fils  etc   consultation produite au procès  et délibérée par MM  Toullier  Carré  et autres jurisconsultes du barreau de Rennes   (i)V   pour l'affirmative  tom  24  a  353  s5  3  32     26  3„io6    27  2 9  et pour la'négative  tom  22 1 (214  a6  1 65  V aossi tom  37  3  260 et les arrêts qui y sont indiqués   (a) Le lecteur remarquera que la Cour de Montpellier avait décidé la question en sens contraire  par un arrêt du 19 mai ifaaa  (V  tom  a4  a  353 ) '   J»8 Lois  ; i5 avril 1826. ; C. r. t'e Riom. ;https://gallica.bnf.fr/ark:/12148/bpt6k57755019/f87.image;18281111
18281112;88;LA COUR     Attendu qu'il est constant  en fait  que le sieur Sallin  né en Savoie  a acquis les droits et le titre de citoyen français bien avant la loi du i4 octobre i ii4  qu'en effet il réside en France depuis plus de  cinq ans avant la loi du 2 mai 1817  qu'il a été inscril en 1791 sur la liste des citoyens actifs  et qu'il a prêlé le serment civique  qu'il a formé un établissement de commerce en France  acheté des immeubles  cl épousé une Française  que son domicile a élé constamment à Carcas «iiine   que  depuis lors  il a joui de tous les droits attachés à la qualité de citoyen français  rempli des fonctions publiques  telles que les fonctions de jury et celles d'électeur   qu'il a été nommé membre d'un con   seil municipal  et en exerce aujourd'hui les fonctions  que  soit que J'on considère les lois de 1790  les constitutions de 1791 et 1793  le sieur Sallin avait  d'après ces lois  acquis le titre de citoyen français  que les lois postérieures  en exigeant de nouvelles formalités  n'ont pu avoir un effet rétroactif  et enlever au sieur Sallin des droits acquis    Attendu qu'il n'a élé allégué aucune circonstance qui ait fait perdre au rieur Sallin la qualité de citoyen français     Par ces motifs  statuant  Aur la demande du sieur Sallin  et sur le pourvoi par lui fait envers l'arrêté du conseil de préfecture  du 25 septembre dernier  sans s'arrêter audit arrêté  et l'annulant en tant que de besoin  déclare que le kieur SaUin est citoyen français  etc   ; 12 qovemhrc 1827.; ;https://gallica.bnf.fr/ark:/12148/bpt6k57755019/f88.image;18281112
18281113;88;     Attendu que l'hypothèque n'a de rang que du jour de l'inscription par le créancier sur le registre du conservateur     que la créance de Séraphin Pineau est inscrite à la date du i5 juin 1821  qu'elle a un rang antérieur à celle de Gerbeau qui n'a été prise que le 7 décembre suivant   qu'ainsi le juge commissaire a pu colloquer Pineau  el par suite Courjaud en sous ordre sur le montant de sa collocation  par préférence à Gerbeau   Attendu que l'inscription de Pineau a subsisté  malgré la mainlevée  qu'il en avait consentie par acte du 16 juin 1S21   que cet acle n'est point synallagmalique   que ceux qui auraient pu en faire usage n'en ont point profité pour faire opérer la radiation   que les choses étaient encore entières à cet égard lorsque Pineau a déclaré qu'il révoquait le consentement par lui donné à ce que l'inscription fût radiée   que cette révocation ayant eu lieu avant que son consentement à la radiation eût élé accepté   elle a détruit radicalement l'effet de Pacte en mainlevée du 16 juin et a laissé l'inscription dans toule sa force     Émendant  maintient la collocation faite au procès verbal d'ordre en faveur de Pineau  etc   ; 7 avril 1827. ; C. r. Bordeaux.;https://gallica.bnf.fr/ark:/12148/bpt6k57755019/f88.image;18281113
18281114;89;LA COUR     Attendu que le préfet  représentant  le roi dans  l'ordre administratif  ne plaide personnellement devant les tribunaux que lorsqu'il s'agit des intérêts matériels de ses administrés  mais lorsqu'il s'agit de l'état même de l'un d'eux  c'est au ministère public seul qu'est confié le soin de veiller au maintien de l'ordre public et des droits 1 ndividuels    Attendu  d'ailleurs  que c'est au nom du préfet du département de l'Ain  et dans l'intérêt général de ses administrés que Pacte d'appel a élé formé    Adoptant   au surplus  les motifs des premiers juges     Sans s'arrêter  $ la fin de non recevoir  met l'appellation au néant  ordonne  etc   ;» août 1837. ;C. r.Lyon.;https://gallica.bnf.fr/ark:/12148/bpt6k57755019/f89.image;18281114
18281115;89;LA COUR     Attendu que la procédure en expropriation est régi» par des règles particulières et spéciales  que  par l'une de ces règles  prescrites parl'art  714 du Code de procédure  la partie saisie est obligée de délaisser la possession de l'immeuble aussitôt la signification du jugement d'adjudication  sous peine d'y être contrainte même par corps     Que Moureau  ayant refusé d'obtempérer au jugement  qui avait adjugé le domaine de Tresse à Beyssellance et qui lui avait été signifié avec commandement le 37 septembre dernier  Beyssellance n'a fait que se conformer à la loi en faisant procéder  le 3 octobre suivant  au vidange dudit domains et à l'éjection des meubles de Moureau  ainsi que le tout est constaté par le procès verbal de ce jour dressé par l'huissier Chassât 1    Met l'appel au néant  etc   ; 37 avril 1837. ; C. r: de Bordeaux. ;https://gallica.bnf.fr/ark:/12148/bpt6k57755019/f89.image;18281115
18281116;89;    Attendu que les intimés se sont suffisamment substitués à leur auteur en formant leur  demande en qualité de ses héritiers  et qu'il était inutile qu'ils reprissent une instance dont leur demande n'avait d'autre but que de faire déclarer îa péremption     Amis et met l'appellation au néant  etc   ; 34 février 1836. ; C. r. Metz. ;https://gallica.bnf.fr/ark:/12148/bpt6k57755019/f89.image;18281116
18281117;90;LA COUR  Considérantquel'art  563 Cod  proc  civ   se bornant à exi  ] ger que l'assignation en validité de la saisie arrêt en contienne la dénonciation   et non le report littéral à la partie saisie  il s'ensuit qu'il a été  dans l'espèce  suffisamment satisfait au voeu de la loi par la copie qui a élé notifiée à la veuve Huard Cadet  des saisies arrêls'cn question   car  bien que cette copie ne renferme ni les noms ni l'immatricule de l'huissier qui a instrumenté lesdiles saisies  elle n'en fournit pas moins tous les renseignemens propres à faire connaître leur existence   que d'ailleurs la loi n'ayant pas prononcé de nullité en raison des irrégularités de la  dénonciation  celle cotée par la veuve Huard ne pourrait êlre accueillie  sans contrevenir à Part  io3o du Code précité    Confirme le jugement  attaqué  etc  ; 10 avril 1827. ; C. r. Caen. ;https://gallica.bnf.fr/ark:/12148/bpt6k57755019/f90.image;18281117
18281118;90;"LA GOTJR  r  Considérant que Port  191  n°  8  C  comm   accorde  il est vrai  un privilège aux fournisseurs et employés à la construction des navires   mais que tout privilège devant avoir pour base nécessaire une créance opposable à ceux contre lesquels il doit être exercé  il faut reconnaître que les individus mentionnés audit article n'en ont aucun à réclamer_envers les personnes à l'égard desquelles il ne sont pas réputés créanciers    Que  d'après l'art  1 708 Cod  civ   les maçons  charpentiers  charpentiers autres ouvriers employés à la construction d'un bâtiment ou de tout autre ouvrage fait à l'entreprise  n'ont d'action contre eelui pou» lequel les ouvrages ont été faits  que jusqu'à concurrence de ce dont U se trouve débiteur envers l'entrepreneur au moment où celte action est intentée     Que l'application de cette règle au cas de la construction desnavires par des entrepreneurs chargés de la fourniture des matériaux et de la main d'oeuvre envers les armateurs  qui avait été jugée nécessaire par la déclaration du roi  du 16 mai i747  ne peut être contestée dans l'étet actuel de la législation  où elle devient la conséquence des termes généraux et illimités de Part  1798 Cod  civ   à l'étendue desquels le Code de commerce n'a point apporté de restriction en ce qui touche cette matière     Que seulement  comme en général les navires se construisent sur des chantiers appartenant aux entrepreneurs  il importe  qu'il demeure constant que la foi des fournisseurs et ouvriers en sous   ordre n'a pu être trompée  et qu'ils ont cdhnu ou dû connaître qu'ils fournissaient ou travaillaient pourle compte d'un entrepreneur  et non  pour le compte du propriétaire du navire  mais qu'au surplus la nécessité que cette connaissance leur soit donnée n'étant établie par aucun texte formel de loi  et ne résultant que de l'équité   qui ne permet pas que des individus soient abusés par la vue d'un gage apparent sur lequel Us seraient faussement induits à compter  lorsqu'au fond Us n'y auraient aucun droit réel  il s'ensuit que l'on doit regarder comme abandonnée à la conscience et à la sagesse des tribunaux l'appréciation des faits qui tendent à prouver que l'inconvénient qu'il s'agit ici d'éviter ( l'erreur des ouvriers et fournisseurs ) est ou n'est pas arrivé     Qu'il n'est pas contesté qu'U a élé fait  à la date du 3 juin 18116  un marché par lequel Thibout  constructeur à Caen  a pris l'engagement envers la veuve Hélain de lui construire un navire à raison de 120 fr  le tonneau  avec stipulation que le prix dudit navire serait payé au fur et^ mesure de l'ouvrage fait  chose qui s'est (ponctuellement exécutée de la sorte entre les parties  qu'en vertu de celte convention  la propriété dn navire a   dès l'origine  appartenu à ladite veuve Hélain   ainsi'que la Cour l'a décidé le ao février dernier  par l'arrêt rendu *ntre cette teuve  et la masse des créanciers Thibout   •  Qu'il n'est pas possible de douter que les fournisseurs et ouvriers de Thibout n'aient sulqu'il ne construisait pas pour lui  mais bien pour la veuve Hélain     Que les raisons d'en être convaincu sont (suit Pénonciation de différcns faits)    i""  Qu'à ces divers faits  émanés de la veuve Hélain  par lesquels sa qualité   relativement au navire dont il s'agit  a été manifestée autant qu'il est raisonnable de l'exiger   se joignent des circonstances dérivant de la conduite de Hugot et consorts  qui démontrent que  dan» leur propre pensée  ils ont entendu traiter avec Thibout comme entrepreneur  abstraction faite de garanties particulières sur le navire qu'il construisait (suit Pénonciation de ces circonstances)     *'■ Que de tout cela il résulte   d'une part  qu'on ne peut reprocher à la veuve Hélain de n'avoir pas averti personnellement de son droit de propriété sur le navire en construction  Hugot et joints   puisque aucun d'eux n'ayant eu de marché particulier par rapport audit navire   rien ne faisait savoir à l'armateur que c'était plutôt à eux qu'à d'autres que Thibout s'adressait  et  d'autre part  que l'absence complète de toutes précautions du chef de ces individus  même ' dans la tenue de leurs livres  pour suivre l'application spéciale de leurs travaux et fournitures  montre jusqu'à l'évidence qu'ils suivaient entièrement la foi dudit Thibout sans s'inquiéter des navires existant sur le chantier   ce qui est si vrai  que l'un des adversaires de la veuve Hélain   après la faiuite de Thibout  prétendit d'abord que les matériaux par lui fournis avaient été employés sur un antre navire que celui de la veuve Hélain    Confirme» etc          "; 21 mars 1827. ; C. r. Caen. ;https://gallica.bnf.fr/ark:/12148/bpt6k57755019/f90.image;18281118
18281119;91;     Attendu qné l'acte authentique du 19 septembre i**a n'est point un contrat de prêt auquel puissent s'appliquer les dispositions de la loi du 3 septembre 1807   qu'U est au contraire  dans sa substanoe   comme dans sa dénomination  un véritable contrat de cautionnement  et plus spécialement encore un acte par lequel  dans l'espèce de la cause  Feval s'est obligé de fournir et a fourni réellement le cautionnement que Philippe était obligé de verser au trésor public pour la garantie de l'exercice de son emploi   Attendu qu'il n'est point de la nature d'un pareil acte d'être gratuit   que les parties peuvent donc  licitement lui assigner un prix   que Feval  qui faisait le fond du cautionnement  pouvait à son choix le verser en numéraire ou en rente sur l'État   qu'il n'y a rien à conclure contre lui de ce qu'il a préféré consigner une inscription  sur le grand livre au lieu de numéraire  que s'il n'avait pas déposé au trésor une  rente de 30b fr   par lui achetée à cet effet à quatre vingt quatre pour cent  iln'en aurait pas moins touché l'intérêt et en aurait conservé la libre disposition  de manière i pouvoir la revendre avec bénéfice quand Poeaision s'en serait présentée   qu'on M doit donc pas cumuler l'intérêt de sarente avec celui qu'il a éxigédephilippe danspaote du 19 septembre que l'intérêt de cinq pbur cent  auquel Ptàiippeis'est particulièrement oblige  n'est que lé prix du risque du cautionnement et de l'interdiction que s'imposait Feval de la libre disposition du capital de sa rente  et qu'une semblable stipulation n'était prohibée par aucune loi   Confirme  «ïc  ; 4 décembre 1837.;C. r. Rouen.;https://gallica.bnf.fr/ark:/12148/bpt6k57755019/f91.image;18281119
18281121;92;LA COUR  Attendu  au fond  qu'en règle générale tout créancier peut intervenir dans une demande en partage des biens de son débiteur  mais qu'il ne peut attaquer un partage consommé   que  toutefois  il faut que l'existence de ce partage soit bien constante  et que  d'ailleurs  il ne soit infecté  ni du dol  ni de la fraude  qui font exception à toutes les règles     Attendu que  dans l'espèce  on produit une vente  sous la date du 17 mars 1816  que l'on soutient être un véritable partage  mais que cet acte  sous seing privé  n'a été produit et enregistré qu'en i8»41 qu'on y voit que Villaret renonce à une pension viagère  accordée par jugement  pour vendre une partie des biens de la succession sous une rente viagère qui n'est guère plus élevée que la première  que c'est alors que Sartor le poursuivait  que ViUaret a consenti un pareil acte   que ces circonstances ne permettent pas de croire qu'il soit sérieux   et quand i) l'aurait été  le créancier lésé par ce mode frauduleux aurait eu le droit d'en réclamer    Par ces motifs  démette sieur Berlue de son appel  etc   ; 31 mai 1827.;C. r. Toulouse. ;https://gallica.bnf.fr/ark:/12148/bpt6k57755019/f92.image;18281121
