id;page;arrêt;date;juridiction;lien;id
18410108;86;LA COUR   Attendu que  suivant un acte de partage d'écriture privée en date du 24 mars 1790  et enregistré le 16 mai 1839  les auteurs de Fiallon et ceux de l'épouse Basset sont convenus de jouir en commun  et chacun certains jours de la semaine pour l'usage de leurs lois respectifs  des eaux mortes qui se ramassent dans la pêcherie de la fontaine    Attendu que  au mépris de celte convention   il a été pratiqué par les époux Basset des ouvrages qui détournent les eaux de leur cours ordinaire pendant les jours où elles servaient autrefois à l'irrigation du lot de Fiallon    Attendu que rétablissement de ces ouvrages ne saurait être justifié par l'acte du 8 avr  1839  suivant lequel Basset aurait acquis personnellement de Léonard Chabaut  à litre d'échange  un héritage supérieur à la pêcherie où se ramassaient autrefois les eaux mortes   Qu'en effet  si l'on considère  d'une part  que les héritages donnés en échange à Léonard Chabaut étaient la propriété de l'épouse Basset  et  d'autre part  que le détournement des eaux a précisément pour objet de les conduire  les jours où Fiallon avait le droit d'en jouir  dans une propriété de l'épouse Basset  on ne peut s'empêcher de reconnaître  dans l'échange et dans l'établissement des ouvrages qui l'ont suivi  des faits personnels à l'épouse Basset  à laquelle il ne saurait être permis  suivant les règles de la  bonne foi et de l'égalité  de porter atteinte directement ou indirectement  aux conventions d'un acte de partage où elle a figuré par ses auteurs    Que conséquemment il y a lieu de rétablir le mode de jouissance des eaux qui font l'objet du litige  tel qu'il existait antérieurement à l'échange du 8 avr  1839  et aux ouvrages qui l'ont suivi  Met l'appellation et ce dont est appel au néant  émendant  ordonneque les eaux mortes sur la jouissance desquelles les parties sont en contestation  seront jouies entre elles comme elles avaient coutume d'en jouir avant les ouvrages pratiqués par les époux Basset  etc   ; 1er déc. 1840. ; Cour roy. de Limoges. ;https://gallica.bnf.fr/ark:/12148/bpt6k5558917f/f86.image;18410108
18410109;86;LA COUR   Considérant qu'il résulte des faits consignés au procès verbal du 5 déc  1840  que B    a facilité l'évasion de Marie Renou     Considérant que ces faits loin d'avoir été détruits  ont été confirmés par l'enquête écrite et par les dépositions orales et les débats auxquels elles ont donné lieu devant la Cour   Considérant  173  Lois et Décisions diverses   174  que Marie Renou n'était pas seulement prévenue de délit  mais qu'elle était arrêtée  par suite de condamnation correctionnelle  pour délit  que l'arl  238  Cod  pén   ne distingue point entre les délits qui entraînent seulement des amendes et ceux qui entraînent l'emprisonnement  Déclare B    coupable d'avoir facilité l'évasion de Marie Renou  arrêtée en exécution de condamnation pour délit de police correctionnelle  et condamne B    à la peine d'emprisonnement pendant dix jours  etc   ; 6 janv. 1841.; Courroy.de Rennes. ;https://gallica.bnf.fr/ark:/12148/bpt6k5558917f/f86.image;18410109
18410110;87;LA COUR   Attendu que  pour leur sûreté et leur conservation  on ne peut assimiler les marchandises placées dans la dunette à celles qui le seraient sur le lillac du bâtiment  et qui sont exposées à l'intempérie de l'air et à l'humidilé des flots     Attendu que les dunettes sont établies sur le prolongement des courbes   qu'elles font corps avec le bâtiment et qu'elles sont recouvertes d'un tillac qui a une grande analogie avec celui qui recouvre le pont   que  par leur solidité  elles diffèrent essentiellement des rouffles dont quelques navires sont pourvus     Adoptant au surplus les motifs des premiers juges   Confirme  etc   ; 13 janv. 1841. ; Cour roy. de Bordeaux. ;https://gallica.bnf.fr/ark:/12148/bpt6k5558917f/f87.image;18410110
18410111;87;         Attendu que l'article 229  Cod  comm    n'est pas applicable à l'espèce   que s'il rend le capitaine responsable des dommages arrivés aux marchandises chargées sur le tillac de son vaisseau  c'est par le motif qu'elles s'y trouvent exposées aux intempéries de l'ait et aux violences des lames   mais qu'il n'en est pas de même lorsqu'il existe dans le bâtiment une dunette solidement construite  où les objets qu'elle renferme sont à l'abri du mauvais temps et sous la sauvegarde du capitaine  qui a sa chambre dans cette partie du navire   qu'il est notoirement d'usage entre les capitaines au long cours de garder dans leur chambre les valeurs qui leur sont remises à titre de fret soit en papier  soit en monnaie   Attendu que cela était d'autant plus nature dans l'espèce  que les quadruples étaient renfermées dans des sacs de toile et d'un très petit encombrement  et qu'elles se trouvaient plus en sûreté dans la chambre du capitaine que dans la cale du na(1) na(1) dans le même sens l'article suivant   175  Lois et Décisions diverses   176  vire  que spécialement  dans les circonstances qui ont accompagne le naufrage du Charles Guillaume  les objets qui se trouvaient dans sa cale étaient plus exposés à la rapacité des noirs que ceux qui étaient renfermés dans la chambre du capitaine  et qu'il est impossible de dire que la perte en eût été évitée s'ils eussent été placés sous le pont   Attendu que les reproches adressés au capitaine n'étant pas fondés  et étant décidé qu'il n'a pas commis de faute  il n'y a pas lieu de s'occuper de la garantie exercée contre l'armateur   Met au néant l'appel interjeté par les assureurs  etc   ; 6 déc. 1838. ; Cour roy. de Bordeaux. ;https://gallica.bnf.fr/ark:/12148/bpt6k5558917f/f87.image;18410111
18410113;88; tout en improuvant les inculpations dirigées contre le sieur Lelièvre  lui a dénié le droit d'intervenir personnellement dans l'instance  par les motifs qui suivent   ARRÊT   LA COUR   En ce qui touche l'intervention   Considérant que les motifs donnés par un tribunal à l'appui de sa décision ne constituent pas le jugement   que ce qui constitue essentiellement le jugement  c'est le dispositif  Considérant que le dispositif du jugement rendu par le tribunal de Dreux ne fait aucun grief à Lelièvre   177 Lois et Décisions diverses  178  qui n'a pas même été partie à ce jugement   que  sur l'appel qui en a été interjeté par Bouvyer  il n'a été pris  soit par l'appelant  soit par les intimés  aucune conclusion pouvant préjudicier à Lelièvre  que l'arrêt à intervenir sur l'appel  soit qu'il soit confirmatif ou infirmatif  ne pourrait être frappé de tierce opposition par ledit Lelièvre  qu'en conséquence  l'intervention de ce dernier devant la Cour est non recevable aux termes de l'art  466  Cod  proc    Déclare l'intervention de Lelièvre non recevable  etc  ; 21 déc. 1840.;Cour roy. de Paris. ;https://gallica.bnf.fr/ark:/12148/bpt6k5558917f/f88.image;18410113
18410114;89;     Vu les art  5   6  7 10 et 46 de la loi du 10 avr  1810  concernant les mines  laquelle  par les règles qu'elle a établies  a eu pour but de concilier la bonne exploitation des mines qui est d'intérêt public avec le respect dû au droit de propriété    Attendu que l'action qu'ont dirigée soit le sieur vicomte de Lespine  soit les mariés Faure et Preslous  intimés  contre les sieurs Marnier et d'Asda  parties appelantes  action sur laquelle il a été statué en premier ressort par le jugement dont est appel  a pour objet des restitutions et indemnités par eux réclamées à raison des charbons de terre que ceux ci auraient indûment extraits et enlevés dans le tréfonds houiller existant sous la surface de la propriété des intimés  comme aussi à raison des dégradations commises sur celte même surface  le tout par suite des sondes et recherches qui ont eu lieu de la part des appelans dans le tréfonds dont il s'agit    Attendu que s'il s'agissait de sondes et recherches qui  antérieures à toute concession de la mine qu'on peut avoir à exploiter dans ce tréfonds  n'eussent été laites toutefois de la part des appelans qu'avec l'autorisation du gouvernement  conformément à l'art  10 de la loi précitée   en ce cas et suivant l'art  46 de celle même loi  l'autorité administrative aurait été sans nulle difficulté seule compétente pour connaître de la demande des intimés  mais que telle n'est pas du tout la nature du procès  Attendu en effet qu'il n'apparaît aucunement que les appelans eussent requis et obtenu aucune autorisation du gouvernement  pour faire dans le tréfonds existant  sous la surface de ces propriétés  les recherches et travaux dont il s'agit   que c'est seulement le 17 septembre dernier qu'ils ont obtenu une ordonnance royale  laquelle n'étant point une ordonnance de concession  les autorise seulement à poursuivre et ouvrir des travaux de recherche et reconnaissance de mines dans le territoire où sont situées les propriétés des intimés   d'où il suit que les sondes et recherches qu'ils y firent bien antérieurement  sans aucune autorisation préalable et qui ont donné lieu à l'action exercée par les intimés  furent de leur part des voies de fait  à raison desquelles la demande en restitution et en indemnité qui s'y référait  telle que les intimés l'ont formée  devait bien être portée  ainsi qu'elle l'a été devant les tribunaux ordinaires     Attendu dès lors que le déclinatoire proposé par M  le préfet de la Loire  pour que l'affaire dont il s'agit soit renvoyée devant l'autorité administrative  administrative  être déclaré inadmissible   Par ces motifs  sans s'arrêter au déclinatoire proposé par M  le préfet de la Loire  lequel demeure rejeté  dit et prononce que les parties devront contester au fonds devant elle sur l'appel qu'ont interjeté les sieurs Marnier et d'Asda  du jugement rendu parle tribunal de Roanne  le 20 nov  1839  etc  ; 14 janv, 1811. ; Cour roy. de Lyon. ;https://gallica.bnf.fr/ark:/12148/bpt6k5558917f/f89.image;18410114
18410115;89;    Attendu que  d'après la disposition de l'art  111  Cod  civ   lorsqu'un acte contient élection de domicile pour son exécution dans un autre lieu que celui du domicile réel  les significations  demandes et poursuites relatives à cet acte peuvent être faites au domicile convenu et devant le juge de ce domicile     Attendu que l'on ne peut échapper à l'application de cet article  sur le motif qu'il ne s'agit pas de l'exécution de l'acte  mais d'une demande en nullité  formée contre cet acte   car cette demande ne constitue qu'une exception à son exécution     Attendu que l'acte intervenu entre les parties  le 27 août 1827  contient élection de domicile à Montpellier pour son exécution   Qu'il faut  dès lors  reconnaître que le tribunal de Montpellier a été valablement nanti de la demande en nullité de cet acte     Par ces motifs  démet la caisse hypothécaire de son appel  etc  ; 4 janv. 1841.; Cour roy. de Montpellier.;https://gallica.bnf.fr/ark:/12148/bpt6k5558917f/f89.image;18410115
18410116;89;   Considérant qu'il est reconnu entre les parties que  le 13 déc  1828  Grenier  de Paris  avait promis de consentir à Aubin Stanislas Grenier  son frère  le bail de la ferme de Morangles  dans le cas où au commencement de la dernière période de trois ans du bail en vertu duquel il jouissait  il serait en droit de lui faire un bail de ladite propriété   qu'à celte époque  la ferme de Morangles était encore entre les mains de Louis Pesant  oncle des parties   que  par conséquent  l'engagement de Grenier portait sur des biens dépendans d'une succession future    Considérant que la promesse de bail du 8 juill  1830  n'est autre chose  à quelques modifications près  que la convention de 1828  qu'à cette époque  les deux frères n'avaient en vue que des biens qui se trouvaient dans les mains de leur oncle décédé postérieurement    Que  dans celle promesse  Grenier  de Paris  loue à son frère  au fur et mesure qu'il en aura la propriété et jouissance  tous les biens qui lui seront abandonnés par acte de donation et partage que M  Louis Pesant se propose de faire   Que ce bail est fait pour quinze années qui commenceront à courir de l'époque à laquelle Grenier  de Paris  entrera en jouissance des biens qui lui seront donnés par son oncle  179  Lois et Décisions diverses   180  ou qu'il recueillera dans sa succession   Qu'il résulte de là que la promesse de bail porte sur une même généralité de biens  quel que soit le titre en vertu duquel le bailleur en devienne propriétaire   que  par conséquent  la clause qui contient la désignation des biens est indivisible   Considérant que bien que Pesant eût manifesté l'intention de faire une donation à ses neveux  il pouvait décéder avant la réalisation de ce projet  et qu'alors les biens n'arrivaient à Grenier  de Paris  qu'à titre successif    Que d'ailleurs Pesant pouvait acquérir d'autres biens après la donation  et que ceux qui seraient échus à Grenier  de Paris  se seraient trouvés compris dans la promesse   Qu'ainsi  tant à raison de la généralité des objets sur lesquels la promesse de bail portait  que par la fixation de l'entrée en jouissance  cette promesse contient un pacte sur une succession future   Qu'il importe peu que les biens soient arrivés à Grenier  de Paris  par l'effet de la donation et non à titre successif  parce que l'acte  frappé de nullité dès son origine  ne peut devenir valable par l'effet d'un événement postérieur   Confirme   ; 26 déc. 1839.;Cour roy.d' Amiens.;https://gallica.bnf.fr/ark:/12148/bpt6k5558917f/f89.image;18410116
18410117;90;     Attendu qu'en matière criminelle  correctionnelle ou de police  la prescription est absolue et d'ordre public  et que lorsqu'elle est acquise  elle élève un obstacle insurmontable contre l'application de la peine   que dès lors elle doit être suppléée d'office par les Cours et tribunaux     Attendu qu'aux termes des art  637 et 638  Cod  inst  crim   l'action publique et l'action civile  résultant d'un délit de nature à être puni correctionnellement  se prescrivent après trois années révolues  à compter du jour où le délit a été commis  si dans cet intervalle il n'a été fait aucun acte d'instruction ni de poursuite  et que  s'il a été fait dans cet intervalle des actes d'instruction ou de poursuite non suivis de jugement  l'action publique et l'action civile ne se prescrivent qu'après trois années révolues  à compter du dernier acte    Attendu que  lorsque  dans la seconde de ces deux dispositions  le législateur parle d'actes d'instruction ou de poursuite non suivis de jugement  il ne peut avoir en vue que des actes d'instruction ou de poursuite non suivis de jugement de condamnation  parce que  par la disposition de l'art  636  dont les art  637 et 618 ne sont pas la corrélation obligée  il venait de régler le temps de la prescription en ce qui concernait les peines prononcées par les arrêts ou jugemens définitifs ou en pre mier ressort   d'où il résulte nécessairement que  lorsqu'il s'agit d'actes d'instruction ou de poursuite suivis d'un jugement d'acquittement  le temps de la prescription reste fixé à trois années  à compter du dernier acte d'instruction ou de poursuite  Attendu qu'au cas particulier  le jugement dont est appel  en déclarant le procès verbal du 23 juill  1836 insuffisant pour constater  à la charge de Maximin Witz  le délit à raison duquel il se trouvait poursuivi  a purement et simplement renvoyé ledit Witz de l'assignation     Que l'appel de ce jugement  émis par le sous inspecteur des forêts  est du 11 nov  1836  et que depuis lors il n'apparaît d'aucun acte d'instruction ni de poursuite   qu'ainsi la prescription de trois années est acquise au profit de Witz     Par ces motifs  déclare la poursuite éteinte par prescription  etc  ; 29 avril 1840.;Cour roy. de Colmar.;https://gallica.bnf.fr/ark:/12148/bpt6k5558917f/f90.image;18410117
18410119;92;LA COUR    Considérant que l'appelant n'a point traité avec l'intimé  que seulement il prétend que ce dernier est intervenu pour cautionner les obligations du sous entrepreneur  que ce fait est positivement dénié   que le cautionnement est un contrat distinct qui ne se lie pas d'une manière nécessaire aux conventions qui ont pu avoir lieu entre l'appelant et le sous entrepreneur  que s'il est vrai que les effets du cautionnement  à l'occasion d'affaires de commerce  peuvent  lorsqu'il existe ou qu'il est avoué  être appréciés par les juges de commerce  il n'en peut être de même lorsque la contestation s'engage  comme dans l'espèce  par action principale et dans le but de faire reconnaître un cautionnement dont l'existence est contestée  que  dans ce cas  c'est devant les juges ordinaires que la demande doit être portée     Dit qu'il a été bien jugé  mal appelé   ordonne que le jugement dont est appel sortira effet   ; 18 janv. 1840.;Cour roy. de Bourges.;https://gallica.bnf.fr/ark:/12148/bpt6k5558917f/f92.image;18410119
18410120;92;LA COUR     Considérant  en droit  que le caractère constitutif de l'escroquerie définie et réprimée par l'art  406  Cod  pén   est d'avoir fait usage de faux noms ou de fausses qualités  ou d'avoir employé des manoeuvres frauduleuses pour persuader l'existence de fausses entreprises  d'un pouvoir ou d'un crédit imaginaires  ou pour faire naître l'espérance ou la crainte d'un succès  d'un accident ou de tout autre événement chimérique  à l'effet de se faire délivrer des objets appartenant à autrui    Considérant que les faits reconnus constans par les premiers juges ne réunissent pas ces caractères   Qu'en effet  la dépense modique de 1 fr  5 cent  n'a été accompagnée d'aucune circonstance de nature à tromper la femme Leclerc   Que  pour ce qui concerne l'escroquerie au préjudice de la famille Michel  Didiot ne s'est présenté à celte famille que conduit par un intermédiaire  comme étant apte au service militaire  sans faire usage d'aucune manoeuvre frauduleuse   qu'il s'était même assujetti à produire ses papiers   Que les alimens et la faible somme d'argent de 6 fr  qu'il a reçus  lui ont été remis volontairement par celle famille   Qu'il en résulte que les faits imputés à l'appelant ne constituent pas le délit prévu par l'art  405  Cod  pén      Par ces motifs  dit qu'il a été mal jugé par le jugement dont est appel   Emendant et faisant ce que les premiers juges auraient dû faire  renvoie Didiot de l'action correctionnelle intentée contre lui  sans dépens   ; 12 sept. 1840. ; Cour roy. de Bourges. ;https://gallica.bnf.fr/ark:/12148/bpt6k5558917f/f92.image;18410120
18410121;92;LA COUR     Attendu que la loi du 25 ventôse ordonne  sous peine de nullité  que les actes notariés soient reçus par deux notaires  toutes les fois que le notaire rapporteur n'est pas assisté de témoins     Que ces dispositions sont trop claires pour que l'on puisse penser qu'il n'est demandé au notaire en second que de signer l'acte reçu par son collègue    Qu'elles sont trop précises pour qu'en validant un acte qui serait entaché de cette irrégularité  on ne se mît pas en opposition tacite avec la loi   Que c'est vainement que pour le maintenir  on chercherait à s'appuyer sur un usage de tolérance qu'on dirait suffisamment établi    Qu'il n'en est aucun qui puisse abroger les lois  toutes étant par leur nature essentiellement obligatoires     Que s'il en était autrement  il n'y aurait plus rien de certain dans la législation  puisqu'on ne pourrait jamais assez bien reconnaître le moment précis où l'usage invoqué aurait assez de force pour l'emporter sur la disposition législative    Attendu que l'usage dont on voudrait se prévaloir dans l'espèce  n'est pas même généralement suivi  puisqu'il est des notaires qui se sont imposé le devoir de ne jamais faire signer par un de leurs  (1 et 2) La première de ces solutions se trouve déjà dans un précédent arrêt de la Cour de Bourges du 5 mars 1840  que nous rapporte suprà pag  149  en ajoutant quelques observations dans le sens de la doctrine qu'il consacre  mais nous ne saurions ici  quant à la seconde solution  faire valoir les mêmes considérations  Il nous semble qu'il y avait bien dans le deuxiéme fait de la prévention l'un des caractères essentiels de l'escroquerie   manoeuvres frauduleuse  pour faire naître l espérance d'un succès  d'un événement chimérique     L'exiguité du dommage causé doit ici évidemment avoir eu une grande influence sur l'acquittement   185  Lois et Décisions diverses   186  collègues aucun acte sans l'avoir reçu en sa présence   et que tous se soumettent à celle obligation pour quelques actes qu'ils jugent plus importans que les autres     Que dès lors Choppart doit être admis à prouver que le notaire D    n'a point reçu  concurremment avec son collègue D    l'acte reçu par ce dernier  puisque ce fait  s'il était établi  entraînerait la nullité dudit acte  Admet l'inscription de faux  etc  ; 12 janv. 1841.;Cour roy. de Nîmes. ;https://gallica.bnf.fr/ark:/12148/bpt6k5558917f/f92.image;18410121
