id;page;arrêt;date;juridiction;lien;id
18410250;244;LA COUR    En ce qui touche la délibération du conseil de fa(1)  fa(1) arrêt établit une distinction importante entre la peine d'emprisonnement portée par l'art  337  C  pén   contre la femme convaincue du delit d'adultère  et l'emprisonnement  ou plutôt la réclusion  que l'art  308  Cod  civ   enjoint au ministère public de requérir  et aux juges de prononcer contre la femme  lorsqu'elle est séparée de son mari pour cause d'adullère  Dans le premier cas  l'action du ministère public ne peut être mise en mouvement que sur la plainte du mari (Cod  pén   336)  et il dépend de lui par son désistement  d'arrêter la poursuite et d'empêcher l'application de la peine (V  dans notre Collect  nouv   nos observations sur l'arrél de Cass  du 22 août 1816  Vol  5 1 235)  il peut encore après la prononciation de la peine  en empêcher l'effet en consentant à reprendre sa femme (Cod  pén   337)  et la même disposition se retrouve en matière de séparation de corps  dans l'art  309  Cod  civ  Mais résulte t il de là que le mari  demandeur en séparation pour cause d'adultère  puisse empêcher l'application de la peine d'emprisonnement ou de réclusion prononcée par l'art  308  Evidemment non  Evidemment l'action du ministère public ne dépend plus  dans ce cas  de la volonté du mari  le désistement qu'il peut avoir donné lors de la poursuite correctionnelle  ne peut donc enchaîner le ministère public et empêcher la condamnation de la femme par les juges civils  c'est la conséquence nécessaire de la demande en séparation de corps poursuivie par le mari   L  M  Dnv   489 Lois et Décisions diverses  490  mille produite devant la Cour     Considérant que le juge de paix fait partie du conseil de famille  et que la délibération exprimant que le conseil de famille a été unanimement d'avis qu'il y avait lieu de former la demande en séparation de corps  cet avis comprend celui du juge de paix    Considérant  d'ailleurs  que celte délibération n'était pas exigée par la loi pour la validité de la demande du subrogé tuteur   Adoptant au surplus les motifs des premiers juges   Confirme  etc   ; 21 août 1841.;Cour roy. de Paris. ;https://gallica.bnf.fr/ark:/12148/bpt6k5558917f/f244.image;18410250
18410251;245;     Attendu que la juridiction des tribunaux de commerce est exceptionnelle    Que ceux là seulement y sont soumis qui ont la qualité de commerçant  ou qui ont fait des actes commerciaux de leur nature  ou présumés tels par la loi     Attendu que la veuve Hérault n'était pas marchande publique   qu'elle n'a fait personnellement avec les sieurs Pelissot Croué et comp  aucune des opérations spécifiées par l'art  632  Cod  comm   Que  si  par sa lettre datée de Vouvray  le 1er mai 1838  enregistrée  elle a consenti  à titre de garantie pour l'avenir  à cautionner le sieur Dausac  son gendre  pour la somme de 3 600 fr   montant de la dette de celui ci envers le sieur Pelissol Croué  il ne s'ensuit pas qu'elle ait fait un acte de commerce   Qu'en thèse générale  le cautionnement n'est pas lui même de sa nature un engagement commercial et que  dans l'espèce  il ne ressort ni des termes  ni de l'esprit de la lettre prédatée  que la veuve Hérault ait entendu s'obliger commercialement  ni se soumettre à une juridiction qui n'est pas la sienne   Que  de ce que le cautionnement dont il s'agit est l'accessoire d'un engagement commercial  il n'en résulte pas nécessairement qu'il participe de la même nature  et qu'il doive suivre le même sort quant à la juridiction    Qu'en effet  deux parties peuvent s'obliger à la même dette d'une manière différente  l'une commercialement  l'autre civilement  et  dans ce cas  ces obligations doivent être régies par les règles propres à leur nature spéciale  Que vainement aussi on argumente des dispositions de l'art  191  Cod  proc  civ   qui veut que le défendeur en garantie soit tenu de procéder devant le tribunal où la demande originaire est pendante  parce que celte règle  spéciale aux tribunaux civils  qui ont une juridiction universelle  n'est d'ailleurs applicable qu'au cas où l'action en garantie est de même nature que l'action principale  et où le tribunal se trouve compétent  ratione malerioe  à l'égard des deux défendeurs  ce qui n'a pas lieu dans l'espèce   Que  s'il est vrai de dire que des înconvéniens graves peuvent résulter de la division des actions et de la contrariété possible des décisions  ces inconvéniens ne sauraient entrer en balance avec les conséquences bien plus graves encore de la violation de ce principe tutélaire   Que nul ne peut être enlevé à ses juges naturels  Par ces motifs  déclare la juridiction commerciale incompétente pour connaître de l'exécution du cautionnement purement civil de l'appelante  ; 17 juin 1850.;Cour roy. d'Orléans.;https://gallica.bnf.fr/ark:/12148/bpt6k5558917f/f245.image;18410251
18410252;245;    Considérant qu'il est constant que le testament du 21 mai 1818  par lequel Olympe Goubin  femme Bigot  était instituée légataire universelle  avait été révoqué par celui du 20 mai 1820  et que  pour que l'acte révocatoire du 23 juin 1829 l'eût fait revivre   il faudrait au moins qu'il apparût par cet acte même que telle était la volonté de Lemercier Bellengerie    Considérant que l'acte du 23 juin 1829 est complètement muet à cet égard   qu'au contraire  Lemercier  en disant dans cet acte qu'il révoquait purement et simplement le testament du 20 mai 1820  fait en faveur de Anne Jeanne  semblait annoncer que c'était seulement  quant à la libéralité par lui exercée au profit de celte fille  qu'il entendait que l'acte du 20 mai 1820 fût regardé comme non avenu  et non quant à la révocation qu'il avait faite du testament de 1818     Considérant que si Lemercier eût voulu rendre l'existence à ce testament de 1818  il aurait été d'autant plus nécessaire qu'il s'en expliquât  1° qu'il résulte de celui de 1820 que ce n'était pas Olympe Goubin qui venait exclusivement après Anne Jeanne dans l'ordre de ses affections  puisqu'en cas de prédécès de celle ci  il voulait que sa succession passât à tous ses héritiers  moins un   2° qu'AnneJeanne  légataire universelle dans le testament révoqué de 1820   avait été instituée légataire à titre particulier dans celui de 1818  et qu'il devenait au moins très douteux  par le fait même de la révocation de 1829  qu'il voulût lui laisser encore une partie de sa fortune     Infirme le jugement dont est appel   dit que l'acte revocatoire du 23 juin 1829 n'a pas fait revivre le testament du 21 mai 1818   déclare en conséquence la dame Bigot mal fondée à se prétendre légataire universelle de Lemercier Bellengerie  ; 24 avril 1841 .;Cour roy. de Caen. ;https://gallica.bnf.fr/ark:/12148/bpt6k5558917f/f245.image;18410252
18410255;247;    Considérant que Heot  créancier sur les époux Champy pour les dépens d'un procès soutenu à l'occasion des biens de la femme  après avoir infructueusement tenté une saisie mobilière  a dirigé des poursuites à l'effet d'obtenir paiement de sa créance sur les revenus des immeubles de ses débiteurs   mais que ces immeubles ayant été affermés  et le prix des fermages payé d'avance  ni saisie brandon  ni saisie arrêt n'ont pu produire d'effet  que c'est dans cet état de choses  et pour éviter le renouvellement annuel d'un pareil obstacle  que Heot a demandé l'autotisalion de faire bannir aux enchères les biens des époux Champy    Considérant que ceux ci ne font aucune offre qui tende à meure leur créancier à l'abri du danger qu'il signale   que suivant toute apparence ils continueraient à employer tous les moyens propres à rendre ses poursuites illusoires  moyens qu'il ne pourrait faire proscrire qu'à l'aide de nouveaux procès  dans lesquels  malgré la fraude des époux Champy  il pourrait succomber  comme il l'a déjà fait  à l'égard des tiers qui exciperaient de leur bonne foi   qu'en de telles circonstances  la justice serait blessée et la loi convaincue d'impuissance  s'il n'était pas possible de subvenir au créancier  Considérant qu'il ne s'agit pas de savoir si l'on peut admettre d'autres voies d'exécution que celles qui sont indiquées par le Code de procédure civile   que  dans la réalité  la demande de Heot se réduit à l'exercice d'une saisie arrêt  que  seulement  pour assurer l'effet de ce mode légal d'exécution  il réclame une mesure qui n'a pour objet  comme on l'a déjà dit  que de prévenir les fraudes par lesquelles on pourrait y mettre obstacle     Considérant que la loi ne s'oppose pas à l'admission de cette mesure  qu'aux termes de l'art  1166  Cod  civ   les créanciers peuvent exercer tous les droits et actions de leur débiteur  à l'exception de ceux qui sont exclusivement attachés à la personne   qu'en vertu de celte disposition les créanciers peuvent être autorisés à affermer les biens de leur débiteur   que ce droit est même spécialement consacré pour des biens dont le débiteur serait lui même fermier par le n° 1er de l'art  2102  que dans l'espèce les époux Champy  par le fait même des baux qu'ils ont précédemment consentis  ont reconnu qu'il n'était pas de leur intérêt de faire valoir leurs immeubles par eux mêmes  que d'ailleurs il n'est pas douteux qu'un bail fait pour un certain nombre d'années  et dont les fermages seront payables dans les délais d'usage  produira un prix plus élevé que s'il n'était fait que pour un an  et payable par avance  que dès lors les époux Champy n'ont pas de motifs légitimes pour s'opposer à la demande de Heot   Infirme le jugement dont est appel  ordonne que les biens appartenant aux époux Champy seront affermés par bannie et aux enchères  pour neuf années  pour les fermages servir à acquitter en premier ordre les charges grevant Iesdits biens  d'après justification  et ensuite  jusqu'à concurrence de la moitié du surplus (1)  les créances de Heot  en principal  intérêts et frais  etc  ; 29 avr. 1841.;Cour roy. de Caen. ;https://gallica.bnf.fr/ark:/12148/bpt6k5558917f/f247.image;18410255
18410256;247;   Considérant que  par l'acte du 14 oct  1812  Etienne et Henri 3Lahaie s'obligèrent solidairement envers Lefortier au service de la rente de 118 fr  50 c  qui avait été créée en 1739  et constituèrent une hypothèque sur leurs biens pour en garantir le paiement  Considérant que Henri Lahaie oppose à tort l'exception de l'art  2037  Cod  civ   en se fondant sur ce que Lefortier a omis de renouveler en temps utile l'inscription prise sur les biens d'Etienne Lahaye  par suite de l'acte du 14 oct  1812   qu'en supposant que cet article puisse être invoqué par un codébiteur solidaire aussi bien que par la simple caution  l'application n'en doit pas moins être rejetée dans l'espèce actuelle    Considérant que  sous l'ancienne jurisprudence  l'exception cedendarum aclionum n'était admise  conformément à l'opinion de Pothier  que quand c'était par un fait positif de la part du créancier qu'il s'était mis hors d'état de céder ses actions contre l'un de ses débiteurs en déchargeant sa personne ou son bien  ou lorsqu'en laissant donner congé de la demande qu'il avait formée contre lui  il s'était rendu suspect de collusion  mais qu'une simple négligence de sa part à conserver ses hypothèques ne suffisait pas pour le rendre non recevable à agir contre la caution  que l'art  2037  Cod  civ   a clairement exprimé l'intention de maintenir celte distinction  en disant que la caution est déchargée  lorsque la subrogation ne peut plus s'opérer en sa faveur par le fait du créancier    Considérant que cette intention est d'autant plus évidente  que  quand la loi a voulu punir la négligence comme le fait lui même  elle a eu soin de s'en expliquer formellement   qu'ainsi  après avoir dit dans l'art  1382  Cod  civ   que tout fait de l'homme qui cause à autrui un dommage  oblige celui par la faute duquel il est arrivé à le réparer  elle a cru nécessaire de créer une disposition spéciale dans l'art  1383 pour ajouter que  dans ce cas  chacun était responsable non seulement de son fait  mais encore de sa négligence ou de son imprudence   que pareille addition ne se rencontrant pas dans l'art  2037  on doit d'autant moins la suppléer qu'il s'agit d'une déchéance prononcée contre le créancier  et que les déchéances sont de droit étroit   Considérant que l'art  2037  ainsi entendu  est éminemment juste   qu'en effet  lorsqu'il y a fait positif  par exemple  lorsque le créancier a donné mainlevée de l'hypothèque  d'une part la mauvaise volonté de ce dernier est manifeste  et de l'autre la caution n'avait aucun moyen d'empêcher le préjudice qui en résulterait pour elle   mais lorsqu'il n'y a que négligence  simple omission de renouvellement de l'inscription  indépendamment de la moindre gravité de la faute du créancier  la caution en a commis une elle même en ne veillant pas  comme elle en avait le droit et comme son intérêt le lui commandait  à ce renouvellement     Considérant qu'ainsi le texte et l'esprit de la loi concourent à faire repousser l'exception opposée par Henri Lahaye     Infirme le jugement dont est appel   en conséquence  condamne Henri Lahaye  comme débiteur solidaire  au paiement des arrérages  ainsi qu'au remboursement du capital intégral de la renie de 118 fr  50 c  dont il s'agit  etc  ; 3 juill. 1851.;Courroy.de Caen.;https://gallica.bnf.fr/ark:/12148/bpt6k5558917f/f247.image;18410256
18410257;248;  Considérant sur l'appel incident formé par L     sur le barreau  que par un traité en date du 30 mars 1835  L    céda à N     moyennant une somme de 15 000fr   l'office d'avoué qu'il occupait à       et s'obligea à le mettre en possession de son élude aussitôt après sa nomination   mais que par un autre acte portant la date du même jour et qualifié de traité additionnel  il fut stipulé entre le cédant et le cessionnaire  outre les conventions établies dans le traité apparent  une association dont la durée fut fixée à deux ans et qu'ils s'engagèrent à tenir secrète  laquelle avait pour objet  pendant cet espace de temps  le partage par moitié de tous les profits et produits de l'étude   qu'on remarque dans ce dernier acte que pendant l'association l'étude devait continuer d'être exercée au domicile du cédant et qu'à son expiration celui ci s'interdirait toute immixtion dans les fonctions d'avoué par lui cédées   Considérant que la loi du 28 avr  1816  en autorisant par son art  91 les fonctionnaires qui y sont désignés à présenter des successeurs à l'agrément du roi ne leur a point conféré un droit de propriété absolu sur leurs offices   que le gouvernement  auquel appartient la nomination aux emplois publics  a incontestablement le droit d'admettre ou de rejeter les candidats présentés s'ils ne réunissent pas les qualités d'idonéité et de probité qui seules peuvent garantir à la société l'exact accomplissement de leurs devoirs  comme de s'assurer si les traités passés entre les parties intéressées ne contiennent pas des conditions trop onéreuses et pouvant avoir pour effet de nuire à l'intérêt général en mettant les nouveaux titulaires dans le cas de manquer aux principes de délicatesse et d'honneur qui doivent être la règle de leur conduite   que par conséquent tout traité occulte ayant pour objet de dérober un supplément de prix au juste et légitime contrôle du gouvernement  est nul comme contenant des conventions illicites et contraires à l'ordre public  que d'un autre côté une association formée pour l'exercice de fonctions publiques constitue une grave atteinte à la loi et à la morale  que ces fonctions sont du domaine public  qu'elles sont inhérentes à la personne  qu'elles confèrent à celui qui en est revêtu un caractère qui n'esl susceptible ni de participation ni de partage   que l'ordre public et l'intérêt de la société exigent donc que de pareilles stipulations soient formellement interdites   Considérant que l'association formée entre L    et N    par le traité secret du 30 mars 1835 contenait évidemment pour le premier le droit de participer avec son cessionnaire à l'exercice des fonctions d'officier ministériel  puisque par une clause expresse de cet acte il s'engage à ne plus s'immiscer dans ces fonctions à l'expiration du terme qui avait été fixé par les parties  que celte convention  outre qu'elle contenait une violation flagrante des obligations imposées aux officiers ministériels par les lois et règlemens  a eu par la manière dont elle a été exécutée des résultats essentiellement préjudiciables au public   qu'en effet les produits de l'étude que le cédant lui même reconnaissait  en fév  1835  n'atteindre que le chiffre de 4 000 fr   ont été portés pendant les deux années de l'exploitation des deux associés à la somme de 14 539 fr  94 c  ce qui doublait à peu de chose près le revenu de l'office  que celle augmentation de produits était due  comme il résulte des documens de la cause  à l'exagération des mémoires et par conséquent à des perceptions illicites  que l'association dont il s'agit  également contraire à la morale et à l'ordre public  est encore en opposition avec les lois spéciales relatives à la profession d'avoué  qu'en effet   d'après la loi du 27 vent  an 8  ces officiers ont exclusivement le droit de prendre des conclusions devant les tribunaux pour lesquels ils sont établis   que le fait de postulation a été dans tous les temps réprimé par des peines sévères  qui ont été renouvelées par les dispositions du décret du 19 juill  1810  et que l'infraction commise par les parties à ces dispositions aggrave encore l'atteinte qu'ils ont portée à l'intérêt social par des stipulations aussi illicites qu'immorales   Par ces motifs  etc   ; 28 août 1851.;Cour roy. de Rennes.;https://gallica.bnf.fr/ark:/12148/bpt6k5558917f/f248.image;18410257
