id;page;arrêt;date;juridiction;lien;id
18152225;312;LA COUR    Prononçant sur les fins de non recevoir proposées par la défenderesse    Attendu sur la première   que le maire de Chevigney avait couvert par son intervention dans l'instance en cassation   l'irrégularité de la procédure instruite en cette Cour sous le nom collectif des habitans de cette commune  laquelle intervention avait rempli suffisamment le dispositif et le voeu de l'art  1er  de la loi du 29 vendémiaire an 5   et de l'art  19 de celle du 28 pluviose an 8   Attendu sur la seconde   que la veuve Dosnier ayant comparu et défendu au fond sur l'assignation qui lui avait été signifiée à personne ou domicile   ensuite de l'admission du pourvoi  elle avait au moins tacitement reconnu la régularité de ladite assignation  et renoncé à se prévaloir du vice de forme qu'elle faisait résulter de ce qu'ayant toujours paru au procès sous la double qualité de femme commune en biens avec son mari   et de mère tutrice de ses enfans mineurs  elle n'avait reçu qu'une seule copie d'assignation  au lieu de deux qu'elle aurait dû recevoir   Attendu sur 7a troisième   que l'empêchement de {ait résultant de l'invasion par les armées ennemies  de  la contrée dans laquelle étaient domiciliées les parties   avait formé obstacle à ce qu'elles pussent être assignées dans les délais du règlement  que cet obstacle de fait se trouve légalement constaté par le certificat du président du tribunal civil de Gray et du sous préfet de cet arrondissement  produit au procès   Par ces considérations   la Cour rejette les trois fins de non recevoir proposées par la défenderesse  etc   ; 21 juin 1815. ; Cour de cassation. ;https://gallica.bnf.fr/ark:/12148/bpt6k58074274/f312.image;18152225
18152226;314;"LA COUR     Vu l'art 16 du Cod  de proc  civile   ainsi conçu   "" L'appel des jugemens de la justice de paix » ne sera pas recevable après les trois mois   à dater du » jour de la signification faite par l'huissier de la justice » de paix  ou tel autre commis par le juge  ""  Et l'art  443 du même Code   portant   "" Le délai » pour interjeter appel     courra      pour les juge» mens par défaut  du jour où l'opposition ne sera » plus recevable  »  Attendu que l'art  16 du Code de procédure ci dessus cité   autorise suffisamment l'appel des jugemens rendus par défaut dans les justices de paix   par cela seul qu'en déterminant le délai après lequel l'appel des jugemens des juges de paix ne sera plus recevable  il ne fait aucune distinction entre les jugemens contradictoires et les jugemens par défaut    Attendu d'ailleurs que l'article 443 du même Code (applicable aux tribunaux civils   comme aux tribunaux d'appel de justice de paix ) achève de mettre dans tout son jour la pensée du législateur lorsqu'il énonce  sans aucune restriction   que le délai de l'appel des jugemens par défaut courra à compter du jour où l'opposition ne sera plus recevable    Qu'ainsi le tribunal civil de Baïonne a expressément violé les dispositions desdits articles 16 et 443 du Code de procédure  en déclarant le sieur Chegaray non recevable dans son appel    La Cour casse et annulle le jugement rendu par le tribunal civil de Baïonne   le 8 septembre 1813   etc   "; 8 août 1815. ; Cour de cassation. ;https://gallica.bnf.fr/ark:/12148/bpt6k58074274/f314.image;18152226
18152227;315;LA COUR     Attendu que la vente publique à l'encan rend l'adjudicataire vrai propriétaire des effets à lui adjugés  sans qu'on puisse former contre lui l'action en revendication   qu'ainsi la circonstance que l'on n'a pas laissé à la partie saisie les bestiaux désignés par l'ordonnance   ne rend pas nulle la vente des effets du saisi  mais peut seulement donner lieu à des dommages intérêts   qui  dans le fait  lui ont été accordés par le jugement dénoncé     que d'ailleurs l'art  14 du titre 33 de l'ordonn  de 1667 doit être entendu dans son véritable but   celui de laisser au saisi un moyen de subvenir à sa pauvreté   mais jamais le voeu de la loi ne peut s'appliquer au demandeur en cassation     Rejette   etc   ; Ier. thermidor an 11. ; Cour de cassation.;https://gallica.bnf.fr/ark:/12148/bpt6k58074274/f315.image;18152227
18152228;315;     Considérant que tout ce qui a été fait et dit par les quatorze communes avant qu'elles eussent été autorisées  est nul  et n'a pas pu les lier d'aucune manière   etc      ; 11 janvier 1809.; Cour de cassation. ;https://gallica.bnf.fr/ark:/12148/bpt6k58074274/f315.image;18152228
18152229;316;LA COUR    Sur les conclusions de M  Pons  avocat général    Vu les pièces du procès et le mémoire présenté par le condamné à l'appui de son pourvoi    Considérant   sur le premier moyen   que la qualité de légionnaire dont un citoyen a été revêtu par le chef de l'état   ne forme point d'obstacle à ce qu'il soit condamné aux paines portées par la loi contre les crimes dont il aurait été convaincu   que l'arrêté du gouvernement du 24 ventôse an 12   ordonne seulement qu'en cas de condamnation à une peine infamante  le légionnaire sera dégradé avant l'exécution   et que la formule en sera prononcée par le président immédiatement après le jugement   mais que l'omission de cette formalité ne rend point nul l'arrêt ou le jugement de condamnation    Considérant  sur le deuxième moyen  qu'aucune loi ne déclare nulles les poursuites et procédures qui seraient faites  en matière criminelle  les jours de fêtes et dimanches    Rejette  etc   ; 14 avril 1815. ;Cour de cassation. ;https://gallica.bnf.fr/ark:/12148/bpt6k58074274/f316.image;18152229
18152230;317;LA COUR   Attendu que le réclamant n'a fait ni pu faire aucun reproche à Cabaud   son remplaçant  qui a fourni son service effectif  et couru tous les dangers de sa position   que le réclamant n'a rien stipulé pour le cas survenu  et n'a pu réclamer que des indemnités pour les pertes par lui faites   ce qu'il a obtenu par l'arrêt attaqué   qu'il suit donc que les articles invoqués sont sans application à l'espèce   et n'ont pu être violés  ne s'agissant au fond que du montant des indemnités à régler     Rejette  etc   ; 9 mai 1815. ; Section des requêtes. ;https://gallica.bnf.fr/ark:/12148/bpt6k58074274/f317.image;18152230
18152231;318;"LA COUR   Sur les conclusions de M  Pons   avocat général    Attendu que si  lorsqu'une action qualifiée crime par la loi a été commise avec discernement par un individu âgé de moins de quinze ans   la peine afflictive et infamante que cet individu avait encourue est réduite à une peine correctionnelle  ce changement dans la nature de la peine  n'est pas l'effet d'un changement dans la nature de l'action  qui ne cesse pas d'être criminelle  et qu'il a lieu uniquement par égard pour le jeune âge du coupable   que cette indulgence qui lui est personnelle   puisqu'elle est accordée à son âge   ne saurait donc être invoquée par son complice  que si l'art  59 du Code pénal dit que "" les complices d'un crime ou d'un délit   seront punis de la même peine que les auteurs mêmes de ce crime ou de ce délit  » il ajoute néanmoins   « sauf les cas où la loi en aurait disposé autrement ""   et que l'un de ces cas est nécessairement celui où l'auteur et le complice d'un crime sont âgés l'un de moins   l'autre de plus de seize ans   puisqu'ils ne pourraient être soumis l'un et l'autre à la même peine sans qu'il y eût violation ou de l'article 67 du Code pénal  ou des divers articles du même Code qui ne prononcent des peines correctionnelles que contre les délits   et punissent les crimes de peines afflictives et infamantes   qu'ainsi   lors même que dans l'espèce  Cartin fils aurait été déclaré l'auteur du vol  et qu'il l'aurait commis n'étant âgé que de moins de quinze ans  Cartin père   déclaré complice par recelé du vol  qui est le vol de l'article 388 du Code pénal   n'en aurait pas moins été légalement condamné à la peine déterminée par cet article   mais que Cartin fils  décédé en prison long temps avant le jugement du procès   n'a pu être et n'a point été déclaré coupable   et que le jury s'est borné à déclarer le vol constant  sans pouvoir en nommer l'auteur   qu'il est de principe que   pour qu'un complice soit poursuivi et puni de la peine prononcée par la loi contre l'auteur même du crime   il n'est pas nécessaire qu'il y ait eu condamnation ni poursuite contre ce dernier   qu'il suffit que le fait matériel du crime existe   que ce fait matériel du crime soit reconnu et jugé avec celui qui est accusé d'en avoir été le complice   et que les faits de complicité aient un caractère moral criminel   que ces circonstances se trouvent réunies  puisque le fait matériel du vol est déclaré constant par le jury et que Cartin père est déclaré coupable d'avoir recelé sciemment les objets voles   la condamnation dudit Cartin aux peines de l'article 388 du Code rénal a dû être prononcée  et que   sous aucun rapport   l'arrêt attaqué n'est susceptible de censure     Rejette   ect   "; 21 avril 1815. ; Cour de cassation. ;https://gallica.bnf.fr/ark:/12148/bpt6k58074274/f318.image;18152231
18152232;321;LA COUR     Attendu   sur le premier moyen   que s'il est vrai que les lois antérieures à celle du 2 octobre 1789   détendaient aux prêteurs de stipuler des intérêts pour les simples prêts   il est vrai aussi qu'aucune de ces lois n'empêchait le débiteur de payer volontairement les intérêts qui n'avaient point été stipulés   et au paiement desquels le débiteur ne pouvait nullement être  contraint  et que l'ayant ainsi jugé  l'arrêt attaqué n'a point violé lesdites lois    Sur le second moyen   Attendu qu'il est reconnu en fait  que les intérêts dont il s'agit dans ce mayen étaient des avances qu'un mandataire avait faites au profit de ses mandans    Et attendu   en droit  que les lois en vigueur après celle du 2 octobre 1789   accordaient elles mêmes les intérêts de ces avances    Attendu   au surplus  qu'il a été également reconnu  en fait   que la stipulation au moins faite de ces intérêts résultait des faits et circonstances du procès   et particulièrement des comptes passés entre les parties    Rejette  etc   ; 6 avril 1815. ; Cour de cassation. ;https://gallica.bnf.fr/ark:/12148/bpt6k58074274/f321.image;18152232
18152233;322;LA COUR     Attendu qu'il s'agissait d'une saisie et vente de meubles garnissant une maison louée   et pour loyers dus   que lesdites saisie et vente ont été légalement consommées et le prix reçu en paiement  sans intervention   opposition ou réclamations des autres créanciers du débiteur saisi   et sans que dès lors il existàt des actes  protêts ou plaintes de faillite   ainsi qu'il a été reconnu par l'arrêt dénoncé  que si par la suite   et plusieurs mois après que le tout a été terminé  les autres créanciers se sont réunis et ont obtenu un jugement le 22 mai 1810   qui a déclaré la faillite   et en a reporté l'ouverture à la date de la saisie et vente en septembre 1809   le jugement n'a pu avoir l'effet d'anéantir tout ce qui aurait été alors consommé en exécution et conformément à la loi   que la Cour d'appel  qui n'a découvert aucun caractère de fraude dans lesdits actes ainsi consommés   et qui a déclaré les syndics de la faillite Moreau seulement fondés   dans l'espèce  à exiger et recevoir le compte offert du produit de la vente  sous la déduction des loyers légitimement dus et frais faits régulièrement pour parvenir au paiement   n' a nullement violé   ni l'autorité de la chose jugée par le jugement du 22 août 1810   ni contrevenu aux dispositions des articles 501 et suivans du Code de commerce   ladite Cour ayant réservé aux syndics tous débats   contredits  recharges audit compte par tous moyens de droit    Rejette  etc   ; 16 mai 1815. ; Cour de cassation.;https://gallica.bnf.fr/ark:/12148/bpt6k58074274/f322.image;18152233
18152234;323;LA COUR    Vu les pièces du procès et le mémoire présenté par le condamné à l'appui de son pourvoi    Considérant que l'article 317 du Code d'instruction criminelle n'attache pas indistinctement la peine de  nullité à l'inobservation de chacune de ses dispositions  mais seulement à l'inobservation de celle qui prescrit la formalité du serment qui doit être prêté par les témoins   d'où il suit que le défaut d'entendre oralement les témoins   ne peut  aux termes de l'art  408 dudit Code   donner ouverture à cassation   qu'il s'ensuit  par une conséquence ultérieure  que la fausse application de la loi du 18 prairial an 2   qui   dans cette circonstance   aurait été faite par la Cour d'assises   ne saurait plus servir de base à l'arrêt dénoncé    Rejette  etc   ; 14 avril 1815. ;Cour de cassation. ;https://gallica.bnf.fr/ark:/12148/bpt6k58074274/f323.image;18152234
18152235;323;LA COUR     Vu l'art  410 du Code d'instruction criminelle  qui autorise l'annullation des arrêts des Cours d'assises qui contiennent fausse application des lois pénales    Considérant que la déclaration du jury ne peut servir de base à une condamnation que lorsqu'elle contient l'affirmation claire et précise d'un fait punissable d'après les lois pénales   que   dans l'espèce  il a été proposé au jury   conformément au résumé de l'acte d'accusation    318  Jurisprudence  la question suivante ( voyez ci dessus )   qu'au lieu de répondre catégoriquement à cette question   comme le lui prescrivait l'article 345 du Code d'instruction criminelle   le jury a déclaré que l'accusé était coupable de l'homicide commis volontairement et avec préméditation   en ajoutant ( ce qui ne lui était pas demandé )   que l'accusé avait coopéré audit homicide   en fournissant à son mari les moyens nécessaires à sa destruction   que de cette réponse   qui caractérisait dans le même l'ait tout à la fois le crime d'assassinat et la complicité d'un fait de suicide qui n'est puni par aucune loi pénale   il résultait une contradiction qui ne laissait plus d'élémens pour asseoir un arrêt  soit de condamnation  soit d'absolution   que la Cour d'assises   au lieu d'annuller cette déclaration irrégulière et de renvoyer les jurés dans leur chambre pour en faire une nouvelle   a laissé subsister ladite déclaration   et l'a prise pour base de la condamnation à la peine capitale qu'elle a prononcée contre l'accusée   que cette condamnation contient donc une fausse application des lois pénales    Casse  etc   ; 27 avril 1815.;Section criminelle.;https://gallica.bnf.fr/ark:/12148/bpt6k58074274/f323.image;18152235
18152236;325;LA COUR   Considérant que   d'après l'art  31 de la loi du 22 frimaire an 7  les droits d'enregistrement des actes civils et judiciaires ne doivent être supportés que par les personnes auxquelles ces actes profitent  que  dans l'espèce  la sommation dirigée par Denizart contre Leloup a eu pour unique objet la remise d'un écrit sous seing privé unilatéral   confié par Denizart à Leloup   que Denizart n'a élevé aucune prétention sur aucune somme déposée  et n'en a même fait aucune mention dans sa sommation  qu'il a même  au contraire  formellement refusé d'accepter les offres réelles des sommes dont Leloup a prétendu être dépositaire  que les créances de Denizart ont été établies par des titres authentiques dûment enregistrés   que par conséquent la réponse de Leloup n'a rien ajouté à la sûreté des créances de Denizart  que cette réponse  qui a été un fait personnel à Leloup  et dont Denizart a formellement refusé de tirer avantage   n'a pu rendre Denizart passible du paiement du droit auquel il n'a nullement donné lieu     Rejette  etc   ; 2 mai 1815, ; Cour de cassation ;https://gallica.bnf.fr/ark:/12148/bpt6k58074274/f325.image;18152236
18152238;333;LA COUR     Attendu que sous l'empire du Code civil comme sous l'ancienne législation   dont il n'a fait qu'adopter les bases  la tutelle n'est instituée que dans l'intérêt du mineur   et que s'il s'élève quelque doute sur ce qui est le plus avantageux au mineur  la loi permet de recourir au magistrat   qui  328  Jurisprudence  consulte la famille et prononce ensuite selon sa conscience et ses lumières    Attendu que dans l'espèce   l'arrêt attaqué n'a fait qu'appliquer ces principes   et qu'en ordonnant que la famille serait consultée sur ce qui pourrait être commandé par l'intérêt du mineur   pour être ensuite fait droit   il ne s'est mis en opposition avec aucune des dispositions du Code civil  et n'a point violé l'art  450 de ce Code    La Cour rejette le pourvoi   etc   ; S août 1815. ; Cour de cassation. ;https://gallica.bnf.fr/ark:/12148/bpt6k58074274/f333.image;18152238
18152240;340;LA COUR     Sur les conclusions de M  Joubert  avocat général    Attendu que l'art  17 de la loi du 23 frimaire an 7 ne détermine pas d'une manière précise les bases que les experts doivent suivie dans leurs évaluations   d'où il suit qu'ils peuvent choisir celles que leurs lumières et leur conscience leur suggèrent  sauf au juge à les apprécier    Attendu qu'il est vrai qu'aux termes des art  322 et 323 du Code de procédure   les juges s ne sont point astreints à suivre l'avis des experts   si leur corviction s'y oppose   et qu'ils peuvent   dans ce cas   ordonner une nouvelle expertise   mais que   dans l'espèce  le tribunal de Mirecourt a déclaré rue la première enquête éclaircissait suffisamment sa religion  et lui fournissait tous les renseignements nécessaires pour qu'il pût prononcer en connaissance de cause    Rejette  etc   ; 6 avril 1815.; Cour de cassation. ;https://gallica.bnf.fr/ark:/12148/bpt6k58074274/f340.image;18152240
18152241;342;LA COUR    Sur les conclusions de M  Joubert   avocat général   et après qu'il en a été délibéré en conformité de l'arrêt du 20 de ce mois    Considérant qu'aux termes du tit  1er    liv  2 du Code civil  de la distinction des biens  les biens sont meubles et immeubles   suivent leur nature ou leur destination  que d'après cette définition   la vente d'une coupe de bois taillis étant de sa nature et suivant sa destination  une vente d'objets mobiliers  l'art  1622 du Code civil   seulement relatif aux ventes d'immeubles  n'avait point d'application à l'espèce    Rejette   etc   ; 24 mai 1815. ; Cour de cassation.;https://gallica.bnf.fr/ark:/12148/bpt6k58074274/f342.image;18152241
18152242;346;LA COUR     Considérant que  par le contrat sons seing privé du 16 octobre 1807   les mariés Picton hypothéquèrent spécialement  au profit de Louis Pierre Agis de Saint Denis  pour sûreté des engagemens pris dans ce contrat  le domaine du Billot    Que les mariés Picton s'obligèrent en outre à déposer ce contrat devant notaire   à leurs frais  et à délivrer une grosse exécutoire audit Agis de Saint Denis    Qu'en exécution de cette obligation   les mariés Picton firent en effet le dépôt dudit bail devant notaire  à Evreux  le 2 octobre 1808    Que   par ce dépôt fait par les débiteurs devant notaire  en exécution de ladite obligation  ledit contrat sous seing privé est authentique    Qu'à compter du jour de cette reconnaissance et dadépôt  l'hypothèque convenue a été légalement constituée   puisque l'acte déposé et l'acte du dépôt dressé par le notaire  se sont identifiés  et n'ont plus formé qu'un seul et même acte    Qu'en le décidant ainsi  la Cour  dont l'arrêt es» attaqué  bien loin d'avoir viole l'article 21 27 du Code  De la Cour de Cassation   341  civil  en a fait au contraire une juste application     Rejette le pourvoi  etc   ; il juillet 1815. ; Cour de cassation. ;https://gallica.bnf.fr/ark:/12148/bpt6k58074274/f346.image;18152242
18152243;349;LA COUR     Sur les conclusions de M  Thuriot  avocat général    Attendu   sur le moyen présenté par le réclamant  que l'article 339 du Code d'instruction criminelle  qu'il invoque   n'est pas prescrit à peine dp nullité   que l'article 408 du même Code n'impose à la Cour de cassation le devoir d'annuller les arrêts pour inobservation des formes  non prescrites à peine de nullité   que dans les cas où il a été omis ou refusé de prononcer sur une ou plusieurs demandes de l'accusé   tendant à user d'une faculté ou d'un droit accordé par la loi   qu'à la vérité le réclamant a fait une demande de cette espèce   mais que fa Cour d'assises a formellement prononcé sur celle demande  comme il est constaté parle procès verbal des débats   qu'en déclarant que le fait d'excuse proposé no résultait pas des débats   cette Cour a usé d'un droit qui lui est implicitement accordé par la combinaison des articles 339 et 408 du Code d'instruction criminelle    Attendu que d'ailleurs la procédure est régulière   et qu'aux faits déclarés constans la peine a été bien appliquée    Rejette   etc   ; 2 février 1815. ; Cour de cassation. ;https://gallica.bnf.fr/ark:/12148/bpt6k58074274/f349.image;18152243
18152244;350;LA COUR    Sur les conclusions de M  Jourde avocat général    Vu les articles 61 et 64 de la loi du 22 frumaire an 7    Attendu qu'il résulte de l'ensemble des dispositions de cet article 64  que  pour la perception des droits d'enregistrement  c'est la contrainte signifiée au redevable qui établit le commencement des poursuites  et l'opposition motivée et signifiée à la Régie  avec assignation devant les juges compétens qui constitue l'instance   d'où il suit que le tribuna l de Novi  en jugeant qu'une semblable opposition n'était pas l'instance ment tionnée en l'art  61 de la loi du 22 frimaire an 7  a faussement appliqué cet article 61  et violé l'article 64 de la même loi    Casse  etc   « ; 27, juillet 1813. ; Cour de cassation. ;https://gallica.bnf.fr/ark:/12148/bpt6k58074274/f350.image;18152244
18152245;352;LA COUR     Attendu que l'art  323 du Code de procédure civile n'autorise les tribunaux à s'écarter de l'avis des experts que lorsqu'ils ont la conviction personnelle que les experts se sont trompés  et que  dans l'espèce  la Cour de Douai  qui a fait prévaloir l'opinion solitaire d'un des experts  n'a pas déclaré qu'elle se décidait d'après sa propre conviction   mais seulement sur ce que l'expert  dont elle adoptait l'opinion   semblait rendre la question incertaine    Casse  etc   ; 7 août 1815. ; Cour de cassation. ;https://gallica.bnf.fr/ark:/12148/bpt6k58074274/f352.image;18152245
18152246;354;LA COUR     Attendu que Marie Pétronille Mesmacker était sous la puissance de Jacques Vandercolme son mari  lorsque les défendeurs la firent citer pour plaider sur leur appel  et qu'elle y a procédé sans avoir été autorisée de son mari ni de la justice    Casse etc   ; 7 août 1815.; Cour de cassation. ;https://gallica.bnf.fr/ark:/12148/bpt6k58074274/f354.image;18152246
18152247;355;LA COUR     Sur les conclusions de M  Jourde   avocat général    Attendu   en droit  que si la loi du 11 brumaire an 7  articles 4 et 17   n°  5   exige que la constitution et l'inscription de l'hypothèque indiquent   entre autres choses   l'espèce et la situation des Liens hypothéqués    elle ne prescrit nulle part des formalités sacramentelles sans lesquelles ladite indication ne puisse être faite    Attendu   en fait   que la constitution et l'inscription de l'hypothèque faites par Beaudoin  portaient sur « son bien de Baudoin  composé de deux domaines et » une réserve situe's au lieu de Baudoin   commune de » Lorey de Harleix  canton de Jumiliac   arrondisse» ment du bureau des hypothèques de Nontron   dé» partement de la Dordogne »   qu'ainsi   en décidant que les constitution et inscription d'hypothèque  eu égard à l'acception du mot bien reçue dans la contrée   renfermaient l'indication de l'espèce et de la situation des biens hypothéqués voulue par la loi  l'arrêt attaqué n'a point violé les articles 4 et 17 de la loi invoqués par les demandeurs    Attendu  au surplus  qu'en effet personne  dans l'espèce   ne se plaint d'avoir été induit en erreur par les termes de la constitution et de l'inscription de l'hypothèque en question     Rejette   ; 15 juin 1815. ; Cour de cassation.;https://gallica.bnf.fr/ark:/12148/bpt6k58074274/f355.image;18152247
