id;page;arrêt;date;juridiction;lien;id
1822181;270;"  ■ ■ Attendu   en fait  que Pierre Devoise c élant décédé le ier  août 1793  Françoise Garelon  son c épouse  devint  par ce décès   tulrice'légale de ses en  1 fans mineurs  Sylvaine  Devoise el Léonard Devoise  i celui ci né le i5 février 1786  que le 24 pluviôse an 4 J ladile Garelon ayant fait faire un inventaire des meubles' 1 el effets des susdits mineurs  Pierre Bicrgeou y figura  1 en se qualifiant de cotuteur  el se chargea du montant 1 dudit inventaire   que ledit  Biergeon élanl devenu le 1 lendemain  25 pluviôse   l'époux de Françoise Gare  ] ton  exerça  de concert avec elle   la tutelle desdits ' mineurs  que ladite Garelon étant décedée avant la 1 majorité do Léonard Devoise   ledit Pierre Biergeon se perpétua dans ladite lulelle  jusqu'à lamajorilé des mineurs  qu'il n'a jamais rendu aucun compte à Léonard Devoise   et que cependant celui ci l'institua son héritier par son testament  en date du 4 octobre 1808  epui fut suivi de son départ pour l'armée   et de son absence depuis 1809   Attendu  endroit  cpie la tutelle dudit Léonard Devoise s'élant ouverte sous l'empire de l'ancienne lég'slation   c'est l'ancienne législation qui a fixé la qualité des parties et leur condition respective    Attendu cjue l'ancienne législation frappait de nullité   non seulçmenl toute disjiosilioii testamentaire faite en faveur d'un tuteur  dont le compte n'était pas apuré  mais encore toute disposition de ce genre en faveur d'un administrateur comptable des biens d'un mineur   qui n'avait pas encore rendu son compte   '  Attendu que  de là   il suit que le testament fait par ]LéonardDevoisc eu faveur de Pierre Biergeon  ne peut produire aucun effet   Attendu encore cpie   sous l'empire du Gode civil  le résultat serait le même   Françoise Garelon   ""mère de Léonard Devoise   devait en effet  lorsqu'elle voulut épouser Pierre Biergeon    convoquer  avant son mariage   en se conformant à l'article 39 5 de ce Code   le ""conseil de famille  pour lui faire décider si la lulelle de ses enfans mineurs lui serait conservée  et dans le cas de l'affirmative 'son second mari'devcnait nécessairement son cotuteur   auxterrnes ele l'ail  3g6  Elle nc fil point  celte convocation   et dès lors elle perdit de plein droit la tulelle   d'après l'art  3g5   mais en la  perdant de droit  elle la conserva réellement de fait  bien qu'indûment   étal de choses admis aussi par cet  article   et par cela seul   son mari aurait été solielairemenl responsable des suites ele cette tutelle   mais  non seulement le mari fut alors cotuteur de ""fait   durant l'intervalle cpii s'est  écoulé de la mort de Fran çoise Gareton à la majorité de Léonard Devoise  il   a aussi indûment conservé  et SUT sa seule tête   la tutelle dudit Léonard  Or suivant l'art  907 du Code civil  le mineur devenu majeur ne peul disposer au profil de celui qui a été  son tutciir  qu'après que le compte  définitif a élé préalablement rendu et apuré  et Pierre Biergeon peut il prétendre   avec quelque l'o■idemeut   qu'il n'est pas dans le cas et'cxclusion prononcée par la loi '  Si   en se conformant au Code civil  sa femme eût élé nommée tutrice  il devenaitcoluteur  eldès lors ii était exclu  dans le cas où il se trouve   de la succession de Léonard Devoise   car l'exclusion embrasse nécessairement le coluteur comme le tuteur  la colntelle ein nl wdivisiJ^e de la tutelle  Sa  femme el lui oui enfreint  la loi qui leur imposait l'obligation de donner im tuteur légal au mineur  Lui attribuer à lui  gérant de cette lulelle indûment conservée   un avantage cpie  le tuteur légal n'aurait pas eu  ce serait admettre que l'infraction à la loi peut tourner à l'avantage de celui qui se la permet  conséquence repoussée par la raison et lesprincipes de la justice   el dont le vice rnel en évidence celui ele la prélenlion do Biergeon   Attendu de plus   epio le motif pour lequel le législateur a voulu que le mineur   devenu majeur   ne pût disjioscr'en faveur de son tuteur  avant que le compte définitif fût rendu et apuré   c'est que  jusqu'alors   il est dans la dépendauce de ce tuteur   qui  encore possesseur de toute sa fortune   peut user envers lui du movens de caplulion   d'influence  cl même de eontramte   or   ces movens élanl les mômes pour _celui qui a élé tuteur indu   cpie pour celui ejui a été tuteur légal  la raison d'exclusion doit êlie la même pour l'un el pour l'antre j  D'où il faut conclure erïie  quand même la cause devrait être jugée par les dispositions du Code civil   le testament de Léonard Devoise ne pourrait non plus produire aucun effet   Tvlol l'ajipel an néant   ordonne   en conséquence   que ce dont est appel sortira son plein cl entier effet   condamne l'appelant en l'amende  cl aux eléjiens   "; 4 mars 1822. ; Cour royale de Limoges.;https://gallica.bnf.fr/ark:/12148/bpt6k5737538v/f270.image;1822181
1822182;273;    Adoptant les motifs du jugemenldonl est appel  ordonne qu'il sera exécuté suivant sa forme et teneur  ; 10 mai 1822.;Cour royale de Bordeaux.;https://gallica.bnf.fr/ark:/12148/bpt6k5737538v/f273.image;1822182
1822183;284;"  Attendu que toute institution contractuelle doit êlre régiejjar la loi existante au jour duconlrat  à quelque époque et sous quelque législation que soil survenu le décès de l'instituant  parce que l'inslilulion contractuelle   conférant immédiatement à l'institué un droit irrévocable sur la succession de l'instituant  constitue  dès le moment même de l'institution  un contrat parfait  auquel on  ne pourrait apjiliquer la disposition d'une législation jiosiérieure  sans lui donner un effet rétroactif  que ce jirincijic a déjà reçu la sanction de la Cour  par un arrêl du 19 août 181S  confirmé par arrêt de la Cour de cassation  en date du iet  juin 1820  tous deux rapportés par Sirey  tom  21   première jiartie  jjage 3o   que l'institution contractuelle   à litre universel  en faveur de l'épouse Pélissier  a élé faite le 12 jiluviose an 5   sous l'emjsire des lois du 17 nivôse et 22 venlose an 2 quiprohib'aienitouleslesdisposiiions universelles  elque conséquenimenl il y a lieu d'en prononcer la nullité  quoique l'instituant ne soit décédé quejjoslérieuremenl à la promulgation du Code civil   Attendu que pour régler les effets d'un testament  il importededislinguer trois choses   la forme de l'acte  la capacité de tester elle fond même de la disposition  ejue relativement à la forme extérieure el jmremeul probante  c'est un jirincipe constant que le testament doit être revêtu des lorinalilés jsrescriles ]3ar la loi en ■vigueur au jour de sa confection  que relativement à la  capacité de tester  il y a généralement deux éjioqucs à considérer  celle de la confection du testament  et celle du décès du testateur  que relativement enfin au fond de la disposition   comme pendant toute la vie du testateur  il n'est qu'un simple projet  révocable à chaque instant  qui ne se réalise et ne se confirme qu'au moment de son décès (par la raison que leteslateur  11'ayanl jjoiut manifesté d'intention contraire  esl censé   lui avoir imprimé alors le sceau de sa dernière  et que n'ayant point révoqué sa première disposition  il esl jjrésuroé ne l'av oir faite réellement qu'au moment 'qui précède immédiatement son décès ) 'le sort de cette 1 disjiosition doil êlre réglé par la loi en vigueur  lors du décès  quelle que fût celle en vigueur  lors de la confection du testament   Attendu qu'en faisant l'ajiplicalion de ces règlps à l'institution universelle testamentaire   du 16 frimaire ' an 11  il ne jseul y avoir aucune difficulté sur la validité du  testament  en ce cjui concerne la forme de l'acte el la capacité du testateur  qu'en ce qui touche la disposition  elle était prohibée   à la vérité   par les lois des 17 nivôse   22 venlose an 2 el 4 germinal an 8  sous l'empire desquelles elle a élé fane  mais que cette jirohibilion a élé levée par le Code civil  sous l'empire duquel est décédé le testateur  • eju'en effet  l'art  1002 de ce Code autorise les dispositions testamentaires à titre universel  sauf réduction à la quotité disponible  que  dans l'espèce  le testateur ayant laissé trois enfans   celle quotité esl du quart des biens  aux termes de l'art  9i3 du Code civil   et que l'institution universelle du 16 frimaire an 11   en favcur'de l'épouse   [Pélissier  devant être régiâ par la loi actuelle  se i trouve conséquemment réductible au quart    Attendu que bien qu'il poil établi jiar l'article 919  Code civil  que le legs d'une quotité disponible est sujet à rapport  lorsqu'il n'a pas élé fait à titre de préi cijiulet horsparl  îestermesdelaloi ncsonl point sacramentels  el que le légataire  en l'absence deces termes   n'en doit pus moins êlre dispensé du rapport  toutes les fois qu'il résulte nécessairement  soit du contexte du testament  soil de la nature de la disposition  que le testateur a eu la volonté formelle de faire au légataire une libéralité non sujette à rapport  que   dans l'espèce il s'agit d'une institution testamentaire  à titre universel  qui embrasse dans sa généralité tous les biens de ^'instituant  cl que l'énergie"" d'une pareille disposition renferme une dispense de rapport aus«r expresse que si le testateur se fut servi littéralement des termes   de la loi  ainsi qu'il a élé jugé par un arrêl ele la  1 Cour de cassation  en date du 20 août 1812  rapporté j par Sirey  tom 12   première partie  jiage 386  que conséqueinmenl l'épousePélissiernedoit j3omt être as  sujélie à raj3j3orter le quart  jsour êlre admise au partage de la succession d'Antoine Faure  son père   Attendu que c'est avec raison que les jiremier s juges ont refusé d'allouer en reprisé aux ajipelans les   quittances des ier  thermidor an 12  16 termidor an j i3   el 24 jum 1806  parce cju'il esl suffisamment juslilié que ces quittances onl pour objet des sommes payées par Pélissier à Marie Faure   épouse Gorse   à comple sur la constitution dotale de celle ci  cjui dejiuis  dejiuis a cède ses droits successifs""   Attendu qu'il y a lieu d'allouer à Pélissier la reprise d'un mobilier de la valeur de 200 francs   cju'il justifie  par son contrat de mariage  avoir apporté dans la maison de son beau père   Attendu qu'il y a pareillement lieu d'allouer à Pélissier la reprise des contributions de l'an 11  dont le jjaiement esl justifié avoir élé fail de ses deniers   Met l'appel et ce dont est oj3pel au néant  Emendanl  faisant ce que les jsremiers juges auraient dû faire   déclare la disjiosiiion testamentaire à litre universel  du 16 frimaire an n   valable  réductible néanmoins au ejuarl disponible  et non sujette à ra]3j>orl   Ordonne que le partage de la succession d'Antoine Faure sera fait sur celle base  autorise en faveur de Pélissier le [irélèvement du mobilier jiar lui ajiporté   ou d'une somme équivalente   si le mobilier n'existe plus en nature  alloue aussi à Pélissier la rejsrise des impositions de l'an 11   Ordonne ejue les dépens seront em]3loyéu en frais de partage   sauf le coût de Pari et cjui demeure à la charge des intimés   dit que pour le surplus le jugement dont est ajipel sortira son plein et entier effet   fait main levée de l'amende  renvoie les parties devant le tribunal d'Ussel jsour l'exécution du jirésent arrêl     "; 26.juin 1822.;Cour royale de Limoges.;https://gallica.bnf.fr/ark:/12148/bpt6k5737538v/f284.image;1822183
1822184;299;"    Considérant que Charignon jière  en slijiulanl dans l'acle du 29 juillet 1807  jiour son fils absent  s'est fait fort jiour lui  el s'est engagé directement  avec l'affectation de ses biens et hy jioihèque  jiour le paiement de la somme de 3 ooofr  envers Ferlin  et cru'ainsi ce de nier n'a dû açjir iusqu au jiaiement de la créance que coulie ses héritiers 5        Considérant que le jirix d'un remjilacement  en matière de conscription  est  de sa nature  sujet à rajijiort  qu'on doit le considérer comme une dette de l'héritier  qul  d'ajirès l'art  851 du Code civil  est rajijiortable  que l'art  85a   invoqué jiar Augustin Charignon   n'est jias ajijilicable à la cause  parce que le jirix dont il s'agit ne jieul êlre assimilé aux irais d'éducation  d'àjijirenlissage ou d'équijiemenl militaire   qui sont le sujet de cet article  d'où il suit qu'Augustin Charignon  venant à"" jitirtage de la succession de son jière  doit rajijiorler la somme de 3 ooo fr   qui doit être jiayée à Ferlin    Condamne les héritiers Charignon à payer la somme de 3 ooo fr  due à Ferlin  avec intérêts   et faisant droit à la demande en garantie des héritiers Charignon   condamne Augustin Charignon à rapporter à la masse de la succession du jière commun les 3 000 fr  payés à Ferlin  renvoie celui ci à faire statuer ainsi et comme il avisera contradictoirement avec  Joseph Charignon  donataire de la portion disponible  sur la question de savoir si ladite somme de 3 ooe fr  doil être prélevée sur la portion disponible  ou imputée sur la part dudit Augustin Charignon dans la réserve légale         "; 12 février 1816. ; Cour royale de Grenoble. ;https://gallica.bnf.fr/ark:/12148/bpt6k5737538v/f299.image;1822184
1822185;301;"    En ce qui touche l'apjiel interjeté par Landtieux   du jugement rendu jiar 1 le uibuhat civil d'Abbeville  du 18 mai 1821  el les conelusidns jirincipales par lui prises   Attendu que  soit que l'on considère les arbres qui font l'objet du piocès comme ayant été jilantés antérieurement à la jmbhcdhon du Code C1V1I  soit qu'on  les„considère comme l'ayant clé dejims  te'esi toujours aux lois anciennes   aux réglemens jiarliculiers   aux usages constant et reconnus   qu'il faut recourir pour déterminer à quelle distance des héritages voisir* doivent êlie filantes les aibies à haute ilige    Attendu que cetle distance était fixée a cinq jiîeds  jiar les lois 1 ornâmes  <jui formaient le droit coiû  mun dans jnesque loul le legsoil du parlement de Pans  et notaihinenl dans toute l'étendue derl'ancîenne piovince de Picardie  danslacjuelle était sjtuée la commune de Canchy     (  Attendu que lesdites lois  de même que le Code civil  donnent au voisin le di oit d'exiger que les al'bres jilantés a une moindre distance   soient'anachés    et cju'il est reconnu  dans la cause   queues jiommiers litigieux sont jilanlés a moins de cinq jiiedsde la ligne séjiaialive des hèi itages des jiarlies  * i  Attendu que  sous l'empiie de la couiume de Pon ^ ihieu^ dans le ressort de laquelle était «rtu""e ladite'  T  A Ali    9e   IIe  Paît    F  58  a98  Lois  commune de Canchy  la prescription   en matière de servitude   n'avait lieu qu'en faveur du jiossesseur du 'fonds grevé à l'effet de se libérer  et qu'elle ne jiou vait jamais supjiléer au défaul de litre jiour acquérir une servitude    Attendu d'ailleurs que l'époque à laquelle aurait commencé la jiossessiou invoquée jiar Landrieux à l'effet de prescrire   ne saurait êlre celle de la plantation des arbres litigieux  parce qu'alors lesdils arbres faisant  jiar leur nature   partie intégrante de la haie   Guerville ou ses auteurs n'auraient pu en demander l'enlèvement  que cette jiossession ne saurait remonter au delà de l'époque à laquelle l'étal des arbres a changé   soil par leur élévation au dessus de ladite haie   soit jiar les greffes qui y ont élé ""ajmosées   el qu'il ne s'est jias écoulé 20 ans dejiuis •celte éjsoque   d'où il suit que la prescription invoquée par Landrieux n'est jioinl établie    En ce qui louche les conclusions subsidiaires jirises en la Cour par Landrieux   Attendu que la commune de Canchy était soumise  comme toutes les autres communes de la même jiroviuce  à la disposition des lois romaines   cjui y formaient le droit commun en cette matière  disjiosition à laquelle il n'était dérogé ni jiaï la coutume de Ponthieu  ni par aucune autre coutume jiarticulière de ladite jirovince      Que l'usage contraire ejue Landrieux jirétend exister à Canchy  et dont il offre la jireuve   ne saurait être un autre usage ejue celui qu'on retrouve dans les communes environnantes el dans la jilujiarl de celles de la même jirovince  c'est  à dire l'habitude dans un grand n'ombre d'héritages de laisser croître des arbres dans les haies   en deça de la distance voulue jiar la loi  habitude entretenue jiar la condescendance ou la négligence des jirojiriélaires voisins   qui lout au jilus •jiourrait servir aujourd'hui à établir la jirescriplion 'après le lajis de 3o ans   dans les Jiays où des servitudes jiouvaient s'acquérir de celle manière   mais qui n'a jamais été ni ne saurait être regardé comme un usage constant et reconnu   tel que celui auquel le Code civil accorde force de loi   jiarce qu'il l'avait ■aussi sous l'ancienne jurisjirudence  et qui jiût déroger à celte jurisjirudence    Allendu encore que Landrieux semble avoir luimême reconnu que tel était et est encore cet usage   en n'offrant la preure qu'en la Cour el en consentant même en jiremière instance à l'enlèvement des autres arbres jilanlés dans le même alignement ejue les jiommiers qui font l'objet de la conlestation    Sans s'arrêter ni avoir égard aux conclusions tant jirincipales que subsidiaires jirises jiar Landrieux   mel l'ajijiellation au néant   Condamne Landrieux en l'amende et en tous les déjieiis des causes principales et d'ajipel   j  "; 21' décembre 1821 ;Cour royale d'Amiens. ;https://gallica.bnf.fr/ark:/12148/bpt6k5737538v/f301.image;1822185
1822186;303;"    Considérant quo M 8  N    demande d'être comjiris sur le tableau de l'ordre des avocats  sur le motif que  quoique établi à Marseille  il conserve l'csjmt de retour  cl que la loi n'impose l'obligation de la résidejjce qu'aux magistrats et non aux avocats    Considérant qu'il résulte  au contraire  bien cxjircssément des diverses disjiosilions du décret du i4 décembre'i8id  que les avocats établis jirès les tribunaux inférieurs n'ont tins le droit d'être compris sur le tableau des'avocats de la Cour    que ce décret prescrit la formation d'autant de tableaux  qu'il y a de 'tubunaux  d'où' il '^uit que chacun de ces""la "" bloaux doit comprendre le nom de ceux des av ocats qui residenldai s le siège de chacun de ces tribunaux  et cju'il Vst imjiossible d admetlie que le tableau des avocats de la Cour doive suffire à lui seul  et puisse conajuer dre tous les dvocats du ressort   jquttl  est') bien  vrai que le décret jirécité donne le droit aux av ocdts inscrits au tableau de la Cour de jilaider'devant les tribunaux de son ressort  mais qu'il refuse aux avocats de  ces tribunaux dé plaider devant la Cour sans permission spéciale  <el'cju'ainsi/ en considérant la Cour commeile centredes tribunaux do son ressort  l'avocat peut aller dû centre a la Circonférence   mais non do 'la circonférence amcenlre   Considéiant que les avocats qui veulentêlve inscrits' au tableau de 1 ordre deslavocats de la Cour doivent résider devant elle  jiuisquils jieuvent êtie nommés  membics du conseil de> discijihnb""  oui du bureatvde consultalionigral uite „■ ou noinmes'd'office'&la défense des prév omis   ou appelés à donner des consultations pour des communes   des'mineurs  cl en matière de requête civile  • qu'ils sont  de plus  soumis à la surveillance  du conseil de discijiline   et que rien de tout celan'esl jiossible   s'ils ne résident 1 noint  qu'ainsi  la faculté  cjuxuit les avocats de l«i Cour de plaider  j devant les tribunaux dii'rcsso t ne jieul les autoriser à résider bahiluellemenl'el a transférer leur  cabinet  1 dans le siège de lïun de ces tribunaux'  ■    Que si l'on considère encore la dignité de celte pro1  pro1   il est imjhjssuvc d'admc Uré* qu'un* «ivecat  W 9   Loisjiuisse  Loisjiuisse parcourir les grands chemins   jiour se rendre d'un tribunal à l'autre   Considérant qu'en faU  il est constant et reconnu jiar M^  N     lui même  que depuis jilus de tiois ans il a iransféië à Marseille son cabinet  el qu'il a fait de celle Ville le lieu de son principal établissement   qu'il ne jieul  dès lors  êlre compris au tableau des avocats de la Cour  qu'autant qu'il aura jirealablemenl dans Aix un logçmenl el un cabinet convenables à sa  jirofpssion  e\  cju'il auia de nouveau  et assez longtemjis  fixé sa iesider ce en celte ville  jiour qu'il ne jiuisse jilus êlie considéré comme un avocat de Maiseilie    P«p ces motifs  mainlipnl Iç lablau des avocats exerçant jvrès la Cour  jiour l'année judiciaire 1821   tel qu'il a étç diessé  sauf et îéserve audit Me  Hi   tous ses dioils  jiour être reporté sur le tableau qui sera formé à la jnochaine rentrée delà Cour   condamne l'ajipelani à l'amende sans dépens  33  "; 2 «nul 1822 ;Cour royale d'Aix •;https://gallica.bnf.fr/ark:/12148/bpt6k5737538v/f303.image;1822186
