id;page;arrêt;date;juridiction;lien;id
1822123;103;"LA COUR     Attendu que des"" dispositions combinées des art  151 et 154 du Code civil  il résulte que les enfans de famille  ayant atteint la majorité fixée par l'art  148  sont tenus  avant de contracter mariage  de demander  par un acte respectueux et solennel  le conseil de leurs père et mère  dans le cas où ceux ci refusent leur consentement  que les formes de cet acte sont toutes particulières  puisqu'il doit être notifié par deux notaires   et que le ministère des huissiers est supprimé en pareil cas   par cela seul qu'ils sont chargés de l'exécution des actes de rigueur  que l'acte respectueux n'a point pour but ce mettre le fils en présence du père  puisque   comme plusieurs arrêts l'ont jugé  ce système  loin d'être propre à concilier les esprits  servirait souvent à les aigrir   et pourrait donner lieu à des scènes affligeantes et scandaleuses   la loi n'exige pas non plus que l'acte soit signifié à l'ascendant  en parlant à sa personne   car ce serait rendre cette notification impossible   et entraver la liberté des mariages  que l'on a voulu favoriser   le père de famille  auquel trois actes respectueux devaient être adressés  comme dans l'espèce  averti des temps auxquels il doit les recevoir   ne manquerait pas de s'éloigner de son domicile   espérant d'obtenir de nouveaux délais  et tromper la prévoyance de la loi   Sans doute  le fils de famille doit faire ce qui est en lui pour que l'acte respectueux soit adressé au père luimême  et s'il était prouvé qu'il a pris des mesures pour que le père ne fût pas rencontré dans son domicile  cette affectation  essentiellement opposée à la nature de l'acte  devrait être pesée dans la balance de la justice  mais hors ce cas  la notification est toujours régulière  quoique l'on ne parle point à la personne de l'ascendant    Attendu que l'on objecte vainement que les termes de l'article 154 répugnent à cette interprétation   puisqu'ils exigent que le notaire fasse sur son procès verbal mention de la réponse de l'ascendant   comme l'observe M  Toullier  le refus de répondre  ou l'impuissance de répondre résultant de ce que l'ascendant n'a point été trouvé dans son domicile  seront constatés par le notaire  et de voeu de la loi sera rempli  car elle n'exige la mention de la réponse  qu'en prévoyant le cas où elle en ail fait une    Attendu qu'il est aussi mal à propos que l'on a prétendu que   du moins   une sommation antérieure devait être adressée au père  pour le constituer en demeure   outre que celte sommation serait peu respectueuse en soi  qu'elle aurait pour but de contraindre le père à recevoir un acte dèplaîsant pour loi  et que les rapports qui existent entre un père et son fils n'admettent pas un mode aussi inconvenant   d'ailleurs   on ne peut ajouter aux dispositions de la loi  et créer des formalités qu'elle n'a pas prescrit de remplir  C'est ainsi que la jurisprudence constante des Cours du royaume   et de la Cour de cassation   ont interprété l'article 154   la Cour elle même  13*  100  Lois  s'est prononcés sur ce point dans la cause de la demoiselle Pouderoux  en prenant pour règle celle jurisprudence  le texte de la loi et l'opinion unanime des auteurs    Attendu que  dès lois  les actes resprectueux notifiés au sieur Mercier père se trouvent réguliers   que le premier a été adressé au père lui même   qu'en son absence le second et le troisième lui ont été adressés en parlant à son épouse qui s'est chargée de lui remettre la copie   sur l'invitation du notaire  que le sieur Mercier père   dans son opposition  reconnaît avoir reçu les trois actes respectueux   et qu'au fond il n'allègue aucun motif pour s'opposer à une union parfaitement assortie sons tous les rapports  etc   par ces motifs  Rejette   etc  »  "; 21 juillet 1821. ;Cour royale de Toulouse. ;https://gallica.bnf.fr/ark:/12148/bpt6k5737538v/f103.image;1822123
1822124;107;"     Considérant  en premier lieu f que la donation de 8000 francs ne devra être retenue par la dame Lafontan qu'à concurrence des six dixièmes des biens   parce qu'elle a été faite à une époque où la mère commune pouvait disposer de la moitié de ces mêmes biens  sans priver la donataire de la légitime sur le restant  mais que   si ladite somme de 8000 fr  excédait les six dixièmes des propres maternels  elle serait sujette à retranchement  conformément à l'ordonnance de 1731   et à concurrence de ce qui manquerait pour remplir les autres enfans de leur légitime maternelle   Qu'en second lieu   si cette somme de 8000 francs  au lieu d'excéder les six dixièmes des propres maternels  était inférieure au quart desdits biens propres maternels  le surplus de ce quart (1) constituerait une portion de la quote disponible""  qui devrait tourner au profit de ceux des autres enfans qui seront reconnus ultérieurement donataires ou légataires du préciput   mais qu'au surplus  dans cette supposition qui devrait se faire dans l'intérêt des autres enfans   d'après les dispositions du Code civil  on ne devra attribuer à la dame Lafontan aucune portion de la réserve légale  parce qu'aux termes de l'art  845 du Code civil  le don ou le legs auquel se tient un des cosuccessibles n'est imputable que sur la portion disponible    D'après ces motifs  vidant le renvoi au conseil     a mis et met les appellations et ce dont a été appelé au néant  déclare que'  moyennant la renonciation faite par la dame Lafontan  le 12 février 1819  à tous autres droits sur la succession  la donation de 8000 fr  doit sortir son effet à concurrence des six dixièmes des biens  et n'être sujette à retranchement qu'autant qu'il ne resterait pas de quoi remplir les droits légitimaires des autres enfans  tels qu'ils étaient fixés par les anciennes lois   dans le cas où ladite somme de 8000 francs excéderait les sixdixièmes propres délaissés par ladite Matthieu   mère commune  l'excédant sera partagé entre les autres quatre enfans Renaud     »  "; 27 juin 1821. ; Cour royale de Toulouse. ;https://gallica.bnf.fr/ark:/12148/bpt6k5737538v/f107.image;1822124
1822125;108;LA COUR   Considérant que la section 2e du titre 2  livre 8 du Code civil   qui règle la réduction des donations  est seule applicable à l'espèce   et qu'aux termes de l'article 921 l'action en réduction des dispositions entre vifs n'appartient qu'à ceux au profit desquels la loi fait la réserve  qu'il en résulte qu'elle ne peut être exercée par le demandeur en réduction  que jusqu'à concurrence de sa part dans la réserve à laquelle il n'a droit qu'en qualité d'enfant du donateur   que la renonciation de l'enfant donataire à la succession de son père  n'étant relative qu'aux biens existans au jour du décès   ne peut  conformément à l'article 924  lui faire perdre le bénéfice de la saisine résultant de la donation   et notamment sa part de la réserve qui lui appartient aussi en qualité d'enfant du donateur   Met l'appellation an néant  ordonne que ce dont est appel sortira son plein et entier effet   etc  »  ; 31 Juillet 1821, ; Cour rovale de Paris;https://gallica.bnf.fr/ark:/12148/bpt6k5737538v/f108.image;1822125
1822126;110;LA COUR    Attendu   quant au premier grief  que le bénéfice de la cession de biens a pour résultat de décharger le débiteur de la contrainte par corps   de conférer à ses créanciers le droit de faire vendre ses biens à leur profit  et d'en percevoir les revenus jusqu'à la vente  que dès lors la cession de biens intéresse singulièrement tous les créanciers   qu'elle les prive de l'un des moyens d'exécution qui leur étaient déjà acquis  et avec lesquels elle opère une sorte de contrat ou jugement relatif au bien du débiteur  que cet intérêt a été senti par le législateur  qui  en disposant que « les créanciers ne peuvent refuser la cession judiciaire »   si ce n'est dans les cas exceptés par la loi »  a reconnu par là qu'il était des cas on les créanciers peuvent la refuser  qu'il est évident que   pour les mettre A même d'accepter ou de réfuser  il faut les avertir de la demande formée  et les mettre en demeure sur cette demande   mais que la seule difficulté qui naît de ces premières notions consiste à déterminer l'époque à laquelle les créanciers doivent être àppelés  qu'il ne résulte nullement des dispositions combinées des art  898 et suivans du Code de' procédure civile et des art  569 et suivans du Code de commerce  que l'ajournement doive avoir lieu dès l'instant où la demande est adressée au tribunal civil 5 que cette demande n'a pas pour objet immé   Et Décisions diverses'   107   diat la cession de biens  mais seulement l'admission du débiteur à faire cette cession  que dès  lors  c'est au tribunal civil à apprécier d'office le mérite d'une de mande qui ne tend qu à faire autoriter le débiteur à passer outre   que la présence des créanciers n'est rigoureusement nécessaire que lorsque leur débiteur fait réellement la cession  de biens   parce que  d'une part  il en résulte entre lui et ses créanciers une sorte de contrai   auquel les créanciers doivent nécessairement concourir  et parce que  d'autre part   le montent où le débiteur va faire sa cession de biens est le moment opportun pour les oppositions que voudraient faire certains créanciers  que leur vocation prématurée aurait l'inconvénient d'être inutile   si le tribunal civil doit rejeter d'office la demande qui lu  est adressée   et d'être mal à propos dispendieuse si la plupart des créanciers sont disposés à ne pas refuser la cession   que ce premier aperçu de l'état de notre législation sur cette mature est justifié par plusieurs dispositions particulières de celte même législation   que les art  899 du Code judiciaire et 569 du Code de commerce   relatifs à la manière d'introduire la demande en admission à la cession de biens   indiquent réellement la nécessité d'appeler les créanciers   et que ces articles  en disant que « le demandeur se pourvoira devant le Tribunal de son » domicile  qu'il formera sa demande à ce tribunal   » que le tribunal se fera remettre les titres nécessaires  » que la demande sera insérée dans les papiers publics  font assez entendre que   pour le moment  les poursuites se font hors la présence des créanciers   que la communication au ministère  public   voulue spécialement par l'art  900 du Code judiciaire  est une nouvelle  preuve que  sur la demande primitive en admission   la loi ne donne au demandeur d'autre contradicteur que le ministère public   que ce même article 900 du Code judiciaire et l'art  570 du Code de commerce   en disposant que  ri le demandeur sollicite un sursis aux poursuites de ses créanciers  les parties seront appelées  fournissent une nouvelle preuve qu'elles ne l'ont pas été encore  puisque   dans le cas contraire  la demande en sursis ne serait qu'un incident aux procédures déjà faites  et n'exigerait point de citation nouvelle  qu'il est faux de dire que  par les mots parties appelées  la loi indique que les créanciers sont déjà en cause  parce que ces mots parties s'applique plus particulièrement aux auteurs des poursuites dont le débiteur veut provisoirement arrêter les effets  que les art  901 du Code judiciaire et 571 du Code de commerce   veulent que le débiteur admis au bénéfice de cession fasse ou réitère cette cession devant le tribunal de commerce de son domicile  les créanciers appelés  qu'il est impossible de croire   malgré toute la sévérité dont le législateur a dû accompagner la concession du bénéfice de cession   qu'il ait voulu soumettre le débiteur à une série d'ajournemens qui rendrait le bénéfice de la loi d'autant plus difficile à obtenir   que le débiteur serait plus malheureux   qu'il est impossible de croire que si le jugement d'admission avait été rendu avec tons les créanciers  s'il était contradictoire avec eux  la loi eût nécessité des frais considérables pour l'accomplissement d'une formalité  formalité n'aurait plus désormais un très grand avantage   puisqu'il s'agirait de l'exécution d'un jugement désormais inattaquable  qu'il est bien préférable de pfnser que l'appel des créanciers à l'audience où le débiteur admis au bénéfice de cession fait cette cession  ou la réitère   est une conséquence du principe que ces créanciers n'ont pas été appelés plutôt  que cet appel se fallait moment le plus opportun   puisqu'il fait intervenir' les créanciers dans le contrat  que la cession de biens faite ou réitérée opère entr'eux et le débiteur   puisqu'il les met à même d'attaquer le jugement d'admission   s'ils se croient fondés à refuser la cession   puisqu'enfin  il ne soumet le débiteur à contester qu'avec ceux de ses créanciers qui y sont disposés et intéressés   Attendu qu'il résulte de celle interprétation de nos lois  d'autant plus applicables à Fraunié  qu'il appar   tient évidemment à la classe des négocians faillis  que Fraunié n'a dû appeler en cause aucun créancier  sans qu'on puisse argumenter contre lui de ce qu'il en a appelé une partie  puisque ceux appelés  ayant fait des poursuites  devaient être mis à même de défendre à la demande en exécution provisoire   qui ne tendait qu à un sursis aux poursuites déjà commencées par eux   Attendu  quant au deuxième grief  que la remise  des livres et litres actifs du demandeur en cession de biens n'est pas impérativement demandée par la loi  que l'art  898 du Code judiciaire n'exige la remise des livres que si le demandeur en a  que l'art  569 du Code de commerce dispose seulement que le tribunal se fera remettre les titres nécessaires   Attendu que  dans l'espèce  le débiteur n'a pas dû déposer les livies et les titres actifs   et que le tribunal civil n'a pas pu exiger un pareil dépôt   qu'en effet   quant aux livres  Fraunié a déclaré n'en point avoir   parce qu'ayant cessé tout commerce depuis sa faillite  il n'a pas cru devoir conserver les livres qu'il avait tenusavant cette époque  que cette explication ne peut qu'être admise  puisqu'elle est conforme aux faits  et  qu'en droit  l'art  21 du Code de commerce ne soumet les commerçans à conserver leurs livres que pendant dix  ans  qu'au surplus  on peut d'autant moins attribuer à un esprit de fraude le défaut de remise des livres et l'explication donnée à cet égard  qu'en 1807  époque de la faillite de Fraunié  ses livres furent mis entre les mains  et du ministère public  et des commissaires de la faillite   qu'il fut reconnu que ces livres étaient en bon état * propres à attester le malheur et la loyauté du failli  qu'en conséquence il l'ut fait un concordat  lequel fut homologué par la justice   que ce concordat a eté exécuté par tous les créanciers   qu'ainsi  dans l'espèce  la représentation des livres de Fraunié ne fut elle pas impossible   serait inutile  que  quant aux titres actifs   Fraunié déclarant qu'il n'en peut remettre  qu'il a employé an paiement du premier dividende tout l'actif qu'il pou vait avoir  la question se réduit à un point de fait  dont l'examen appartient plus directement à la discussion du troisième grief  puisque  si Fraunié avait en main des titres actifs qu'il n'aurait point remis   en prétextant n'en pas avoir  ce fait constituerait le demandeur eu état de mauvaise foi  et le rendrait non seulement irrece14  irrece14  108  Lois  fable quant à présent   mais indigne à jamais du bénéfice de cession    Attendu  quant au troisième grief  que  Fraunié ne se trouve dans aucun cas d'exception déterminé par les art  905 du Code judiciaire et 575 du Code de commerce  que le bénéfice qu'il réclame ne saurait donc lui être refusé  si  d'ailleurs  il est malheureux et de bonne foi    Attendu que ses malheurs et sa bonne foi ont été reconnus par ses créanciers et par la justice en 1807  que l'examen fait aujourd'hui même des causes de la faillite a prouvé qu'elle fut nécessitée par les faillites antérieures que venait d'essuyer Fraunié lui même  que l'examen fait aujourd'hui même de sa conduite à l'époque où il cessa ses paiemens  et où il concorda avec ses créanciers  a prouvé qu'il n'avait rien détourné  qu'il n'avait caché aucune partie de son a tif  et qu'alors que cet actif ne s'élevait en totalité qu'à 99 000 fr   il s'obligea de payer la totalité de son passif  s'élevant à 140 000 fr    qu'à la vérité celte obligation n'a été remplie qu'à concurrnnre de 55 p  %  mais qu'on n'a pas prétendu que Fraunié ait pu mieux faire  qu'on L'aurait prétendu mal à propos  qu'il est prouvé que le paiement des deux premiers dividendes  formant une somme totale de 77 000 fr   a absorbé tout l'actif  qui n'a produit en réalité qu'une valeur de 73 000 fr    qu'il est prouvé que le secours de ses parens a seul mis Fraunié à même de payer deux dividendes pour lesquels son actif aurait été insuffisant  que ce cas avait été prévu dans le concordat  où  pour le troisième dividende  les créanciers n'exigèrent aucune garantie  et ne comptèrent que sur les bénéfices que pouvait obtenir leur débiteur s'il reprenait les affaires  que sa position ne lui ayant pas  permis de les reprendre  on ne peut' qu'attribuer au malheur qui le poursuit l'impuissance où il s'est trouvé d'exécuter en entier ses engagemens  et qu'enfin la manière dont Fraunié a vécu depuis 1807 témoigne qu'il s'est dépouillé de tout en faveur de ses créanciers  lesquels ne pouvaient pas exiger au delà d'un débiteur qu'ils ont reconnu malheureux et de bonne foi    Attendu  quant au quatrième grief  qu'il est évidemment fondé  puisqu'au lieu de se conformer aux dispositions des art  901 et 902 du Code judiciaire  les premiers juges ont ordonné que Fraunié serait mis en liberté avant d'avoir fait ou reitéré cession de ses biens en présence de ses créanciers    Attendu que le succès de l'appel   quant à ce quatrième grief  nécessite la restitution de l'amende  et que pour les frais il ne faut pas perdre de vue que l'admission de la demande en cession de biens n'ôte pas à Fraunié sa qualité de débiteur    Par ces motifs  reçoit les parties de Druilhe à intervenir dans l'instance  et à adhérer à l'appel  disant droit sur l'appel  réformant  quant à ce  ordonne que Fraunié fera et réitérera la cession et abandon de tous ses biens à ses créanciers  et ce en personne  les créanciers dûment appelés devant le tribunal de commerce de cette ville  le tout aux formes de droit  auquel effet  attendu que Fraunié est détenu  ordonna son extraction avec les précautions en pareil ras réquises et accotuméees après quoi ledit Fraunié sera mis en liberté   avec  défenses à ses créanciers de plus à l'avenir user envers'  lui de la contrainte personnelle  et pour tout le surplus   ordonne que le jugement dont est appel sera exécuté suivant sa forme et teneur  etc  »  ; 30 avril 1821. ; Cour royale de Toulouse. ;https://gallica.bnf.fr/ark:/12148/bpt6k5737538v/f110.image;1822126
1822128;116;LA COUR     Considérant qu'une institution contractuelle est annullée par le décès de l'institué avant celui de  l'instituant   qu'à la vérité cette règle cesse dans le cas d'enfans   parce que  l'institution en payeur du mariage est réputée par la loi faite A leur profit   mais que ces enfans sont ceux nés du mariage qui a donné lieu à l'institution   non ceux nés d'un mariage postérieur  l'instituant étant présumé n'avoir considéré que le mariage auquel il concourt   et les fruits qui pourraient en résulter     que cette règle ne peut recevoir d'exception qu'au cas où il s'agirait d'une institution faite par un père à ses fils  parce que ses petitsfils   de quelque mère qu'ils soient nés   sont toujours l'objet de son affection     que   dans l'espèce   Jean Cutard   premier du nom  institué ( en 1779 )   est mort avant Anne Ageorges   instituante   et n'a point laissé d'enfans du mariage   en faveur duqeul l'institution fut faite   mais seulement d'un mariage postérieur  qui sont les appelans   Considérant qu'une institution contractuelle ne peut avoir lieu  que par contrat de mariage en faveur des époux et leurs enfans   et que dans l'acte du 13 septembre 1812   Jean Cutard  second du nom   était le seul des six enfans qui se mariait alors     Que cette institution le charge bien d'appeler au partage ses cinq frères  frères soeurs   tous les six étant associés par égale portion   mais que cette disposition à légard des cinq autres ne pouvait avoir lieu que par une institution particulière à chacun d'eux   qu'ainsi  elle est nulle en la forme     Qu'à la vérité Jean Cutard  second du nom  ne pourrait leur opposer cervice  parce que le partage était une condition  une charge de son institution   mais qu'ici ceux qui réclament sont les héritiers du sang auxquels rien n'interdit la critiqué des irrégularités de cette disposition   Considérant qu'il en est de même des prélèvement avant partage   stipulés en faveur de François et Anne Cutard  puisque  d'une part  la forme des dispositions est irrégulière à leur égard   et que de l'autre n'ayant pas droit au partage   il ne peut y avoir lieu à prélèvement à leur profit   Considérant que l'institution au profit de Jean Cutard  second du nom  ayant été faite par son contrat de mariage de 1812  la disposition est valable à son égard  mais que l'instituante ayant appelé les six enfans à un partage par égales portions   celle de l'époux institué se réduisait nécessairement à un sixième    Considérant que l'accroissement à lieu quand le legs fait à l'un des intimés devient caduc   mais qu'il ne peut jamais s'opérer quand les dispositions n'ont pas été faites dans une forme légale  que   dans l'espèce   celle en faveur des cinq enfans autres  que l'époux est nulle   comme contraire à la loi   et des lors réputée non écrite    Considérant qu'aux termes de droite les testamens sont révoqués par un testament postérieur ou par un acte devant notaire  portant déclaration de changement de volonté    Que   dans l'espèce   le testament de 1807 disposait de toute le fortune d'Anne Ageorges en faveur de François Cutard  l'un des six enfans   et que l'institution contractuelle du 13 septembre 1812 est aussi de toute la fortune de l'intituante au profit de Jean Cutard   second du nom  qu'ainsi  il y a révocation tacite de son testament     Qu'en vain on oppose que François Cutard étant appelé par cette institution au sixième de la fortune de l'instituante   cette institution n'a annullé le testament de 1807 que pour les cinq autres sixièmes   qu'ainsi  le legs y contenu doit valoir pour cette portion     Qu'un testament et une institution contractuelle de la même fortune   et au profit de personnes différentes  attestent un changement de volonté  qu'ainsi  ces deux actes ne peuvent exister simultanément   que le premier ayant été révoqué  il ne reste plus à François Cutard d'autre titre que la disposition portée en l'acte de 1812 laquelle est nulle de droit   A mis l'appellation au néant   ordonne que le jugement dont est appel sera exécuté suivant la formé et teneur  et condamne l'appelant en l'amende et aux  dépens   ; 19 décembre 1821, ; Cour royale de Bourges. ;https://gallica.bnf.fr/ark:/12148/bpt6k5737538v/f116.image;1822128
1822129;118;LA COUR   Considérant  qu'aux termes de l'art  54 du Code de procédure civile  les conventions insérées dans les procès verbaux de conciliation dressés par les juges de paix ont force d'obligation privée entre les parties qui ont comparu   Considérant que la circonstance  que ces conventions auraient eu pour objet de désigner le juge de paix lui même pour l'un des arbitras investis par les parties du droit de terminer leur contestation  ne peut changer la nature de ces conventions  et diminuer la foi due au mode qui a servi à les constater   dèslors qu'il n'existe aucune disposition précise qui interdise aux juges de paix d'être désignés arbitres par les parties qui comparaissent devant eux   Considérant que  dans l'espèce  la partie qui attaque le compromis passé devant le juge de paix aurait volotairement paru devant les arbitres  communiqué les titre  ainsi qu'il résulte du jugement arbitral   que le fait  d'ailleurs  n'a pas été dénié  d'où résulterait une ratification du compromis dont il s'agit  en  supposant qu'il n'eut pas été régulier dans son principe   Sans s'arrêter à l'opposition formée envers l'ordonnance d'exequatur  mise au bas du jugement arbitral du 17 août 1818  ordonne que ce jugement sera exécuté selon sa forme et teneur  »  ; 17 janvier 1822.; Cour royale de Grenoble;https://gallica.bnf.fr/ark:/12148/bpt6k5737538v/f118.image;1822129
