id;page;arrêt;date;juridiction;lien;id
1822157;200;"LA COUR   Attendu que d'après l'art  904 du   Code civil  le mineur parvenu à l'âge de seize ans ne  peut disposer que par testament  et jusqu'à concurrende seulement de la moitié des biensdont la loi permet au majeur de disposer   Attendu que la loi n'établit à cet égard aucune distinction entre les mineurs  qu'ils soient mariés ou non  que par conséquent les juges ne sauraient en établir   que cet article doit donc s'appliquer indistinctement à tous les mineurs parvenus a l'âge de seize ans   Attendu que  vainement on dirait que l'art  904 du Code civil est modifié par le chapitre 9 du titre 2 du livre 3 de ce Code  et notamment par l'art  1094  qui permet aux époux de se faire  soit par contrat de mariage   soit pendant le mariage  divers avantages subordonnés à l'existence  ou d'enfans provenus du mariage  ou d'héritiers en faveur de qui la loi fait une réserve   cette modification ne saurait être admise  puisque 1°  cet art  1094 n'est point corrélatif avec l'art  904  2°  l'art  1094 ne s'applique qu'au époux majeurs  s'il s'y était agi des époux mineurs  le législateur qui  par là même  aurait fait exception à l'article 904 et étendu les droits des mineurs  n'aurait point manqué de le dire  lui qui  dans l'article suivant (1096)  énonce expressément qu'il s'occupe des époux mineurs   3° l'art  1095 est le seul dans le chapitre 9 susdit  qui se rapporte à la capacité des mineurs de disposer  et il est corrélatif  non point avec l'art  904  qui ne parle que du droit de tester des mineurs  parvenus à l'âge de seize ans  mais avec l'article 903  qui parle' des  mineurs âgés de moins de seize ans   lesquels ne peuvent disposer que de la manière exprimée audit art  1095   C'est  au surplus  dans la combinaison de ces quatre art ""903  904  1094 et 1095 du Code civil  qu'on trouve toute la pensée du législateur au sujet de la capacité des époux  soif majeurs  soit mineurs  ralativement à leurs dispositions   On y voit que la femme  qui  à quinze ans révolus peut contracter mariage  ou l'homme qui  à cet âge  peut obtenir dispense pour le contracter  ne peuvent alors disposer (art  903) que par donation simple ou par donation réciproque  faite par contrat de mariage et avec le consentement et l'assistance de ceux dont le consentement est requis pour la validité de leur mariage (art  1095)  auquel cas la loi leur permet de donner tout ce que l'époux majeur peut donner à son conjoint   Que ce consentement cette assistance sont indispensables à tout mineur  qui veut  par contrat de mariage  faire une donation simple ou réciproque à son conjoint (art  1095)   Qu'à l'âge de seize ans  les époux peuvent tester   mais que leur capacité de disposer ne peut (sauf le  droit de donner par contrat de mariage  dérivant pour eux de l'art  1095)  être exercée que par testament  et jusqu'à concurrence seulement de la moitié des biens dont la loi permet au majeur de disposer (art  904)  Enfin  que les époux majeurs peuvent  soit par contrat de mariage  soit par testament  se donner  s'ils ont des enfans  un quart de leurs biens en propriété  Et Décisions diverses  197  et un quart en usufruit  et  s'ils n'ont point d'enfans ou descendans  tout ce dont ils pourraient disposer en faveur d'un étranger  et en outré l'usufruit de la totalité de la portion dont la loi prohibe la disposition au préjudice dé l'héritier (art  1094)   Que de cet ensemble il résulte évidemment que le législateur a voulu protéger  soit par la surveillance dont il lés a entourés au moment de leur contrat de mariage  soit par la limite assignée à la quotité de biens dont ils peuvent disposer  les époux mineurs contre l'inexpérience de leur âge et la séduction dont ils pourraient facilement être victimes    Et attendu que  tel étant l'objet incontestable des précautions et des restrictions imposées par le législateur aux époux mineurs  prétendre que ce même législateur a  par l'art  1094 du Code civil  attribué dès l'âge de seize ans  aux époux mineurs (dont cet article ne parle pas)  autant de droit qu'aux époux majeurs  ce serait méconnaître également le texte de la loi et son esprit   Attendu enfin que de ce qui précède  dérive la conséquence que Suzanne Dutheil  femme Claux  qui a testé et est décédée en minorité  n'a pu donner à Jean Claux  son époux   que la moitié de sa succession    Met l'appel et ce dont est appel au néant   émendant  réformant et faisant ce que les premiers juges auraient dû faire  réduit la disposition universelle dont s'agit  faite par le testament du 8 juillet 1818  à la moitié en pleine propriété de la succession de la testatrice  ordonne en consequence le partage de ladite succession  en deux lots  dont l'un sera attribué à Jean Claux  héritier institué  et l'autre aux héritiers naturels de la testatrice   ordonne que les dépens  tant de première instance que d'appel  seront pris sur la succession  comme frais de partage  sauf le coût de l'arrêt auquel l'intimé est condamné  et pour l'exécution du présent arrêt  renvoie la cause et les parties devant le tribunal de première instance de Tulle  fait la mainlevée de l'amende   "; 15 janvier 1822. ; Cour royale de Limoges. ;https://gallica.bnf.fr/ark:/12148/bpt6k5737538v/f200.image;1822157
1822158;201;"    Attendu que l'art  557 du Code de procédure accorde à tout créancier la faculté de saisirarrêter  entre les mains d'un tiers  les sommes et effets mobiliers appartenant à son débiteur  et que l'héritière sous bénéfice d'inventaire n'a pas (sauf l'avantage de ne pas confondre ses biens personnels avec ceux de l'hérédité plus de droits ou de priviléges que l'héritier pur et simple   Qu'à la vérité l'héritier bénéficiaire est chargé d'administrer  d'administrer biens dé la succession (art  803 du Code  civil)  mais dans l'objet indiqué par l'art  808  de  de payer les créanciers à mesure qu'ils se présentent   lorsqu'il n'y a pas d'opposition et qu'il serait au moins  extraordinaire que l'héritier qui ne pourrait refuser la  somme dont il s'agit au créancier qui se présenterait  pour la recevoir  pût empêcher ce même créancier de  la saisir dans les mains d'un tiers et d'en obtenir la  main levée    Que la dame de Marcillac ne justifie pas que  la somme arrêtée soit nécessaire pour pourvoir aux frais de l'administration de l'hérédité  qu'il n'a point été fait d'opposition entre ses mains  qu'il n'est pas prouvé que la somme arrêtée soit particulièrement affectée à une classe de créanciers hypothécaires ou privilégiés  et que d'ailleurs on ne peut exciper des droits d'un  "" V  tom  15  1  155   tom  30  2  242   198  Lois  tiers   infirme le jugement dont est appel et déclare la saisie arrêt valable   "; 19 avril 1822. ;Cour royale de Bordeaux.;https://gallica.bnf.fr/ark:/12148/bpt6k5737538v/f201.image;1822158
1822159;207;LA COUR    Attendu que  d'après tes dispositions formelles des lois anciennes  comme des lois nouvel  l'es  les communes ne peuvent ester en jugement  tant et demandant qu'en défendant  qu'après y avoir été autorisées par l'autorité administrative  soit sur leur propre demande  soit sur celle des tiers qui veulent introduire contre elles une action en justice   que ces principes  qui sont d'ordre public  et qui dérivent de l'état de minorité ou sont placées les communes  et de la protection spéciale qui leur est due à ce titre sent  consacrés par une jurisprudence constante et invariable  et qu'il ne peut y être dérogé  que dans les cas clairement et expressément déterminés par des lois d'exception  et que le sieur Gazelles a lui même rendu hommage à ces principes   lorsque  dans l'exploit signifié à sa requête  le 25 juillet 1818  à la commune de Montagnac  dans la personne de son maire  il lui a donné un délai de quinzaine  afin qu'il eût le temps d'obtenir l'autorisation administrative dont il conteste maintenant la nécessité    Attendu que la commune de Montagnac n'a pas été autorisée à défendre à l'action introduite contre elle devant le tribunal de Béziers par le sieur Gazelles  le 15 juillet 1818  qu'il résulte de l'exploit de ce dernier  en date dudit jour  que le sieur Cazelles entendit agir  et agit en effet de son chef  par voie principale  et même en motivant son action sur ce que le ministère public n'avait fait aucune des poursuites auxquelles semblait l'obliger la loi du 10 vendémiaire an 4  qu'il intenta directement contre la commune de Montagnac une action mobilière en paiement de sommes qu'il prétendit lui être dues à titre de restitution et de dommngesintérêts   et dont il détermina lui même le montant  sans s'arrêter aux évaluations faites eu 1815 par l'autorité administrative  comme étant inférieures aux pertes qu'il avait éprouvées   et que  se présentant ainsi avec le caractère d'un véritable créancier  il était tenu de se pourvoir  avant toute poursuite  devant l'autorité administrative  pour en obtenir l'autorisation voulue par l'édit du mois d'avril 1683 et par l'arrêté du 17 vendémiaire an 10   Attendu qu'il n'y a pas moyen de soutenir que la citation du 25 juillet 1818 n'ait pas introduit une instance nouvelle  et qu'elle n'ait été qu'accessoire aux poursuites dont le tribunal de Béziers était depuis Iongtemps saisi par suite de l'envoi des procès verbaux et des autres actes de l'autorité administrative qui avait été fait en 1815 au procureur du roi près ledit tribunal  qu'il est bien vrai que cet envoi avait pour but  et paraissait devoir produire l'effet de provoquer des poursuites d'office de la part du ministère public contre la commune de Montagnac  mais que de là que le procureur du roi acquit par cet envoi les moyens de poursuivre  on ne peut pas conclure que la tribunal de Béziers ait été nanti desdites poursuites  lorsqu'il est prouvé que le procurenr du roi a gardé dans son cabinet les pièces qui lui furent envoyées en 1815  sans en faire aucun usage  et qu'il n'a adressé au tribunal aucune  demande  aucune réquisition qui ait pu le saisie de l'affaire  et le mettre à même d'y statuer   que l'inaction absolue du procureur du roi est reconnue par le sieur Gazelles lui même  qui s'en est plaint comme d'un déni de justice  et qui n'a pas en d'autre motif pourrintroduire de son chef une action que le  ministère public ne se mettait nullement en peine d'exercer  que lorsque  par suite de l'instance engagée directement par le sieur Gazelles  le procureur du roi a rompu le silence absolu qu'il gardait depuis l'envoi des pièces administratives  ce magistrat n'a parlé que pour réclamer en faveur de la commune de Montagnac   204 Lois  défaillante  l'autorisation d'ester en jugement  prescrite par les lois  qu'il n'existait donc pas d'instance contre la commune de Montagnac devant le tribunal de Béziers avant la citation du 25 juillet 1818  et que le sieur Gazelles ne peut  par conséquent  couvrir le vice de ses poursuites  qui résulte du défaut d'autorisation de la commune de Montagnac  sur le fondement qu'il n'aurait fait qu'intervenir dans une instance préexistante où cette autorisation n'était pas requise  Attendu que la circonstance  prise de ce que le sieur Gazelles fondait sa demande sur les dispositions de la loi du 10 vendémiaire an 4  relative à la responsabilité civile des communes  ne l'affranchissait pas de l'observation de la formalité essentielle cl d'ordre publie qui est proscrite  tant par l'édit de 1683  que par l'arrêté du 17 vendémiaire an 10  et cela par plusieurs raisons également décisives   Qu'en premier lieu  sans rien préjuger sur l'existence ou l'abrogation de la loi du 10 vendémiaire an 4  question qui appartient au fond de la cause  dont la Cour n'a pas a s'occuper  cl  en supposant même que cette loi  toute d'exception et de circonstance  soit encore en vigueur  il faut reconnaître qu'elle détermine des formes spéciales de procédure pour les poursuites d'office dont elle charge les autorités administratives cl judiciaires   mais qu'elle ne s'occupe nullement des formes à suivre dans le cas où la partie lésée agit directement cl en son nom contre la commune qu'elle veut rendre passiblel des réparations et dommages intérêts résultant de délits commis sur son territoire  que  dèslors  dans ce dernier cas  la partie lésée ne trouvant rien dans la loi sur laquelle est basée l'action qu'elle prétend exercer qui prescrive  en ce qui la concerne  des formes particulières  est astreinte à suivre la marche de la procédure ordinaire   Qu'en second lieu  la loi du 10 vendémiaire an 4   considérée comme loi spéciale et de haute police  est éminemment une loi d'exception  qu'on ne pourrait étendre à des cas qu'elle n'a pas expressément prévus et déterminés  sans violer ouvertement les principes les plus positifs et les plus tutélaires de notre législation   or  qu'on étendrait évidemment les dispositions déjà si rigoureuses  pour ne rien dire de plus  de celte loi  si l'on soumettait les parties privées à des formes de procédure qui n'ont été établies que pour les poursuites d'office de la partie publique  etqui dérogent d'une manière aussi essentielle au droit commun  qu'à la vérité  le Conseil d'Etat  par un avis du 12 mai  approuvé le 1er  juin 1807  a décidé  que nonobstant l'article 1041 du Code de proc  civ   les formes de procédure établies par des lois spéciales doivent continuer d'être observées  quoique dérogeant aux lois générales  mais qu'il résulte seulement de cet avis  que les lois spéciales doivent être suivies  quant à la forme de procéder  et dans l'intérêt du gouvernement  lorsqu'elles déterminent elles mêmes cette forme  et dans les seuls cas pour lesquels elles l'ont expressément prescrite   qu'ainsi  et à l'égard de la loi du 10 vendémiaire an 4  supposé qu'elle soit encore en vigueur  les autorités administratives et judiciaires  aynat à en faire l'application   l'application  devraient se conformer au mode de procéder qu'elle détermine  et selon lequel il n'est certes pas besoin que les communes soient autorisées à ester en jugement   puisque   loin de les appeler en cause   on doit alors procéder contre elles en leur absence  et sans qu'elles soient admises à se défendre  mais qu'il n'en saurait être ainsi  lorsque   comme dans l'espèce la partie lésée  voyant que le ministère public demeure dans l'inaction  au lieu de provoquer l'exercice des poursuites d'office qui lui sont dévolues par le recours à l'autorité supérieure  se décide à engager de son chef une instance contre la commune repsonsable  et qu'exerçant  dans ce cas  une action purement privée  et dans son intérêt seul  ne trouvant  d'ailleurs  dans la loi dont s'agit que le principe de celle action au fond  sans aucune forme spéciale relativement à son exercice  il est évident que la partie lésée doit se conformer au droit commun  en faisant autoriser la commune contre laquelle il agit    Qu'en troisième lieu   il est incontestable   et on en demeure d'accord  que s'il était intervenu d'office   cl sur les seules réquisitions du ministère public  un jugement de condamnation contre la commune de Montagnac  celle ci aurait eu le droit  malgré le silence de la loi du 10 vendémiaire an 4 à cet égard  de former opposition à ce jugement  ou d'en interjeter appel  qu'il est aussi incontestable que la commune n'aurait pu faire usage de l'un ou de l'autre moyen  surtout envers la partie lésée  qu'avec l'autorisation préalable du conseil de préfecture  qu'elle aurait dû provoquer dans ce cas  en sa qualité de demanderesse   mais que ces deux propositions étant admises  il serait bien singulier et bien étonnant que le sieur Gazelles   poursuivant lui même le jugement avec la commune de Montagnac par une instance régulière et privée  ait pu légitimement s'affranchir du recours préalable à l'autorité administrative   et se dispenser  en attaquant la commune  de l'accomplissement d'une formalité sans laquelle la commune elle même n'aurait pu agir contre lui par voie d'apposition ou d'appel   Attendu  enfin  que la nécessité de l'autorisation des communes  même relativement à l'application de la loi du 10 vendémiaire an 4  a été formellement reconnue et consacrée par le Conseil d'Etat  notamment par son arrêté du 12 brumaire an 11  relatif à deux jugemens du tribunal de première instance de Fontenay  et plus récemment par une ordonnance royale  aussi rendue en Conseil d'Etat le 8 juillet 1819  dans la cause du sieur Guy contre la commune d'Agde    Attendu qu'il suit des motifs ci dessus  qu'il a été bien jugé par le tribunal de Béziers  et que le jugement par lui rendu dans la présente cause  le 23 novembre 1818  doit être confirmé  etc     Par ces motifs   procédant eu vertu du renvoi à elle fait par l'arrêt de la Cour de cassation  en date du 19 novembre 1821  et vidant ledit renvoi  vidant aussi le renvoi au Conseil  a démis et démet le sieur Gazelles de son appel du jugement rendu par le tribunal de Béziers  le 23 novembre 1818  a ordonné et ordonne que ledit jugement sorte son plein et éîtier effet  Et Décisions diverses  200  ; 5 mars 1822. ; Cour royale de Toulouse;https://gallica.bnf.fr/ark:/12148/bpt6k5737538v/f207.image;1822159
1822160;210;LA COUR     Attendu  sur la fin de non recevoir proposée par les intimés  tirée de ce que l'interdit ne pouvait procéder en justice  et qu'ainsi il n'a pu introduire l'action en main levèe de l'interdiction prononcée contre lui  que de la combinaison des art  512 du Code civil et 891 du Code de procédure civile  il résulte évidemment que  lorsqu'il y a cessation des causes de l'interdiction  il y a lieu à en demander la main levée  et qu'il serait absurde et barbare d'interdire aux malheureux les moyens de réclamer ce droit   Considérant que ce serait d'autant plus dangereux dans le procès actuel  que l'interdit a pour tuteur et subrogé tuteur les deux maris de ses soeurs  qui  étant ses successibles  sont interessés à empêcher qu'il reprenne l'administration et la disposition de ses biens  Qu'ainsi  loin de l'écarter par cette fin de non recevoir  la justice doit lui tendre une main secourable  sauf à voir si  comme on le dit  les causes de son interdiction ont cessé   Considérant que de ce qui vient d'être dit il résulte que la fin de non récevoir est mal fondée  et qu'il y a lieu à faire droit sur l'appel du jugement qui  se bornant à l'admettre  n'a pas prononcé sur le fond du procès  qui  si cette exception eût été réjetée  était sur le point de recevoir une décision définitive   Par ces motifs  sans s'arrêter à la fin de non recevoir opposée par les intimés  dans laquelle ils sont déclarés mal fondés  fait droit de l'appel interjeté par Jean Audy  du jugement du tribunal de Bergerac  du le août 1816  émendant  déclare Audy recevable dans son appel  et  statuant sur le fond  etc   ; 8 mars 1822. ; Cour royale de Bordeaux. ;https://gallica.bnf.fr/ark:/12148/bpt6k5737538v/f210.image;1822160
1822161;212;LA COUR    Attendu que la maxime fructus augent hoereditatem ne s'applique qu'au cas où un individu jouit en seul et sans titre particulier d'une succession dévolue à plusieurs  que cette maxime ne s'applique nullement à celui qui jouit en vertu d'un titre qui lui confère la qualité d'héritier général et universel   que   quant à ce dernier  et bien que le titre soit nul  si  d'ailleurs  le possesseur est de bonne foi  et qu'il ignore la nullité de son titre  il fait les fruits siens  tant que cette bonne foi et cette ignorance subsistent  que telle est la jurisprudence constante du parlement de Toulouse  que l'art  550 du Code civil la consacre formellement  et qu'il ne distingue point entre le testament ou tous autres titres   Attendu que  clans l'espèce  la bonne foi de Bernard Baladie n'est pas douteuse  qu'il était en pupillarité quand son père décéda  que   devenu majeur  il continua à jouir sur la foi qu'il était héritier de son père  qu'il traita en cette qualité avec ses soeurs  et que ses soeurs lui reconnurent celle même qualité  qu'il parait même que Bernard Baladie n'avait jamais lu le testament de son père   etc    D'après ces motifs   réformant le jugement du 31 mai 1820  demeurant l'offre du sieur Bernard Baladie de restituer les fruits perçus sur les biens paternels   mais seulement  à compter du 19 septembre 1819  jour de l'introduction de l'instance   relaxe le sieur Baladie de plus amples demandes  etc  »  ; 6 juillet 1821. ; Cour royale de Toulouse. ;https://gallica.bnf.fr/ark:/12148/bpt6k5737538v/f212.image;1822161
1822162;215;LA COUR     Attendu que la disposition du jugement du 21 février dernier   conformé   sous ce rapport  au testament du père des intimés   et suivant laquelle leur oncle a été admis a réclamer l'expédition des immeubles a lui légués   n'est point querellée   que   dès lors  le sieur de Ribaut oncle doit profiter de l'entier legs  sauf si la libéralité qu'il renferme excédait le quart de la succession  Que le don gratuit fait par le testateur à son frère ne se compose que de l'excédant de la valeur des deux métairies sur les 34 000 fr  qui étaient auparavant  dus au légataire   que le testament n'a pas effectivement donné à ce dernier la partie de la Valeur de ces immeubles correspondant à cette dernière somme   qu'il suit de là que les deux métairies dont s'agit ne devaient être ébréchées que tout autant qu'elles dépasseraient la quote disponible   distraction préalablement faite sur leur valeur de la somme de 34 000 fr   etc    Par ces motifs  sans avoir égard à la demande en rejet proposée par les intimes   disant  au contraire   droit sur l'appel dû sieur de Ribaut oncle   envers le jugement du 21 février dernier  et le réformant  quant a ce   a ordonné et ordonné que les experts chargés de procéder à l'exécution des jugemens  des 13 mai 1819 et 21 février dernier  ne retrancheront les deux métairies léguées qu'à concurrence de ce que leur valeur   distraction préalablement faite sur icelles de la somme de 34 000 fr   pourrait excéder là quotité disponible  c'est à dire  le quart de la succession de feu JosephFrançois de Ribaut  en telle sorte  que cette réduction  le cas y échéant  ne frappe que sur la portion desdites métairies que le testateur se trouve avoir réellement et gratuitement donnée à son frère au dessus des 34 000 fr  dont ce dernier se trouvait son créancier avant le testament   ; 24 janvier 1822. ; Cour royale de Toulouse. ;https://gallica.bnf.fr/ark:/12148/bpt6k5737538v/f215.image;1822162
