id;arrêt;date;juridiction;lien;id
188206300;"« Le Tribunal,   « Attendu que le 12 décembre 1879, il a été constaté  que la plupart des marchandises garnissant la boutique  occupée p r Béliard dans la maison sise rue de Rambu- teau, 46, et consistant en galons et tresses d'or et d'ar- gent ont été avariées ; que Béliard s'étant immédiate- uieiit pourvu en référé pour faire procéder à la  constatation régulière de ces dégâts et en rechercher les  causes, dès le 15 décembre, même mois, Boutmy, ex- pert commis par ordonnance en date du 13 décembre, a  procédé auxdites constatations ;   « Attendu qu'il résulte du rapport par lui dressé le 3   juin 1880, que 1 analyse chimique à laquelle il a été   procédé démontre que les détériorations subies par les  marchandises du demandeur sont le fait d'une sulfura- tion et qu'il n'existait pas d'autres causes possibles de  cette sulfuration que celle résultant de l'action des gaz  sortis de la fosse de la maison n° 48 et dont la vidange  a été opérée par la Compagnie Parisienne de Vidanges  et Engrais dans la nuit du 11 au 12 décembre ;   « Attendu que, par suite de la réglementation à la-  quelle se trouve soumis le service de la vidange par  l'ordonnance de police du 29 novembre 1854, les entre- preneurs de vidange sont tenus de prendre les mesures  propres à prévenir les su'furations pouvant résulter du  dégagement des gaz et à assurer la désinfection de la   fosse ;   « Que la compagnie défenderesse n'établit pas que  les précautions par elle prises lors de la vidange de la  fosse de la maison rue de Rambuteau, n° 46, aient été   suffisantes ;   « Qu'il a été reconnu par l'expert que les désordres   par lui constatés ne peuvent être attribués à l'action du   gaz d'éclairage;   « Que ses affirmations à cet égard empruntent une  nouvelle force à la constatation des mêmes effets sur les  dorures existant dans la boutique du sieur Million, coif- feur, habitant la même maison ou s'opérait la vi-  dange ;   « Qu'il importe peu que les matières extiaites de la   fosse aient été ou non déversées sur la voie publique  par suite de l'insuffisance des voitures de transport;   « Qu'il est sans intérait de vérifier les allégations du   demandeur à cet égard   « Que les constatations faites suffisent pour déterminer   la cause des pertes subies par Béliard, à établir la res- ponsabilité de la compagnie Parisienne des vidanges et   engrais ;   « Attendu que le Tribunal a les éléments nécessaires   pour apprécier le préjudice causé, que l'expert en a  évalué l'importance à la somme de 5,960 francs 90 cen-  « Par ces motifs,  « Entérine le rapport de l'expert Boutmy, condamne   la compagnie Parisienne des vidanges et engrais à payer   à Béliard à titre de dommages et intérêts, la somme de  5,960 francs avec les intérêts de droit ;   a Condamne ladite compagnie aux dépens y compris   les frais de référé et d'expertise ;   La compagnie parisienne des Vidanges interjeta   appel de citte décision.   Elle soutint qu'aucune faute ne saurait lui êlre   JUS";24 mai;COUR D'APPEL DE PARIS 2* chambre;http://www.enap.justice.fr/ARCHIVE/ENAP_GAZETTE_TRIBUNAUX_18820630.pdf;188206300
188206301;"« La Cour,   « Ouï le rapport de M. Saint-Luc-Courborieu, conseil-  ler, et les conclusions de M. Tappie, avocat-général;   « Joint les pourvois comme connexes et statuant par   un seul et même arrêt ;   i &n ce qui concerne le pourvoi contre l'arrêt du   31 mai ;   * Attendu qu'en rejetant les conclusions à fins du   sursis fondées sur IVxUtence d'une demande en renvoi  pour cause de suspicion légitime, par les motifs que cette  demande n'avait pas donné lieu à un arrêt de fait com- muniqué rendu par la Cour de cassation, la Cour d'ap- pel a statué conformément aux dispositions des articles   551 et 531 du Code d'instruction criminelle ;   « Sur le pourvoi dirigé contre l'arrêt du 1er juin ;   « Attendu qu'en déclarant l'appel interjeté contré le   jugement du 23 mars 1881, non recevable, conformé-  ment à l'article 9 de la loi du 29 décembre 1875, l'arrêt  attaqué n'a fait qu'une exacte application de cet article  qui était en vigueur au moment où cet appel contre un  jugement incident était intervenu avant l'appel contre le  jugement sur le fond;   « En ce qui concerne l'étendue de la preuve offerte   par les prévenus ;   a Attendu qu'aux termes de l'arlicle 24 de la loi du   26 mai 1819, comme d'après les dispositions des arti- cles 35 et 52 de la loi du 29 juillet 1881, la preuve au- torisée contre les fonctionnaires publics ne peut être au- tre que celle du fait diffam„toire qui a motivé la pour- suite, sauf le cas d'indivisibilité (qui n'est pas celui de  l'espèce) entre le fait poursuivi et les autres faits im- putés ;   « Attendu qu'en jugeant dans ce sens, la Cour d'ap-  pel n'a fait qu'une exacte application des règles les plus  certaines de la matière ;   « Attendu, d'ai leurs, que les arrêts sont réguliers   imputée; qu'elle s'était conformée aux règlements   dans leur forme ;   en désinfectant au préalable la fosse, et qu aucune   contravention n'avait été relevée contre ehe par les   « Rejette les deux pourvois de Paul Genay, gérant du   journal la Lanterne et le condamne à l'amende et aux   inspecteurs de la salubrité.   M. Béliaid conciut à la confirmation du juge-  frais, etc.;   « Ordonne, etc. »";23 juin;COUR DE CASSATION chambre criminelle;http://www.enap.justice.fr/ARCHIVE/ENAP_GAZETTE_TRIBUNAUX_18820630.pdf;188206301
188207010;"« Le Tribunal, sans s'arrêter à la demande en liqui-  dation et partage de la succession de feue Anna  Joder, femme Klopfenstein, laquelle est rejetée comme  mal fondée;   « Déclare recevable l'action en rescision formée par le   demandeur, pour cause de lésion de plus du quart contre,  la donation portant partage en date du 19 juin 1864, et  contre les deux actes qualifiés de vente, en date du 21   du mêmê mois ;   « Et avant de statuer au fond sur cette action, dit et   ordonne que par trois experts, etc. »";11 février;COUR D'APPEL DE BESANÇON ;http://www.enap.justice.fr/ARCHIVE/ENAP_GAZETTE_TRIBUNAUX_18820701.pdf;188207010
188207020;"« Le Tribunal,  « Attendu que la somme de 2,076 francs, dont le de-  mandeur réclame le paiement, représenie le montant des  contributions des portes et fenêtres, s'apphtuanf aux di- vers locaux occupés par Guérin, à titre de locataire,  dans la maison sise à Paris, rue du Petit-Carreau, 26,  appartenant à de Nugent, et qui auraient été soldées par  celui ci pour le comote et en ('acquit de son locataire,  depuis le 1er juillet 1859, date à laquelle remonte l'en-  trée en jouissance des lieux loués ;   « Attendu que, s'il est de principe que les contribu-  tions des portes et /fenêtres sont à la charge du pre- neur , si, par suite, Je bailleur, qui en fait l'avance, peut  en réclamer le remboursement à ce dernier, ce n'est  qu'autsnt qu'il n'a pas été dérogé à cette règle, soit  explicitement/soit implicitement par des conventions   particulières;  "" « Attendu qu'aucun des baux successivement consentis  par de Nugent à Guérin, à partir du 2o février 1859, et  comprenant les ateliers, magasins, et autres locaux af- fermés à l'exercice de la profession d'imprimeur, n'a rap- pelé, parmi les charges accessoires du bail, l'obligation   d'acquitter les contributions dont il s'agit;   « Que ce n'est que par le bail du 17 février 1877,   qu'il a été stipulé que le preneur serait tenu, indépen- damment des charges de ville et de police auxquelles  les locataires sont ordinairement assujettis, de payer au  bailleur une somme de 40 francs par quart, aux  échéances du terme de loyer, ladite somme, fixée à for- fait, d'un commun accord, s'appliquant spécialement à  l'impôt des portes et fenêtres, pour les quatre magasins   f du bail du 17 février ci-dessus rappelées ;   j « Qu'il n'a été fait, lors desdits paiements, aucune  I réserve en ce qui concerne les contributions pouvant   s'appliquer aux autres locaux et qui se trouvent com- prises dans la somme de 2,076 francs formant l'objet de   la demande ;   « Attendu que les réserves faites, soit lors du paie- ment dn terme échu le 1er janvier 1878, et postérieure- ment, de même que celles contenues dans le bail du 17  février 1877, si elles sont exclusives de la renonciation  du bailleur au droit de réclamer le remboursement des  autres contributions pouvant être à la charge du preneur  ne peuvent impliquer de la part de celui-ci la reconnais- sance de l'obligation d'opérer ce remboursement ;  qu'elles ne peuvent donc suffire en elle-même pour éta-  blir le bien fondé de la demande ;   « Attendu qu'il résulte de l'ensemble des faits ci-  dessus rappelés et des documents de la cause que, dans  l'intention commune des parties, Guérin a été affranchi,  par les divers baux à lui successivement consentis, de  l'obligation de conserver à sa charge le paiement des   contributions des portes et fenêtres;   « Que c'est par suite de l'interprétation ainsi donnée   par de Nugent lui-même, par l'absence de toute récla- mation en ce qui encerne iesdites contributions, au bail  originaire, que lors des renouvellements successifs dudit  bail, le prix du loyer a été fixé ;   « Que cette circonstance, les stipulations du bail du  17 février 1877, dans leurs termes restreints, rapprochés  du silence des baux antérieurs, l'absence de toute récla- mation pendant près de vingt années, le défaut d'indi- cation précise du chiffre des contributions payées chaque  année, établissent suffisamment qu'il a été dérogé par  les parties à la règle prescrite par l'article de la loi du   4 frimaire an Vil ;   « Qu'il devient, dès lors, inutile de rechercher si, une   imprimerie, pouvant être classée parmi les établissements  industriels exempte, aux termes de l'article 19 de la loi  du 4 germinal an XI, de la contribution des portes et  fenêtres, le demandeur, en négligeant, soit de se pourvoir  dans le délai fixé par l'article 28 de la loi du 21 avril  1832, pour obtenir une décharge, ou de mettre Guérin  en demeure d'exercer ce recours, a commis une faute  rendant, dans tous les cas, l'action en répétition par lui  aujourd'hui introduite, non recevable;   « Par ces motifs,  « Déclare de Nugent mal fondé dans sa demande ;  « L'en déboute ;  « Et le condamne aux dépens. »";1er avril, ;COUR D'APPEL DE PARIS 3' ch;http://www.enap.justice.fr/ARCHIVE/ENAP_GAZETTE_TRIBUNAUX_18820702.pdf;188207020
188207030;"« La Cour,   « Donne acte au sieur et à la dame Viguier de   ce,   qu ils déclarent reprendre l instance pondante sur 1  qu'ils déclarent reprendre l'instance pondante sur   pel interjeté par Trouillard en sa qualité de tuteur du   sa fille mineure Marguerite, aujourd'hui majeure, é/fuse   Viguier ;   « Considérant qu'aux termes d'une police d/?surance   sur la vie, contractée à Paris le C juillet 187r^t à .San-  tés le 11 du même mois, la compagnie la jfetionale s est   engagée à payer, au décès de la djine T^nillard, à ses   enfants, ou à son ordre, la somme d/ 50,000 francs,   moyennant le versement d'une prime annuelle de 1,440   francs; f   « Que, le 25 juillet de la même-année, la dame Trouil-  lard a transféré à Hedin, sur ladite somme de 50,000   francs, celle de 23 000 francs/se réservant la libre dis-  position des répandions de# bénéfices;   « Que le double de la police qui se trouvait en la   possession de ladite damo, égaré en 1873, n'a pu ê   retrouvé ;   tOIR D'APPEL DE PAR";22 mai;COUR DE CASSATION ch;http://www.enap.justice.fr/ARCHIVE/ENAP_GAZETTE_TRIBUNAUX_18820703.pdf;188207030
188207050;« La Cour,  « Statuant sur le pourvoi  avocat, pour le sieur Robe, en  la Cour d'appel d'Alger, re»;20 juin;COUR DE CASSA HON ch;http://www.enap.justice.fr/ARCHIVE/ENAP_GAZETTE_TRIBUNAUX_18820705.pdf;188207050
188207060;« Le Tribunal,  a En ce qui louche le chef de demande à tin de sup-  pression de billard :   a Attendu qu'i! résulte des débats que le 28 juin 1878,  la compagnie Immobilière, actuellement représentée par  Potier, a consenti à Maluouiy, aux droits duquel se  trouve Pescaut un bail sous seings privés, enregistré à  Paris, le 29 juin suivant, par lequel el e lui loua i uu  . magasin et dépendances, dans la maison sise à P.iri-s  ! rue de Marignon, li, à la charge par lui de ne pouvoir   TIO;27 juin;TRIBUNAL CIVIL DE LA SEINE 6e ch;http://www.enap.justice.fr/ARCHIVE/ENAP_GAZETTE_TRIBUNAUX_18820706.pdf;188207060
188207070;"« Le Tribunal,  « Attendu que Varnier a fait assigner Patoux, pour   le faire condamner à lui payer des dommages intérêts,  en réparation du préjudice qu'il lui avait causé, en pre- nant à la source de Sermaize, une quantité de bouteilles  d'eau supérieure à celle, d'après lui, qu'il avait droit  d'en emporter;   « Attendu que Varnier par actes reçus Chevillion, no-  taire à Sermaize, des 18 juin 1874 et 5 janvier 1878, est  devenu concessionnaire d'une source minérale, apparte- nant à la communauté de Sermaize;   « Qu'il est inutile pour la cause d'examiner les diver-  ses clauses et conditions de ces actes, à l'exception de  l'article 10 du contrat de 1874, lequel article est ainsi  conçu :   « Les habitants de Sermaize auront le droit de prendre   « l'eau nécessaire à leur usage personnel et journalier,  « ainsi que par le passé. »";1er juillet;COUR D'APPEL DE PARIS 4e ch;http://www.enap.justice.fr/ARCHIVE/ENAP_GAZETTE_TRIBUNAUX_18820707.pdf;188207070
188207071;"« La Cour,   * Sur les conclusions principales,  « Considérant que si le contrat * concession de la   source minérale de Sermaize fait â Varnier par la com- mune oblige les habitants de la commune à l'exécuter  de bonne foi, et s'il ne leur permet pas d'user du droit  de puisage qui leur a été réservé pour leur usage per- sonnel de manière à porter préjudice au concessionnaire,  il incombe à ce dernier de faire la preuve de l'abus ou  de la fraude qu'ils auraient pu commettre à ce sujet ;  que dans l'espèce, quelque graves que soient les pré- somptions qui savent à l'encontre de Patoux et qui  tiendraient à étftblir que le 31 mai 1880, la quantité  d'eau qu'il a puisée à ladite source et qu'il a emportée  chez lui, dépassait celle qui était nécessaire à son usage  personne^, elles doivent cependant être considérées  comme ile formant pas une preuve suffisante;   « En ce qui concerne les faits articulés, et lors même   qu'ils seraient établis, ils ne seraient pas de nature à  constituer la preuve exigée, que dès lors ils ne sont pas   pertinents ;   « Par ces motifs,  « Sans s'arrêter ni avoir égard à la demande d'en-  quête infirme ;   contre lui prononcées ;   « Emendant, décharge l'appelant des condamnations   « Et statuant à nouveau,  « Déclare Varnier mal fondé dans sa demande, l'en   déboute ;   « Ordonne la restitution de l'amende.  « Et condamne l'intimé aux dépens de première ins-  tance et d'appel. »";1er juillet;COUR D'APPEL DE PARIS 4e ch;http://www.enap.justice.fr/ARCHIVE/ENAP_GAZETTE_TRIBUNAUX_18820707.pdf;188207071
188207072;"« Le Tribunal joint les demandes vu leur connexité   et, statuant par un seul et même jugement :   '« Attendu que les testaments dont Guillaume et con- sorts demandent l'exécution sont argués de nullité par   les héritiers Lemaire, principalement comme n'émanant  pas du prétendu testateur et subsidinirement comme étant  le produit de la démence;   « Attendu, sur ks conclusions principales desdits hé- ritiers, qu'en présence d'une dénégation d'écriture, les  Tribunaux ne sont pas tenus de recourir à la procédure  organisée par l'article 193 etsuivants, du Code de procé-  dure civile ; qu'il* ont le droit de procéder eux-mêmes à  ia vérification à l'aide des éléments qu'ils peuvent puiser  dans les documents de la cause ;   « Attendu, quant au testament du 26 avril 1876, que   l'écriture en est conforme à celle de la lettre non sus- pecte adressée par le de cujus au maire de Valenciennes,  le 8 septembre 1875 et dont ledit testament n'est d'ail- leurs que le complément et l'exécution ; que si l'on rap- proche notamment de certains mots de la lettre les mots  semblables qui figurent dans le testament, tels que les- mots : « Paris, ma ville natale m ; si l'on compare dans  les dimx écrits la forme du « J * et du « P »";18 avril;TRIBUNAL CIVIL DE LA SEINE 1™ ch;http://www.enap.justice.fr/ARCHIVE/ENAP_GAZETTE_TRIBUNAUX_18820707.pdf;188207072
188207080;"« Le Tribunal, jugeant en premier ressort d office   avec la dame Houdon, défaillante;   « Déclare nulle-et de nul effet à l'égal de la faillite   Houdon l'acte d'obligation passé devant M0 Thomas, no-  taire à Montrouge, le 5 juillet 1878 ;   « Dit que la subrogation consente par la dame Hou-  don au profit de Roze, dans l'e4'et de son hypothèque   légale par l'acte susénoncé, est nulle et de nul elfet  tant à l'égard de Roze qu'à i"" égard de la dame Houdon,  et qu'ils n'ont droit à ai^une action résultant de cette  hypothèque et de la subrogation, au préjudice de la   masse des créanciers de la faillite Houdon ;   « Dit et ordonne que sur le vu du présent jugement,  le conservateur des hypothèques du départemedt de la  Seine, troisième bureau, sera tenu de radier l'inscrip- tion de cette hypothèque légale au profit de Roze comme  subrogé, prise audit troisième bureau des hypothèques  du département de la Seine, du 19 juillet 1878, volume  781, numéro 91, à quoi faire sera le dit conservateur  contraint, même à l'égard de la dame Houdon, quoi   faisant bien et valablement déchargé ;   « Condamne Roze et la dame Houdon par les voies   de droit eu tous les dépens. »";8 juin;COUR D'APPEL DE PARIS 2* chambre;http://www.enap.justice.fr/ARCHIVE/ENAP_GAZETTE_TRIBUNAUX_18820708.pdf;188207080
188207090;"« La Cour,  « Sur le moyen unique du pourvoi, tiré de la viola-  tion des articles 1131, 1134, 1172, 1376 et 1780 du  Code civil, et de l'article 7 de la loi du 20 avril 1810;   « En ce qui touche la première branche du moyen ;   « Attendu, en fait,, qu'il résulte de l'arrêt attaqué,   qu'aux termes du règlement de la caisse de prévoyance  de la compagnie défenderesse éventuelle (article 16),  tout employé dont le compte est liquidé souscrit l'enga- gement d'honneur de ne pas porter ses services à une   autre compagnie, et, s'il manque à cet engagement,   toutes les sommes qu'il a reçues peuvent être répétées   JOU";2 mai;COUR DE CASSATION chambre des requêtes;http://www.enap.justice.fr/ARCHIVE/ENAP_GAZETTE_TRIBUNAUX_18820709.pdf;188207090
188207091;« Le Tribunal condamna X... à payer à la demande-  resse la somme de 2,500 francs, à titre de dommages  intérêts. »;17 mai;"COUR D'APPEL DE NIMES 1"" ch";http://www.enap.justice.fr/ARCHIVE/ENAP_GAZETTE_TRIBUNAUX_18820709.pdf;188207091
188207092;« La Cour confirme le jugement attaqué. »;17 mai;"COUR D'APPEL DE NIMES 1"" ch";http://www.enap.justice.fr/ARCHIVE/ENAP_GAZETTE_TRIBUNAUX_18820709.pdf;188207092
188207100;"« La Cour,   Sur la compétence,  a Considérant que la somme de 24,375 fr. 25 c, ré-  clamée par les héritiers Grunstadt à Coste, se décompose  ainsi qu'il suit : 1° 3,000 francs prêtés par Grunstadt à   Coste le 10 juillet 1874, 21,375 fr. 25 c. formant le   solde en principal et en intérêts courus au 31 décembre  1874 d'un compte courant existant entre eux ; et qu'il y  a lieu de distinguer entre ces deux éléments de la  demande ;   « En ce qui concerne les 3,000 francs,  a Considérant qu'il n'est pas allégué que Coste soit   commerçant, qne l'emprunt par lui fait de Grunstadt à  la date susindiquée ne se rattachait à aucun acte com- mercial, a conservé à son égard un caractère civil, et  que dès lors le Tribunal de commerce était incompétent   pour en connaître ;   « En ce qui concerne les 21,375 fr. 25 c.   « Considérant que les négociations qu'a faites Grun-  stadt par les ordres et pour le compte de Coste, n'ont  pas eu pour objet des achats réels de valeurs pour en  opérer la revente réelle, mais seulement des spéculations  fictives devant se résoudre par des différences ; qu'ils  n'ont donc pas constitué des astes de commerce et que  dès lors aussi la juridiction consulaire était incompétente   à leur égard ;   « Annulle le jugement dont est appel ;  « Mais considérant que la matière est disposée a rece-  voir une solution définitive et qu'il y a lieu d'évoquer;   « En ce qui concerne les 21,375 fr. 25 c;  « Sur la violation de l'article 76 du Code de com-  incrcG *   « Considérant que Coste se borne à alléguer que les   opérations auxquelles il s'est livré au cours des années  1866 et 1867, portant sur des effets publics, ont été ac- complies par Grunstadt sans recourir au ministère obli- gatoire d'un agent de change ; qu'à l'appui de cette allé- gation il ne produit ni les bordereaux qui lui ont été  adressés au sujet desdites opérations, m les pièces de  correspondances qui s'y rattachent ; qu'il rerésente seule-  ment l'extrait d'un compte courant mentionnant le résultat   en perte ou bénéfice pour lui de la liquidation de chaque   quinzaine, pendant quelques mois de 1866 et 1867 ; que  ce document est sans signification ni valeur et ne forme  même pas un adminicule de preuve; qu'il s'ensuit que  que Coste ne justifie pas l'exception par lui proposée ;   « Sur l'exception de jeu :   « Considérant qu'il en est autrement pour l'exception   de jeu ; que l'extrait dn compte courant ci-dessus men- tionné, et émané de Grunstadt, suffit à démontrer que  les négociations que celui-ci a effectuées pour le compte  de Coste n'avaient pas trait à l'achat ou à la vente de  valeurs publiques qui aient jamais dû être suivis de levées  ou livraisons de titres, mais qu'elles n'ont été dans l'in-  tention des parties que des spéculations formant des paris   sur la hausse ou la baisse des effets publics et devant se  liquider par le paiement de différences; qu'elles tombent,  en conséquence, sous l'application de l'article 1965 du  Code civil;   « En ce qui concerne les 3,000 francs :  a Considérant que Coste ne peut diviser les documents   dont il se sert; que sur l'extrait du compte courant qu'il  produit et qu'il invoque, et à la suite du débit résult ai  pour lui de ses opérations de Bourse se trouve portée  i enonciation des 3,000 francs qui lui ont été prêtés ipar  Grunstadt à la date du 10 juillet 1874 ; qu'il ne mécon- naît pas que ce prêt lui ait été réellement fait en espè- ces un mandat représentant des espèces, que dans di- verses pièces versées au procès il a accepté comme solde  à sa charge les 24,375 fr. 25, dont les 3,000 francs for- maient l'un des éléments; que par là il a reconnu l'exis- tence de sa dette au sujet de ces 3,000 francs ; qu'il lui  incomberait d'établir qu'il les a payés ; que loin qu'il  fasse cette preuve, tous les faits de la cause démontrent  qu'il ne s'en est point acquitté ; qu'il s'ensuit qu'à con- currence de ladite somme la demande des héritiers  Grunstadt est fondée;   « Dit que les héritiers Grunstadt n'ont aucune action   en justice contre Coste pour le paiement de 21,375 fr. 25  sur les sommes par eux réclamées ;   « Les déclare non recevables dans leur demande de ce   chef, mais les condamne à payer à Coste la somme de  3,000 francs du surplus avec les intérêts de droit ;   « Ordonne la restitution de l'amende ;  « Et fait masse des dépens, tant de première instance   que d'appel pour être supportés, un quart par Coste, et  trois quarts par les intimés. »";22 juin;COUR D'APPEL DE PARIS 4e ch;http://www.enap.justice.fr/ARCHIVE/ENAP_GAZETTE_TRIBUNAUX_18820710.pdf;188207100
