id;arrêt;date;juridiction;lien;id
188203160;"« Le Tribunal,   « Attendu que Tavernier, agent de change près la   Bourse de Paris, a, les 13 et 15 décembre 1881, acheté  pour le compte de M. Audoin -Dubreuil, à l'émission,  cent actions nouvelles de la société de l'Union Générale,  sans exiger de son client, soit le prix de ces actions, soit  une couverture en titres ou en espèces ;   « Que Tavernier a réglé vis-à-vis d'Audoin-Dubreuil,   les liquidations des 15 décembre, 31 décembre et 15  janvier, sans retenir aucune somme pour se couvrir des  opérations restées en suspens jusqu'au jour de l'émission  des titres nouveaux de l'Union Générale; que c'est seule- ment au cours de la liquidation du 31 janvier que Ta- vernier a élevé la prétention de retenir à titre de ga- rantie de l'achat de cent actions nouvelles de l'Union  Générale, une somme de 230,000 francs, dont il offrait  d'ailleurs de payer les intérêts, jusqu'au jour où il au- rait été pris une décision au sujet de cette émission ;   « Attendu que pour justifier la rétention de cette   somme aujourd'hui déposée dans la caisse de la chambre  syndicale, Tavernier soutient tout d'abord qu'il a agi,  pour son client, en deux qualités distinctes ; que poul- ies opérations autres que celles relatives aux actions nou- velles de l'Union Générale, il a négocié en sa qualité  d'agent de change ; mais que pour la négociation de  ces actions nouvelles qui n'étaient pas cotées au par- quet, et qu'il a dû acheter en banque, il n'a été  qu'un simple mandataire ; qu'il a contracté une obli- gation personnelle, et que dès lors, aux termes des ar- ticles 1999 et 2000 du Code civil, son mandant doit, dès  à présent, le rembourser, l'indemniser, ou tout au moins  lui rapporter une décharge de l'engagement qu'il a con- tracté en son nom personnel, vis-à-vis de Gaertner et  Roichberg et C°, banquiers, qui lui ont vendu les cent   actions dont s'agit ;   « Attendu, qu'aux termes de l'article 76 du Code de   commerce, les agents de change ont le droit exclusif de  faire les négociations des effets publics et autres sus- ceptibles d'être cotés ; que cette disposition qu'ils ont  fréquemment invoquée, ne comporte aucune distinction  ni réserve ; que si les règlements de la chambre syndi- cale de Paris interdisent aux agents de change d'opérer   la négociation des valeurs qui n'ont pas été admises à   la cote officielle, cette interdiction, qui n'existe pas d'ail- leurs pour les agents de la plupart des autres Bourses  de France, n'est prononcée par aucune loi, et qu'il suffit,  lors même que les actions n'ont pas été cotées, que la  Bourse soit le marché où elles doivent, par leur nature,  se coter et se négocier, pour que l'article 76 du Code   de commerce reçoive son application ;   « Attendu, en fait, que si les actions nouvelles de   l'Union Générale, actions dont la validité n'est point en  cause, n'étaient pas cotées, on ne saurait prétendre  qu'elles n'étaient pas susceptibles de l'être, comme les  actions anciennes de la même société; qu'en admettant  qu'elles aient été négociables, elles n'ont pu être régu-  ""n ment négociées que par l'intermédiaire des agents  change, et qu'en conséquence, Tavernier n'a agi   qu'en celle qualité ;   « Attende, d'ailleurs que dans ses relations avec son   client, Tavernier n'a jamais exprimé la pensîi qu'il  agissait en une double qualité ; que ni dans ses lettres  d'avis, ni dans ses livres, ni dans ses courtages, ni enfin  dans sa correspondance, il n'est fait aucune distinction à cet  égard et que lui-même, aussi bien que son client, il a   oujours pensé qu'il n'agissait qu'en sa qualité d'officier   ministériel ;   « Attendu qu'eu opérant comme agent de change, Ta-  vernier avait le droit et le devoir, aux termes d ; l'article  13 de l'arrêté du 27 prairial an X, d'exiger du deman-  deur les sommes nécessaires pour payer les actions que  celui-ci lui faisait acheter à terme ; qu'il n'a pu, après  oup, alors qu'il a fait foi à la solvabilité de son client,  soit exiger une couverture, soit s'en constituer une, de  sa propre autorité, par la rétention de fonds qui ne sont  parvenus en ses mains que pour d'autres causes ;   « Attendu enfin qu'il n'est nullement établi et que   Tavernier ne semble même plus soutenir qu'Audoin- Dabreuil ait accepté à titre de transaction, la consigna- tion des fonds qui lui appartiennent à la chambre syn-  dicale ;   « Qu'ainsi, à aucun.point de vue, le défendeur n'est   fondé à retenir les sommes qui lui sont réclamées, et qui  proviennent de la vente de titres qui lui ont été confiés,   à la charge de les vendre et d'en remettre le prix ;   « Attendu toutefois que la créance d'Audoin-Dubreuil   a été réduite, par suite d'opérations en cour--, à 225,033  fr. 70 c;   « Par ces motifs :  a Condamne Tavernier à payer au demandeur la   somme de 225,033 fr. 70 c, montant des causes sus- énoncées, avec les intérêts du jour de la demande ;   « Et, en ce qui touche l'exécution provisoire :  « Attendu qu'elle est démaillée en dehors des cas   prévus par l'article 135 du Code de procédure civile, dit  n'y avoir lieu de l'ordonner ;   « Condamne Tavernier aux dépens. »";16 décembre;COUR D'APPEL DE PARIS o ch;http://www.enap.justice.fr/ARCHIVE/ENAP_GAZETTE_TRIBUNAUX_18820316.pdf;188203160
188203161;"« La Cour,  « Considéranl, en droit, que les articles 481 et sui-  vants du Code civil, déterminent avec précision les con- ditions de la capacité relative que l'émancipation con-  fère au mineur ;   « Que, particulièrement, s'il ne peut contracter d'em-  prunt sans l'autorisation dûment homologuée de son  conseil de famille, et s'il ne peut non plus, aliéner ses  immeubles, si ce n'est dans les conditions fixées par la  loi, le paragraphe deux de l'article 484 prévoit aussi  lé cas où il s'oblige en vertu d'un contrat commutatif;  « Que, dans ce cas, son engagement n'est pas nul de   plein droit ;   « Qu'il est simplement réductible s'il est excessif, et  en tenant compte des circonstances de fait relatives à  la fortune du mineur, à la bonne ou à la mauvaise foi  de ses co-contractants, à l'utilité ou à l'inutilité des   dépenses ;   « Que ces dispositions de la loi sontessentiellementfiis-  tinctes de celles qui s'appliquent aux actes de pure ad- ministration, qui n'impliquent pas toujours et nécessai- rement une obligation contractée par le mineur   émancipé ;   « Qu'il suit de là que l'unique question, dansai'espèce,   est celle de savoir si, en fait, l'engagement de la dame   Bernier est infecté de ll'un des vices énumérés dans le   paragraphe deux de l'article précité ;   « Considérant que la dame Bernier, mineure éman-  cipée par son mariage, et le sieur Bernier, son mari,  ont acheté conjointement et solidairement, aux termes  d'un acte sous seing privé en date du 3 octobre 1876,  enregistré, un fonds de commerce appartenant aux   « Qu'il n'est aucunement justifié que le prix de la   cession fût exagéré; qu'il n'est point établi, ni même   articulé, que les cédants aient été de mauvaise foi ;   « Que s'il est vrai que la valeur du fonds de com-  merce fût supérieure aux ressources que possédaient les  cessionnaires et notamment du montant de la dot de la  dame Bernier, cette circonstance ne saurait être prise  en considération, alors qu'il est constant que les produits  que les époux Ledier avaient retirés de l'exploitation de  leur industrie étaient proportionnels au prix stipulé, et  que les époux Bernier ont contracté en vue des mêmes   bénéfices ;   « Qu'ainsi dans leurs légitimes prévisions, l'achat   qu'ils ont fait, ayant pour objet de leur procurer un  instrument de travail approprié à leurs conditions et à  leurs occupations antérieures, loin d'être inutile, devait   leur être profitable ;   « Que, dès lors, l'engagement solidaire pris par la  dame Bernier, conjointement avec son mari, envers feâ  époux Ledier, n'a rien d'excessif, et qu'il n'y a lieu   d'en réduire les effets ;   « Qu'on ne saurait, d'ailleurs, s'arrêter à l'objection   tirée de l'article 1431 du Code civil ;   « Que si, aux termes de cet article, la femme qui  s'oblige solidairement avec son mari, n'est réputée à  l'égard de celui-ci, s'être obligée que comme caution,  cette disposition est exclusivement applicable aux rap- ports des époux entre eux, mais ne l'est point aux enga- gements directs que la femme a pu prendre personnel-  lement envers les tiers ;   « Par ces motifs,  « Confirme la sentence dont est appel ;  « Condamne les appelants en l'amende et aux dépens.»";17 février;TRIBUNAL CIVIL DE LA SEINE 21 ch;http://www.enap.justice.fr/ARCHIVE/ENAP_GAZETTE_TRIBUNAUX_18820316.pdf;188203161
188203190;"« Le Tribunal,  « Attendu que le recours exercé par la compagnie   d'assurances la France, subrogée aux droits d'Augé, son  assuré, propriétaire de la maison sise à Auxerre, boule- vard du Temple, contre Rousset, Petit, veuve Dutliel et  Meignant, locataires, pour avoir remboursement de la  somme de 7,940 fr. 90 c, par elle payée à Augé, à  raison de l'incendie arrivé le 22 janvier 1879, est  basé sur les dispositions des articles 1733 et 1734 du   « Attendu que, suivant ces articles, les locataires so it   solidairement responsables, par suite d'une présomption  de négligence, imprudence, en un mot, de faute de leur   Code civil ;   part ;   « Attendu que cette responsabilité comporte une ex-  ception au principe général du droit, d'après lequel ce- lui-là seul est atteint qui est convaincu de faute ;   « Que, pour cette raison, elle doit être rigoureusement   limitée au cas que le législateur a dû prévoir en l'édic- tant, à savoir, au cas où les locataires ont eu exclusive- ment et privativement la libre disposition du bâtiment   incendié ;   « D'où la conséquence que si, dans le bâtiment in- cendié, le propriétaire s'est réservé la jouissance et la  disposition d'une ou plusieurs parties de ce bâtiment, il  s'est trouvé dans les mêmes conditions de possession que  les locataires, exposé aux mêmes chances de causes d'in- cendie et, par suite, soumis aux mêmes présomptions de   faute ;   « Qu'il n'existe aucun motif de préférence en sa fa-  veur, au regard des locataires ;   « Attendu que le propriétaire ne saurait échapper à   ladite présomption de faute commune, à lui et aux loca  taires, qu'autant qu'il établirait d'une manière irréfraga- ble qu'il a été nécessairement étranger aux causes du  sinistre, soit en faisant connaître la cause précise du si- nistre, soit en établissant que le feu a été mis par un  locataire, parce qu'alors la présomption de faute s'éva- nouirait devant la preuve contraire ;   « Attendu, dans l'espèce, que la cause de l'incendie   est demeurée inconnue ;   « Que, des enquêtes criminelle et expertise qui ont eu   lieu, il ressort que le feu a éclaté dans l'un des trois  greniers privativement possédés par Rousset, Petit et  veuve Duthel, mais qu'il n'est pas possible d'affirmer  dans lequel il a commencé ;   « Attendu que des mêmes documents il résulte que   ces trois greniers ouvraient sur un couloir donnant accès  à un grand nombre de greniers, communiquant entre  eux par un espace vide laissé au-dessus des cloisons sé- paratives, entre ces cloisons et le faîte de la toiture ;   a Qu'Auge s'était réservé la jouissance de l'un de ces   petit greniers ;   « Que, pour arriver à ce dernier grenier, il fallait pas-  ser devant les greniers de Rousset, Petit et veuve Duthel;  enfin, que la porte du grenier de Petit était à claire-  voie ;   « Attendu qu'en l'état des faits, à défaut de la convic-  tion de faute de l'un des locataires spécialement, la  cause de l'incendie, par présomption, peut être imputée   à tous ceux qui avaient accès au corridor, aussi bien à   Augé ou à ses gens, qu'aux locataires ;   « Attendu que la France demande à faire preuve par  témoins qu'à deux moments qui se placent au commen- cement de l'incendie, le corridor en question n'avait  pas été atteint par les Hammes ;   « Mais que ces faits manquent de pertinence, puisque,   fussent-ils pouvés, ils n'excluraient p.is la po.-sibilité de  supposer que le feu ait été communiqué au grenier par  une flamme ou une étincelle malencontreusement pro- jetée ou tombée à l'intérieur de ces greniers, lors du   passage d'une personne dans le corridor en question ; T  laquelle personne pourrait être Augé ou quelqu'un de  sa maison, aussi bien que l'un des locataires ;   « Que l'articulation de la France doit donc être re-  jetée ; J   « Attendu que, dans ces circonstances, les articles   1733 et 1734 sont inapplicables à la cause ;   a Par ces motifs,  « Sans s'arrêter aux autres fins, moyens et conclu- sions des parties, devenus sans objet, par suite de ce  qui précède ;   « Déclare la compagnie la France, représentant Augé,   mal fondée en sa demande ;   « L'en déboule ;  « Et la condamne en tous les dépens, y compris ceux   des demandes et défenses en garanties formées par  veuve Duthel, Petit et Meignant, et soutenues par ces  derniers, ces demandes ayant été la conséquence de la  demande au principal formée par la France. »";14 février;COUR D'APPEL DE PARIS ch;http://www.enap.justice.fr/ARCHIVE/ENAP_GAZETTE_TRIBUNAUX_18820319.pdf;188203190
188203191;"« La Cour,  « Vu la connexité, joint les causes, etc.;  « Sur l'appel de la compagnie la France contre Petit   et la veuve Duthel ;   « Considérant qu'Augé est propriétaire d'une maison   sise à Auxerre, qu'il a fait assurer à la compagnie la  France ;   a Considérant que, le 22 janvier 1879, un incendie a con- sumé entièrement l'étage des combles de ladite maison, étage  occupé partie par Augé lui-même, partie par un certain  nombre de locataires, parmi lesquels Petit, la veuve  Duthel et Rousset ;   « Considérant que le dommage ayant été évalué à la   somme de 7,940 fr. 90 c, la compagnie l'a remboursé  à Augé et s'est fait subroger par lui dans tous les droits  que les articles 1733 et 1734 du Code civil lui donnaient  contre les locataires ;   « Considérant qu'en vertu de cette subrogation, la   compagnie a assigné Petit, et la veuve Duthel, à fin de  condamnation solidaire en paiement de ladite somme  de 7,940 fr. 90 c.   « Mais qu'elle a été déclarée mal fondée dans sa de-  mande, par ce motif que si, dans un bâtiment incendié,  le propriétaire s'est réservé la jouissance d'une ou plu- sieurs parties de ce bâtiment, il ne saurait échapper à  la présomption de faute commune à lui et aux locataires,  qu'autant qu'il ferait la preuve irréfragable, preuve que  ne ferait pas dans l'espèce, la compagnie la France,  qu'il a été étranger aux causes du sinistre, soit en fai- sant connaître la cause précise de ce sinistre, soit en  établissant que le feu e été mis par un locataire.   « Considérant qu'en décidant ainsi, les premiers juges  n'ont pas donné leur portée véritable aux articles 1733 et  1734 ;   « Considérant que les dispositions de ces articles étant   fondées sur une présomption de faute des locataires, il en  résulte, il est vrai, que lorsque le propriétaire habite une  partie de la maison incendiée, la présomption de faute  pèse sur lui comme sur les locataires ; qu'il doit doac,  avant de pouvoir invoquer contre ceux-ci la présomption  desdits articles, commencer par prouver qu'il est lui- même exempt de faute, et que le feu n'a pas pris dans  la partie de la maison qu'il occupait ;   « Mais considérant que s'il fait cette preuve, la pré-  somption légale établie par l'article 1733, reprend toute   sa force contre les locataires, et le principe de la soli- darité créé par l'article 173^, doit également recevoir  son application ;   « Considérant, en lait, que la compagnie la France,   subrogée aux droits d'Augé, fait ia preuve qui lui, in- combe; qu'il résulte, en effet, tant du rapport de l'ex- pert commis par justice que des diverses enquêtes aux- quelles il a été procédé, que le feu n'a pris naissance  ni dans l'une ni dans l'autre des parties de l'étage in- cendié occupées par le propriétaire, non plus que dans  les dépendances communes entre le propriétaire et les  locataires ; que la compagnie appelante est donc fondée  à invoquer contre Petit et la veuve Duthel la présomp- tion légale édictée par l'article 1733;   « Considérant, d'autre part, que ni Petit ni la veuve   Duthel ne prouvent que l'incendie est arrivé par cas  fortuit ou force majeure, ou par vice de construction,  ou que le feu a été communiqué par une maison voi- sine; qu'ils ne prouvent pas davantage que l'incendie a  commencé dans l'habitation de l'un d'eux, ou qu'il n'a  pu commencer chez eux ; qu'ils doivent donc être solidai- rement responsables du dommage occasionné par l'in- cendie du 22 janvier 1879 ;   « Sur l'appel éventuel de Peiit contre Rousset ;  « Considérant que Petit, ne faisant pas la preuve que le   feu n'a pas pris naissance dans les localités qu'il occu- pait, ne faisant pas non plus la preuve qu'il a pris  naissance dans celle qu'occupait Rousset, son recours en  garantie contre ce dernier n'est pas fondé ;   H« Par ces motifs,   « Met à néant le jugement dont est appel ;   §p« Décharge la compagnie la France, des condamna- tion et disposition qui lui font grief, intirme, et sta- tuant à nouveau ;   « Condamne Petit et la veuve Duthel, solidairement, à   payer à ladite compagnie la somme de 7,940 fr. 90 c,  avec les intérêts suivant la loi ;   « Déclare Petit mal fondé dans son recours en ga-  rantie contre Rousset;   « L'en déboute;  « Ordonne la restitution de l'amende consignée, sur   l'appel de la compagnie la France ;   « Condamne Petit à l'amende de son appel contre   Rousset ;   « Condamne solidairement Petit et la veuve Duthel,   aux dépens de première instance et d'appel, lesquels  comprendront ceux de référé et d'expertise, mais non  eux de l'appel de P'etlt contre Rousse', auxquels Petit  est seul condamné. »";14 février;COUR D'APPEL DE PARIS ch;http://www.enap.justice.fr/ARCHIVE/ENAP_GAZETTE_TRIBUNAUX_18820319.pdf;188203191
188203250;"« Le Tribunal,   « Attendu qu'en supposant qu'à une époque antérieure   à la demande, il eût existé pour la veuve Gélyot une  cause de trouble et de préjudice, cette cause avait dis- paru dès avant le 6 juillet 1;V78, date de l'assignation,  laquelle se trouvait ainsi sans objet;   « Attendu, en effet, qu'il résuite de deux lettres du  vice-recteur de l'Académie de Paris, du professeur Paul   Bert, en date des 16 et 17 juillet 1878, qui seront enre- gistrées avec le présent jugement,que, sur la plainte du  sieur Durieu, « qui se déclarait chef de la mai-ou, »";24 mars;COUR D'APPEL DE PARIS !'• ch;http://www.enap.justice.fr/ARCHIVE/ENAP_GAZETTE_TRIBUNAUX_18820325.pdf;188203250
188203260;"« La Cour,  « Sur l'exception tirée de la violation de l'article 76   du Code de commerce :   « Considérant qu'il incombe à Jobert, qui l'allègue,   d'établir que les négociations d'achat ou de vente des  valeurs pour lesquelles il a donné des ordres à Beetz et   Dekker ont été effectuées, non par le ministère d'agent  de change, mais par des intermédiaires sans qualité à  cet effet; qu'il ne fournit pas cette preuve, et qu'il ne  saurait y suppléer par sa seule déclaration;   « Sur l'exception de jeu :  « Considérant qu'alors môme que Jobert aurait eu la   volonté, comme il le prétend, de ne pas se livrer à des  opérations sérieuses d'achat ou de vente d'effets publics,  mais de spéculer sur la hausse et la baisse de ces effets,  et de n'en liquider les résultats qu'au moyen de diffé- rences, il ne produit aucune pièce et n'argue d'à • n  fait de nature à démontrer que Beetz et Dekker aient  connu son intention et aient prêté sciemment leur con- cours à ses spéculations; qu'en conséquence, il ne peut   leur opposer l'exception de jeu ;   « Au fond,  « Adoptant les motifs des premiers juges;  « Par ces motifs,  « Sans s'arrêter ni avoir égard aux exceptions dont   s'agit,   « Confirme. »";10 mars;COUR D'APPEL DE PARIS 4e ch;http://www.enap.justice.fr/ARCHIVE/ENAP_GAZETTE_TRIBUNAUX_18820326.pdf;188203260
188203261;"« Le Tribunal,  « Attendu que pour résister à la demande, Jobert   soutient que les opérations qu'il a faites chez Beetz et  Dekker ne seraient pas sérieuses, et constitueraient  actuellement des opérations de jeu pour lesquelles toute  action en justice serait interdite ; et, qu'en conséquenee,  Beetz et Dekker devraient être déclarés non recevables   en leur demande ;   « Mais attendu qu'il n'appert pas des débats que l'in-  tention de Jobert de se livrer à des opérations de jeu  était connue de Beetz et Dekker ; qu'au contraire, il est  constant qu'à diverses époques, lorsque les opérations  avaient présenté un avantage pour Jobert, elles avaient   toujours été régulièrement exécutées ;   « Que, d'ailleurs, les opérations faites par Jobert  étaient en rapport avec sa situation de fortune appa- rente, et telle qu'il l'avait révélée à Beetz et Dekker ;   o Que, dès lors, ceux-ci étaient fondés à croire qu'elles   étaient sérieuses ;   « Que le moyen opposé ne peut donc être accueilli;  « Et attendu que de l'examen et de la vérification des   comptes produits, il ressort que Jobert reste débiteur   envers Beetz et Dekker de 4L459 fr. 60 c.   * Qu'il ne justifie pas de sa libération ni d'aucune   compensation liquide et exigible ;   « Qu'il y a lieu, dès lors, de l'obliger au paiement   réclamé ;   « Par ces motifs,  « Vu le rapport de l'arbitre ;  « Le Tribunal, jugeant en premier ressort;  « Condamne Jobert à payer aux demandeurs 41,4a9 fr.   00 c, avec les intérêts suivant la loi, à satisfaire à ce  que dessus sera le défendeur contraint par toutes les   voies de droit ;   « Et condamne, en outre, le défendeur aux dépens. »";21 mars;TRIBUNAL CIVIL DE LA SEINE lre ch;http://www.enap.justice.fr/ARCHIVE/ENAP_GAZETTE_TRIBUNAUX_18820326.pdf;188203261
188203290;« La Cour :   Il VMS;28 mars;COUR D'APPEL DE PARIS lr° ch;http://www.enap.justice.fr/ARCHIVE/ENAP_GAZETTE_TRIBUNAUX_18820329.pdf;188203290
188203300;"« Le Tribunal,  « Attendu que s'il est dit, dans la clause du contrat   du 2 septembre 1880, que la vente est faite moyennant  le prix principal de 430,000 francs, il ne s'en suit nulle- ment que cette somme devait être payée intégralement  en espèces ;   « Qu'il résulte, au contraire, de l'ensemble de ladite   clause que, pour se couvrir de la moitié du prix, soit  223.000 francs, les époux Anekaert devaient recevoir à  leurs risques et périls 1,286 actions delà compagnie la  Provinciale, évaluées au moment du contrat 173 francs  l'une, ce qui faisait bien 223,000 francs ;   « Que ce qui était déterminé et certain, c'était le   nombre d'actions et non leur prix, qui n'a été indiqué  que d'une manière énonciative et qui était naturellement  susceptible de varier, mais dont la hausse ou la baisse  devait incomber au vendeur seul ;   « Que les acquéreurs étaient donc en droit de se libé- rer envers ces derniers jusqu'à concurrence de moitié de  leur prix par la remise de 1,286 actions ;   « Que seulement ils étaient tenus, aux termes des dis- positions des articles 2183 du Code civil et 836 du Code  de procédure civile, d'évaluer, ainsi qu'ils l'ont fait, les  choses par eux offertes;   « Qu'ils ont évalué chacune des actions à leur cours   au jour des notifications, soit 80 francs l'une, pour les  1.286 actions 102,830 francs, ce qui faisait pour le prix  total une offre en espèces de 327,880 francs ;   « Qu'ils ont ainsi complètement satisfait aux prescrip-  tions de la loi ;   « Que, d'un autre côté, les droits des créanciers hy-  pothécaires, pour le cas où ceux-ci auraient trouvé  l'évaluation insuffisante, étaient pleinement sauvegardés  par la taculté de surenchérir que leur accordait l'article  2185 du Code civil ;   « Que si aucun d'eux n'a usé de cette faculté dans les   délais fixés par la loi, ils n'ont qu'à s'en prendre à eux- mêmes, leur forclusion n'étant imputable en rien au fait  des acquéreurs ;   « Donne acte à Anekaert de ses réserves ;  « Déclare régulières les notifications faites le 2 juin   1881, à la requête des défendeurs, et leurs offres suffi- santes ;   « Déboute les demandeurs de leurs fins et conclu-  sions ;   « Et les condamne aux dépens. »";14 mars;COUR D'APPEL DE DOUAI l'e ch;http://www.enap.justice.fr/ARCHIVE/ENAP_GAZETTE_TRIBUNAUX_18820330.pdf;188203300
