id;arrêt;date;juridiction;lien;id
188210010;"« Le Tribunal,  « Attendu que le 6 décembre 1878, rue Bassano, à   Paris, Philippe Chommeton, cocher, au service de de  Mier, a été renversé par un cheval attelé à une voiture  dite Victoria, qu'il conduisait en exécution des ordres   de son maître ;   a Attendu que Chommeton père, agissant au nom et   comme administrateur de la personne de Philippe  Chommeton, son fils mineur, soutient que la responsa- bilité des suites de l'accident doit retomber tout à la  fois sur de Mier et sur Mesnage, marchand de chevaux,  qui avait vendu à l'essai et livré le matin même à son  maître le cheval cause de l'accident, et demande contre  eux une condamnation solidaire de 13,000 francs de  dommages intérêts, avec intérêts à partir de la de-  mande ;   « Qu'enfin de Mier a assigné Mesnage en garantie et   demande que ce dernier soit condamné dans tous les  cas à lui payer 1,500 francs à titre de dommages inté- rêts pour inexécution des conditions de la vente et ré- paration du dommage causé à sa voiture;   « Attendu que, pour justifier sa demande contre de   Mier et Mesnage, Chommeton père se fonde :   « 1° Sur les termes de l'article 1385 du Code civil;  « 2° Sur le motif que le cheval était vicieux ;  « 3° Sur l'imprudence que de Mier aurait commise  personnellement en confiant à un jeune homme de dix- neuf ans qui n'était que son cocher en second, la direc- tion d'un cheval difficile et livré à l'essai le jour même  de l'accident ;   « 1° En ce qui concerne l'article 1385 du Code civil,   attendu que cet article n'est applicable qu'au cas où le  dommage a été causé à des tiers par des animaux dont   ils n'avaient pas accepté la garde ou la direction ;   « Que le propriétaire ne saurait être responsable lors-  que l'accident est arrivé à des préposés spéciaux qui,  moyennant un salaire proportionnel aux difficultés de  leur industrie, se sont engagés vis-à-vis de lui, à pren- dre ces animaux à leur charge ;   « Qu'il faudrait au moins prouver que le cheval était   vicieux, et que ses vices avaient été dissimulés ;   « En ce qui concerne les vices du cheval :  oc Attendu que si précédemment ce même cheval, sous   la conduite d'un cocher de Guillout, s'était subitement   emporté en descendant le quai Conti et s'était précipité,   avec la voiture à laquelle il était attelé, sur le mur de   l'institut, ce fait, d'ailleurs isolé, ne suffit pas pour éta- blir qu'il était vicieux, c'est-à-dire impropre à l'atte- lage :   « Qu'il résulte au contraire de toutes les dépositions  des témoins entendus dans l'enquête et la contr'enquête  faites par Mesnage, que ce cheval d'origine hollandaise,  et âgé d'environ six ans était doux et tranquille ;   « Qu'il avait été employé pendant longtemps chez Mes-  nage au dressage des jeunes chevaux et servait, suivant  l'expression des témoins, de maître d'école ;   « Qu'ainsi il présentait toutes les garanties désirables   de sécurité pour l'attelage ;   « En ce qui concerne l'imprudence de de Mier :  « Attendu que Chommeton fils élevé par un père qui   était cocher lui-même, ayant toujours été occupé à soi- gner et à conduire les chevaux, était depuis longtemps  au service de de Mier, aux gages de 180 francs par  mois, et avait fait preuve de l'expérience et de la force  physique nécessaires pour faire le service dont il avait  été chargé ;   « Que, dans ces conditions, de Mier n'a commis au-  cune faute de nature à engager sa responsabilité en  chargeant son cocher en second, qui était venu deman- der chez lui ses ordres d'atteler le cheval, vendu par  Mesnage, à sa Victoria, pour se faire conduire lui- même ;   « Qu'il est établi, au contraire, qu'au moment de la   livraison. Mesnage avait averti et fait avertir Chommeton  fils que le cheval avait la bouche un peu dure, qu'il était  un peu vif, et qu'il fallait toujours le conduire avec  doubles guides ;   « Que Chommeton fils avait négligé de prendre, cette   précaution le jour de l'accident, et que cette négligence  était d'autant plus coupable qu'il avait toujours trois   paires de doubles huides à sa disposition dans les écu- ries ;   « En ce qui touche la demande en garantie et la de-  mande en dommages-intérêts de de Mier contre Mes- nage;   « Attendu que Chommeton père succombant dans sa   demande principale contre de de Mier et Mesnage, il n'y  a pas lieu de s'occuper de la demande en garantie de  de Mier contre son vendeur;   « Que d'ailleurs Mesnage a rempli toutes les conditions   par lui contractées envers de Mier en lui livrant le che- val à l'essai, et ne saurait être responsable des dom- mages causés à sa voiture par la faute de son cocher ;   « Par ces motifs,   a Déclare Chommeton père mal fondé dans toutes ses  conclusions contre de Mier et M. Mesnage, l'en déboute ;   « Condamne Chommeton père aux dépens.   M. Chommeton fils, devenu majeur, interjeta ap-  pel de cette décision, reproduisant les mêmes moyens  qu'en première instance.   La Cour, après avoir entendu Me Hamel pour l'ap-  pelant, M8 Lalle pour M. de Mier, Me de Bigauit   du Grandrut pour M. Mesnage a, après avoir en-  tendu Me Havel, avocat général, en ses conclusions,   tendantes à la responsabilité des deux intimés  rendu l'arrêt suivant.   « La Cour,   « Sur la demande de Chommeton tendant à la con-  damnation solidaire de de Mier et de Mesnage au paie- ment d'une somme de 13,000 francs à titre de domma- ges-intérêts, avec intérêts à partir du jour de la de- mande;   « En ce qui concerne de Mier,  a Considérant que le jour où est survenu l'accident   qui fait l'objet du procès, de Mier n'était pas propriétaire  du cheval que Mesnage lui avait le même jour livré pour  en faire l'essai ; qu'en conséquence l'article 1385 du Code  civil ne lui est pas applicable ;   « Considérant en outre au point de vue de la respon-  sabilité édictée par l'article 1382 du Code civil qu'il ne  résulte pas de l'enquête à laquelle il a été procédé, que  de Mier ait commis aucune faute de matière à engager  sa responsabilité, adoptant de ce chef les motifs des pre- miers juges en ce qu'ils n'ont rien de contraire à ceux  qui précèdent ;   « En ce qui concerne Mesnage,   « Considérant que l'article 1385, Code civil lui est éga-  lement inapplicable, le cheval qui a occasionné l'acci- dent n'étant pas sous sa garde le jour où ledit accident  s'est produit;   « Qu'il y a lieu de rechercher si le demandeur fait   contre Mesnage la preuve d'une faute engageant la res- ponsabilité de ce dernier aux termes de l'article 1382,  Code civil ;   « Considérant qu'en septembre ou octobre 1878, à la   suite d'un accident causé par le même cheval ; Mesnage,  marchand de chevaux, avait été obligé de le reprendre  d'un sieur Guillout qui le refusait comme dangereux ;   « Qu'au mois de décembre de la même année de   Mier ayant demandé à Mesnage de lui procurer un che- val pouvant être attelé en toute sécurité aux voitures des- tinées à son usage et à celui de sa famille, Mesnage lui  a offert à l'essai le cheval en question sans le prévenir  que l'animal s'était déjà subitement emporté une pre- mière fois, et sans l'informer des précautions toutes par- ticulières qui devaient être recommandées au cocher qui  serait chargé de le conduire ; qu'à la suite de l'accident  du 6 décembre 1878, Mesnage renonçant à vendre l'ani- mal en question comme cheval de maître, l'a immédia- tement fait vendre au Mattera'all où il a été adjugé à un  un laitier pour la somme de 770 francs.   « Que ces circonstances attestées par les documents   de la cause, établissent à la charge de Mesnage une im- prudence qui a contribué à amener l'accident dont  Chommeton a été victime ;   « Mais, considérant d'autre part qu'il résulte dus en-  quêtes que Chommeton chargé de conduire pour la pre- mière fois et d'essayer un cheval vigoureux attelé à une  voiture légère, a négligé de prendre les précautions qui  lui étaient recommandées en vue de maîtriser le cheval,  par la personne qui le lui avait amené, précautions dont  sa propre expérience devait lui démontrer la nécessité ;  qu'il a omis notamment de faire emploi de doubles gui- des alors qu'il en avait plusieurs paires à sa disposition,  et que l'on en faisait dans la maison de de Mier un  usage journalier ;   « Considérant que cette faute de Chommeton a con- tribué à amener l'accident dont celui-ci a été victime,  et doit être prise en considération pour diminuer la part  de responsabilité qui incombe à Mesnage ; que la Cour  trouve dans les documents de la cause les éléments né- cessaires pour déterminer la part que Mesnage doit sup  porter dans la réparation du préjudice éprouvé par   Chommeton et en fixer l'importance à la somme de   6,000 francs, augmentée de la totalité des dépens ;   « En ce qui touche la demande en garantie et l'appel   éventuel de de Mier contre Mesnage ;   « Considérant que la demande principale contre de   Mier étant reconnue mal fondée, ladite demande en ga- rantie et ledit appel éventuel se trouvent sans objet ;  que toutefois les dépens qu'ils ont occasionnés doivent  suivre le sort de ceux qui ont été faits sur la demande  priucipale ;   « Par ces motifs,   ton contre Mesnage ;   « Infirme en ce qui touche la demande de Chomme-  « Condamne Mesnage à payer à Chommeton la somme   de 6,000 francs à titre de dommages-intérêts avec les  intérêts de droit, le jugement rendu en ce qui con- j   cerne la demande de Chommeton contre de Mier, sor- tissant effet ;   « Dit n'y avoir lieu de statuer sur l'appel éventuel de   de Mier ;   « Ordonne la restitution des amendes ;   « Condamne Mesnage en tous les dépens de première   instance et d'appel. »";3 août;COUR D'APPEL DE PARIS 2e ch;http://www.enap.justice.fr/ARCHIVE/ENAP_GAZETTE_TRIBUNAUX_18821001.pdf;188210010
188210020;"« Le Tribunal,   « Attendu que, suivant exploit des 22 mars et 5 avril   1880, Bougueret assigné devant le Tribunal civil de  Montbrison les consorts Veude, Thomas et autres par-  ties, de Me Coudour en nullité et mainlevée d'une op-  position par eux formée le 21 juillet 1876, en transfert  sur les registres de la compagnie de Roche-la Molière de  239 actions, lesdites même cédées et vendues au sieur  Bougueret par Auguste Mellet-Mandard, suivant acte   aux minutes de M0 Champelier de Rlbes, notaire à Pa-  ris, le 20 septembre 1878, signifié à la compagnie dé- nommée et à la dame veuve Mandai-, légataire en usu- fruit desdites actions par exploit du 6 octobre même  année ;   « Attendu que peu de jours après et avant que l'ins-  tance introduite par les exploits des 22 mars et 5 avril  1888 ait été liée par la constitution d'avoué des défen- deurs et la signification de leurs conclusions, Bougueret  a, par exploit du 27 avril 1880, notifié à leurs per- sonnes ou à leur domicile, un désistement de son ajour-  nement ;   « Attendujque, avant même ce désistement et sa noti-  fication dès les 6 et 7 avril 1880, Bougueret avait assi- gné devant le Tribunal civil de la Seine en nullité et  mainlevée de la même opposition :   « 1° Les consorts Vende, Thomas et autres, plus la   compagnie de Saint-Just-sur-Loire ;   « 2° Le sieur Mellet-Mandard, en exécution du contrat   de vente des deux cent trente-neuf actions par le trans- fert de celles-ci à son profit, nonobstant les oppositions  des 21 juillet 1876 et 16 juillet 1879 ;   « 3° La compagnie des Mines de Roche-h-Moliôre en  déclaration de jugement commun, aux fins d'opérer lecUt   transfert;   « Attendu que devant le Tribunal de la Seine IVx   ception de litispendance ayant été soulevée, ce Tribunal,  sans rendre aucun jugement, aurait invité les parties à  faire vider préalablement la question de nullité ou de  validité du désistement donné et notifié devant le Tribu- nal de Montbrison ;   a Que c'est en cet état de la cause que les parties re-  viennent devant le Tribunal de Montbrison qui a le droit  et le devoir de statuer sur la totalité du litige qui lui a  été soumis par les exploits des 22 mars et S avril 1880,  à la requête de Bougueret, et non comme le prétend ce  dernier sur un procès restreint et limité aux questions  de validité, de désistement et de nullité de procédure sur  lesquelles seulement il a consenti ù conclure et à  plaider ;   t Sur le désistement :   « Qu'aux termes de l'article 402 du Code de procé- dure civile, le désistement signifié par acte d'avoué à  avoué est nul s'il n'est signé de la partie même ou de  son mandataire;   « Que d'après une jurisprudence et une doctrine im-  portante, la nécessité de la signature de la partie existe  également lorsque le désistement est notifié par exploit  d'huissier à personne ou domicie;   « Attendu que le désistement signifié le 27 avril 1880   par Bougueret, par exploit d'huissier à personnes ou au  domicile des défendeurs, ne portant pas sur la copie la  signature du désistant est nul, et ceux-ci sont bien fondés  dans leur refus à l'accepter;   « Attendu que le même désistement renouvelé suivant   exploit du 31 mars 1881 est, il est vrai, régulier, l'ori- ginal et la copie étant revêtus de la signature de Bou- gueret, mais son acceptation ne saurait être imposée aux  consorts Vende, Thomas, Frécon et veuve Angénieux,  qui, à cette époque, avaient constitué avoué, et, dans  leurs conclusions signifiées, s'étaient portés reconven- tionnellement demandeurs ;   « Qu'il n'existe aucun mode plausible militant en  faveur de son acceptation et pour dessaisir le Tribunal  de Montbrison sur la question de nullité de l'opposition  dont il a été competemment saisi par Bougueret lui- même, lequel, précédemment, dans une lettre écrite par  lui à Mellet-Mandar, avait reconnu la légitimité de cette  mesure conservatoire pratiquée par les consorts Vende  et autres pour assurer le paiement de leur créance ;   « Attendu, en effet, que cette opposition, quelle qu'ait   été sa valeur juridique, a produit tout son effet et n'a l  plus de raison d'être depuis que, par son jugement du  31 août 1877, le Tribunal de Montbrison a mis sous  séquestre les deux cent trente-neuf actions et a ordonné  la vente d'un nombre suffisant de ces actions pour désin- téresser les créanciers de la succession de Jean-Pierre g  Mellet-Mandard, d'où elles proviennent ;   « Attendu que les défendeurs ont le plus légitime   intérêt à faire maintenir le. litige devant le Tribunal afin  de faire statuer sur leur demande reconventionnelle,   dont le gain doit faire cesser l'obstacle qui.; s'oppose à   l'exécution du jugement du 31 août 1877, et,î-par suite,  leur procurer le paiement de leur créance,   « Sur l'exception de nullité de Me Coudour, avoué des   défendeurs, et des actes de procédure subséquents, parce  que les actes ne porteraient pas la signature de cet  officier ministériel ;   « Attendu que la loi n'indique nulle part les forma-  lités générales des exploits, qu'elles n'en prescrit de ri- goureuses que pour l'exploit d'ajournement ;   « Que, d'autre part, l'article 1031 du Code de procé-  dure civile défend de déclarer nul un acte quand la nul- lité n'en a pas été prononcée par la loi;   a Attendu que le but de tous les actes n'étant pas les   mêmes, les formalités ne sont pas essentielles à tous,  d'où la conséquence qu'il appartient aux Tribunaux d'ap- précier dans chaque circonstance si le but que l'exploit  doit attendre a été rempli ;   « Attendu que l'application de cette règle à la cause   permet de décider que l'absence de la signature de M""  Coudour sur l'acte de sa constitutiou ne constitue pas  une condition essentielle de sa validité ;   « Que cette signature, en effet, n'était pas nécessaire  pour attester sa qualité d'officier ministériel bien connue   de M6 Fraisse, avoué de la partie adverse, attaché lui-  même au même Tribunal ;   « Que c'est par un motif semblable qu'il n'est pas con-  testé en jurisprudence que l'huissier audiencier n'a pas  besoin de mentionner sur les exploits qu il notifie à  avoué, quoique d'après l'article 61 du Code de procé- dure civile il soit obligé de le faire à peine de nullité,  quand il s'agit de la signification d'un ajournement ;   « Attendu que la régularité de la procédure devant   être reconnue et le double désistement écarté, reste à  examiner le fond du procès ;   « Sur la demande principale,   « Attendu que cette demande qui tend à la nullité et   à la mainlevée de l'opposition à transfert d'actions faite  par les consorts Vende, Thomas, Frécond et veuve An- génieux est sans objet, car cette opposition a été rem- placée comme mesure conservatrice par le séquestre des- dites actions, ordonné par le jugement précité du 31  août 1877 qui a acquis l'autorité de la chose jugée et  est opposable à Bougueret, cessionnaire de Mandard ;   « Qu'il est donc sans intérêt de rechercher si l'oppo-  sition dont il s'agit est nulle par défaut de l'observation  des formalités prescrites pour la saisie-arrêt, puisqu'elle a  produit tout l'effet que les opposants en attendaient;   « Sur la demande reconventionnelle ;   « Attendu que par suite de la signification par Bour-  gueret à la société des Mines de Boche-la-Molière et  Firminy de la cession et transfert de 239 aclions qu'il  avait acquis de Mandar, le jugement du 31 août 1877  n'ayant pu recevoir son exécution, les créanciers au pro- fit desquels le séquestre a été ordonné ont un intérêt  manifeste à faire tomber cet obstacle au paiement de  leur créance;   « Que leur demande qui n'est qu'un défaut de l'action   principale de Bougueret est recevable à la forme, porte  au fond et doit être accueillie;   « Que JC-Î consorts Vende, Thomas et autres qui n'ont   point été partie dans ce jugement, y ont été représentés  par leurs débiteurs; le sieur Man iar et la veuve lin- dard dont ils sont les ayants cause;   « Qu'on ne peut donc contester qu'ils soient fondés à   réclamer le bénéfice de ce jugement;   »";5 mai;COUR D'APPEL DE LYON 2e ch;http://www.enap.justice.fr/ARCHIVE/ENAP_GAZETTE_TRIBUNAUX_18821002.pdf;188210020
188210021;"« La Cour,   « Sur l'exception tirée de la nullité des actes de pro-  cédure antérieurs au 2e désistement.   « Considérant qu'il faut reconnaître que l'acte de con-  stitution de M8 Coudour et l'acte renfermant ses conclu-,   sions notifiées sont absolument nuls comme n'étant point  revêtus de la signature de l'avoué et ne sauraient, en  l'absence de cette formalité qui est essentielle à tous les  actes, avoir le caractère d'actes réguliers, mais qu'il ré- sulte de la combinaison des articles 61, 75 et 76 du  Code de procédure civile que la constitution d'avoué peut  être établie autrement que par un acte dressé par l'offi- cier ministériel, acte qui n'est requis que pour en four-  nia la preuve et qui n'est point essentiel à sa validité;  — que cette constitution peut être verbale et même ta-  SSV";5 mai;COUR D'APPEL DE LYON 2e ch;http://www.enap.justice.fr/ARCHIVE/ENAP_GAZETTE_TRIBUNAUX_18821002.pdf;188210021
188210040;"« Le Tribunal jugeant en premier ressort ;   « Beporte et fixe définitivement au 2 janvier 1877,   l'époque de la cessation des paiements de la société  Boulanger frères ;   « Déclare nulles et de nul effet, au regard de la masse,   les hypothèques prises, savoir : au profit de Spronck,  E. Fosse et C°, au bureau des hypothèques de Meaux,   le 23 février 1877; v. 818, n° 46, au 1er bureau des hy-  pothèques de la Seine, le 26 mars 1877, vol. 1262, n° 38;  au bureau des hypothèques de Meaux, le 27 mars 1877,  v. 819, n° 55 ; au profit de Vivier, au bureau des hypo- thèques de Meaux, le 26 juin 1877, v. 821, n° 155;   « Dit que, sur le vu du présent jugement, le conser-  vateur du 1er bureau des hypothèques de la Seine et le   conservateur du bureau des hypothèques de Meaux se- ront tenus de radier les inscriptions ci-dessus énoncées,  à quoi faire seront lesdits conservateurs contraints, quoi   faisant valablement déchargés ;   « Sans s'arrêter à la demande en déclaration de juge-  ment commun formée par le syndic contre les dames  Boulanger ;   « Déclare nulles et de nul effet la caution et la subro- gation dans leurs hypothèques légales consenties par les  dames Boulanger au profit des créanciers de leurs  maris ;   « Déclare Spronck, E. Fosse et C"", quant à présent,   mal fondés dans leur demande reconventionuelle en ad- mission pour la somme qu'ils réclament ;   « Condamne Spronck, E. Fosse et Ce, par les voies de   droit, à rapporter à la masse 18,861 fr. 50 c, avec les  intérêts suivant la loi, depuis le jour de l'encaissement;   « Ordonne qu'aux requête et diligence du syndic, men-  tion du présent jugement, en ce qui touche le report de  la faillite, sera faite partout où besoin sera. »";4 août;COUR D'APPEL DE PARIS {¥ chambre;http://www.enap.justice.fr/ARCHIVE/ENAP_GAZETTE_TRIBUNAUX_18821004.pdf;188210040
