id;arrêt;date;juridiction;lien;id
188606132;"« Le Tribunal,  « Attendu que de Strada, Bouchet, Bouton, Thuas-  ne, Huard, Herbin et Roux, ne comparaissent pas, ni  personne pour eux, adjuge le profit du défaut précé-  demment prononcé ;   « Statuant, tant à leur égard d'office qu'à l'égard   des défendeurs comparants ;   « En ce qui touche de Misery et Weyl ;  a Attendu qu'ils soutiennent que les griefs allégués   par Bonneau ès qualités, en sa demande en nullité  de la Société des Vidanges militaires et en responsa- bilité des fondateurs et administrateurs, ne seraient  pas de nature à entraîner la nullité de cette société ;  qu'aucun des motifs relevés en l'assignation ne sau- rait être assimilé à ceux prévus par la loi et pouvant  causer la nullité, lesquels ne sauraient être étendus;  que, si, par suite des circonstances qui ont accompa- gné ou suivi la création de la société, la valeur des  apports a pu être inférieure à celle reconnue par l'as- semblée constituve, après discussion des évaluations  faites par les commissaires rapporteurs, il y a lieu  de reconnaître que le payement de la valeur'desdits  apports était effectué par la société, en actions et   non en numéraire; que les actions ainsi données en  payement devaient suivre le sort de l'affaire elle- même, et ne donner de bénéfices aux apporteurs  qu'autant que la Société elle-même prospérerait ; que  si la Société acceptait la charge d'acquitter T.M.OOO fr.  formant le passif de l'apj)orteur, elle trouvait dans  ces apports eux-mêmes, en terrains, constructions  el matériel, l'équivalent de cette somme; que vaiue- menl Bonneau, es-qualités, soutiendrait que la  deuxième assemblée constitutive de la société aurait  été composée d'actionnaires porteurs d'actions d'ap- port; que ces actionnaires, ne pouvant être à la t'ois  juges et parties, la vérification des apports aurait été  faite dans des conditions qui en vicieraient la sincé- rité; que 'thuasne n'aurait pas assisté' à cette assem- blée, qui auraitélé seulement composée des actionnai- res, tous souscripteurs, et qui ont fourni le capital  en numéraire ; que la composition de cette assem- blée aurait donc été régulière; qu'eùt-il promis à  certains actionnaires présents des actions d'apport,  ces actionnaires n'auraient pu perdre, par ce fait,  leur qualité d'actionnaires et le droit d'assister à  l'assemblée et de voter la vérification ; qu'enfin  Bonneau prétendrait à fort que la transmission  dd apports n'aurait pas été opérée; que Thuasne  et C° se seraient tenus à la disposition de la  société pour opérer, à toute époque, la partie de  cette transmission non effectué©.; qu'en ce qui con- cerne le partie incorporelle des apports, la société  aurait continué l'exploitation des marchés à elle cé- dés par Thuasne et Ce, sans obstruction de la part  de l'Etat ; que ces marchés et les procédés des cé- dants ont été, en effet, transférés à la société ; que la  cession du surplus n'aurait jamais été demandée  qu'en ce qui concerne la mutation de la propriété,  elle existe par le fait même de l'acte de vente, le fait  de la transcription n'étant qu'une formalité et ne  constituant pas seul la propriété ; que, d'ailleurs,  cette objection ne pourrait avoir de valeur qu'autant  que des inscriptions seraient survenues sur Thuasne  et Cc, depuis la vente ; qu'il n'en serait relevé au- cune ; que le grief serait donc sans valeur, sauf en ce  qui touche la négligence reprochable, peut-être, aux  administrateurs, mais qui, en fait, n'aurait aucune- ment nuit à la société; que si la réalisation de la  vente de partie des immeubles a pu être ordonnée au  profit de précédents vendeurs non désintéressés,c'est  sur la faillite, et faute de paiement par elle, que cetlc  vente a pu être obtenue; que de mémo, en ce qui con- cerne les marchés, les tiers ne sauraient préfendre  que l'Etat aurait pu être obligé d'en continuer l'exécu- tion avec une société en faillité, la faillite entraînant  elle-même, d'après la clause insérée aux marchés  cédés, la caducité des traités; qu'ainsi, et à tous  égards, la demande du syndic ne saurait être ac-  cueillie.   produits il ressort ;   « Mais attendu que des débals cl des documents   « Sur la majoration des apports: que l'évaluation  des apports faite par les commissaires nommés par  les actionnaires dans la première assemblée du 10  décembre 1880 fixait à 'i,080,050 fr. les valeurs acti- ves de la société Thuasne et C0., cédante de la  société en formation et indiquait un passif total de  7ô5,i07 fr. 05 c; que dans cet apport figuraient, no- tamment, pour 68,305 fr. des plans et études pour  l'obtention d'un brevet sur lequel reposait la valeur  des procédés dont l'exploitation faisait l'objet irfême  de la société à constituer ; que le brevet, remontant à  septembre 1865, était tombé dans le domaine publicet  par conséquent, sans valeur ; que les différents traités  passés entre Thuasne et l'autorité militaire, et qui  seuls pouvaient constituer la valeur des procédés à  exploiter étaient, par eux-mêmes incessibles, l'auto- risation préalable de l'autorité militaire pouvant  seule en permettre la transmission ; qu'en effet, dès  le début, des difficultés se sont produites dans l'ex- ploitation, l'administration de la guerre ayant déclaré  ne pas reconnaître la société cessionnaire des mar- chés ; que la société en formation était, aux termes  des articles 25, 26 et 27 du rapport des commissaires  vérificateurs, chargée d'acquitter tout le passif de la   société Thuasne et (>, s'élevant à 775,000 fr., et re- présentant l'importance des seules valeurs actives  apportées par la société Thuasne et O; que si un  commanditaire de la société Thuasne et C° avail an- térieurement apporté à cette société 5,000 fr. en es- pèces et une ouverture de crédit de 95,000 fr., ce cré- dit devait également être remboursé par la Société  des Vidanges militaires; que, dans cette situation,  Thuasne et C°, dont les apports étaient nuls ou  sans valeur, recevaient de la société 6,000 actions  entièrement libérées, ne pouvaient que profi- ter des bénéflcWs', alors qu'ils laissaient toutes  les chances de pertes aux actionnaires et aux créan- ciers de la nouvelle société ; que si, malgré l'insigni-  fiance de leur valeur, ces apports ont été acceptés   par l'assemblée du 24 décembre 1885, cette acceptation  se trouve entachée de fraude; qu'en effet il ressort  des documents de la lraude et notamment des carnets  de souche, que sur 6,000 actions d'apport, 4,800 ont  été promises et distribuées à un certain nombre des  souscripteurs d'actions en numéraire, présents à  l'assemblée, et au rapporteur lui-même ; qu'ainsi, les  actionnaires votant l'acceptation des apports se trou- vaient intéressés à l'exagération excessive de la va- leur de ces apports composés de marchés non cessi- bles et du droit à l'exploitation d'un droit périmé;  que, consentie dans ces conditions, l'acceptation de  ces apports pour une valeur de 3,000,000, était dom- mageable aux tiers qui étaient en droits de compter   sur leur réelle existence ; que l'article i de la   loi du 2i juillet 1867 réserve, en cas de fraude ou dol,   l'action ultérieure des tiers, nonobstant cette accep- tation ; que la majoration excessive et frauduleuse  des apports est de nature à entraîner la nullité  de la société ; que tous les défendeurs fondateurs  administrateurs ont négligé de demander à la sociélé  Thuasne et O la cession notariée du brevet, la trans- mission des marchés et la transcription des immeu- bles cédés, qu'ils avaient le devoir d'exiger de cette  Société; qu'ils ont pris part aux manœuvres sus-in-  diquées en acceptant pour eux-mêmes un certain  nombre d'actions d'apport; qu'il y a lieu, en consé-  quence, de les déclarer responsables; à l'égard des  tiers, du passif créé par la société, et de les obliger à  payer à Bonneau la somme de 100,000 francs à titre   de provision;   « Par ces motifs,  « Déclare nulle, comme entachée de fraude dans sa   MVX";25 mai ;TRIBUNAL DE COMMERCE DE LA SEINE ;http://www.enap.justice.fr/ARCHIVE/ENAP_GAZETTE_TRIBUNAUX_18860613.pdf;188606132
188606140;"« Le Tribunal,   « Donne acte à M. le procureur de la République   du dépôt du déclinatoire en date du 26 mai 1886, pré- senté par M. le préfet de la Seine ;   « Et, statuant sur la compétence :  « Attendu que Puech réclame des dommages-inté-  rêts contre le général Alleyron, à raison du préjudice  que lui aurait causé la mesure d'expulsion dont il a  été l'objet aux termes d'un arrêté en date du 8 jan- vier 1875, rendu contre lui par le défendeur, alors  gouverneur de la Nouvelle-Calédonie;   « Que cette décision, d'après le libellé de l'assigna-  tion, était ainsi conçue :   « Vu l'ordonnance du 23 avril 1843, ensemble le dé-  cret du 14 janvier 1860, réglant les pouvoirs extraor- dinaires du gouverneur ;   « En exécution des ordres du gouvernement, trans-  mis par un télégramme du ministre de la marine et  des colonies, reçu à Sidney le 24 décembre dernier,   « Arrête :  « Article 1er. — Les sieurs Puech, commerçants à   Nouméa, sont expulsés du territoire de la Nouvelle- Calédonie et dépendances.   « Art. 2. — Un délai de deux mois leur est accordé   pour se conformer à ces dispositions. »";5 mai;TRIBUNAL CIVIL DE LA SEINE lre cli;http://www.enap.justice.fr/ARCHIVE/ENAP_GAZETTE_TRIBUNAUX_18860614.pdf;188606140
188606230;"« Le Tribunal,  « Attendu que Polge, qui s'était rendu acquéreur,   le 5 septembre 1883, aux enchères publiques, au Tat- tersall, d'un étalon nommé Faublas, avait chargé cet  établissement de lui expédier l'animal à son haras  situé à Dormans, station de la ligne de l'Est;   « Attendu que, pendant son embarquement, le che-  val s'est blessé au paturon du membre postérieur   droit, ce qui a rendu nécessaire sa rentrée dans les   écuries du Tattersal, pour y recevoir les soins exigés   par son état ;   « Que le 11 septembre, le cheval paraissant aller  bien, fut dirigé sur le haras de Polge; mais que, peu  de jours après, son état s'est empiré et que le 16 sep-  tembre il succombait;   « Attendu qu'il s'agit d'examiner si, comme le pré-  tend Polge, la compagnie de l'Est et le Tattersall sont   responsables de la mort de l'animal ;   « Attendu, en ce qui concerne lacompagnie de l'Est,   que Polge prétend avoir expressément recommandé   à cette compagnie de transporter l'animal dans un  wagon dit wagon-vachère ; mais qu'elle n'aurait   pas tenu compte de la recommandation et aurait   donné pour opérer le transport le compartiment d'un  wagon-écurie; que l'accident ne se seraiï pas pro- duit si ses instructions avaient été suivies par la   compagnie;   « Que cette dernière aurait ainsi commis une faute   qui engagerait sa responsabilité, et qu'elle devrait,  dès lors, être tenue de lui payer et le prix du cheval   et des dommages-intérêts ;   « Attendu qu'un wagon-vachère aurait-il été com-  mandé par Polge, ce qui du reste n'est pas établi, ce   fait ne saurait engager la responsabilité de la com-  pagnie de l'Est, que si la personne chargée par Polge   d'embarquer le cheval avait demandé un wagon de ce   genre et s'il était établi que la compagnie ait refusé  de le mettre à sa disposition ;   « Qu'il n'est pas allégué que cette demande ait été   faite et que la compagnie de l'Est ait refusé d'y faire   droit ;   « Que Polge est dès lors mal fondé à prétendre   qu'elle est responsable de l'accident;   « Que la demande, en ce qui la concerne, doit donc   être repoussée ;   « Attendu, en ce qui concerne le Tattersall, que  Polge a transmis à cet établissement une dépêche   ainsi conçue : « Faites embarquer par homme sûr   « Faublas aujourd'hui train partant midi pour Dor-  « mans, vachère commandée Est »";25 février ;COUR DE CASSATION ch;http://www.enap.justice.fr/ARCHIVE/ENAP_GAZETTE_TRIBUNAUX_18860623.pdf;188606230
188606250;"« Le Tribunal,  « Au fond :  « Attendu que François-Victor Camand est: décédé à   Paris, boulevard Voltaire, 180, le 13 janvier 1883, lais- sant pour habiles à se dire et porter l-îériliers, Au- guste, Joseph et Miette Camand, ses frères W sœur,  et Victor et Joseph Vaché, ses neveux par représenta- tion d'Euphrasie Camand, son autre sœur, femme  d'Antoine Vaché, décédée ;   «Attendu que ceux-ci demandent la nullité d'un   legs universel fait à la mineure Jeanne Gaboris, aux  termes d'un testament en date du 10 décembre 188i;,  déposé à M0 d'Hardiviller, notaire à Paris;   « Attendu que, dans un premier testament en date   du 25 janvier 1881, déposé à M= Fabre, notaire à Bru- noy, après avoir institué pour légataire à titre uni- versel et sous réserve d'acquitter les charges y conte- nues, Victor Vaché, le testateur, s'exprime ainsi :   « Secundo. Il sera tenu de fiiire une rente à   « Mlle Bodet, avec qui j'ai'eu deux enl'anls, une rente.  « dis-je de 300 francs par an pendant la vie duranl, de  « cette demoiselle. Dans le cas où le dernier de nos  « enl'anls viendrait à vivre, à su majorité, il donnerait  « un capital de 10,000 francs; ce capital annulerait la  « rente et si la mère et la fille venaient à mourir, il ne   « devrait rien à personne de ce chef. Cette enfant aura  « sept ans le 8 avril 1881. »";25 mai ;COUR D'APPEL DE PARIS 7e ch;http://www.enap.justice.fr/ARCHIVE/ENAP_GAZETTE_TRIBUNAUX_18860625.pdf;188606250
188606280;"« Le Tribunal,  « Attendu que, par acte sous-seing privé, en date   du 29 janvier 1880, enregistré, Peretmère, alors pro- priétaire d'une maison sise rue des Pyramides, 17,  appartenant actuellement à la darne de Montger- mont, a donné à bail à la Société civile des Mines du.  Quercy le premier étage de la maison pour une durée  de dix années ;   « Attendu que, par acte sous-seing privé, en date-  du 3 janvier 1883, la Société civile des Mines du  Quercy a cédé son bail à MM. Abel Rey et frères, avée  toutes les charges,clauses et conditions insérées au- dit bail, mais avec faculté toutefois,pour les cession- naires, de faire cesser la location à leur gré ïe  1"" avril 1886 ;   « Attendu que Abel Rey et frères, entendant user   de la faculté qu'ils s'étaient réservée, concluent à ce  que la dame de Montgermont soit tenue de les lais- ser déménager et quitter les lieux le 15 avril pro- chain ;   « Mais attendu qu'en vertu du bail sus-énoncé, le   premier était tenu, de convention expresse, « de gar- « nir les lieux loués et de les tenir garnis de meu- « bles et objets mobiliers, en suffisante quantité  « pour répondre du payement des loyers ; »";5 mai ;"TRIBUNAL CIVIL DE LA SEINE 7"" ch";http://www.enap.justice.fr/ARCHIVE/ENAP_GAZETTE_TRIBUNAUX_18860628.pdf;188606280
188606300;« La Cour,   « Attendu en droit que la généralité des termes de  l'article 574 du Code de commerce démontre que cet   article doit recevoir son application pour tous les  effets de commerce, même ceux portant un endosse- ,  »;7 juin ;COUR D'APPEL DE CHAMBERY ;http://www.enap.justice.fr/ARCHIVE/ENAP_GAZETTE_TRIBUNAUX_18860630.pdf;188606300
188607010;"« Le Tribunal joint les causes, et, statuant sur le   tout par un seul et même jugement, tant sur la de  mande principale de A. Rey et frères que sur la de- mande reconventionnelle de Tholotte et C° ;   « Sur la demande principale de 1,188 francs 90 cen-  times :   « Attendu que Tholotte et C% pour repousser la de-  mande de Abel Rey et frères, soutiennent que, ces  derniers n'ayant pas effectué dans le délai voulu la li- vraison à laquelle ils s'étaient engagés, ils auraient  été en droit de leur retenir la somme de 1,188 francs   90 centimes, à titre d'indemnité ;   « Qu'en conséquence, Tholotte et C"" ne sont pas   fondés a retenir la somme de 1,188 fr. 90 sur le mon- tant des livraisons ;   « Qu'il y a lieu de les obliger au payement ce celte   somme ;   « Sur la demande reconventionnelle :  « Attendu que, de ce qui précède, il résulte que   A. Rey et frères ne sont pas responsables des fêtards  apportés dans la livraison des 1,000 quintaux de blé ;  ■< Et attendu que Tholotte et C"" ne justifient pas  des frais de camionnage et autres dont ils réclament   le payement ;   « Qu'en conséquence ils doivent être déclarés mal   fondés en leur demande reconventionneMc ;   « Par ces motifs,   a Le Tribunal,   « Condamne Tholotte et Ce, par les voies de droit,   à payer à A. Rey et frères la somme de 1,188 fr. 90,  montant de la demande, avec les intérêts suivant   la loi :   « Déclare Tholotte et C« mal fondés en leur demande   reconventionnelle, les en déboute et les condamne,  par les voies de droit, en tous les dépens, y compris  70 francs pour les honoraires de l'arbitre, même au  coût de l'enregistrement du présent jugement ;   « Ordonne que le présent jugement sera exécuté  selon sa forme et teneur, et en cas d'appel, par pro- vision, pour le principal et les intérêts seulemeul, ;'i  charge par Abel Rey et frères de fournir caution ou  de justifier île solvabilité suffisante, ooïiferœésisenl à  l'article 439 du Code de procédure civile. »";16 janvier ;COUR D'APPEL DE PARIS 7e ch;http://www.enap.justice.fr/ARCHIVE/ENAP_GAZETTE_TRIBUNAUX_18860701.pdf;188607010
188607011;"« La Cour,  « Considérant qu'à la date du 8 mai 1880 Tholotte   et Ce ont acheté de Abel Rey 1,000 quintaux de blé  roux hiver d'Amérique sur juin 1880 au prix de  30 fr. 50 les cent kilos sur wagon Rouen, gare mari- time, avec la faculté aux vendeurs de livrer au Havre  à 30 fr. 25 les 100 kilos; que, dès le 12 juin suivant,Tho- lotte et Ce ont fourni à Rey les moyens d'opérer leur  livraison en l'autorisant à prendre en location à leur  compte des sacs à la maison Scups ;   « Que, le 30 juin, la livraison n'étant point effectuée,   Tholotte et C° ont signifié à Rey frères une mise en  demeure et que les expéditions n'ont eu lieu qu'aux  dates des 2, 3, 4 et 5 juillet;   « Considérant qu'aux termes du contrat la mar-  chandise était livrable sur wagon, que conséquein- ment c'était au vendeur qu'incombait l'obligation de  délivrer sur wagon ladite marchandise, de prendre  les mesures nécessaires pour assurer celte délivrance  et notamment d'adresser une réquisition dans ce but  à la compagnie du chemin de fer; que cette in- terprétation du contrat est d'autant plus rationnelle   que la date de la livraison était variable entre le 1e1' et  le 30 juin, et que l'acheteur, qui était éloigné du lieu  de débarquement, aurait pu difficilement envoyer les  wagons au moment où le vendeur aurait été en me- sure d'opérer la délivrance;   « Considérant que Rey ne prouve pas qu'il ait  adressé de réquisition à la compagnie de l'Ouest;  qu'il est en faute de ne pas avoir rempli cette obliga- tion; que conséquemment il est passible de dom- mages-intérêts à raison du préjudice éprouvé par son  acheteur ;   « Considérant qu'en l'absence de ta justification   d'une réquisition au chemin de fer il n'y a lieu de  rechercher au procès actuel de la compagnie de  l'Ouest aurait été dans l'impossibilité de livrer des  wagons; que de plus il n'est pas douteux que par  leur acte de mise en demeure'du 30 juin Tholotte et  Ce n'aient utilement, protesté contre le retard, de la  livraison;   « Que, par suite de l'inexécutiou dans le délai sti-  pulé des engagements de leur vendeur ils ont éprou- vé un préjudice que les éléments de la cause per- mettent d'arbitrer au chiffre de ?00 francs ; qu'enlip.  ils justifient avoir payé 188 francs 90 pour frais de  camionnage et autres accessoires dont Rey frères  leur doivent le remboursement ;   «Qu'il résulte de ce qui précède qu'il y a lieu de  condamner Rey frères au payement de 688 francs DO  pour les causes ci-dessus spécifiées et de confirmer,   d'autre part, la disposition du jugement condamnant  Tholotte et Cau payement de 1,188 francs pour solde  de leur prix ;   « Mais, considérant que par suite de l'exécution  provisoire du jugement dont appel, Tholotte et C°  ont déjà acquitté aux mains de Rey frères la somme  de 1,188 francs.   « Que, conséquemment, Rey frères doivent être   condamnés envers Tholotte et Ce, toute compensation  opérée, en payement de 688 francs 90 centimes;   « Par ces motifs,  « Reçoit Tholotte et C° appelants du jugement du   « Mais, attendu qu""it résulte des documents pro-  Tribunal de commerce de la Seine du 19 février 1881 ;   duits et des explications des parties que A. Rey et  frères ont vendu à Tholotte et C° 1,000 quintaux de  blé, livrables dans le mois de juin, au prix de 30 francs  50 centimes, sur wagon Rouen, gare maritime, dans   les sacs des acheteurs ;   « Que, le 25 juin, Abel Rey et frères ont avisé Tho-  lotte et Cc d'avoir à adresser immédiatement et direc- tement à la maison Trotrot, à Rouen, cosignataire  du navire, les toiles nécessaires pour les 1,000 quin-  taux de blé livrables en juin ;   « Infirme ledit jugement en ce qu'il a débouté   Tholotte et Ce de leur demande reconventionnelie ;   « Emendant et statuant à nouveau, condamne Rey   frères à payer à Tholotte et C° la somme de 688 francs  90 centimes avec les intérêts de droit ;   « Confirme le jugement en ce qu'il condamne Tho-  lotte et C° à payer à Rey frères la somme de  1,188 francs, solde de leur prix d'achat, laquelle con- damnation a été suivie d'exécution en conformité de  l'article 439 C. pr. civ.   « Que, le 30 juin, Tholotte et C°, ayant fait somma-  « Fait masse des dépens de première instance et   d'appel, etc. »";16 janvier ;COUR D'APPEL DE PARIS 7e ch;http://www.enap.justice.fr/ARCHIVE/ENAP_GAZETTE_TRIBUNAUX_18860701.pdf;188607011
188607020;"« La Cour,  « Sur la fin de non-recevoir opposée par Filon à   l'appel de Houzet, es noms, et de Dambricourt;   « Considérant, d'une part, que si le paiement des   frais d'une instance fait sans aucune réserve de l'ap  pel est un acte d'exécution équivalant à un acquies- cement volontaire et libre ;   «Considérant, d'autre part, que si le défaut de ré   serves exprimées et formelles ne peut être suppléé  par les circonstances accessoires du payement des  frais telles que l'appel lui-même, et le retrait des piè- ces de poursuites, circonstances qui ne peuvent prê- ter qu'à une interprétation arbitraire ; que si, dans  cette hypothèse, c'est à bon droit que le payement  des frais doit être considéré comme un acquiesce- ment, il en est autrement du cas, où en payant les  frais, l'appelant a formellement réservé le droit et le   bénéfice de son appel ;   « Considérant, en effet, que l'acquiescement à un   jugement est la reconnaissance du bien jugé et la re- nonciation à critiquer la sentence rendue;   « Qu'on ne peut attribuer un tel résultat à un fait   aussi explicite que celui des réserves elles-mêmes et  une semblable pensée à celui qui exprime une volonté  contraire aussi peu équivoque ;   « Considérant en fait que le 11 septembre 1884,   Filon a fait commandement à Houzet ès qualités de  paye:"" principal, intérêts et frais ;   « Considérant que Houzet ès qualités a fait ce paic-  menl complet comme contraint et forcé, et sous ré- serve d'appel ; qu'il a ainsi clairement manifesté sa  volonté de ne pas, en payant, se soumettre à la déci- sion qu'il considérait comme lui faisant grief;   « Au fond,  « Considérant, etc., etc.  « Par ces motifs,  « Déclare l'appel recevable, au fond, infirme, etc.  « Condamne Filon aux dépens de l'instance et   d'appel. »";4 mai ;COUR D'APPEL DE PARIS 2e ch;http://www.enap.justice.fr/ARCHIVE/ENAP_GAZETTE_TRIBUNAUX_18860702.pdf;188607020
