id;arrêt;date;juridiction;lien;id
188609240;"« La Cour,  « Ouï M. le conseiller Crépon en son rapport, l'a-  vocat des demandeurs en ses observations, M. l'avo- cat général Desjardins en ses conclusions, et après  en avoir délibéré conformément à la loi :   « Sur la recevabilité du pourvoi :  « Attendu que l'art. 16 de la loi du 21 mai 1836   renvoie pour les conditions dans lesquelles doit être  formé le pourvoi en cassation aux formes détermi- nées par la loi du 7 juillet 1833 ;   « Attendu que par suite, il y a lieu de se reporter  aux articles 20 et 42 de cette loi, reproduite textuel- lement par les articles 20 et 42 de la loi du 3 mai 1841;   « Attendu que l'article 42 renvoie à l'article 20 pour   leo formes du pourvoi ;   (f Que le Tribunal au greffe duquel doit être faite la   décla.ration de pourvoi est, d'après cet article, le Tri- bunal qui a rendu le jugement d'expropriation ;   « Attt'ndu que rien n'autorise à déroger à cette  prescription formelle de la loi en matière d'expro-  priation poxur l'établissement de chemins vicinaux et   a admettre t'omme régulier le pourvoi formé au Tri- bunal depaix, d'une part, parce que ce Tribunal n'est  Pas désigné par la loi pour la réception du pourvoi,  de l'autre parce que le juge de paix, quand il préside   lejury, n'agit que comme délégué du Tribunal civil,  et que le Tribunal de paix n'a sa place marquée dans   aucune des phases de la procédure d'expropriation ;   « Attendu en fait que le pourvoi des sieurs Bahae- |el et consorts a été formé non au greffe du Tribunal   Dunkerque qui avait prononcé l'expropriation,   niais au greffe de la justice de paix du canton ouest   de cette ville ;   « Attendu que dans ces conditions, ce pourvoi ne   saurait être considéré comme régulier et valable, et  Que, par suite, les demandeurs ont encouru la dé- chéance prononcée contre les parties qui ne se sont  Pas pourvues dans la quinzainede la décision du jury;  « Par ces motifs, dit le pourvoi non recevable, con-  damne les demandeurs à l'amende de 150 francs en- vers le Trésor public, décimes non compris, à 75 fr.   a indemnité envers le défendeur, et aux dépens. »";17 mars ;COUR DE CASSATION ch;http://www.enap.justice.fr/ARCHIVE/ENAP_GAZETTE_TRIBUNAUX_18860924.pdf;188609240
188609241;"« La Cour,   « Sur l'appel principal ;   « Attendu que la réserve de l'approbation préfec-  torale dans le trailé du 9 novembre 1883, n'avait d'au- tre but que de rendre la commune habile à contrac- ter et de rendre ainsi l'acte valable ;   « Attendu que c'était donc l'approbation de l'auto-  rité pouvant donner cette habilité qui était visée et  non l'autorité préfectorale abstraitement, fût-elle  même inapte à la procurer ;   « Attendu que pour pouvoir utiliser les eaux ache- tées d'Odon-Vigne, la commune de Bourg-du-Péage  devait, outre l'approbation du traité, obtenir encore  les moyens de se libérer, et dès lors, la faculté de  contracter un emprunt et de s'imposer extraordinai- rement, comme aussi obtenir toutes autorisations  nécessaires pour arrivera amener et à distribuer ces  eaux ;   « Atlendu que pour avoir ces dernières autorisa- tions et facultés, la commune de Bourg-du-Péage de- vait avoir recours, non pas au préfet, mais bien au  gouvernement ; que dès lors, toutes ces affaires étant  connexes, les prescriptions administratives voulaient  qu'elles fussent soumises à un examen d'ensemble,  après lequel l'autorité supérieure, absorbant les  autres, serait seule apppelée à statuer sur toutes les  questions simultanément ;   « Que c'est ce qui a eu lieu au regard des demandes   de la commune de Bourg-du-Péage; qu'on ne saurait  donc lui faire un reproche d'avoir suivi la seule voie  que traçaient les circulaires ministérielles et dont elle  n'aurait pu s'écarter; que l'approbation voulue par le  traité du 9 novembre 1883 a donc été régulièrement  donnée par le décret d'utilité publique du 30 mai 1885;  que cette approbation est aussi claire, aussi nette et  aussi complète que possible ;   « Attendu que le décret du 30 mai 1885 et l'arrêté   de cessibilité du 7 novembre 1885 qui avaient pour  but, en plus de l'approbation et de la vie à donner au  traité du 9 novembre 1883, de permettre à la com- mune d'être exonérée des droits d'enregistrement du  traité, étaient nécessaires tous deux pour arriver à  ce dernier résultat ; que ni l'un ni l'autre de ces actes  d'administration n'a entendu, en cas d'exécution de  trailé donner à la commune d'autres droits ou faculté  sur les eaux d'Odon-Vigne ou les propriétés qui les  renferment que ceux concédés dans le traité du 9 no- vembre 1883 ;   « Que l'autorité administrative a seulement voulu   permettre encore à la commune de Boug-du-Péage  d'exécuter les travaux nécessaires pour amener et  distribuer les eaux vendues et lui donner le moyende  se libérer ; que notamment l'arrêté préfectoral"" du 7  novembre 1885 n'a entendu rendre cessible que sui- vant les clauses et condit ions du traite avec Odon-Vi- gne, que, sans qu'il y ail lieu de se livrer à aucune  interprétation, cela ressort non seulement du dispo- sitif de cet arrêté, mais d'une façon plus nette et  plus saisissante encore de ses considérants et des  documents qui y sont visés; que c'est donc en vain  qu'Odon-Vigne prétend aujourd'hui que l'approba- tion, telle qu'elle est donnée, renferme des clauses  contraires au traité et incompatibles avec son exé- cution ;   « Attendu que le dépôt du traité en l'étude du no-  taire Monnet n'a rien d'irrégulier. ni rien de contraire  aux intérêts d'Odon-Vigne ; qu'il a été fait unique- ment pour arriver à l'enregistrement gratuit désiré  par la commune ;   « Attendu qu'Odon-Vigne ne justifie d'aucune   cause de dommages autre que celle dont il sera parlé  au su jet de l'appel incident ;   «Adoptant au surplus et entant que de besoin,   les motifs non contraires donnés par les premiers  juges :   « Sur l'appel incident :  « Attendu que le fait par la commune de Bourg-du- Péage d'avoir, pour être dispenséedes droits d'enregis- trement, eu recours à un décret d'utilité publique,  fait que les parties n'avaient pas prévu au moment du  traité, a pu être l'occasion d un retard dans l'appro- bation, retard préjudiciable à Odon-Vigne dans une  mesure dont il est et a été justement et suffisamment  tenu compte par la mise à la charge de la commune  de Bourg-du-Péage d'une partie des dépens de pre- mière instance;   « Par ces motifs,   « Statuant tant sur l'appel principal que sur l'appel   incident;   29 juin 1885. »";26 juin;COUR D'APPEL DE GRENOBLE ;http://www.enap.justice.fr/ARCHIVE/ENAP_GAZETTE_TRIBUNAUX_18860924.pdf;188609241
188609242;"« Le Tribunal,   « Déclare nulle et de nul effet la surenchère faite  par Bénézech sur la vente d'immeubles consentie  à Maffre par les époux Marty, suivant acte, au rap-  port de Me Prades, notaire, en date du 29 mai 1885;   «Condamne Bénézech aux dépens sans dommages.»";4 février ;TRIBUNAL CIVIL DE CASTRES ;http://www.enap.justice.fr/ARCHIVE/ENAP_GAZETTE_TRIBUNAUX_18860924.pdf;188609242
188609250;« Le Tribunal,  « Attendu que les déclarations de six témoins de   'enquête fournissent la preuve d'injures et surtout  ae violences suffisamment graves de la part de D...   FEU;25 mars ;TRIBUNAL CIVIL DE SAINT-OMER ;http://www.enap.justice.fr/ARCHIVE/ENAP_GAZETTE_TRIBUNAUX_18860925.pdf;188609250
188609251;"« Le Tribunal, avant dire droit au fond et tous   moyens des parties étant réservés, sauf en ce qui  concerne la validité de la clause do non-responsabi-  lité alléguée, autorise le demandeur à prouver, tant   par titres que par témoins, en la forme accoutumée  des enquêtes et devant M. Benoit, juge en ce siège;  « 1° Que le 7 décembre 1885, il a été victime d'un   accident au cours du travail qu'il efl'ectuait pour le  compte de Lhoste ;   « 2° Que ledit accident a été causé par un bloc de   pierre qui s'est détaché du toit du chantier dans la  carrière de pierre où il travaillait;   « 3° Que ce chantier était abrité par un avancement   de rochers qui n'était ni boisé ni étayé, et qu'ainsi le  bloc de pierre a pu librement se détacher de cet avan- cement de rochers et blesser très gravement le sieur  Barlet ;   « 4° Que cet accident a eu pour Barlet des consé-  quences très graves, que sa jambe droite a été bri- sée, sa jambe et son bras gauche ont été fracturés,  outre de nombreuses contusions* à la tète et à plu- sieurs parties du corps;   « 5° Qu'il est incapable de tout travail et que n'ayant   aucune ressource, il est réduit, ainsi que sa femme,  à la plus profonde misère ;   « Autorise le juge-commissaire à se rendre sur les   lieux, en se faisant assister d'un expert s'il le juge  utile ;   « Nomme M. le docteur Cénas à l'effet de visiter le   blessé et de dire quelles ont été dans le passé et  quelles seront dans l'avenir les conséquences de  l'accident dont il a été victime ; quelle a été la durée  de son incapacité de travail totale ou partielle, et si sa  capacité de travail sera diminuée, et, en cas d'affir- mative, de combien ;   « Pour en suite des enquête et contre-enquête et  rapport, être admis par les parties requises et par le  Tribunal statue ce que de droit ;   « Réserve les dépens. »";10 août ;TRIBUNAL CIVIL DE SAINT-ETIENNE lre ch;http://www.enap.justice.fr/ARCHIVE/ENAP_GAZETTE_TRIBUNAUX_18860925.pdf;188609251
188609260;"« La Cour : ouï à l'audience publique du 12 avril   1886, M. le conseiller Dareste en son rapport et M's  Gocley et Moutard-Martin, avocats des parties, en  leurs observations respectives et à l'audience publi- que du 13 avril 1886, M. Desjardins, avocat général,  en ses conclusions, et après en avoir délibéré en la  chambre du conseil ;   « Sur le premier moyen du pourvoi :  « Attendu que l'article 1er de la loi du 29 juin 1872   assujettit à la taxe de 3 GfO sur le revenu toutes les  sociétés, compagnies ou entreprises quelconques ;  « Attendu que, par acte notarié en date du 2 juin  1880, les sieurs Klein et Duclos et le comte de Gram- mont, ont déclaré former entre eux une société civile  et particulière ayant pour objet la mise en valeur de  deux immeubles contigus leur appartenant, l'ouver- ture d'une ou plusieurs rues, la construction de plu- sieurs maisons et ta vente desdites constructions ou  des terrains ; que le même acte détermine les apports  des associés et règle le partage des bénéfices à réali- ser ; qu'ainsi, le contrat formé entre les parties pré- senle tous les caractères essentiels du contrat de so- ciété ;   «Attendu qu'il importe peu que la société dont il   s'agit n'ait ni raison sociale ni siège social et qu'elle  n'ait pas été publiée ; qu'en effet, les sociétés civiles  ne sont point soumises à ces conditions ni à ces for- malités ; que si le comte de Grammont s'est engagé  par l'article 6 à fournir son concours et celui de sa  femme pour les actes d'emprunt et d'aliénation, il ne  suit pas de là qu'il se soit réservé la propriété exclu- sive de son apport, quele contraire résulte de tous les  articles du contrat où il est parlé de l'administration  et du partage de l'actif social ;   « Attendu, dès lors, qu'en statuant ainsi qu'il l'a  fait, le jugement attaqué, loin de violer l'article 1"" de  la loi du 29 juin 1872, en a fait, au contraire, une juste  application ;   « Par ces motifs,  « Rejette le moyen ;  « Mais sur le deuxième moyen, présenté à titre   subsidiaire ;   « Vu l'article 2 de la loi :  « Attendu que cetarticle s'applique uniquement au   cas où il s'agit de fixer le chiffre du revenu ; qu'il ne  saurait faire obstacle au droit qui appartient à la so- ciété de prouver par tous les moyens légaux qu'elle  n'a eu aucune espèce de revenus ;   « Attendu qu'en décidant le contraire, le jugement   attaqué a violé la disposition précitée ;   « Par ces motifs,  « Casse, etc. »";12 et 13 avril ;COUR DE CASSATION ch;http://www.enap.justice.fr/ARCHIVE/ENAP_GAZETTE_TRIBUNAUX_18860926.pdf;188609260
188609290;"« Le Tribunal,   « Attendu qu'aux termes d'un jugement rendu par   le Tribunal de commerce de la Seine le 21 février  1883, confirmé par arrêt de la Cour de Paris, en date   3 juillet 1885, Sari a été condamné à payer à   «angloff la somme de 12,341 francs 05 centimes;   « Que Weiler, cessionnaire de la créance de Gan-  S.lofï, a commencé contre Sari des poursuites de sai- sie immobilière ;   « Que par conclusions en date du 3 novembre 1885   kari a soulevé un incident, tendant à la nullité des   Poursuites ;   1 instance ;   « Que Sari, ayant été déclaré en faillte par juge- ment du Tribunal de commerce de la Seine, en date  27 novembre 1885, Normand est interveuu dans   * Qu'il a déclaré reprendre,, en sa qualité de syn-  dic de la faillite, et a conclu à la nullité des pour- suites, et subsidiairement à la discontinuation ;   « En la forme :  « Reçoit Normand ès noms intervenant et déclare   l'instance reprise avec lui ;   « Et statuant au fond ;  « En ce qui touche la validité des poursuites :  « Attendu que Sari a prétendu les poursuites en-  tachées de nullité, pour inobservation des formalités  prescrites par la loi ;   « Mais qu'il a négligé non seulement, d'établir la   justification de ses prétentions, mais même de préci-  ser les formalités qui n'auraient pas été remplies;   « Qu'il n'y a lieu de s'arrêter à son incident, qui   présente le caractère d'un moyen dilatoire;   « Attendu que Normand ès noms soutient que la   procédure d'expropriation serait viciée et nulle,  comme ayant été suivie par un cessionnaire, sans que  le transport ait été signifié au débiteur;   « Qu'il est justifié au contraire que l'acte sous   seings privés, en date du 15 novembre 1884, enregis- tré à Paris le 10 janvier suivant, folio 46, case 4«, con- tenant transport par Gangloff à Weiler de la créance  dont s'agit, a été signifiée par Weiler, suivant ex- ploit de Vincelet, huissier à Paris, en date du 14 jan- vier 1885;   « En ce qui touche la continuation des poursuites :  « Attendu que Normand és noms, expose que l'hy-  pothèque judiciaire, dont Weiler peut se prévaloir, a  été inscrite le 15 septembre 1885; qu'une instance est  commencée par le syndic, devant le Tribunal de com- merce de la Seine, afin de faire reporter l'ouverture  de la faillite, à une date antérieure audit jour, et que  l'effet de ce report, s'il était prononcé, serait de met- tre à néant l'hypothèque de Weiler ;   « Qu'il invoque l'application de l'article 572 du Code   de commerce, lequel réservait aux créanciers hypo- thécaires, et au syndic exclusivement, la poursuite  de la vente des immeubles, laquelle serait interdite  aux créanciers chirographaires ;   « Qu'en conséquence, il demande la disconti-  nuation des poursuites commencées par Weiler, et  subsidiairement un sursis, jusqu'à l'issue de l'ins- tance pendante devant le Tribunal de commerce;   « Attendu en droit, que si l'article 571 du Code de   commerce ne permet pas aux créanciers chirogra- phaires de procéder à l'expropriation des immeubles,  à partir du jugement déclaratif de la faillite, l'article  572 accorde au syndic le droit privatif d'en poursui- vre la vente, en cas seulement où il n'y a pas de pro- cédure en expropriation antérieurement commencée;   « Que les termes généraux dans lesquels est conçu   ce dernier article, s'applique aussi bien aux poursui- tes commencées par les créanciers chirographaires  qu'à celles faites au nom des créanciers hypothé- caires, en sorte que de la combinaison des deux ar- ticles il résulte qu'après le jugement déclaratif, le  créancier chirographaire ne peut pas commencer une  poursuite, mais peut continue uner poursuite com- mencée ;   « Que cette solution est conforme aux principes ;  « Que la faillite qui dessaisit à la fois le failli de   l'administration de ses biens, et le créancier chirogra- phaire de l'exerce de ses droits, ne produit ses effets  qu'en prenant les biens, dans l'état où ils sont, et sous la  réserve des actes consommés et des droits légitime- ment acquis, par l'effet d'une mainmise, acte et  droits auxquels il ne saurait être porté aucune at-  teinte ;   « Que d'ailleurs si la solution proposée par Nor-  mand était adoptée, les frais faits par le créancier,  pour parvenir à la vente, deviendraient des frais inu- tiles;qu'aucune disposition de la loi n'autorise à met- tre à la charge de la masse, et qu'il ne serait pas  juste de faire supporter parle créancier poursuivant,  lequel a agi dans la limite de son droit ;   « Attendu en fait que le commandement signifié   au nom de Weiler porte la date du 4 août 1885;   « Que la saisie porte lss dates des 7 et 8 octobre sui-  vant, la dénonciation de la saisie, la date du 15 du  même mois, que le cahier des charges a été déposé  le 30 octobre ;   « Que toutes ces dates sont antérieures à la décla-  ration de la faillite, laquelle a été prononcée le 29 no- vembre ;   « Que dans ces conditions, il est sans intérêt en la   cause qu'un jugement puisse, en reportant l'ouver- ture de la laillite, mettre à néant le droit hypothé- caire de Weiler, les poursuites commencées devant,  dans tous les cas, être mises à fin ;   « Par ces motifs,  « Dit Normand, ès noms, mal fondé dans sa de-  mande, tant principale que subsidiaire et l'en dé- boute ;   « Ordonne la continuation des poursuites :  « Et attendu qu'il y a titre, ordonne l'exécution   provisoire du présent jugement ;   « Condamne Normand, ès noms, aux dépens, dont   l'emploi est autorisé, pour Weiler, en frais de pour- suites, et pour Normand, ès noms, en frais d'admi- nistration. »";3 avril ;COUR D'APPEL DE PARIS 3° ch;http://www.enap.justice.fr/ARCHIVE/ENAP_GAZETTE_TRIBUNAUX_18860929.pdf;188609290
188609291;"« La Cour,   « Considérant que, d'après les derniers documents   produits devant la Cour, Weiler a donné, depuis l'in- troduction de l'appel, main-levée de l'inscription prise  par lui sur Sari à la date du 15 septembre 1885;   « Que, du reste, les premiers juges, en admettant   pour Weiler, comme créancier chirographaire, le  droit de suivre et de mettre à fin la saisie immobi- lière par lui pratiquée n'avaient plus eu à examiner  la demande subsidiaire de sursis basée sur l'instance  en report de faillite dont a été saisi le Tribunal de  commerce;   « Que la Cour n'a donc point à s'occuper, quelle   que puisse être sa décision, des conclusions subsi- diaires de Normand, ès qualités, qui- sont devenues  sans objet;   « Considérant, sur le seul chef de la demande et   de l'appel subsistant aujourd'hui, que si, en matière  de saisie mobilière, la déclaration de faillite amène la  discontinuation des poursuites, et la mainmise du  syndic sur les biens du failli avec le droit et la mis- sion de les réaliser, les articles 571 et 572 du Code de  commerce, qui s'expliquent sur la vente des immeu- bles du failli, défendent, à la vérité, aux créanciers,  sauf aux créanciers hypothécaires, de saisir les im- meubles après la déclaration de faillite, mais que le  texte de ces articles ne saurait être interprété en ce  sens que le créancier chirographaire, quiacommencé  une poursuite, alors qu'il était en droit de l'entre- prendre, ne pourrait la mener à fin et la verrait in- terrompue par l'effet seul du jugement déclaratif  peut-être même au moment où elle va aboutir après  une procédure compliquée et dispendieuse qui se  trouverait ne profiter à personne ;   « Considérant, au point de vue du poursuivant,   que, usant de son droit, il a dû compter sur un pri- vilège pour les frais exposés par lui pour une réalisa- tion utile à toute une catégorie de créanciers, privi- lège qui s'évanouissait au cas de substitution d'une  nouvelle procédure de vente à la procédure d'expro- priation, puisque ces frais auraient été faits en pure  perte, et que, s'ils sont dus par le failli, ils ne se- raient, en tous cas, exigibles qu'en monnaie de fail- lite ;   « Considérant qu'à un autre point de vue, la pour- suite, valablement entreprise ne saurait s'éteindre au  moment où la faillite est déclarée, sans nuire à tous  les créanciers inscrits ;   « Que la saisie pratiquée a dû, en effet, avoir pour   conséquence de paralyser leur action, puisque la sai- sie qu'ils auraient pu faire n'aurait pas dû être trans- crite, et qu'enfin la poursuite, à partir d'une certaine  époque, devenant commune à tous les créanciers hy- pothécaires, lesquels peuvent demander la subro- gation en cas d'interruption ou de ralentissement  dans l'instance, on ne comprendrait pas la clôture  d'une poursuite encourue, prononcée contre le sai- sissant, alors qu'elle pourrait être reprise par un  créancier hypothécaire intervenant ;   « Adoptant, au surplus, les motifs des premiers   juges ;   « Considérant, sur les offres libellées, dans les con-  clusions de Normand des frais de poursuites exposés  par Weiler jusqu'à déclaration de faillite, que sans  examiner si elles sont régulières, si, même elles ne  dépassent pas les pouvoirs du syndic, il résulte de ce  que dessus, qu'elles sont insuffisantes ;   « Que Weiler est donc en droit de ne pas les agréer;  « Par ces motifs, et ceux déduits au jugement:  « Met l'appellation à néant ;  « Déboute l'appelant de toutes ses demandes et   conclusions, comme non recevable et mal fondé ;   « Ordonne, en conséquence, que ce dont est appel   sortira son plein et entier effet ;   « Condamne Normand ès qualités, à l'amende et   aux dépens d'appel qu'il est, d'ailleurs, autorisé à  employer en frais de syndicat. »";3 avril ;COUR D'APPEL DE PARIS 3° ch;http://www.enap.justice.fr/ARCHIVE/ENAP_GAZETTE_TRIBUNAUX_18860929.pdf;188609291
188610010;"« La Cour,  « Considérant que Alexandre Edmond a, en 1883,   commandé à l'entreprise des Pompes funèbres le  convoi du sieur Deniset, décédé à Enghien et qu'il  s'est obligé solidairement tant en son nom personnel  qu'en celui des héritiers, à en payer les frais, fixés  d'un commun accord, à la somme de 3,025 fr. sur la- quelle il a versé acompte celle de 1,500 fr.;   « Considérant que, statuant sur la demande de la-  dite Compagnie, en payement du solde de la com- mande s'élevant à 1,525 fr., le jugement dont est ap- pel a déclaré que l'engagement souscrit par Edmond  constituait un contrat unilatéral et qu'il en a pro- noncé la nullité à raison du défaut d'accomplisse- ment des formalités prescrites par l'art. l,326du Code   civil;   « Mais, considérant que l'acte passé le 19 décembre   1883 entre les parties contient des engagements réci- proques; que l'entreprise des Pompes funèbres, s'o- bligeait en effet, à faire les fournitures du convoi en  échange de l'engagement d'Edmond de payer le prix   stipulé;   « Que la convention a donc le caractère d'un con-  trat synaltagmatique, et qu'elle est régie non par  l'article 1326 du Code civil, mais par l'article 1325   dudit Code ;   « Considérant, d'ailleurs, que ledit contrat men- tionne qu'il a été fait double entre les parties et qu'il  est régulier en la forme;   « Considérant enfin que l'intimé a exécuté pour  partie la convention, en payant un acompte, et qu'il  en a ainsi reconnu la validité;   « Par ces motifs,  « Reçoit l'entreprise des Pompes funèbres appe-  lante ;   « Met à néant le jugement dont est appel;  « Condamne Edmond à payer pour solde à la Com-  pagnie appelante la somme de 1,525 fr. avec les inté-  rêts de droit;   « Ordonne la restitution de l'amende;  « Condamne Edmond aux dépens de première ius-  tance et d'appel, etc. »";19 juillet ;COUR D'APPEL DE PARIS 7° ch;http://www.enap.justice.fr/ARCHIVE/ENAP_GAZETTE_TRIBUNAUX_18861001.pdf;188610010
