id;arrêt;date;juridiction;lien;id
188603051;"« La Cour,  « Considérant que la demande formée par Troussel, a   pour objet d'une part, de faire prononcer la nullité de  la société anonyme de Peignage et de Filature de laine,  fondée par Bonpain en 1880, et, d'autre part, de faire  déclarer les fondateurs et administrât-urs de cette so- ciété solidairement responsables de celte nullité dans les  termes de l'article 42 <ie la loi de 1867 ;   « Considérant que Troussel reconnaît qu'il n'est pas   créancier de Ja société ; qu'il s'est, en effet, désisté de sa  demande en paiement de 10,000 francs qu'il avait formée  en cette qualité ;   « Qu'il se présente uniquement comme porteur d'ac- tions de la société de Peignage, dont il n'est pas proprié- taire, mais qu'il soutient lui avoir été remises en nan- tissement par Bonpain, son débiteur ;   »";17 février;COUR D'APPEL DE PARIS 3» eh ;http://www.enap.justice.fr/ARCHIVE/ENAP_GAZETTE_TRIBUNAUX_18860305.pdf;188603051
188603070;"« La Cour,  « Sur l'exception de jeu opposée par Goujon,  « En droit, considérant que la loi du 18 avril 1885,   n'est pas une loi interprétative et n'a pas d'effet ré- troactif;   « Que la loi nouvelle n'a fait pour l'avenir que rendre  licite la cause des obligations qui, prenant leur principe  dans le jeu, n'étaient pas considérées antérieurement  comme remplissant la quatrième condition prévue par  l'article 1108 du Code civil;   « Qu'elle a pour objet principal en effet de réglé-  menter les conventions des parties, et que si dans une  certaine mesure, elle intéresse l'ordre public en validant  des transactions d'une nature particulière, elle n'a pas  pour but spécial de sauvegarder les principes d'intérêt  général ;   « En fait : considérant que les opérations faites à la   Bourse antérieurement à la loi susvisée du 8 avril 188o  n'ont consisté qu'en des spéculations sur des différences;  que le caractère de ces opérations était connu de  Crêpez ;   « Par ces motifs,   « Infirme,  « Déclare Crêpez non recevable en sa demande;  « L'en déboute ;  « Restitution de l'amende,  « Condamne Crêpez en tous les dépens de première   instance et d'appel. »";10 décembre;COUR D'APPEL DE PARIS 2a ch;http://www.enap.justice.fr/ARCHIVE/ENAP_GAZETTE_TRIBUNAUX_18860307.pdf;188603070
188603071;"« Le Tribunal,   « Raçoit Clément ès qualité opposant en la forme au   jugviuiWU par défaut conue lui ïendu en ce Tribunal le  29 août 1885, et statuant au fond sur le mérite de son  opposition ;   « Sur l'ensemble des demandes :  « Attendu qu'il ressort des faits de ia cause que fin   octobre 1884, Buffier et Fribourg concédaient à ia so- ciété Cahuzac, Limouzin et Parejo, le droit de publier  dans les journaux qu'ils éditaient, un roman intitulé le  Fils de Pazza, moyennant lé prix de 10 centimes la  ligne ;   « Attendu que Clément ès qualité soutient que les   journaux dont s'agit ayant cessé de paraître avant la  publication entière du roman, il ne devrait payer que  dans la proportion parue du roman ;   « Biais attendu qu'en traitant avec Buffier et Fribourg,   la société susvisée a pris à forfaiî le roman entier qui  lui était offert; que seuls Cahuzac, Limouzin et Parejo  doivent supporter la conséquence de la disparition des  journaux dans lesquels ils publiaient le roman dont  s'agit; que le contrat qu'ils faisaient avec les deman- deurs n'était nullement subordonné à l'existence de ces  journaux; qu'il est justifié que le roman entier dont  s'agit, devait comporter onze mille quatre cent soixante- quinze lignes ; que c'est donc à bon droit que Buffier et  Fribourg réclament, de ce chef, le paiement de 1,147 fr.  S0 c. ; mais qu'il y a lieu de repousser leur demande en  dommages-intérêts, aucune justification d'un préjudice  quelconque n'étant faite;   « Par ces motifs,   « Déboute Clément ès qualité de son opposition au   jugement du 29 août 188a ;   « Déclare toutefois les demandeurs mal fondés en leur   demande en dommages-intéiêts ;   « Annule, sur ce chef, la condamnation prononcée par   ledit jugement ;   « Et condamne Clément ès qualité aux dépens. »";23 février;TRIBUNAL DE COMMERCE DE LA SEINE;http://www.enap.justice.fr/ARCHIVE/ENAP_GAZETTE_TRIBUNAUX_18860307.pdf;188603071
188603100;"« Le Tribunal,  « Attendu que par jugement du 25 février 1884, la  dame G... a été autorisée à faire par voie d'enquête la  preuve des faits articulés par elle à l'appui de sa de- mande en séparation de corps ;   « Qu'il a été procédé aux enquête et contre-enquête,   qne la dame C... ayant par conclusions du 2 août 1884,  demandé la transformation de sa demande en divorce,  une ordonnance de cette chambre a donné acte à la  dame C... de ses conclusions, a ordonné la communica- tion au ministère pnblic, désigné M. Duboys, juge,  comme rapporteur et fixé le jour de l'audience ;   s En ce qui concerne la demande subsidiaire en sé-  paration de corps :   « Attendu qu'en prenant des conclusions tendant à   'a conversion en divorce de sa demande de séparation  de corps, la dame C... a formellement renoncé à sa de- mande primitive ;   « Que cette demande dont les conséquences sont com-  plètement différentes de celles de la demande en divorce,  ^saurait en être considérée comme un subsidiaire,  qu'elle est donc non recevable ;   « En ce qui concerne la demande principale,  « Attendu que de la combinaison des témoignages reçus   «ans les enquête et contre-enquête, il ne lésulte pas   suffisamment que les griefs .articulés soient complète- ment justifiés ;   « Que tout au moins ils ont été singulièrement exa-  gérés et dénaturés ; que si, dans certaines circonstances,  G... s'est servi vis-à-vis de sa femme d'expressions plus  ou moins grossières, il est établi par la contre-enquête  que C... avait été provoqué par des scènes de jalousie  que lui faisait fréquemment sa femme, que les actes de  violence relevés dans les articulations n'ont pas eu la  gravité qui leur était attribuée ;   « Que notamment il n'est pas suffisamment établi que   C... ait jeté de l'eau sur sa femme alors qu'elle était  déshabillée et dans sou lit, ni qu'il lui ait jeté à la tête  une cafetière ou du café;   « Qu'il n'apparaît pas que les relations de G,., avec   une femme P... aient eu le caractère coupable et inju- rieux pour la dame G..., que celle-ci leur attribue; que  le sieur G... connaissait, avant son mariage, la femme P...,  que celle-ci est dans la plus complète misère, qu'elle a  huit enfants, ce qui explique que C... ait pu, à diverses  reprises, donner des secours à cette femme ; que d'ail- leurs la dame G... ne l'a pas ignoré ;   « Qu'en résumé, les faits articulés, réduits par les en- quête et contre-enquête à leurs véritables proportions ne  sont pas suffisants pour faire rompre le lien conjugal et  n'ont pas une gravité suffisante pour empêcher dans  l'avenir Ja reprise de la vie commune ;   « Par ces motifs,  « Déclare la dame C... non recevable en sa demande   subsidiaire en séparation de corps ;   « L'en déboute ;   « Dit qu'il n'y a lieu d'admettre le divorce entre les   époux C... ;   « Gondamne la dame C... aux dépens. »";5 mars;COUR D'APPEL DE PARIS 49 ch;http://www.enap.justice.fr/ARCHIVE/ENAP_GAZETTE_TRIBUNAUX_18860310.pdf;188603100
188603101;"« La Gour,   « Attendu que Viollet frères, négociants à Thuir,   exploitent depuis l'année 4853 un produit de leur inven- tion dénommé par eux Byrrh au malaga; qu'ils ont dé- posé conformément à la loi, le 10 février de la même  année, au greffe du Tribunal de commerce de Perpignan  l'étiquette représentant leur marque de fabrique et des- tinée à être apposée sur les bouteilles de Byrrh ;   « Attendu que Jullian, négociant à Cette, a créé un   produit similaire, par lui dénommé Bikk, apéritif au vin  de Malaga, et déposé, le 21 novembre 1884, au greffe  du Tribunal de commerce de Cette la marque de fabri- que du susdit produit qu'il exploite sous le nom de Jul- lian-Viollet ;   « Que Viollet frères, se prétendant victimes d'une con-  currence déloyale ont actionné Jullian en réparation du  préjudice qu'elle leur a occasionné; qu'ils signalent  comme éléments de cette concurrence déloyale l'adjonc- tion par Jullian du nom de Viollet à son nom patrony- mique, l'état de ses étiquettes, reproduisant l'aspect gé- néral et les traits essentiels de leur marque de fabrique,  et les agissements dolosifs de Jullian ou de ses voya- geurs à l'effet de créer une confusion entre sa maison et  celle de Viollet frères ;   « Sur l'adjonction du nom de Viollet à celui de Jul-  lian ;   « Attendu que l'intimé soutient qu'il n'a ajouté à son   nom celui de Viollet, qui appartient à sa femme, que  pour se distinguer de divers négociants de Cette, ses  homonymes, et qu'il s'est conformé en agissant ainsi aux  usages de commerce ; qu'il invoque au surplus les autres  mentions de ses étiquettes, circulaires et factures comme  exclusives de toute intention frauduleuse et comme suf- fisant à empêcher toute confusion entre la maison Viol- let frères et la sienne ;   « Attendu que si la pratique du commerce autorise,   dans certains cas, un négociant à joindre le nom de sa  femme au sien dans une marque de fabrique, il appar- tieut à la justice de prévenir ou réprimer les abus qui  peuvent résulter d'une pareille tolérance et d'interdire  l'usage du nom de sa femme au commerçant qui l'ex- ploite dans un intérêt de concurrence déloyale -, que les  documents et les circonstances de la cause démontrent  que Jullian n'a constitué sa raison commerciale avec le  nom de sa femme que pour profiter de la notoriété ac- quise au nom de Viollet dans le commerce des apéritifs  et pour créer une confusion entre ses produits et ceux  des appelants ; que sa visite aux frères Viollet, au mois  de juin 1883, ne peut laisser aucun doute à cet égard,  que ses explications au sujet de cette visite sont dénuées  de toute vraisemblance et démenties par sa correspon- dance même ; qu'en effet, par sa lettre du 24 juin 1883,  Jullian rappelait à Viollet frères un projet qu'il avait sou- mis à Viollet fils et demandait une réponse prompte  en se disant prêt à se rendre à Thuir au premier avis ;   que cette lettre, sainement interprétée, témoigne d'une  démarche comminatoire antérieurement faite par Jullian  près de la maison Viollet et accompagnée, ainsi que le  déclarent les appelants, d'une mise en demeure d'adhé- rer à ces propositions, sous peine d'une concurrence  exercée à l'aide du nom de sa femme ; que la visite de  Jullian à Viollet frères, loin de prouver la bonne foi de  Jullian révèle la pensée de spéculation qui l'animait, et  que l'adjonction du nom de Viollet au sien a été le pre- mier acte et l'élément principal de la concurrence dont  il les avait menacés ;   « Qu'il résulte au surplus des autres documents du   procès que Jullian ne s'est servi du nom de sa femme  que pour usurper la notoriété et la clientèle de Viollet  frères, en créant une confusion entre leurs produits et  les siens ; que l'usage du nom de Viollet a donc été  de sa part, au premier chef, un acte de concurrence  déloyale ;   « Sur la marque de fabrique :  « Attendu que, malgré des différences de détails   assez notables entre l'étiquette de Jullian et celle de  Viollet frères, et même entre les dénominations de leurs  produits, il est cependant hors de doute que Jullian a  intentionnellement composé le mot « bikk »";24 décembre;COUR D'APPEL DE MONTPELLIER 33 ch;http://www.enap.justice.fr/ARCHIVE/ENAP_GAZETTE_TRIBUNAUX_18860310.pdf;188603101
188603120;"« Le Tribunal,   « Vu la connexité joint les causes et statuant par un  seul et même jugement sur l'ensemble des demandes :   « Attendu qu'il convient de constater tout d'abord que   la société l'Union générale, fondée en mai et juin 1878,  au capital de 25 millions de francs, a successivement, le 29  avril 1879, augmenté ce capital à concurrence de  50 millions de francs ; le 15 novembre 1880 à concurrence  de 100 millions de francs, et le 5 novembre 1881 à con- currence de 150 millions de francs;   « Que le 2 février 1882, l'Union Générale a été décla-  rée en faillite, et que l'ouverture des opérations a été  fixée au 30 janvier précédent ;   « Qu'un jugement de ce Tribunal, du 15 mai 1882, a   prononcé la nullité de la dernière augmentation du ca- pital social;   « Que, par un autre jugement de ce Tribun il du 14   septembre 1883, les deux premières augmentations du  capital des 29 avril 1879 et du 15 novembre 1880, ont  de même été déclarées nulles, mais que le jugement a  refusé de prononcer la nullité de la société elle-même  et reconnu qu'elle avait été valablement constituée ;   « Que le 15 mars 1884, une convention est intervenue   entre Heurtey, syndic de ta faillite, et une société ano- nyme dite Comité-Union, par acte sous seings privés,  portant cette mention : Enregistré à Paris, le 15 avril   1S84, folio 97, case 6e, reçu 125,003 fr, 75 c, signé :   Poinet ; aux termes de laquelle le syndic « vend et cède  à la société anonyme Comité-Union, qui accepte tous les  droits de la faillite sur l'appel de fonds relatif à la libé - ration des actions anciennes de l'Union générale portant  les numéros 1 à 200,000, moyennant la somme de vingt  millions »";4 mars;COUR D'APPEL DE PARIS lre ch;http://www.enap.justice.fr/ARCHIVE/ENAP_GAZETTE_TRIBUNAUX_18860312.pdf;188603120
188603140;"« La Cour,  « Considérant qu'aux termes de l'article 70 de l'or- donnance du 15 novembre 1846, « aucun crieur, ven- deur ou distributeur d'objets quelconques ne peut être  admis par les compagnies des chemins de fer à exercer   sa profession dans les bâtiments et cours des stations et  dans les salles d'attente destinées aux voyageurs, qu'en  vertu d'une autorisation spéciale du préfet du départe- ment ; »";12 mars;COUR D'APPEL DE PARIS lra ch;http://www.enap.justice.fr/ARCHIVE/ENAP_GAZETTE_TRIBUNAUX_18860314.pdf;188603140
188603141;"« Le Tribunal,  « Attendu que la veuve Normand est décédée à Vin-  cennes le 19 avril 1885 laissant pour seul et unique hé- ritier sou fils majeur Paul-Adolphe Normand ;   a Que son testament, fait en la forme authentique le   28 mars 1885, contient la disposition suivante : « Je   « veux et entends qu'à ma mort on place en rentes sur  « l'Etat français tout ce que l'on pourra de ma fortune,  « j'entends que mon fils Paul-Adolphe Normand, parti  « en Amérique et n'ayant pas donné de ses nouvelles  « depuis plusieurs années, ne puisse jamais toucher que   « les arrérages de ces rentes, sans pouvoir aliéner les   t capitaux ; *   « Attendu, en ce qui concerne la réserve légale,   que la testatrice ne pouvait la grever d'aucune restric- tion ;   « Attendu, quant à la quotité disponible, que la dis-  position du testament ne constitue pas une substitution  dans les termes de l'article 1048 du Code civil ;   « Qn'elle ne contient pas, en effet, la charge de con-  server et de rendre aux enfants nés ou à naître du lé- gataire et qu'elle a été faite évidemment dans l'intérêt  exclusif de ce dernier ;   « Attendu que si la défense d'aliéner les biens légnés   est valable lorsqu'elle est motivée par un intérêt légi- time et qu'elle est temporaire, il n'en est pas de même  lorsqu'elle est, comme dans l'espèce, absolue et perpé- tuelle ;   « Qu'une telle condition est illicite comme contraire  au principe de la libre circulation des biens et que, dès  lors, elle doit être réputée non écrite aux termes de  l'article 900 du Code civil ;   « Qu'on objecte vainement que la testatrice avait le   droit de léguer une rente incessible et insaisissable ;   « Qu'en effet, l'objet de la disposition porte non sur   la rente, mais sur le capital lui-même;   t Par ces motifs,   t Déclare nulle, comme contraire à i'ordre public, la   défense d'aliéner contenue au testament de la veuve  Normand ;   « Dit que la disposition susindiquée ne contient pas   de substitution ;   t Dit, en conséquence, que les biens et valeurs dépen-  dant de la succession de la veuve Normand peuvent  être recueillis et perçus par Paul-Adolphe Normand sur  sa seule quittance et décharge sous l'effet des droits de  ses cessionnaires ou créanciers ;   « Condamne Grandjean ès qualité qu'il agit aux dé-  pens, qu'il est autorisé à employer en frais et  séquestre. »";9 mars;"TRIBUNAL CIVIL DE LA SEINE 1"" ch";http://www.enap.justice.fr/ARCHIVE/ENAP_GAZETTE_TRIBUNAUX_18860314.pdf;188603141
188603142;"« Le Tribunal,  « Sur la prescription :  « Attendu que la prescription quinquennale fixée par   l'article 64 du Code de commerce ne peut être acquise  qu'aux associés non liquidateurs et à leurs représen- tants; qu'il appartient à dame veuve Bizet d'établir que  feu Lecocq père n'était pas liquidateur de la société  ayant existé entre ses fils et lui ;   « Attendu que la preuve n'en peut résulter que d'un   acte publié conformément à la loi ; que la défenderesse  ne justifie pas que la nomination du sieur Gaston Lecocq  en qualité de liquidateur ait été portée à la connais- sance des tiers par voie de publication légale ;   « Que, faute par les membres de ladite société   d'avoir rempli cette formalité, ils doivent être réputés  avoir procédé conjointement à la liquidation de leur so- ciété ;   « Attendu que s'il en était autrement, le défaut de   publication de la nomination d'un liquidateur aurait   pour effet d'étendre à tous les membres d'une société le  bénéfice d'une prescription qui est limitée par la loi aux  seuls associés non liquidateurs ;   « Attendu que ces principes doivent d'autant plus re-  cevoir leur application dans l'espèce, qu'en l'acte consti- tutif de la société A. Lecocq et ses fils, il était stipulé  qu'en cas de dissolution de la société, les associés s'en- tendraient entre eux pour la liquidation ;   « Attendu, d'autre part que, s'il est exact en fait que   le sieur A. Lecocq soit décédé le 5 mars 1875, il n'est  établi ni allégué que cet événement ait été régulière- ment porté à la connaissance des tiers ; qu'au surplus,  le décédé a pu être remplacé dans ses fonctions de li- quidateur par l'un de ses héritiers ou ayants cause, le- quel ne serait pas recevable à opposer la prescription  dont s'agit ;   « Attendu que cette hypothèse suffirait à démontrer,   s'il était nécessaire, l'obligation qui existe pour les héri- tiers d'un associé liquidateur ou réputé tel, de publier  légalement les changements apportés au mode de liqui- dation, par suite du décès du de cujus ;   « Attendu qu'en négligeant de ce faire, les héritiers   de feu A. Lecocq ont commis la faute de laisser les  tiers dans l'ignorance d'un événement qui ne saurait  donc être opposé à ceux-ci pour faire courir contre eux  la prescription fixée par l'article 64 du Code de com- merce ;   « Et attendu que veuve Bizet, ès qualité, ne fait pas  la preuve qui lui incombe quant aux diverses publica- tions légales relatives à la dissolution et au mode de li- quidation de la société A. Lecocq et ses fils ; qu'il n'y a  donc lieu d'accueillir le moyen de prescription par elle  opposé ;   « Par ces motifs,  t Rejette le moyen de prescription opposé. »";9 mars;COUR D'ASSISES DE L'OISE ;http://www.enap.justice.fr/ARCHIVE/ENAP_GAZETTE_TRIBUNAUX_18860314.pdf;188603142
188603150;"« Le Tribunal,  « Attendu que le 15 mai 1881, le sieur Foudras tra-  vaillait pour le compte du sieur Mourichon à la con- struction d'un hôtel sis à Paris, avenue Friedland, 29,  lorsqu'il reçut sur la tête une pince en fer du poids  de 15 kilos qui lui brisa le crâne et le tua sur le  coup ;   « Attendu que la veuve Foudras demande au sieur  Mourichon, une indemnité de 12,000 francs en répara- tion du dommage que cet accident, lui a causé ainsi  qu'à ses enfants mineurs, et dont il serait civilement  responsable, soit directement de son chef, soit de celui  de ses ouvriers ;   « Mais attendu que la veuve Foudras ne prouve pas   et n'offre pas de faire la preuve d'une faute reprochable  soit au sieur Mourichon, soit à un de ses ouvriers  laquelle aurait déterminé l'accident dont son mari au- rait été victime ;   i Que dans ces circonstances, sa demande est mal   fondée contre le sieur Mourichon en tant qu'elle pro- cède d'une responsabilité civile sous la réserve de droit  que peut donner à la veuve Foudras contre le sieur  Mourichon le contrat d'assurance que ce dernier aurait  passé avec une compagnie d'assurances des ouvriers de  son chantier ;   a Par ces motifs,  « Déclare la veuve Foudras, mal fondée dans sa de-  mande contre le sieur Mourichon ;   « L'en déboute,  * Et la condamne aux dépens. »";3 février;COUR D'APPEL DE PARIS 6* ch;http://www.enap.justice.fr/ARCHIVE/ENAP_GAZETTE_TRIBUNAUX_18860315.pdf;188603150
188603151;"« La Cour,  « Considérant que Mourichon, en préposant, le 15   mars 1881, Foudras, dont il était le patron, à un travail  de maçonnerie à exécuter au-dessous d'une ouverture  pratiquée dans la partie supérieure de l'édifice en cons- truction avenue Friediand, n° 29, a commis envers son  ouvrier une imprudence qui a eu pour conséquence la  mort de celui-ci ;   « Qu'en effet, en sa qualité d'entrepreneur de maçon-  nerie de cet édifice, Mourichon devait prévoir les  dangers résultant, pour l'ouvrier qu'il faisait travailler  sur ce point, de l'existence, au-dessus de la têts de cet  ouvrier, d'une ouverture par laquelle pouvait à tout mo- ment, tomber un objet de nature à comprometlre*sa>ie,  et qu'il devait obvier à ce danger permanent en prenant  ou faisant prendre les précautions nécessaires pour  l'éviter ;   « Que c'est fauta d'avoir rempli envers Foudras ce   devoir de protection que celui-ci a été atteint par la  chute de la pince de charpentier tombée tout à coup  par l'ouverture laissée béante au sommet du bâtiment  au pied duquel il travaillait;   « Mais considérant que si Mourichon est ainsi, en   principe, responsable des suites de l'accident survenu  à son ouvrier et, s'il y a lieu, de l'astreindre à les ré- parer dans la mesure du préjudice causé à l'appelante  et à ses enfants, il convient de reconnaître que la faute  qu'il a commise lui a été commune avec un autre en- trepreneur du même édifice, lequel, par arrêt de ce  jour et de cette chambre, a été condamné, pour sa par- ticipation à ladite faute, à payer à la demandereesa ès  qualité une somme de 6,000 francs à titre de domma- ges-intérêts ;   « Qu'en cet état, l'appelante concluant contre les inti-  més à une condamnation à 12,000 francs pour l'entière  réparation du préjudice causé à elle et à ses enfants par  la mort de son mari, il n'y a lieu de faire droit à des  conclusions contie les intéressés qu'à concurrence d'une  somme de 6,000 francs ;   « Par ces motifs,  « Reçoit la veuve Foudras, ès qualité, appelante du   jugement ausdaté ;   »";3 février;COUR D'APPEL DE PARIS 6* ch;http://www.enap.justice.fr/ARCHIVE/ENAP_GAZETTE_TRIBUNAUX_18860315.pdf;188603151
188603152;"« Le Tribunal,  « Statuant sur les demandes principales formées par   Combes et les consorts Brunet et Lagrange. et la de- mande en garantie formée par Lagrange contre Brunet,  vu la connexité, joint les causes, et, statuant par un seul  et même jugement ;   « En ce qui touche la demande principale formée   contre les consorts Brunet ;   « 1° Sur les travaux de construction de trois cabinets   d'aisance et l'établissement d'uue soupape automatique  à celui qui existe déjà;   t Attendu qu'aux termes du bail du 5 mai 1876 con- senti à LagraDge, ledit bail reçu Guidon, notaire à Paris  et la prolongation du bail consenti à Combes reçu  même notaire le 8 février 1881 par les consorts Brunet,   II. Ne doit-on pas considérer comme actes inter-  BIL";16 février;TRIBUNAL CÏVIL DE LA SEINE 5° ch;http://www.enap.justice.fr/ARCHIVE/ENAP_GAZETTE_TRIBUNAUX_18860315.pdf;188603152
188603190;"« Le Tribunal,  « Attendu que Picard avait souscrit sous les dates des   29 et 31 octobre 1877 à la compagnie d'assurances sur  la vie dite l'Union une assurance de 10,000 francs,  payables lors de son décès à la dame Picard née Bouisson,  sa femme, et en cas de prédécès de ladite dame, aux hé- ritiers de l'assuré ou à toute autre personne qui ledit  assuré se réservait d'indiquer; la prime due pour cette  assurance était de 261 francs payables annuellement et  d'avance ;   »";5 mars;COUR D'APPEL DE PARIS lr° ch;http://www.enap.justice.fr/ARCHIVE/ENAP_GAZETTE_TRIBUNAUX_18860319.pdf;188603190
188603191;"« Le Tribunal,   « Attendu que le Tribunal n'a pas à rechercher, ni à  apprécier les causes de la révocation qui sert de base k  l'action en dommages-intérêts formée par le demandeur ;  « Que la gestion du théâtre de l'Opéra appartient, en   effet, à un directeur-entrepreneur qui administre libre- ment à la condition toutefois de se conformer aux obli-  NOT";il mars;"TRIBUNAL CIVIL DE LA SEINE 1"" ch ";http://www.enap.justice.fr/ARCHIVE/ENAP_GAZETTE_TRIBUNAUX_18860319.pdf;188603191
