id;page;arrêt;date;juridiction;lien;id
18671159;182;   Attendu que  par exploit du 7 juill  1866  Brouillet a demandé au tribunal de commerce de Chambéry  principalement la dissolution et la mise en liquidation de la société du chemin de fer Victor Emmanuel  subsidiairement la nomination d'un ou plusieurs experts pour examiner et constater l'état actuel de cette société   Sur l'exception d'incompétence soulevée     Attendu qu'en principe  aux termes des art  59  § 5  et 69  § 6  C  proc  civ   une société commerciale doit être assignée   tant qu'elle existe  devant le juge du lieu où elle est  établie en sa maison sociale  Attendu que la société anonyme sous la dénomination de société des chemins de fer Victor Emmanuel  au capital de 157 500 000 fr   représenté par 315 000 actions  a été constituée par acte public reçu Me Turvano  notaire à Turin  dans la capitale du royaume d'Italie  et que ses statuts  annexés audit acte  ont été approuvés par décret royal en date du 21 oct  1863   Attendu que les statuts primitifs de 1853 1857 ont été  en réalité  remplacés par ceux du 14 sept  1863  les seuls qui régissent la société dont Brouillet semble faire partie   que tous les actionnaires ont échangé leurs anciens titres pour des titres au porteur  reproduisant  au dos  textuellement et uniquement quelques uns des statuts de 1863   que  depuis celte époque  ils ont touché  en verlu de leurs nouveaux titres  des dividendes de 6 p  100  bien supérieurs à ceux qu'ils recevaient auparavant  et que l'art  11 desdits statuts dispose   « La souscription ou la possession d'une ou plusieurs actions emporte de plein droit l'adhésion aux présents statuts   » Attendu que de leur ensemble  notamment des art  4  17  24  40  et des divers documents versés au procès  il résulte clairement que le siége social a été et demeure fixé dans la capitale du royaume d'Italie   que les dividendes afférant aux actions nouvelles étaient payables à Turin ou à Paris   que  depuis 1863  les actionnaires ont assisté  sans protestation  aux assemblées générales à Turin   que Cbambéry ne peut plus être considéré que comme un siége ou centre d'exploitation   qu'aucun membre du conseil d'administration n'y réside   qu'on n'y possède aucun des livres  registres ou autres éléments de comptabilité nécessaires pour constater la situation de la société     Attendu que vainement Brouillet invoque l'art  4 des statuts de 1863  ainsi conçu   « Le siége de la société et son domicile  pour tout ce qui concerne la construction et l'exploitation des chemins de fer calabro siciliens  sont établis dans la capitale du royaume  »   Que de cette clause  qui s'explique par la teneur et par l'esprit des statuts  on ne saurait  par voie de déduction  conclure à la constitution d'un deuxième siége social établi ailleurs que dans la capitale de l'Italie  même pour la portion du chemin de fer située sur le territoire devenu français par suite de l'annexion de la Savoie   Qu'une mesure aussi grave  aussi exceptionnelle  aurait été certainement exprimée en termes formels et aurait fait l'objet d'une déclaration spéciale    Que la seule conséquence logique qu'on puisse tirer de la clause susénoncée  c'est que  les sociétaires ayant l'intention manifeste de céder la partie du chemin de fer Victor Emmanuel traversant la Savoie (division du Rhône)  le tribunal de Chambéry  en dehors de ce qui concerne les calabro siciliens  pourrait être compétent pour les difficultés relatives à l'exploitation du réseau de  COURS IMPÉRIALES  CONSEIL D'ÉTAT  ETC   183  Savoie  mais qu'il n'en peut résulter que le siége véritablement social de la société  essentiellement italienne  puisse  en aucun cas  être déplacé et transporté en France   Attendu  en effet  qu'une société commerciale  de chemin de fer notamment  peut  il est vrai  indépendamment du domicile général établi à son siége social en vertu de ses statuts  avoir d'autres domiciles distincts  sinon dans toutes les localités où elle possède une gare  du moins aux lieux où elle a un établissement ou centre important d'opéralions et d'administration   mais que ces divers domiciles n'entraînent juridiction que relativement aux intérêts et aux affaires qui y sont traités  sans absorber et détruire le domicile social  eu égard aux questions et aux différends affectant la société tout entière de la nature de ceux dont il s'agit dans l'espèce    Attendu qu'aux termes de l'art  14  C  Nap   un Français qui traite avec un étranger  même à l'étranger  peut bien citer cet étranger devant les tribunaux français  que la jurisprudence  jalouse de concourir à la protection de l'intérêt national  a étendu  en pareil cas  au créancier d'une société anonyme étrangère  autorisée ou non autorisée par le Gouvernement français  le bénéfice de cet art  14  Qu'il ne saurait toutefois être applicable dans le procès actuel  où il s'agit  non plus d'un créancier poursuivant la rentrée d'une somme ou la consécration d'un droit quelconque vis à vis d'une société étrangère  mais bien d'un actionnaire français prétendant faire dissoudre une société étrangère  dont il fait partie  par un tribunal français  Attendu  d'ailleurs  qu'on peut toujours renoncer au bénéfice exorbitant de l'art  14  que cette renonciation ne présente rien de contraire à l'ordre public et aux règles fondamentales du droit  que  Brouillet se trouvant manifestement soumis aux statuts de 1863  les art  39 et 40 desdits statuts lui enlèveraient la faculté d'invoquer l'art  14  C  Nap    Qu'il y a doublement renoncé  d'abord par la clause compromissoire insérée en l'art  39  ensuite en se reconnaissant justiciable  pour toutes les contestations sociales  des tribunaux étrangers compétents du siége de la société  aux termes de l'art  40    Que  bien que la clause compromissoire soit nulle à défaut de désignation des arbitres et de l'objet du litige  conformément à l'art  1006  C  proc  civ  français  on ne peut admettre qu'une semblable clause soit sans valeur sous l'empire du Code de commerce italien  qui dispose (capo secondo  del Compromesso  art  12)   « Lorsque  dans un contrat ou après  les parties se sont engagées à compromettre et soumettre à des arbitres les difficultés qui en pourraient naître  si les arbitres n'ont pas été désignés ou si tous ou quelques uns viennent à manquer pour une cause quelconque  la désignation des manquants (la nomina dei mancanti) est faite par l'autorité judiciaire qui serait compétente  compétente connaître de la difficulté  à moins que les parties n'en aient décidé autrement   » Que  dans tous les cas  la clause dont s'agit vaut comme renonciation à profiter de l'art  14  C  Nap   toutes les fois qu'on a formellement accepté une juridiction étrangère  se soumettant ainsi aux règles de procédure tracées pour cette juridiction  et que l'intimé ne saurait s'y soustraire en présence de la disposition spéciale de l'art  40  § 2  des statuts ainsi conçue   « A défaut d'élection de domicile  les comparants et tous les actionnaires font élection de domicile  pour toutes notifications quelconques  au parquet de l'avocat fiscal de la ville où est le siége de la société  et se reconnaissent  pour toutes contestations sociales  justiciables des tribunaux compétents dans cette dernière ville   »   Attendu que les considérations qui précèdent rendent superflu l'examen des questions de savoir   si Brouillet  simple actionnaire  a qualité pour demander la dissolution de la société  si ce droit n'est pas exclusivement conféré par les statuts aux assemblées générales  quel est le caractère du jugement du 27 août 1866  s'il est interlocutoire ou simplement préparatoire  susceptible ou non d'appel  en ce qu'il a nommé un expert pour constater préalablement l'état actuel de la société     Par ces motifs  etc  ; 1er déc. 1866.;C. Chambéry;https://gallica.bnf.fr/ark:/12148/bpt6k5531092k/f182.image;18671159
18671160;184;LA COUR  Sur la première question (fin de non recevoir contre la demande en résiliation)   Adoptant les motifs des premiers juges   Sur la deuxième question   Considérant que les travaux entrepris par l'autorité administrative pour l'établissement d'un chemin ne peuvent  sous aucun rapport  être assimilés aux voies de fait prévues par l'art  1725  C  Nap   et dont le preneur serait en droit de poursuivre les auteurs en son nom personnel   que l'autorité administrative ne fait  en ce cas  qu'user du droit que la loi lui confère dans un intérêt public  que tout propriétaire est légalement astreint à supporter  sauf indemnité  les conséquences de ces travaux  soit qu'ils nécessitent sa dépossession irrévocable  soit qu'ils affectent seulement sa jouissance temporaire    Qu'au premier cas  en vertu des dispositions expresses de la loi  le preneur dépossédé de tout ou partie de la chose louée  est indemnisé directement et sans recours contre le bailleur qui l'a mis en mesure de faire valoir ses  droits à l'indemnité et demeure dès lors à l'abri de toute garantie  que  dans le second  il n'y a lieu de procéder par voie d'expropriation vis à vis du preneur  qui n'est privé d'aucune parcelle de l'immeuble affermé et n'éprouve qu'un trouble à sa jouissance   que ce trouble est le résultat de l'exercice d'un droit supérieur qui pèse sur la propriété  que le bailleur est obligé  par la nature du contrat de louage  de faire jouir paisiblement le preneur de la chose louée pendant la durée du bail  et ne peut être affranchi de cette obligation que dans les cas prévus par la loi    Que  dans l'espèce  le trouble provient bien d'un fait que le bailleur n'a pu ni prévoir ni empêcher  mais que ses effets  c'est à dire le préjudice qu'il occasionne à la jouissance  peuvent toujours être surmontés  puisque le bailleur trouve dans sa qualité de propriétaire le droit de se faire indemniser  Qu'il ne pourrait invoquer la force majeure pour s'affranchir de l'obligation  imposée par l'art  1719  C  Nap   d'indemniser le preneur du préjudice causé à sa jouissance  qu'autant que lui même serait dans l'impossibibité de se faire allouer cette indemnité   qu'au cas particulier il n'a tenu qu'à lui de l'obtenir  qu'en effet  l'appelant prétend qu'à plusieurs reprises il a été privé  d'abord par les travaux d'établissement du chemin  puis par la négligence du bailleur à rétablir le barrage destiné à la retenue des eaux  de la jouissance de tout ou partie de ces eaux nécessaires au roulement du moulin qu'il tient à titre de sous bail de l'intimé Bretin   que s'il en est ainsi  le bailleur avait incontestablement le droit de réclamer  près de l'autorité compétente  la réparation du dommage provenant de l'exécution des travaux  qu'étant donc en mesure de se faire garantir contre les conséquences dommageables de ces travaux  il ne peut échapper aux obligations que lui impose l'art  1719 précité  et refuser de garantir à son tour le preneur du préjudice qu'il peut avoir éprouvé    Infirme  etc  ; 12 déc. 1866.; C. Dijon;https://gallica.bnf.fr/ark:/12148/bpt6k5531092k/f184.image;18671160
18671161;184;LA COUR     Attendu que si Nicolas M    a fourni  d'abord au parquet du tribunal civil d'Angoulême  et ensuite au tribunal lui même  des renseignements défavorables au sujet d'Ernest M     candidat aux fonctions d'huissier  il est à remarquer que ce n'est point de son propre mouvement  mais sur la demande expresse du procureur impérial  que Nicolas M    a été appelé à fournir ces renseignements  et qu'il les a donnés d'une manière toute confidentielle  sans les répéter en public  puisque l'offre de preuve contenue dans les conclusions d'Ernest M    ne présente aucune articulation contraire à cet égard   Attendu qu'il ne ressort des circonstances de la cause aucun motif de soupçonner que Nicolas M    fût animé de mauvais sentiments envers Ernest M     ni qu'il eût un intérêt quelconque à faire une déclaration contraire à la vérité  que tout se réunit donc pour montrer qu'il a agi de bonne foi  que  d'un autre côté  on ne trouve nulle part des indices portant à faire croire que son langage ait été dicté par une légèreté condamnable  qu'Ernest M    n'est  par conséquent  point fondé  dans l'étal actuel de la cause  à accuser Nicolas M    d'une faute qui ait engagé sa responsabilité et dont il doive réparation     Attendu  quant à la preuve offerte subsidiairement par Ernest M     que les considérations qui précèdent fournissent un motif suffisant pour la faire écarter  car  en supposant prouvés les faits articulés  Nicolas M    pourrait toujours se défendre en invoquant sa bonne foi et le devoir qui lui a été imposé de répondre à des interrogations qu'il n'avait pas provoquées   qu'au surplus  parmi les faits articulés  le second seulement serait de nature à incriminer ses intentions vis à vis d'Ernest M     mais que l'ennui et les regrets que lui aurait causés sa déclaration s'expliquent même en  COURS IMPERIALES  CONSEIL D'ETAT  ETC   185  la tenant pour sincère  car il pouvait parfaitement regretter d'avoir été mis dans la nécessité de révéler ce qu'il croyait vrai au préjudice d'Ernest M        Par ces motifs  confirme etc   ; 13 fév. 1867. ; C. Bordeaux;https://gallica.bnf.fr/ark:/12148/bpt6k5531092k/f184.image;18671161
18671162;185;LA COUR     En ce qui touche la recevabilité de l'appel   Considérant que  s'agissant d'une demande en partage et conséquemment d'une matière indivisible  l'appel interjeté en temps utile par Adhémar de Sanzillon contre les époux de Robien  a conservé son droit vis à vis de la demoiselle de Sanzillon  qu'ainsi l'appel interjeté contre celle dernière est recevable  bien qu'interjeté après l'expiration des délais légaux    Au fond    En ce  qui louche le partage en nature des biens de la succession de la dame de Sanzillon     Considérant qu'il résulte de la consistance et de la composition de ces biens qu'ils peuvent être commodément divisés en trois lots  et par suite qu'ils sont partageables en nature  que la situation et l'éloignement de ces biens n'empêchent pas que  considérés en eux mêmes  ils ne puissent être commodément divisés et partagés   que la circonstance qu'à raison de leur situation  certains de ces biens pourraient ne pas convenir également à tous les copartageants  ne modifiant pas leur consistance et leur composition  ne saurait faire obstacle à l'exercice du droit de chacun des héritiers de demander et d'obtenir sa part en nature  Et qu'enfin il importe peu  au point de vue de la possibilité et de la commodité du partage en nature  que l'un des héritiers soit ou puisse être débiteur de ses  186 COURS IMPÉRIALES  CONSEIL D'ÉTAT  ETC   cohéritiers  les rapports et les droits des copartageants  en tant qu'héritiers  restant indépendants de leurs rapports et de leurs droits en tant que débiteurs et créanciers   qu'il suit de là que c'est à tort que les premiers  Juges ont ordonné la licitation des immeules dépendant de la succession de la dame de Sanzillon    En ce qui touche les legs  de 20 000 fr  chacun  faits par la dame de Sanzillon à la dame de Robien et à la demoiselle de Sanzillon     Adoptant les motifs des premiers juges  Et considérant qu'il n'est point établi que les motifs  énoncés au testament de la dame de Sanzillon  des libéralités par elle faites à ses filles en soient la cause finale et déterminante   que  dès lors  la fausseté ou l'erreur de ces motifs  en les supposant prouvées  ne sauraient avoir aucune influence sur la Validité du legs dont s'agit  et qu'il n'y a lieu  par conséquent  de s'arrêter de ce chef ni aux conclusions principales  ni aux conclusions subsidiaires de l'appelant   En ce qui touche la nullité du partage de la succession de Sanzillon père     Considérant que  aux termes de l'art  472  C  Nap   tout traité qui intervient entre le tuteur et le mineur devenu majeur est nul  s'il n'a été précédé de là reddition d'un compte détaillé et de la remise des pièces justificatives dix jours au moins avant le traité    Considérant que Adhémar de Sanzillon  mineur lors du décès de son père  s'est trouvé de droit  comme ses deux soeurs  sous la tutelle de sa mère  qui a eu  en cette qualité  l'administration des biens composant la communauté et des biens propres au défunt  que  quelque courte qu'ait été cette tutelle a l'égard d'Adhémar de Sanzillon  la dame de Sanzillon n'en était pas moins tenue de rendre compte  et que ce compte n'a jamais été rendu dans les termes exprès et rigoureux de l'art  472    Considérant que l'acte qui est intervenu en l'absence de ce compte  le 24 déc  1855  par devant notaire  entre la mère tutrice et ses  enfants  pour la liquidation et le partage de la communauté ayant existé entre la dame de Sanzillon et son mari  et de la succession de ce dernier  ayant eu pour but et pour résultat de déterminer les situations respectives de la mère et des enfants par rétablissement de la consistance  soit des valeurs communes  soit des valeurs de la succession dont la tutrice a eu l'administration  constitué un traité sur les éléments mêmes du compte de tutelle  et tombe par conséquent sous l'application de l'art  472  C  Nap   avec d'autant plus de raison qu'il renferme un compte de l'administration de la tutrice  compte qui  aux termes dudit article  eût dû précéder de dix jours l'acte de liquidation et de partage dont  pour une partie des valeurs' à partager  les résultats de ce compte devaient être le point de départ    Considérant néanmoins que Adhémar de Sanzillon ne demande la nullité de l'acte du 24 déc   1855 qu'en ce qui touche le partage de la succession de Sanzillon père  et non en ce qui touche le partage de la communauté  qu'il n'y a donc lieu de prononcer que la nullité du partage de la succession de Sanzillon père     Par ces motifs  etc   ; 8 mars 1867. ; C. Paris;https://gallica.bnf.fr/ark:/12148/bpt6k5531092k/f185.image;18671162
18671163;186;  Considérant que le procès à juger est né des prétentions respectives des héritiers de Condé et du domaine de l'Etat à la jouissance du terrain dont s'est accrue la rive gauche de la Seine  dans la commune du Marais Vernier  à la suite des travaux d'endiguement opérés entre Quillebeuf et la Roque    Considérant en effet  d'une part  que l'Etat entend rester maître exclusif des fruits jusqu'au moment où  les travaux étant terminés  il jugera opportun de faire aux propriétaires de l'ancienne rive délivrance de l'entier terrain conquis sur le fleuve  d'autre part  que les héritiers de Condé s'attribuent  au contraire  un droit absolu sur les fruits au fur et à mesure que le terrain se forme  la délivrance ayant  d'après eux  pour objet  quant à ce  de les mettre en possession de la chose dont jusque là ils n'auront eu que la jouissance   Considérant qu'un tel débat implique forcément une question de propriété   que celte question a d'ailleurs été posée en termes exprès dans les conclusions des parties  qu'en principe  la solution est exclusivement du ressort de l'autorité judiciaire  et que  pour la résoudre  il suffit de savoir si le terrain en litige constitue une alluvion dans le sens attaché à ce mot par la loi et avec les conséquences qui en découlent   Considérant que l'art  556  C  Nap   nomme alluvion et alloue aux propriétaires riverains tout atterrissement ou accroissement qui advient d'une façon successive et imperceptible à la rive d'un fleuve  même navigable  sans distinguer le cas où l'alluvion se produit indépendamment d'un acte quelconque de l'industrie humaine  du cas où elle résulte du concours de faits purement naturels et de travaux d'art accomplis par les soins et aux frais  soit des particuliers  soit de l'Etat lui même   Considérant que  dans l'espèce  l'endiguement de la Seine a  sans nul doute  préparé et facilité les atterrissements qui sont venus et viennent encore accroître les propriétés riveraines  mais que cet accroissement n'a pas été soudain  qu'il s'est opéré et qu'il s'opère peu à peu  par progrès insensibles  et qu'en réalité sa formation est l'oeuvre directe d'un fait naturel  c'est à dire du jeu alternatif des marées  favorisé par le fait artificiel de la construction des digues   Considérant  dès lors  que le produit de ces deux causes  l'une essentiellement déterminante  l'autre simplement occasionnelle  constitue une alluvion proprement dite  appartenant par droit d'accession  sans nécessité de concession d'aucune sorte  aux propriétaires de la rive  et que si quelques doutes pouvaient s'élever à cet égard en thèse générale  ils disparaîtraient en présence des actes des représentants de l'Etat dans la cause  Considérant  en effet  qu'à la date du 26 déc  1853  le préfet de l'Eure proposait d'appliquer l'art  30 de la loi du 16 sept  1807 aux propriétés voisines des travaux effectués ou à effectuer pour l'endiguement dont il s'agit au procès  et de fixer à la moitié de la plus value qu'acquerraient ces propriétés le montant de l'indemnité que les propriétaires auraient à payer à l'Etat    Considérant que par arrêté du 23 février 1854  afin de préparer l'application de l'article de la loi susdite  le même agent de l'Etat déter minait les limites de la rive gauche du lit d fleuve  de telle sorte qu'il fût possible d'ex pertiser la valeur de chacune des propriété riveraines au moment où commenceraient les travaux et de fixer ensuite la plus valut qu'elles auraient acquise lorsque ces travaux seraient achevés     Considérant qu'un dé cret du 15 juill  1854  vu les avantages qu les propriétaires riverains retireraient desdit travaux  vu également les propositions e l'arrêté précité du préfet de l'Eure  déclar souverainement les dispositions de la loi d 1807 applicables  au profit de l'Etat  aux pro priétés privées qui  par suite de l'améliora tion et de l'endiguement de la Seine  ac querraient un surplus de valeur     Consi dérant que le sens et la portée de ces acte n'ont rien de douteux  qu'il n'est pas bésoin d'en rechercher l'esprit ni d'en commente le texte  que  pour en tirer un élément d solution  il suffit de les prendre à la lettre et qu'il n'y a  par conséquent  pas lieu pour la Cour de surseoir à statuer jusqu'à ce qu'ils aient été interprétés par l'autorité admini  311)  adde dans le sens de l'arrêt ici rapport MM  Demolombe  Dist  des biens  t  2  n  65 suiv    Massé et Vergé  sur Zachariae  t  2 § 29 p  112  note 12  Aubry et Rau  d'après Zach riae  t  2  § 203  p  222   COURS IMPERIALES  CONSEIL D'ETAT  ETC   187  trative    Considérant  qu'en effet  ces actes  soit par leur disposition propre  soit par leur référence à celles de la loi de 1807  reconnaissent sans obscurité ni équivoque que les terrains formés entre l'ancienne rive délimitée de la Seine et la digue à établir pour le perfectionnement de la navigation  appartiendront par droit d'accession aux propriétaires riverains à la seule charge et condition de payer à titre d'indemnité la moitié des bénéfices provenant de l'accroissement alluvionnaire     Considérant qu'en décidant qu'il y a là  non pas une concession en expectative  mais une reconnaissance actuelle de propriété  d'où se déduit nécessairement le droit à la jouissance de tous les fruits  la Cour ne commettra aucun excès de pouvoir  qu'elle ne juge par là rien qui touche à l'exécution des travaux  que l'Etat reste maître de leur opportunité  de leur conduite et de leur durée  que l'autorité administrative garde le pouvoir de délivrer des terrains quand elle l'estimera convenable  que ni la détention  ni l'exploitation de ces terrains ne lui sont retirées  et que l'autorité judiciaire se borne à constater l'existence des fruits par le fait non contesté de leur récolte  et à attribuer le produit de leur vente au vrai propriétaire    Considérant que ce qui vient d'être dit justifie suffisamment le dispositif qui va suivre et dispense de s'arrêter à aucun des moyens plaides ou conclus pour le préfet de l'Eure et le directeur des domaines    Par ces motifs  déclare les appelants propriétaires par droit d'accession des alluvions formées ou qui pourront se former au droit de leur propriété  arrête que les ventes faites par l'Etat des herbes exclues sur lesdites alluvions n'ont pu avoir lieu qu'au profit des appelants  etc  ; 11 avr. 1865. ; C. Rouen;https://gallica.bnf.fr/ark:/12148/bpt6k5531092k/f186.image;18671163
