id;arrêt;date;juridiction;lien;id
189508090;"« Le Tribunal ;   « Attendu que, les 12 février et 24 mai 1890, Sau-  bion, fabricant de voitures à Montevideo, a contracté  à la Compagnie La New-York une assurance sur la  vie de 50,000 francs, commençant à courir le 12 fé- vrier 1890, moyennant une prime semestrielle de  1,638 fr. 50, payable pendant quinze ans; que le 3  septembre 1890, par devant Hill, consul des Etats- Unis, Saubion a transféré à Bail ladite assurance,  avec tous les bénéfices, dividendes et droits en résul- tant ;   « Que ce transport a été notifié, à Paris, à la Com-  pagnie, qui en a accusé réception le 29 septembre  1890, en faisant connaître à Bail qu'elle le transmet- tait à la direction de New-York, pour être soumis à  son visa ; qu'il était définitivement régularisé à  l'égard de la Compagnie à la date du 28 octobre ;   « Attendu que, le 6 novembre 1890, Saubion, vou-  lant se rendre au Brésil, a demandé et obtenu une  autorisation, moyennant une surprime d'un demi  pour 100 du capital assuré, soit 250 francs ; qu'il était  spécifié que ce permis cesserait d'être valable après le  15 décembre 1890 ;   « Attendu que, dans le courant de 1891, Saubion,   bien que sachant pertinemment qu'une autorisa- tion lui était nécessaire, puisqu'il en avait, l'an- née précédente, sollicité une pour faire le même  voyage, s'est de nouveau rendu, sans déclaration  préalable et sans permis, à Rio-de-Janeiro, où il a  accidentellement rencontré un agent de la Compa- gnie, qui lui a signalé l'irrégularité et les périls de  sa situation, alors surtout que la fièvre jaune régnait  dans le pays ;   « Attendu qu'à la date du 15 octobre 1891, Saubion  a écrit de Rio au directeur de la Compagnie, à Paris,  une lettre reçue le 5 novembre, pour lui exposer que,  ses affaires l'appelant souvent à Rio, où se trouvait  son centre d'opérations, il était dans l'intention de  solliciter l'autorisation de voyager, de Montevideo à  Rio, avec autorisation de résider dans cette ville, et  demandait quels étaient les suppléments de versement  qu'il devrait faire ; qu'il ajoutait qu'il avait obtenu,  en novembre 1890, de l'agence de Buenos-Ayres,  l'autorisation de résider temporairement à Bio et  de revenir à Montevideo, qu'il avait à cet effet payé  la surprime d'un an pour non-acclimatation, plus  la différence mensuelle de prime de Montevideo  et de Rio, et que son permis se terminait en décembre  1890;   « Qu'en même temps qu'il écrivait cette lettre,   et le même jour, il en adressait la copie à Bail,  lui disant, ce qui était inexact, qu'il s'était pré- senté aux bureaux de la Compagnie à Rio, pour  se renseigner sur les démarches qu'il avait à faire  pour régulariser sa situation, et l'informant qu'il  avait écrit à la direction de Paris pour être en rè- gle, en cas de décès, du jour et de la remise de sa let- tre au courrier ;   « Que le 5 novembre, jour même où il a reçu cette   lettre, Bail, qui connaissait tous les détails de la po- lice, qui avait dû les étudier avant d'en conclure le  transport, et qui par suite se rendait bien compte de  la gravité de la situation créée par les agissements de  Saubion, s'est hâté de se rendre au siège de la Com- pagnie ;   « Qu'il allègue que Castel, agent de ladite compa-  gnie, auprès de qui il se renseignait sur sa situation  de bénéficiaire de la police, lui aurait répondu que la  lettre de Saubion ne permettait pas de mettre en  doute sa bonne foi, qu'il pouvait donc être parfaite- ment tranquille et qu'il n'aurait, au pis aller, qu'à  payer la surprime si elle ne l'avait pas été ;   « Que si Castel a tenu ce langage, c'est qu'il avait   été trompé par les assertions mensongères de Sau- bion, qui affirmait être en règle jusqu'en décembre  1891, alors que son permis, délivré pour un précédent  voyage, avait cessé d'avoir effet en décembre 1890 ;   t Que Bail n'a pas dû être plus rassuré par cet en-  tretien qu'il ne l'avait été par la lettre du 10 novem- bre, par laquelle la Compagnie, lui accusant réception  de celle de Saubion, lui faisait connaître qu'elle avait  été transmise à la direction hispano-américaine, qui  se chargerait de faire le nécessaire, et qu'il serait  tenu au courant des combinaisons qui intervien- draient au sujet de cette police;   « Que cet accusé de réception est loin de contenir,   ainsi que le prétend Bail, un acquiescement et un  aveu, puisque la décision à prendre est laissée à l'ap- préciation de la direction hispano-américaine ;   « Que Saubion étant décédé à Rio le 16 décembre   1891 du typhus ictéroïde, Bail en a avisé la Compa- gnie à la date du 18 ;   « Que, le 22 décembre, celle-ci lui a communiqué   une lettre du 9 du même mois, par laquelle ses agents  de New-York l'informaient que, bien que Saubion eût  annulé sa police en se rendant de Montevideo à Rio  sans permis,la Compagnie était disposée à émettre un  permis de 3 0[0 l'an si son bureau médical approuvait  l'examen fait par un des médecins examinateurs, e i  vue du rétablissement de la police ; qu'ainsi, à cette  époque du 9 novembre, Saubion était bien déchu de  son assurance, laquelle ne pouvait être reconstituée  qu'après examen médical ;   « Attendu qu'au moment où cette lettre parvenait   à la direction de Paris, ies conditions imposées pour  ce rétablissement étaient devenues irréalisables par  suite du décès ; que, si elles ne se sont pas réalisées,  la faute n'en incombe pas à la Compagnie, qui était  disposée à se montrer conciliante dans la plus large  mesure, mais qu'elles ont été paralysées par le décès  de Saubion, qui s'était mis en faute en ne prenant  pas, pour le deuxième voyage, le permis qu'il savait  nécessaire, puisqu'il s'en était muni une première  fois ; qu'il est de toute évidence qu'il a voulu frustrer  la Compagnie des surprimes dues pour l'obtention de  ce permis, et que, sa faute ayant été accidentellement  constatée, il a cherché trop tard à ressaisir une po- lice qu'il savait annulée ; que la preuve de sa fraude  et la reconnaissance de sa faute résultent surabon- damment de la lettre qu'il a écrite le 15 octobre à la  direction de Paris ;   « Qu'il inaport»";10 juillet;COUR D'APPEL DE PARIS 6* ch;http://www.enap.justice.fr/ARCHIVE/ENAP_GAZETTE_TRIBUNAUX_18950809.pdf;189508090
189508091;"« La Cour ;   « Statuant par un seul ef même arrêt sur l'appel  d'un jugement du Tribunal civil de la Seine du 22 dé- cembre 1893 interjeté par Bail aîné contre la Compa- gnie La New-York et contre Questel, sur toutes les  conclusions des parties devant la Cour sans s'arrêter  aux conclusions de non-recevabilité de la Compagnie  La New-York, adoptant les motifs des premiers  juges ;   « Considérant d'ailleurs qu'il n'échet de donner acte   à Bail de son offre de payer la surprime sur le capital  garanti, ladite offre étant sans objet à raison de la  confirmation du jugement ;   « Par ces motifs,  « Confirme le jugement dont est appel ; ordonne  qu'il sera exécuté selon ses forme et teneur ; déclare  l'appelant mal fondé en ses demandes, fins et conclu- sions, l'en déboute, le condamne à l'amende et aux  dépens de son appel. »";10 juillet;COUR D'APPEL DE PARIS 6* ch;http://www.enap.justice.fr/ARCHIVE/ENAP_GAZETTE_TRIBUNAUX_18950809.pdf;189508091
189508110;"« La Cour ;  « Sui le moyen unique du pourvoi ;  « Vu les articles 2121 et 2135 du Code civil :   « Attendu que, des termes généraux du premier dô   ces articles, il résulte que l'hypothèque légale con- férée à la femme sur les biens de son mari pour sû- reté de ses droits et créances les garantit tous sans  exception ; que cette hypothèque générale et dispen- sée d'inscription ne peut, en dehors des cas spécifies  aux 2' et 3e alinéas du § 2 de l'article 2135 du Gode   «vil, avoir d'autre date que celle de la célébration  du mariage établie par le 1er alinéa du même article   pour toutes les créances nées du mariage ;   « Attendu que les créances pour lesquelles la dame   Hanot a demandé sa collocation ont évidemment  cette origine ; que c'est en effet au moment du ma- riage qu'a pris naissance l'obligation alimentaire  contractée par le mari à l'égard de sa femme, obliga- tion que le jugement de séparation de corps est venu  simplement sanctionner en condamnant Hanot à  payer une pension alimentaire à sa femme séparée ;  qu'il en est de même de la créance relative aux frais  de l'instance en séparation de corps, frais nécessités  par la méconnaissance par Hanot des devoirs que lui  créait son mariage ; que, lesdites créances dérivant  ainsi du mariage lui-même, l'hypothèque légale qui  les garantit doit être considérée comme née à partir  de la célébration du mariage des époux Hanot ;   FEU";25 juin;COUR DE CASSATION ch;http://www.enap.justice.fr/ARCHIVE/ENAP_GAZETTE_TRIBUNAUX_18950811.pdf;189508110
189508111;"« Le Tribunal ;  « Sur la fin de non-recevoir :  « Attendu qu'il ne s'agit pas au procès d'une con- testation sur un contrat entre associés, mais unique- ment d'une demande en dommages et intérêts pour  réparation d'un préjudice causé par des renseigne- ments erronés donnés avant la constitution de la So- ciété ; que, dès lors, il n'y a pas lieu de s'arrêter à la  fin de non-recevoir opposée par les défendeurs ;   « Au fond :  « Attendu tout d'abord que la bonne foi des défen-  deurs n'est pas contestée ;   « Attendu, sans qu'il y ait lieu de rechercher si un  renseignement donné de bonne foi, alors que depuis  il a été reconnu inexact, peut engager la responsabi- lité pécuniaire de celui qui l'a donné, qu'il n'est en  aucune façon établi que les demandeurs au procès  aient été déterminés à souscrire des actions de la So- ciété française des Mines de cuivre en formation par  les renseignements des défendeurs ; qu'ils ne justi- fient même pas avoir été en communication avec  aucun d'entre eux ni en avoir reçu un renseignement  sous une forme quelconque avant l'époque de leur'  souscription ; qu'ils allèguent, il est vrai, une note  émanée de de Loriol et de Manhès, laquelle attri- buait aux Mines dont l'exploitation devait faire l'objet  de la Société une richesse métallique de beaucoup  supérieure à la réalité, mais qu'ils n'établissent pas  que cette note leur ait été envoyée ni même qu'ils en  aient eu connaissance au moment où ils ont souscrit   leurs actions ;   « Par ces motifs,  « Statuant en premier ressort, par défaut faute de   comparution à l'égard de Marchese et contradictoi- rement vis-à-vis de tous les autres défendeurs;   « Déboute les demandeurs de leur demande et les   condamne en tous les dépens;   « Donne, en tant que de besoin, acte aux deman-  deurs des réserves qu'ils font de tous droits et actions  tant contre les commissaires chargés de la vérifica- tion des apports que contre les divers membres du  Conseil d'administration de la Société française des  Mines de cuivre. »";14 juin;"COUR D'APPEL DE LYON 1"" ch";http://www.enap.justice.fr/ARCHIVE/ENAP_GAZETTE_TRIBUNAUX_18950811.pdf;189508111
189508120;"« Le Tribunal des conflits;   « Considérant que, par exploit, en date du 30 jan-  vierl895, le sieur Sanières, propriétaire du moulin  d'Assier sur la rivière du Lot, a assigné l'Etat devant  le Tribunal civil de Villefranche pour voir dire : qu'à  raison de la construction d'une digue sur un canal  d'amenée et un barrage dépendant de sa propriété, il  se trouvait, en fait, dépossédé de son usine devenue  inutilisable et qu'il lui était dû pour cette cause une  indemnité qu'il évaluait provisoirement à 200,000 fr. ;   « Considérant qu'à cette demande le préfet de   l'Aveyron a opposé un déclinatoire fondé sur ce que  les faits dont se plaint le demandeur ne constitue- raient que de simples dommages occasionnés par un  travail public ; qu'au surplus, il y avait lieu de re- chercher si l'usine avait une existence légale et si les  ouvrages d'amenée, dont le sieur Sanières aurait été  dépossédé, étaient réellement sa propriété, ou au  contraire nô faisaient pas partie du domaine public ;  que, dès lors, ie conseil de préfecture était seul com- pétent pour statuer sur le litige;   « Considérant que ie Tribunal de Villefranche, par   demande spéciale dont l'autorité jmdiciaire ne pour- .'  rait pas couuaîLre ; l   « Qu'ainsi, c'est avec raison que le Tribunal civil de   Villefranche s'est déclaré compétent et que l'arrêté de  conflit doit être annulé ;   « Décide :  « Article premier. — L'arrêté de conflit susvisé du   préfet de l'Aveyron est annulé. »";29 juin;TRIBUNAL DES CONFLITS ;http://www.enap.justice.fr/ARCHIVE/ENAP_GAZETTE_TRIBUNAUX_18950812.pdf;189508120
189508121;"« La Cour;  « Statuant sur l'appel interjeté par la Compagnie   d'assurances maritimes la Vigie d'un jugement  rendu par le Tribunal de commerce de la Seine le  28 septembre 1893 :   « Considérant qu'il résulte des documents soumis   à la Cour que la compagnie la Vigie nouvelle a, par  deux polices en date des 25 avril et 6 mai 1892, assuré  au Comptoir des Métaux le bénéfice à réaliser par  celui-ci sur 70 tonnes cuivre Chili-Lambert, repré- sentées par 676 barres, chargées parle vapeur Chili;  qu'il était stipulé que le bénéfice assuré s'élevait à  15 francs par 100 kilos, sur tout ou partie de la mar- chandise n'arrivant pas à destination, pour quelque  cause que ce soit provenant de la fortune de mer ;   « Considérant qu'il est constant que la Vigie n'a   pris aucun engagement quant à la livraison des cui- vres ; que la police n'indique aucun destinataire et  qu'il y est même ajouté que la Compagnie agit pour  le compte de qui il appartient ; que la Compagnie ré- pondait seulement de la bonne arrivée des marchan- dises au port de destination ; que cette destination  était le Havre ou tout autre port, aux teimes de la.  première police relative à 50 des 70 tonnes, et le Ha-'  vre aux termes de la deuxième police relative aux ''   son jugement du 20 mars 1895, a rejeté ce déclina- toire et s'est déclaré compétent pour connaître de  l'ensemble de l'action intentée par le sieur Sanières et  que le préfet de l'Aveyron a élevé ie conflit;   « Considérant que la demande formulée par le sieur   Sanières a pour objet l'allocation d'une indemnité à  râison d<j la dépossession partielle des dépendances de  son usine et des dommages qui auraient été la consé- quence de cette dépossession, et que le Tribunal civil,  comp .dent pour statuer sur cette demande, l'est éga- lement pour reconnaître le droit de propriété privée  invoqué devant lui, et pour vérifier, sauf interpréta- tion par l'autorité compétente des actes administra- tifs qui seraient invoqués, si les ouvrages et dépen- dances de l'usine, où oni été effectués les travaux,  faisaient ou non partie du domaine public ;   « Considérant, en outre, que la suppression du cou-  rant d'eau et la perte de force motrice dont se plaint  le demandeur n'étant que la conséquence de l'emprise  qui fait l'objet de l'instance, cette cause de dommages  ne saurait en être distinguée, ni donner lieu à un*   20 autres tonnes ;   « Considérant que, si le vapeur Chili a eu un si-  nistre en mer à la date du 10 mai 1892, il est certain  que, malgré ce sinistre, les barres de cuivre assurées,  ou du moins la presque totalité d'entre elles, 671 sur  676, n'en sont pas moins arrivées à destination, soit :  335, le 12 août, à Liverpool, sur le vapeur Sarata ;  64, le 4 novembre, également à Liverpool, sur le va*  peur Magellan ; 272, en février 1893, au Havre, sur  le vapeur Pérou ;   « Considérant que le Comptoir, n'ayant pu prendre   livraison que des 335 premières barres, réclame, pour  le surplus de la quantité assurée, le bénéfice du con- trat d assurance ; mais qu'aucune réclamation, si ce  n'est pour les 5 barres manquantes, ne peut être par  lui adressée à la Vigie ;   « Considérant, en effet, que non seulement celle-ci  n'a pris, ainsi qu'il vient d'être dit, aucun engagement  au sujet de la livraison, ce qui suffirait pour écarter  , sa responsabilité; mais que, si cette livraison n'a pas  7 eu lieu entre les mains du Comptoir dans les ports de   2, RUE";4 avril;COUR D'APPEL DE PARIS 6e ch;http://www.enap.justice.fr/ARCHIVE/ENAP_GAZETTE_TRIBUNAUX_18950812.pdf;189508121
189508122;"« La Cour ;  « Attendu que l'Exploitation du Port et du chemin   de fer de la Réunion, comme tout établissement de  dépôt public jouissant d'un monopole, est tenue,  sauf quelques exceptions prévues, de recevoir les  marchandises qui lui sont offertes, quand elles figu- rent à ses tarifs ; que le gambier est compris dans la  classification des marchandises tarifées dont l'emma- gasinage est obligatoire pour ladite exploitation ;   « Attendu que l'intimée ne conteste pas d'ailleurs   ce principe ; qu'elle soutient seulement qu'il n'est  pas aussi absolu que le prétend le capitaine Bour- daze et que son obligation n'existe que tout autant  que le gambier ne se trouverait point dans des con- ditions de détérioration le rendant susceptible de  nuire par son contact aux autres objets entreposés;   « Attendu que le principe ci-dessus posé doit en   effet fléchir si le refus de recevoir la marchandise  offerte se justifie par des causes légitimes;   « Or, attendu qu'il résulte des constatations des  experts que le gambier chargé sur le navire Le Sou- verain n'est plus un produit solide voire même une  pâte quelconque peu consistante, mais un mélange  presque liquide ne pouvant, sans inconvénient pour  les autres marchandises entreposées, trouver place  dans un dépôt public; que l'Exploitation du Port et  du Chemin de fer est en outre dépourvue de maga- sins spéciaux pour recevoir cette marchandise ava- riée ;   « Attendu, dès lors, que, sans avoir à rechercher si   ces conditions défectueuses du gambier ont pu ou non  se modifier plus tard, il suffit pour justifier le refus  de l'intimée de recevoii ce produit dans ses docks, de  constater l'état où il se trouvait au seuil du litige,  ainsi que l'inexistence révélée par les experts d'une  installation spéciale à l'abri de laquelle ce produit  aurait pu être placé sans dommage pour les autres  objets entreposés ;   « Qu'il y a donc lieu de confirmer le jugement ;   qu'il devient, en conséquence, inutile d'examiner les  autres moyens invoqués par l'Exploitation du Port et  du Chemin de fer pour repousser la demande du ca- pitaine Bourdaze;   « Par ces motifs et ceux des premiers juges qui n'y   sont pas contraires, et sans s'arrêter ni avoir égard  aux autres moyens, fins et conclusions des parties.   « Confirme le jugement dont est appel; condamne   le capitaine Bourdaze en l'amende et aux dépens de  première instance et d'appel. »";4 avril;COUR D'APPEL DE PARIS 6e ch;http://www.enap.justice.fr/ARCHIVE/ENAP_GAZETTE_TRIBUNAUX_18950812.pdf;189508122
189508140;"« La Cour:  « Ouï, en l'audience publique de ce jour, M. le con-  seiller Vilielard de Laguérie, en son apport, Mes de  Ségogne et Boivin-Champeaux, avocats des parties,   en leurs observations respectives, ainsi que M. le  conseiller Reynaud, faisant fonctions d'avocat général,  en ses conclusions; et après en avoir immédiatement  délibéré conformément à la loi ;   « Sur la deuxième branche du moyen : (sans inté-  rêt)...   « Sur la première branche, prise de la violation des   articles 1382 et suivants du Code civil :   « Vu les articles 1382 et 1383 du Code civil ;  « Attendu, en droit, que ces articles ne limitent   pas la responsabilité de celui par la faute duquel un   accident est arrivé au cas où cette faute a été la cause  unique ou immédiate de l'accident, et que l'impru- dence de la victime, qui autorise les Tribunaux a ré- duire le chilfre des dommages-intérêts, ne leur per- met pas d'affranchir de toute responsabilité celui dont  la faute constatée a déterminé l'accident ;   « Et attendu, en fait, qu'il résulte des qualités de  l'arrêt attaqué que, devant la Cour d'appel, les époux  Jousset demandaient à prouver que, bien que leur  fils, âgé de quinze ans, ne dût travailler dans l'impri- merie°du sieur Aubert que de sept heures du matin à  sept heures du soir, cependant Aubert le faisait tra- vailler quelquefois jusqu'à minuit, et que, notam- ment, le jour de l'accident survenu à leur enfant, ce- lui-ci avait été retenu à l'ouvrage par son patron,  etqu'il était dix heures un quartdu soir quand il a été  tué dans l'imprimerie ;   c Attendu que l'arrêt, loin de contester le fait ainsi   articulé, a déclaré qu'il était constant et non dénié   par Aubert que, le 21 avril 1892, jour de l'accident, ce  dernier avait contrevenu aux dispositions de la loi  du 19 mars 1874, en employant à un travail de nuit le  jeune Jousset, mineur de seize ans ;   « Attendu que l'arrêt ajoute, il est vrai, que ce fait   n'a pu engager la responsabilité d'Aubert, parce qu'il  n'a pas eu, avec l'accident survenu au jeune Jousset,  une relation de cause à effet, étant démontré que, eu  égard aux circonstances, ce dernier avait été la vic- time de sa propre imprudence;   « Mais, attendu que, dès qu'il est admis, comme un   fait certain et reconnu par l'arrêt lui-même, que, le  21 avril 1892, le jeune Jousset a été abusivement et  illégalement retenu par son patron au travail auquel  il était employé dans l'imprimerie Aubert, au delà de  l'heure réglementaire prescrite pour la cessation de  ce travail et le départ de l'apprenti de ladite imprime- rie, il en résulte que le sieur Aubert a commis une  faute qui a eu pour conséquence l'indue prolongation  du séjour du jeune Jousset dans l'imprimerie, prolon- gation sans laquelle il n'eût pas été matériellement  possible à celui-ci de commettre l'acte d'indiscipline  constaté à sa charge par l'arrêt attaqué ; que la rela- tion entre la faute d*Aubert et l'accident survenu a  l'apprenti s'induit donc nécessairement des constata- tions mêmes de l'arrêt, qui ne la peut nier sans une  évidente contradiction ; qu'il résulte de là que, dans  une mesure à déterminer, mais certaine d'après l'ar- rêt, le sieur Aubert a contribué par sa faute à occa- sionner l'accident arrivé à son apprenti ; et que, dès  lors, en exonérant Aubert de toute responsabilité  dans cet accident par le seul motif que le jeuneJous- set a été victime de sa propre imprudence, l'arrêt at- taqué a mécoHnu les conséquences légales des faits  par lui constatés et violé, par suite, les dispositions  de loi susvisées ;   « Par ces motifs,  « Casse, renvoie devant la Cour d'appel de Caen. »";7 août;COUR DE CASSATION ch;http://www.enap.justice.fr/ARCHIVE/ENAP_GAZETTE_TRIBUNAUX_18950814.pdf;189508140
