id;arrêt;date;juridiction;lien;id
189509261;"« Le Tribunal ;  « Attendu que l'Administration a fait signifier à la   Congrégation des sœurs de la charité Saint-Vincent- de-Paul deux contraintes : la première du 23 janvier  1886 procédant pour la somme de 2,687 fr. 50, à la- quelle il a été formé opposition régulière, suivant  exploit du 30 du même mois, la seconde du 15 octo- bre 1890, procédant pour la somme de 200,000 francs,  à laquelle il a été formé opposition régulière suivant  exploit du 22 du même mois ;   « Que dans ces deux instances, il a été respective- ment signifié des mémoires dont le dernier, émanant  de la Régie, porte la date du 20 avril 1891, qu'à par- tir de ce moment aucun acte de procédure n'a été  échangé ; que, dans ces circonstances, par deux  exploits de Gillet, huissier à Paris, du 11 mai 1894,  la Congrégation des Filles de la Charité a demandé  contre l'Administration à faire prononcer la péremp- tion des deux instances susvisées, dans les termes de  l'article 397 C. pr. civ., plus de trois ans s'étant écou- lés depuis le dernier acte signifié ;   « Attendu que le Tribunal est ainsi saisi de deux   demandes essentiellement connexes ;   « En la forme, joint les causes pour être statué sur   le tout par un seul et même jugement ;   « Au fond :  « Attendu que la Régie dans son mémoire, se borne   à prétendre que l'opposition contenant assignation  constitue seule l'instance, d'où suivrait que le rede- vable devrait être considéré comme demandeur et ne  saurait par suite invoquer la péremption, laquelle  est exclusivement réservée au défendeur;   « Attendu que, de son côté, dans son mémoire du   17 novembre 1894, la Congrégation des Filles de la  Charité répond que le demandeur est celui qui pour- suit le paiement d'une dette, et que telle est la situa- tion de la régie, quand elle décerne une contrainte  qui, dans la procédure spéciale à l'enregistrement,  constitue une véritable demande en justice ; qu'elle  fait, en outre, remarquer que l'obligation imposée  aux redevables de suspendre l'effet de la contrainte  par une opposition, contenant assignation, ne saurait  intervertir les rôles respectifs des parties et convertir  en demandeur le redevable qui se défend simplement  contre les poursuites du Trésor;   « Attendu que toute la question consiste donc à   savoir quelles sont les règles dans un débat judiciaire  et plus spécialement dans un procès de la Régie,  qui doivent faire considérer comme demandeur l'un ou  l'autre des deux adversaires ;   « Attendu qu'en l'absence de tout texte positif sur   ce point, c'est dans les principes généraux du droit  qu'il faut chercher la réponse ;   « Or, attendu que le véritable demandeur, auquel,   à ce titre, incombe le fardeau de la preuve, est celui  qui demande une chose, qui réclame l'exécution d'une  obligation ou poursuit le paiement d'une dette ; que,  sans doute, dans la procédure de droit commun, le  demandeur étant, en général obligé, pour faire valoir  ses droits, d'assigner son adversaire, se confond par  cela même le plus souvent avec celui à la requête  duquel l'assignation est délivrée ; mais que ce serait  confondre l'effet avec la cause que de faire dépendre  du jeu de la procédure la répartition fondamen- tale des rôles entre les deux parties en présence ;   « Attendu que, même dans les instances de droit   commun, ces principes sont incontestés ; que le créan- cier qui poursuit son débiteur est toujours deman- deur principal, soit qu'il ait porté sa réclamation de- vant le Tribunal pour obtenir un jugement de  condamnation, soit qu'il ait agi par voie d'exécution  parée, et que le Tribunal ait été saisi par opposition   du débiteur, cette opposition n'étant qu'un moyen de  défense tendant à repousser l'action du créancier en  la faisant déclarer nulle et mal fondée ; qu'il en est  ainsi, notamment du débiteur qui porte en justice son  opposition à un jugement par défaut ou qui demande  la nullité, soit d'une saisie, soit d'un commande- ment ;   « Attendu que telle est la situation de fait et de   droit du redevable formant opposition à la con- trainte ;   « Attendu, d'ailleurs, que voulût-on repousser cette   analogie et prétendre même qu'en procédure de droit  commun, le rôle du demandeur est déterminé par  l'assignation, il n'en saurait résulter aucun argument  en faveur de la thèse de la Régie : qu'en effet, la loi  de frimaire an VII";20 juillet;TRIBUNAL CIVIL DE LA SEINE 2e ch;http://www.enap.justice.fr/ARCHIVE/ENAP_GAZETTE_TRIBUNAUX_18950926.pdf;189509261
189509270;"« Le Tribunal ;  « Attendu qu'après l'accomplissement de toutes  les formalités prescrites par la loi, il est intervenu à  la date du 27 décembre dernier entre la faillie et ses  créanciers, un traité à titre de concordat aux termes  duquel, remise lui étant consentie de 70 p. 100, elle  s'est engagée à payer les 30 p. 100 non remis à diver- ses échéances ;   « Attendu que, si aucune opposition n'a été formée   à ce concordat dans le délai de la loi, il résulte néan- . moins du caractère et des circonstances de la faillite   que ledit concordat ne saurait être homologué;   « Qu'en effet, si la faillite n'a présenté aucun ca-  ractère de fraude et si une faillite antérieure s'est  terminée par un concordat dont les conditions  paraissent avoir été remplies, le rapport du syndic de  la dernière faillite révèle un passif privilégié de  10,456 fr. 55, composé en grande partie des termes de  loyer dus au propriétaire ; que cette créance est exi- gible et, en raison de sa nature et des conditions du  bail, pourrait donner lieu à une exécution immédiate;   « Attendu que veuve Brag produit une déclaration  du propriétaire qui ne s'oppose pas à l'homologation  du concordat, mais à la condition toutefois d'un  paiement hebdomadaire de 460 francs, faute duquel  il reprendra immédiatement l'exercice de tous ses  droits ;   « Que par suite les créanciers chirographaires qui   ont consenti à la remise de 70 p. 100 de leurs créan- ces et au paiement des 30 p. 100 non remis en cinq   II UMI";9 mai;COUR D'APPEL DE PARIS 3a ch;http://www.enap.justice.fr/ARCHIVE/ENAP_GAZETTE_TRIBUNAUX_18950927.pdf;189509270
189509271;"« La Cour ;   « Considérant que, si les premiers juges ont refusé   l'homologation du concordat, la situation s'est modi- fiée depuis le jugement dont est appel ; qu'en effet, il  résulte des documents versés au débat que le passif  privilégié qui était exigible, et qui donnait au con- cordat un caractère de précarité incontestable, a été  éteint et que les créanciers chirographaires ont pu  apprécier la véritable situation de leur débitrice ;   « Considérant, qu'en l'état, ces créanciers sont les   meilleurs juges de leurs intérêts ; qu'ils demandent  l'homologation du concordat, et qu'en raison de l'ab- sence de toute fraude et de toute faute de la part de  la veuve Brag pouvant motiver le refus d'homologa- tion du concordat dans un intérêt public, il y a lieu  de réformer le jugement dont est appel, et de pro- noncer l'homologation ; qu'au surplus, le syndic de  la faillite déclare s'en rapporter à justice ;   « Par ces motifs,  « Met l'appellation et ce dont est appel à néant ;  « Emendant, décharge la dame veuve Brag des dis-  positions et condamnations prononcées contre elle ;   « Et faisant droit par décision nouvelle: homologue,   pour être exécuté selon sa forme et teneur, le traité  passé entre la dame veuve Brag et ses créanciers, à  titre de concordat, le 27 décembre 1894 ;   ; « Ordonne la restitution de l'amende consignée sur   l'appel ; condamne Châle, ès-qualilés, aux dépens de  première instance et d'appel, qui seront employés en  frais de syndicat. »";9 mai;COUR D'APPEL DE PARIS 3a ch;http://www.enap.justice.fr/ARCHIVE/ENAP_GAZETTE_TRIBUNAUX_18950927.pdf;189509271
189509280;"« Le Tribunal ;   i ••   « Et d'abord, en -ce qui f.ouche la grotte, espèce de   voûle, située sous, l'immeuble d'un voisin, mais ap- partenant tout de même aux conforts Daussat :   « Attendu que cette voûte n'avait été comprise ni   dans l'arrêté de cessibilité, ni dans le jugement d'ex- propriation ;   « Que le procès-verbal de .la fixation de l'indem-  nité ne mentionne pas non plus que les consorts  Daussat avaient exigé la prise de cette grotte, ce qu'ils   auraient eu incontestableme nt le droit de faire, ni  qu'une indemnité spéciale a.it été accordée pour cet  objet ;   « Attendu, néanmoins,que la. prétention de la com-  mune doit être accueillie ;   « Attendu, en effet, que la gr.otte suivait immédia- tement la filature et n'avait acc< is que par ladite fila- ture ;   « Que la commune n'avait bee K»";24 juin;COUR D'APPEL DE NIMES lre ch;http://www.enap.justice.fr/ARCHIVE/ENAP_GAZETTE_TRIBUNAUX_18950928.pdf;189509280
189509281;"« La Cour ;  « Sur le chef de demande relatif à la grotte con-  tiguë à l'ancienne filature :   « Adoptant les motifs des premiers juges ;  « Attendu, en outre, que sur ce point les hoirs   Daussat ne justifient pas qu'ils fussent propriétaires  d'une parcelle quelconque en dehors de celle qui a  fait l'objet de l'expropriation et sur le sol de laquelle  était édifiée la filature; qu'ainsi donc toute la super- ficie expropriée était contenue dans le numéro 577,  tant la filature que la grotte qui en faisait partie in-  tégrante ;   tation de la filature:   « Sur le chef relatif aux eaux destinées à l'alimen-  « Attendu qu'il n'est pas contesté que les eaux   ayant cette destination provenaient d'une source qui  était la propriété de la famille Daussat bien avant la  construction de la filature ;   « Qu'il est vrai que, lorsque la filature fut con-  struite, les eaux furent en partie employées à son  usage et qu'il est certain aussi que si la filature avait  été vendue soit amiablement, soit sur expropriation  forcée, elle eût passé aux mains de l'acquéreur ou de  l'adjudicataire avec son affectation et aussi avec ses  accessoires, dont les eaux auraient formé un élément   essentiel ;   « Attendu qu'il n'en saurait être ainsi alors qu'il  s'agit d'une expropriation pour cause d'utilité publi- que qui doit avoir pour effet la désaffectation de l'im- meuble exproprié par suite de son incorporation,  connue dans l'espèce, au domaine public; qu'on com- prend donc que l'expropriation de l'immeuble laisse  en dehors la propriété des eaux, lesquelles devien- nent inutiles à l'expropriant à raison du changement  de destination de la chose; que l'on doit même présu- mer qne l'expropriation n'a compris que les articles  nécessaires à l'exécution des travaux en vue desquels  elle a été poursuivie ;   « Attendu que rien dans la procédure d'expropria-  tion ne permet de supposer que la commune ail en- tendu acquérir la source en même temps que l'usine,  que la source n'avait aucune utilité pour la création  du chemin projeté ; que, d'autre part, elle ne présente  aucune indivisibilité avec l'usine; qu'on conçoit, en  effet, la propriété de la source comme distincte de la  propriété de l'usine, puisque les eaux peuvent rece- voir, de la part de leur propriétaire, après l'expro- priation de la filature, comme avant sa construction,   des destinations multiples d'utilité ou d'agrément ;   « Attendu qu'il n'importe que, devant le jury d'ex-  proprialion, les hoirs Daussat se soient prévalus,  pour obtenir une indemnité plus considérable, à rai- son de l'exproprialion de latilature, de cette circons-  tance qu'elle était, pour son fonctionnement, large- ment pourvue d'eau ;   « Qu'évidemment il y avait dans l'utilisation indus-  trielle de la source, qui ne faisait d'ailleurs pas obs- tacle à l'emploi des eaux à d'autres usages, un élé- ment d'appréciation dont il pouvait et devait être  tenu compte pour la détermination du chiffre de l'in- demnité afférente à l'usine, mais que l'estimation de  la plus-value de la filature pour ce motif ne pouvait  comprendre la valeur intrinsèque de la source, ni  par suite le prix de l'usine s'appliquer à la propriété  des eaux ;   « Sur le troisième chef relatif aux eaux destinées à   l'arrosage des jardins:   « Attendu qu'il y a lieu de distinguer entre le jar-  din faisant le n° 579 et le jardin faisant le n° 580 ;  que pour le premier l'arrosage avait lieu avec l'eau  provenant de 1 égout de la fontaine publique, qu'ainsi  donc les hoirs Daussat avaient sur les eaux de ladite   fontaine un droit de servitude au profit de leur jar- din, mais que, cessant d'être propriétaires du fond  dominant, ils ne peuveut conserver le droit à la ser»";24 juin;COUR D'APPEL DE NIMES lre ch;http://www.enap.justice.fr/ARCHIVE/ENAP_GAZETTE_TRIBUNAUX_18950928.pdf;189509281
189509300;"« Le Tribunal ;   « Attendu que, le 12 avril 1894, Bernheim faisait   conduire un cheval chez le vétérinaire Garcin, 17,  rue Cambacérès ; qu'au moment où ce cheval allait   entrer dans l'allée qui mène aux écuries, une voiture   de blanchisseur, appartenant à la veuve Pilard et  conduite par Frischraann, cocher à son service, est   venue se jeter sur la cuisse de derrière du cheval, qui   a été blessé ;   « Que Bernheim a, par exploits des 24 janvier et 19  février 1895, assigné Frischmann en dommages-inté- rêts comme auteur de l'accident, et la veuve Pilard  comme responsable de son préposé ;   « Que les défendeurs opposent à l'action du deman-  deur une exception d'incompétence et concluent à   leur renvoi devant la juridiction commerciale ;   « Mais attendu que la demande en dommages-inté-  rêts de Bernheim est basée sur un préjudice résul- tant d'un délit ou d'un quasi-délit ; que les actions  de cette nature sont des actions purement civiles,  qu'elles se produisent, soit devant la juridiction cor- rectionnelle, soit devant la juridiction civile; que les  Tribunaux civils ont la plénitude de juridiction, tan- dis que les Tribunaux de commerce sont des Tribu- naux d'exception ;   « Que les termes de l'article631 du Code de commer- ce doivent être appliqués dans un sens restreint ; que  le fait illicite sur lequel est basée l'action en domma- ges-intérêts, pour être de la compétence des tribunaux  de commerce, doit s'être produit à l'occasion d'enga- gements commerciaux précis, existant entre les par- lies en cause ; qu'il ne suffit pas que le fait domma- geable ait été le résultat d'une faute imputable à un  commerçant dans l'exercice de son commerce ; qu'il  faut encore que ce fait lui-même dérive des rapports  commerciaux existant entre deux commerçants ; que  la compétence des tribunaux de commerce se trouve  ainsi circonscrite dans la limite des actes qui ont  pour objet essentiel et pour but principal les spécula- tions du négoce;   « Utendu qu'en l'espèce il n'existait entre les dé-  fendeurs et le demandeur Bernheim aucun engage- ment commercial ; qu'aucune spéculation de négoce  n'a jamais existé entre la blanchisseuse veuve Pilard  et Bernheim ; que, d'ailleurs, l'auteur du quasi-délit  ayant porté préjudice au demandeur est le nommé  Frischmann; que la veuve Pilard n'est que civilement  responsable de celui-ci ;   « Que Frischmann ne saurait être assimilé aux per-  sonnes énumérées dans l'article 634 du Code de com- merce ;   « Que la compétence du Tribunal civil est incontes-  table à l'égard de Frischmann et par voie de consé-  quence à l'égard de la veuve Pilard ;   « Attendu, en outre, que l'action en responsabilité   résultant des accidents de voiture comporte dans la  plupart des cas l'examen des règlements de police sur  l'application des lois pénales qui, en raison de la so- lidarité que le Code d'instruction criminelle a établie  entre l'action civile et l'action publique, échappe à la   juridiction commerciale ;   « Par ces motifs,   « Déclare la veuve Pilard et Frischmann mal fon-  dés en leur exception d'incompétence, les en déboute;  se déclare compétent; condamne la veuve Pilard et  Frischmann solidairement aux dépens. »";27 mai ;TRIBUNAL CIVIL DE LA SEINE 4e ch;http://www.enap.justice.fr/ARCHIVE/ENAP_GAZETTE_TRIBUNAUX_18950930.pdf;189509300
189509301;"« Le Tribunal ;   «Attendu que la demande étant fondée non sur  l'article 1385 du Code civil, qui établit une présomp- tion de faute contre le propriétaire de l'animal cause  d'un accident, mais sur les articles 1382, 1383,1384  du même Code, visés dans l'exploit introductif de  l'instance, le Tribunal a ordonné à la charge de Ru- delle, la victime, la preuve de ce fait « que l'accident  « du 2 mai 1893 était dû à l'imprudence de Jullien,  « le propriétaire dont le cheval allait à une allure  « très vive »";31 mai;TRIBUNAL CIVIL DE VERSAILLES 2'ch;http://www.enap.justice.fr/ARCHIVE/ENAP_GAZETTE_TRIBUNAUX_18950930.pdf;189509301
189510020;"« Le Tribunal ;   « Attendu que par assignation en date à Paris du   21 juillet 1892, les époux Mocquet ont demandé à la  dame veuve Girard de faire dresser contradictoire- ment avec eux l'état des lieux d'une maison sise à  Paris, rue Saint-Honoré, 62, à eux louée par ladite  dame ou de faire procéder au dressé dudit état par  tel architecte qu'il plaira au Tribunal commettre à  cet effet ;   « Attendu que la dame Girard prétend n'avoir ja-  mais été sommée par les époux Mocquet de leur  prêter son concours pour la confection de cet état des  lieux ; qu'elle déclare qu'il s'est écoulé quatre années  depuis leur entrée en jouissance, et que l'état des lo- caux tels qu'ils se trouvaient à cette époque ne saurait  être utilement constaté aujourd'hui ;   « Attendu qu'elle s'oppose à la nomination d'un  expert demandée par les époux Mocquet, et conclut  au débouté de leur demande ;   « Attendu que suivant bail reçu Fay. notaire à Pa-  ns, en date du 17 novembre 1887 enregistré, les époux  Mocquet ont loué de la dame Girard, et ce, pour une   période de quinze années, un immeuble sis à Paris,  rue Saint-Honoré, n° 62 ;   « Attendu que ledit bail portait condition : « d'en-  « tretenir les lieux loués en bon état de réparations  « locatives et de les rendre à la fin du bail conformes  « à l'état des lieux que les parties devaient dresser   « contradictoirement dans le mois de l'entrée en iouis- « sance. »";18 mars;COUR D'APPEL DE PARIS 7e ch;http://www.enap.justice.fr/ARCHIVE/ENAP_GAZETTE_TRIBUNAUX_18951002.pdf;189510020
189510021;"« La Cour;   « Considérant que si les époux Mocquet ont eu le   tort de ne pas faire procéder, dans le délai d'un mois  indiqué au bail a eux consenti par la feue veuve Gi- rard, à la confection de l'état de lieux de la maison  rue Saint-Honoré, 62, il ne s'ensuit pas qu'ils soient  déchus du droit de faire dresser cet état de lieux ;   « Considérant, en effet, qu'aucun texte de loi ne   fixe de délai fotal après l'expiration duquel le pre- neur sera privé du droit de faire un état de lieux ; que  le bail des époux Mocquet ne déclare pas que faute  par eux d'avoir fait dresser l'état de lieux dans le  mois ils seront forclos ;   « Considérant que la seule sanction légale du défaut   d'état de lieux est que le locataire qui n'a pas fait  d'état de lieux est présumé avoir reçu les lieux en  bon état de réparations locatives et doit les rendre  tels, sauf la preuve contraire ;   « Considérant que cette preuve contraire mise à la,  charge du preneur négligent et à l'aide de laquelle ii  peut échapper à la présomption de l'article 1731 du  Code civil peut être faite par tous les moyens pos- sibles ;   « Considérant que s'il est vrai que les réparations   locatives ne s'exécutent qu'à la fin du bail, cela n'im- plique pas que le locataire qui n'a pas fait d'état de  lieux doive nécessairement demeurer jusqu'à l'expi- ration de son bail soumis à la présomption de l'arti- cle 1731 et doive attendre jusqu'à cette époque pour  essayer d'administrer la preuve contraire, ce qui  après un long temps écoulé pourrait devenir impos- sible ;   « Considérant dès lors qu'on se sauxait refuser aux   époux Mocquet le droitde se soustraire pour l'avenir,  par la confection d'un état de lieux, à la présomption  de l'article 1731 du Code, civil non plus que le droit  de tenter pour le passé de faire, s'ils le peuvent, la  preuve contraire que cet article autorise ;   « Qu'ainsi il y a lieu,en infirmant le jugement dont   est appel, d'ordonner la confection d'un état dans le- quel on constatera les réparations locatives que l'im- meuble comporte actuellement, sauf aux époux Moc- quet à établir, si cela leur est possible, quelles sont  celles de ces réparations locatives dont ils ne sau- raient être tenus à raison de l'état dans lequel l'im- meuble leur a été remis par leur bailleresse ;   « Considérant que les conclusions très subsidiaires   des époux Mocquet à fin d'enquête ne peuvent être  admises, le fait par eux articulé n'étant pas perti- nent ;   « Par ces motifs,   « Reçoit les époux Mocquet appelants du jugement   du Tribunal de la Seine en date du 27 mai 1893 et  faisant droit sur ledit appel :   « Infirme ledit jugement ; dit que l'article 1731 du   a Code civil n'établit contre le locataire qui n'a pas fait   d'état de lieux qu'une simple présomption qui peut i  être détruite par toute preuve contraire ;   « Dit que dans la huitaine de la signification du   présent arrêt, Pollet devra prêter son concours aux  époux Mocquet à l'effet de dresser l'état de lieux dans  les conditions ci-dessus indiquées et ce sous une as- treinte de 10 francs par jour de retard pendant un  mois après quoi il sera fait droit ;   « Et faute par Pollet de ce faire dans ledit délai :   dit que par Etienne,expert à cet effet commis, lequel  prêtera serment devant le président de cette cham- bre, s'il n'en est dispensé par les parties, et qui en  cas d'empêchement ou de refus sera remplacé par or- donnance du président de cette chambre rendue sur  simple requête, il sera procédé en présence de Pollet  ou lui dûment appelé à la confection, dans les condi- tions ci-dessus indiquées, de l'état de lieux compre- nant l'état des réparations locatives que comporte  l'immeuble ; dit que l'expert s'entourera de tous ren- seignements utiles, entendra toutes personnes à fin  de rechercher quelles sont les réparations locatives  actuelles que les époux Mocquet prouveraient, con- formément à la disposition finale de l'article 1731,  n'être pas à leur charge ;   « Déclare les époux Mocquet mal fondés en leurs   conclusions subsidiaires à fin d'enquête, les en dé- boute; ordonne la restitution de l'amende, et con- damne l'intimé en tous les dépens de première ins- tance et d'appel; dit toutefois que les frais de l'exper- tise ordonnée, qui est un acte conservatoire dans l'in- térêt seul des époux Mocquet qui ont été négligents  en ne faisant pas l'état de lieux dans le délai, demeu- reront à la charge exclusive desdits époux. »";18 mars;COUR D'APPEL DE PARIS 7e ch;http://www.enap.justice.fr/ARCHIVE/ENAP_GAZETTE_TRIBUNAUX_18951002.pdf;189510021
189510022;"« La Cour ;   « Attendu que, suivant acte du 13 février 1880, Ma-  gre, notaire, Alexis Autofage et la dame Tajan, co-  propriétaires, ontvendu à Lasserre divers immeubles,  au prix de 38,000 francs, soit 25,600 francs pour Au- tofage et 12,400 francs pour la dame Tajan ; que Las- serre paya à Autofage 4,000 francs, par où ce dernier  demeurait créancier de 21,600 francs; que ces mêmes  biens ayant été expropriés, sur la tête de Lasserre,  leur adjudication, le 29 octobre 1891, a donné seule- ment 16,000 francs ;   « Attendu qu'à suite de ventilation, la part reve- nant à la dame Tajan a été fixée à 7,565 fr. 80 ; qu'il  n'y a à cet égard aucune difficulté et qu'il convient de  maintenir le jugement, mais en supprimant — ainsi  que cela va résulter de ce dessous — la déclaration  du dispositif, que Tachoires et Benabent pourraient   i éventuellement recourir en sous-ordre sur les biens  relatifs aux reprises de l'épouse d'Alexis Autofage :   « Attendu que sur le prix restant à distribuer fixé   à 9,512 fr. 88, il n'y a pas lieu de former deux caté- gories distinctes ;   « Attendu, en effet, que, dans l'acte du 13 février   1880, Alexis Autofage avait cédé et transporté à Jean- Baptiste Autofage, son frère, d'Alexandrie (Egypte),   ce accepté par le mandataire de ce dernier, la somme  de 11,000 francs à prendre sur Lasserre ;   « Attendu que les héritiers de Jean-Baptiste Auto-  fage ont, à leur tour, par acte du 1er mai 1882, Dave-  rède. notaire, cédé à Jacques Sénac, auteur de la  dame Sénac, 9,500 francs qui se réduisent, aujour- d'hui, en principal à 5,500 francs ;   « Attendu que la délégation de l'acte du 13 février   1880 a eu pour conséquence de rendre Jean-Baptiste  Autofage créancier des époux Lasserre, mais n'a pas  déchargé Alexis Autofage, le cédant, lequel est resté  comme auparavant débiteur de son frère ;   « Attendu que rien, dans la clause de l'acte du 13   ai WJK";4 avril;COUR D'APPEL DE TOULÛpSE F8 ch;http://www.enap.justice.fr/ARCHIVE/ENAP_GAZETTE_TRIBUNAUX_18951002.pdf;189510022
