id;arrêt;date;juridiction;lien;id
187303230;"« Le Tribunal,   « Attendu que la maison sise à Joinville-le-Pont, ave-  nue Mollette, n° 3, appartenant à Poulain et Guébillon,  a été louée par eux a la dame Drier, et sous-louée par   « Que dans les premiers jours du mois de septembre  1870, elle a dû être abandonnée par les sous-locataires,  et qu'elle a, au cours de l'investissement, subi des dé- gradations qui ont élé telles que les lieux, après la cessa-  tion des hostilités, étaient absolument inhabitables ;   « Que des réparations importantes de toute nature ont dû   être effectuées par le bailleur, et que c'est à la date du  24 novembre 1871 seulement qu'un procès-verbal dressé  à la requête de Poulain et Guébillon a constaté leur  achèvement ; que pendant cette longue période, le sous- locataire a été placé dans la nécessité absolue de.se pour-  voir d'une autre habitation ;   « Attendu qu'aux termes de l'article 1722 du Code  civil, si les dégradations subies par l'immeuble sont de  telle nature qu'elles rendent inhabitable ce qui est né- cessaire au logement du preneur et de sa famille, celui- ci peut obtenir la résiliation du bail ;   « Qu'ainsi, par application dudit article, la convention   intervenue entre la dame veuve Drier et Dewez doit être   réalisée ;   « Mais attendu que la dame Drier qui n'habitait pas  les lieux et qui les avait au contraire sous-loués, ne peut  se prévaloir de ces dispositions de la loi ;   « D'où il suit qu'elle est fondée seulement à obtenir la   décharge des loyers courus du 1er septembre 1870 au Ie1'  décembre 1871, mais non la résiliation de son bail ;   « Par ces motifs,   « Déclare résiliée à partir du 1er septembre 1870, la   location consentie par la veuve Drier à Dewez ;   « Ordonne la restitution des loyers d'avance, défalca-  tion faite de ceux dûs au 1"" septembre 1870, à savoir de   deux mois de loyer ;   « Déclare au contraire maintenu le bail consenti par   Poulain et Guébillon, au profit de la dame Drier ;   « Décharge néanmoins la dame Drier des loyers courus   du 1er septembre 1870 au 1er décembre 1871 ;   « Condamne la dame Drier au paiement du surplus des   loyers actuellement dûs ;   les parties ;   Mme veuve Drier a interjeté appel de ce juge-  ment, M0 Deschars, son avocat, a soutenu que les   détériorations subies par l'immeuble n'étaient pas   de nature à entraîner la résiliation du bail, et sub-  sidiairement que si le bail était résilié vis-à-vis du   sieur Dewez, il devait l'être également vis-à-vis de   la dame Drier. La Cour, après avoir entendu   Ma Pignon, avocat de M. Dewez, M6 de Germiny,   avocat de MM. Poulain et Guébillon, et M. l'avocat   général Hémar, en ses conclusions, a statué ainsi   qu'il suit :   « La Cour,  « Considérant que Poulain et Guébillon ont donné en   location à la dame Drier, pour neuf années consécutives, 1  à partir du 1er janvier 1864, à raison d'un loyer annuel ;  de 1,000 francs, un pavillon sis à Joinville-le-Pont ;   « Considérant qu'à partir du 1er juillet 1870, la dame   Drier a cédé son droit à ce bail pour la période de temps  restant à courir jusqu'au 1er janvier 1873 à Dewez,  moyennant un loyer de 1,100 francs par an ;   « Considérant que peu de temps après son entrée en   jouissance des lieux loués, Dewez a dû les abandoner  par suite de la guerre intervenue entre la France et  l'Allemagne ; que, dès le commencement de septembre  1870, il s'est trouvé dans l'impossibilité d'y demeurer ;  que, par des faits de guerre, le pavillon faisan l l'objet  du bail a été dévasté et ruiné de telle sorte qu'il est de- venu complètement impropre à toute habitation ;   « Considérant que nonobstant cette situation, et à la   date du 24 juillet 1871, alors que les dégradations qui  avaient détruit toute possibilité de jouir des lieux loués  subsistaient encore, Poulain et Guébillon ont fait signifier  à la dame Drier un commandement d'avoir à payer les   termes de loyers échus ;   « Qu'à son tour la dame Drier, se repliant contre son   cessionnaire, lui a faft notifier un commandement de   même nature ;   « Considérant que pour résister à cette voie d'exécu-  tion, Dewez a fait assigner la dame Drier devant le  Tribunal de la Seine, à l'effet d'obtenir, en vertu des  dispositions de l'article 1722 du Code civil, la résiliation  du sous-bail et la restitution des loyers payés par   avance ;   « Que les dégradations surrenues au pavillon dont il   s'agit au procès se trouvent pleinement démontrées par  les documents de la cause, et que l'impossibilité d'habi- ter les lieux loués ayant anéanti le droit de jouissance de  Dewez, il avait évidemment, suivant l'esprit de l'article  précité, la faculté de faire résilier la sous-location consen- tie à son profit, et, par suite, de demander le rembour- sement des loyers payés par anticipation pour la période  de temps postérieure au 1er septembre 1870 ;   « Que c'est dès lors à bon droit que cette résiliation a   été prononcée et le remboursement ordonné par les pre- miers juges, sans néanmoins que leur appréciation dût se  baser sur les dispositions de l'article 1724 du Code civil,  quf-se rapportent au cas de réparations nécessitées par  la vétusté ou la construction défectueuse des bâtiments,  et non à la destruction de la jouissance par des événe- ments de force majeure;   « Mais considérant que la même cause de résiliation   existait au profit de la dame Drier vis-à-vis de Poulain  et Guébillon ; que le pavillon dévasté par des actes de  force majeure éttit tout aussi inhabitable pour le locataire  principal que pour le sous-locataire ; que peu importe  que la dame Drier n'y demeurât plus au moment où a  éclaté la guerre, la cession qu'elle a faite de son droit au  bail ne pouvant avoir pour effet d'affranchir le bailleur  des conséquences résultant pour lui de la destruction de  toute possibilité de jouissance des lieux loués;   « Que c'est dès lors à tort que le Tribunal a rejeté les  conclusions aux fins de résiliation présentées de son chef  par la dame Drier, la résiliation du bail n'étant en au- cune façon subordonnée à la condition que jusqu'au mo- ment où la jouissance a été interrompue, le preneur eût  personnellement habité les lieux loués, mais dépendant  uniquement du point de savoir s'ils ont ou non été dé- gradés, de telle sorte que toute habitation y est devenue  impossible, circonstance de fait qui, dans l'espèce, n'a  pu être sérieusement contestée;   « Que conséquemment il y a lieu de faire droit à la  demande de la veuve Drier, èt d'ordonner que Poulain  et Guébillon lui rembourseront de leur côté toute la  partie des loyers qu'elle leur a soldée par avance pour la  période postérieure au 1er septembre 1870, époque à la- quelle l'habitation du pavillon loué a cessé d'être pos- sible ;   « Par ces motifs,  « Sans s'arrêter aux exceptions de nullité et fins de   non-recevoir opposées audit appel, et dont aucun n'a été   précisé ;   premiers juges;   « Maintient la jonction des causes prononcées par les   o Confirme ledit jugement dans ses dispositions rela-  tives à la résiliation du sous-bail, et au remboursement  de loyers au profit de Dewez ;   « Infirme sur les autres chefs;  « En conséquence, déclare résiliée à partir du 1er sep-  tembre 1870 le bail consenti par Paulin et Guébillon en  faveur de la dame Drier ;   « Condamne ledit Poulain et Guébillon à restituer tou-  tes les sommes par lui perçues à titre de loyers, pour la   jouissance postérieure à ladite époque;   « Les condamne en outre aux dépens de première   instance et d'appel envers toutes les parties ;   « Ordonne la restitution de l'amende consignée. »";12 mars;COUR D'APPEL DE PARIS lre chambre;http://www.enap.justice.fr/ARCHIVE/18730323.pdf;187303230
187303240;"« La Cour,  « Considérant que, par son testament olographe, en   date du 27 août 1864, Huet a fait, de la manière sui- vante, un legs universel au profit de la demoiselle Cbar- rin, et un legs particulier au profit de sa famille ;   c Que le legs universel est exprimé dans ces termes,   des plus clairs et des plus formels : « J'institue Mlle So-  i phie-Pétronille Charrin pour ma légataire universelle,  « et j'entends qu'en vertu de cette institution, elle soit  « saisie et mise en possession de toute ma succession ; »";24 mars;COUR D'ASSISES DE LA SEINE;http://www.enap.justice.fr/ARCHIVE/18730324.pdf;187303240
187303260;"« Le Tribunal,  « Attendu qu'il est établi par les documents visés au   procès qu'à la date du 16 mars 1871, des conventions  sont intervenues entre Leconte-Dupond fils et Fréar,  aux termes desquelles ce dernier acceptait la livraison, de  500,000 kilogrammes environ de pommes de terre arri- vées en gare de Paris, moyennant prix fixé à 14 fr. 50  le quintal, à la condition qu'elles seraient acceptées par  l'iuspecteur du gouvernement ;   « Attendu que postérieurement aux accords ainsi in-  tervenus les marchandises dont il s'agit ont été réquisi- tionnées par la Commune de Paris, et n'ont pu faire  l'objet d'une délivrance réelle, au défendeur;   « Attendu que Leconte-Dupond fils, prétendant, aujour-  d'hui, que les marchandises auraient péri pour le compte  de Frear, lui demande le paiement de 79,822 fr. 40,  représentant tout à la fois le prix des pommes de terre  qu'il aurait vendues et celui des sacs qui les contenaient ;  « Qu'il y a donc lieu pour le Tribunal de rechercher   en la personne de qui reposait la propriété de la mar- chandise à la suite des conventions qui sont intervenues  le 16 mars ;   « Attendu que Frear ne nie pas qu'il y ait eu entre lui   et les demandeurs accord sur le prix et sur la chose,  mais soutient que le contrat n'était pas parfait ; que les  conditions, qui étaient imposées à l'exécution doivent  être considérées comme suspensives ; qu'en conséquence,  la livraison réelle n'ayant jamais pu avoir lieu à son  profit, il ne saurait être çonsidéré comme ayant été, à  un moment quelconque,, propriétaire de cette marchan- dise; que, dès lors, elle n'a pu périr pour son compte ;   « Attendu, d'une part, que le Tribunal ne saurait voir,   dans les conventions telles qu'elles lui sont soumises, un  marché fait en bloc ayant constitué immédiatement la  propriété de la chose sur la tête de l'acquéreur ; qu'il  ressort, au contraire, pour lui que la marchandise de- vait encore être l'objet d'un pesage et d'un mesurage  avant sa délivrance, et que les risques de l'objet vendu  demeuraient, jusques-là à la charge du vendeur;   « Attendu, en outre, que, comme condition expresse   du traité, il était entendu que les marchandises devaient  être, avant tout, acceptées par un agent du gouverne- ment ; que cette condition ne s'est jamais réalisée; que  rien ne permet au Tribunal d'en imputer la' faute à  Frear plutôt qu'à Leconte-Dupont fils ;   « Attendu, enfin, que Fréar était si peu maître de dis- poser de la marchandise dont s'agit qu'il n'a jamais été  en possession d'aucun des documents nécessaires pour en  opérer le retrait des mains de la compagnie où elle était  déposée, ni mis en demeure régulièrement par Leconte- Dupont fils de s'en livrer ;   '« Attendu qu'à l'état des faits ainsi relevés par le Tri- bunal il convient de reconnaître que le contrat était bien  assujetti à des conventions suspensives, dont la résiliation  était nécessaire pour assurer la propriété en la personne  de l'acheteur ;   « Qu'il demeure établi pour le Tribunal que ces condi-  tions n'ont jamais été réalisées, et qu'ainsi la marchan- dise est restée aux risques, périls et fortune des deman- deur, pour le compte desquels elle a. péri ;   « Que, dès lors, il y a lieu de déclarer les demandeurs   mal fondés dans leur demande et de les en débouter ;   • « Par ces motifs,   « Le Tribunal, jugeant en premier ressort :  « Déclare Leconte-Dupond fils mal fondés dans leur   demande contre Fréar, formée suivant exploit du minis- tère de Binon, huissier à Paris, en date du 8 août der- nier ;   « Les en déboute ;  « Et les condamne aux dépens. »";20 décembre 1872;COUR D'APPEL DE PARIS 3° ch;http://www.enap.justice.fr/ARCHIVE/18730326.pdf;187303260
187303261;"« La Cour...,  « En ce qui touche les conclusions principales de l'ap-  « Considérant qu'il est établi par les documents de la   cause qu'en exécution d'un marché conclu entre les par- ties au mois de février 1871, Leconte Dupond fils a,  vers le 15 mars de la même année, expédié du départe- ment du Nord à Paris 500,000 kilogrammes environ de  pommes de terre par lui vendues à Frear, et destinées à  être livrées par ce dernier au gouvernement français  pour l'alimentation de Paris, conformément aux traités  Ou accords existant entre ledit Frear et le gouverne- ment;   « Considérant que par lettre en date du 16 mars 1871,   laquelle est représentée par Leconte Dupond fils et sera  enregistrée en même temps que la minute du présent  arrêt, Frear a accepté la livraison des marchandises dont  il s'agit lors de leur arrivée en gare à Paris (gare de  la Chapelle) ;   i « Qu'aux termes de la loi et d'après les règles usitées   en pareil cas, cette acceptation a eu pour effet de faire  passer les marchandises vendues aux risques de l'ache- teur ;   « Considérant que la réserve insérée par Frear dans sa  lettre du 16 mars, à savoir que les marchandises seraient  acceptées par l'inspecteur du gouvernement, ne saurait  faire obstacle à cette application des principes du droit;  que, pour se concilier justement avec l'acceptation de  livraison formant l'objet principal de ladite lettre, la ré- serve dont il s'agit doit être considérée, non comme un i  condition supérieure, mais comme une condition.résolu- toire qui laissait subsister les effets de la livraison accep- tée par Frear, jusqu'à ce qu'il fût par lui justifié du re- fus par les agents du gouvernement de recevoir les mar- chandises en question; qu'au surplus, cette condition  même impliquait de la- part de Frear l'obligation de faire  vis-à-vis du gouvernement les actes et diligences néces- saires que lui seul pouvait faire comme ayant seul traité  avec le gouvernement, et qu'il ne justifie en aucune ma- nière avoir accompli ses obligations à cet égard ;   « Considérant que Frear ne peut se prévaloir de la   disposition de l'article 1585 du Code civil, lequel statue  pour le cas de vente de marchandises vendues au poids,  au compte ou à la mesure, mais sans spécification détermi- née de la consistance matérielle des marchandises faisant  l'objet de la vente ; que, dans l'espèce, l'acceptation de  livraisons formulée dans la lettre de Frear du 16 mars 1871,  s'appliquait à un corps certain, à savoir les 500,000 kilog,  de pommes de terre lors arrivées à Paris, en gare de la  Chapelle, et que les motifs puisés dans la nature des  choses qui ne permettent pas, au cas prévu par l'article  1585, de mettre aux risques de l'acheteur les marchan- dises non encore pesées, comptées ou mesurées, sont  sans application au cas de la cause actuelle ;   « Considérant que si les récépissés de la compagnie   du chemin de fer ou lettres de voiture n'ont pas été re- mises par Leconte-Dupont fils à Frear, ces documents  sont restés en la possession de Leconte-Dupont fils, en  vertu de l'accord des parties pour l'enlèvement effectif  des marchandises à retirer de la gare du chemin de fer;  qu'en effet, il apparaît clairement des faits et des cir- constances de la cause et de fa situation respective des  parties que ce retirement devait être effectué avec le  concours : 1° des agents du gouvernement sous le cou- vert duquel les marchandises avaient voyagé ; 2° de Frear  qui, en livrant les marchandises au gouvernement, de- vait recevoir le prix dont lui-même avait besoin pour  s'acquitter envers Lecomte-Dupont fils ; 3° enfin, de Le- conte-Dupont qui avait stipulé vis-à-vis de Frear que le  prix de leur marché lui serait payé comptant contre li- vraison définitive aux agents du gouvernement ;   « Que, dans ces circonstances, la retenue aux mains   de Leconte Dupond fils des récépissés ou lettres de voi- ture n'a pu avoir pour conséquence d'infirmer ou de  suspendre l'effet de la livraison acceptée par Frear rela- tivement à la mise aux risques dudit Frear des marchan- dises dont il s'agit;   « Qu'enfin, lui-même l'a ainsi compris et entenda   lorsqu'il a déclaré accepter ladite livraison sans exiger la  remise en ses mains des documents susmentionnés ;   « Considérant que l'insurrection dite de la Commune   s'étant emparée des marchandises livrées à Frear elfes  ont péri pour le compte de ce dernier, et qu'il reste dé- biteur envers Leconte-Dupond fils du prix de son acqui- sition ;   « Considérant, enfin, que la somme de 79,822 fr. 40 c.  réclamée par l'appelant n'est l'objet d'aucune contestation'  de la part de Frear, ni sous le rapport du poids et de la  qualité des marchandises livrées, ni sous le rapport de  l'application auxdites marchandises des prix stipulés aux  conventions ;   « En ce qui touche les conclusions subsidiaires de   l'appelant :   « Considérant que_ d'après ce qui précède, ces conclu-  sions deviennent sans objet, et qu'il n'y a lieu d'v sta- tuer; '   « Par ces motifs,  w Met l'appellation et ce dont est appel à néant ;   « Emendant, décharge l'appelant des dispositions et   condamnations contre lui prononcées ;   « Et statuant par décision nouvelle,  <.< Condamne Frear à payer à Leconte-Dupond fils la   somme de 79,822 fr. 40 c. avec les intérêts à raison de  6 pour 100 à partir du jour de la demande;  « Ordonne la restitution de l'amende;   f Condamne Frear, intimé, aux dépens de i"" instant   et d'appel. »";20 décembre 1872;COUR D'APPEL DE PARIS 3° ch;http://www.enap.justice.fr/ARCHIVE/18730326.pdf;187303261
187303280;"« Le Tribunal,  a Ouï en leurs conclusions et plaidoiries, etc.;  « Attendu que la veuve Bieczinska reconnaît avoir pris   en location du sieur Garnier une maison sise à Montmo- rency, rue de Clairvaux, et ce pour trois années, à partir  du 1er avril 1869, moyennant un loyer annuel pe 1,100  francs, payable par trimestre de terme en terme, jus- qu'au 1er avril 1872 ;   « Attendu que la veuve Bieczinska a payé par avance   Présidence de M. Jardin, président.   Audience du 11 mars.   ! OCC";20 mars;COUR D'APPEL DE ROUEN 1« ch;http://www.enap.justice.fr/ARCHIVE/18730328.pdf;187303280
187303300;"« La Cour,  « Considérant que la femme Beale, héritière à réserve   de la femme Waldor, saisie par la mort de celle-ci, a un  droit supérieur à celui des exécuteurs testamentaires ;  que c'est donc à elle qu'il appartient de provoquer la   vente du mobilier ;   « Que d'ailleurs ce droit ne lui est pas enlevé par la   volonté de la testatrice, qui n'a réservé et déféré aux  soins particuliers de Balleynier-Loudun et Alphonse San-  PAR";13 mars;COUR DE CASSATION chambre des reqaêtes;http://www.enap.justice.fr/ARCHIVE/18730330.pdf;187303300
187303301;"« La Cour,  « Dit qu'il n'y a lieu de faire droit aux conclusions   principales des ""appelants ;   « Déclare que les faits offerts en preuve ne sont ni   pertinents, ni concluants, ni admissibles ;   « Rejette les conclusions subsidiaires ;  « Et confirme le jugement dont est appel. »";12 mars;COUR D'APPEL DE ROUEN ch;http://www.enap.justice.fr/ARCHIVE/18730330.pdf;187303301
187303302;"« Le Tribunal,  « Attendu que la qualité héréditaire de la femme Ca-  baret n'est pas contestée ; que l'Etat oppose seulement à  sa demande en pétition d'hérédité deux fins de non-re- voir tirées, l'une de ce qu'elle aurait assigné le préfet de  la Seine au lieu d'assigner le directeur de l'administration   des Domaines, et l'autre de ce que l'assignation au pré- fet de la Seine n'aurait pas été précédée de la remise  préalable d'un mémoire avant l'expiration du délai de la  prescription;   « Attendu, sur la première fin de non-recevoir, que si   l'administration des Domaines a seule qualité pour pour- suivre le paiement des revenus domaniaux et des droits  acquis à l'Etat, ce sont les préfets qui le représentent   dans toutes les questions de propriété, lorsqu'il y a con- testation sur le fond même du droit, et qu'il ne s'agit  pas d'un simple acte de gestion ; que l'assignation a  donc été bien donnée dans l'espèce au préfet de la   Seine ;   « Attendu, sur la deuxième fin de non-recevoir, que   le but de la remise du mémoire exigé par la loi du 5  novembre 1790 est d'éclairer l'administration sur la de- mande qui lui est adressée et de la mettre à même d'y  faire droit amiablement, si elle la reconnaissait fondée,  sans engager un procès. Que ce but est atteint par la  notification du mémoire avant toutes poursuites et dé- fenses, bien que cette formalité ne soit remplie qu'après  l'assignation, que dans ce cas celle-ci ne saurait être  entachée de nullité par la remise postérieure du mé- moire, comme cela a eu lieu dans l'espèce ;   « Attendu qu'en fait le mémoire a été remis avant   toute constitution d'avoué de la part du préfet de la  Seine et toutes défenses. Que l'assignation dès lors par- faitement valable a été donnée avant que la prescription  ait été acquise à l'Etat par l'expiration du délai de trente  ans, qu'il n'y a lieu dès lors d'avoir égard aux deux  fins de non recevoir proposées ;   « Par ces motifs,   « Sans s'arrêter aux fins de non-recevoir proposées- « Déclare Marguerite-Augustine Courbet héritière de   Jeanne-Françoise Vagneron, veuve Langlois, et dit qu'en  cette qualité elle exclue l'Etat comme habile à recueillir  sa succession ;   « Ordonne en ce sens la rectification de l'intitulé d°   l'inventaire dressé après le décès de ladite veuve Lan- glois;   « Condamne le préfet de la Seine, représentant H'Etat   • à rendre aux demandeurs les sommes et valeurs dépen   GRO";20 mars;TRIBUNAL CIVIL DE LA SEINE 1« ch;http://www.enap.justice.fr/ARCHIVE/18730330.pdf;187303302
187304030;"« Le Tribunal,  « Attendu que les brevets et certificats d'addition pris   par Carré le 4 juillet 1870 et le 23 juin 1863 ont pour  objet des sièges à ressorts en lame d'acier ;   « Attendu que Carré ne pouvait pas revendiquer et ne   revendique pas ces sortes de sièges ;   « Attendu en etfet que notamment le brevet de Vigou-  reux, en date du 6 novembre 1839, a été pris pour un  siège métallique à ressort, au moyen de bandes d'acier  disposées de manière à produire l'élasticité ;   BUR";1er mars;COUR D'APPEL DE PARIS 5« ch;http://www.enap.justice.fr/ARCHIVE/18730403.pdf;187304030
187304040;"« Le Tribunal,  « Attendu que de Pindray ne conteste pas le montant   des fournitures et qu'il résulte des documents de la cause  qu'il s'en était reconnu débiteur comme chef du corps  des éclaireurs de la Seine ;   « Par ces motifs,  « Condamne de Pindray à payer à Donny la somme   de 4,377 fr. 25 c, avec les intérêts de droit ;   « Déclare bonne et valable la saisie du 3 février der-  nier ; autorise Antoine Donny à toucher des mains du  tiers saisi le montant des causes de la saisie en principal,  intérêts et frais ;   « Et condamne de Pindray aux dépens. »";21 décembre 1872;COUR D'APPEL DE PARIS 3e ch;http://www.enap.justice.fr/ARCHIVE/18730404.pdf;187304040
187304041;"« La Cour,  « Considérant que l'intimé Donny ne justifie d'aucun   engagement pris par de Pindray, soit directement soit  comme caution, pour le paiement des fournitures dont il   s'agit;   « Que les documents produits par ledit intimé témoi-  gnent seulement de son intervention, comme chef de  corps, laquelle était nécessaire, en effet, pour autoriser  les officiers dénommés auxdits documents à se faire li- vrer, et leurs fournisseurs à leur livrer les effets d'équi-  pement dont le paiement est réclamé;   « Considérant qu'il résulte des faits étab is dans la   cause que Donny acceptait comme débiteurs directs les  officiers auxquels les fournitures étaient faites,et que,s'il  a pu compter sur la caisse du corps et sur les sommes  versées par l'Etat dans ladite caisse, rien ne l'autorise à  prétendre que de Pindray yse serait obligé personnelle-  ment envers lui;   « Par ces motifs,  « Met l'appellation et ce dont est appel à néant ;  « Emendant, décharge l'appelant des dispositions et   condamnations contre lui prononcées;   « Et statuant par décision nouvelle,  « Déclaré Donny mal fondé dans ses demandes, fins et   conclusions ;   « L'en déboute ;   « Fait main-levée des saisies-arrêts pratiquées à la re-  quête de l'intimé, tant aux mains du payeur central du  Trésor public qu'en celles de Miroy, trésorier des éclai- reurs à cheval de la Seine, en tant qu'elles portent sur  l'appelant de Pindray personnellement, leur effet main- tenu s'il y a lieu, en tant qu'elles s'appliqueraient à des  sommes affectées à la caisse dudit corps ;   « Ordonne la restitution de l'amende;  « Condamne l'intimé aux dépens de première instance   et d'appel. »";21 décembre 1872;COUR D'APPEL DE PARIS 3e ch;http://www.enap.justice.fr/ARCHIVE/18730404.pdf;187304041
