id;arrêt;date;juridiction;lien;id
187305193;"« La Cour,  « Considérant que l'obligation de payer les loyers étant   une condition essentielle et résolutoire du bail verbal à  chaque terme, il y a lieu à expulsion du locataire, faute   de paiement d'un seul ou plusieurs termes ;   « Mais que le droit rigoureux de procéder par voie   d'exécution directe n'appartient qu'au bailleur, en vertu  du contrat de location resté en souffrance par le fait du   locataire ;   « Que la convention intervenue entre les parties, com-  prenant à la fois une vente de mobilier et un acte de  sous location n'a pas le caractère déterminé d'un acte de  bail, et que le prix du mobilier et le prix de la sous-lo- cation se trouvant à la fois représentés par des billets à  échéance mensuelle, Wolff doit, à défaut de paiement  d'un seul ou de plusieurs desdits billets dont il est béné- ficiaire, agir par les voies ordinaires ;   « Considérant qu'en prononçant au profit de Wolff la   mesure d'expulsion des lieux loués, et, par voie de con- séquence, la reprise de possession du mobilier vendu, le  juge de référé a statué par interprétation de conventions   privées et excédé ses pouvoirs ;   « Considérant que c'est aux juges du principal à déci-  der s'il y a lieu de consulter un expert à l'effet d'estimer   le mobilier vendu ;   « Par ces motifs,  « Met l'appellation et l'ordonnance de cet appel au   néant ;   « Dit que le juge de référé n'était pas compétent, ren-  voie les parties au principal ;   « Dit que la veuve Lévy sera remise en possession du   mobilier, l'autorise à rentrer dans les lieux dont elle a   été expulsée ;   « Dit qu'il n'y a lieu par la Cour à nomination d'expert;  « Ordonne la restitution de l'amende, condamne ""Wolff   en tous les dépens d'appel et de référé ;   « Ordonne l'exécution provisoire du présent arrêt,   avant l'enregistrement, vu l'urgence. »";4 février;COUR D'APPEL DE PARIS ch;http://www.enap.justice.fr/ARCHIVE/18730519.pdf;187305193
187305220;"« Le Tribunal,  « Vu les articles 59, 60, 62 et 405 du Code pénal, en-  semble les articles 114 et 123 du Code d'instruction cri-  « Condamne le général Frémont, Auffermann et Probst   chacun à cinq ans de prison et 3,000 francs d'amende ;   « Crampon à quatre ans de prison et 3,000 francs d'a-  « Gauldrée-Boileau à trois ans d'emprisonnement;  « Lissignol à deux ans de prison et 3,000 francs d'a-  minelle ;   mende ;   mende ; .   mende ;   « Ordonne la confiscation des ô'O.OOO francs formant le   cautionnement de Probst et celle des cautionnements  fournis par les présents dans les limites de l'article 123   du Code d'instruction criminelle :   « Condamne solidairement tous les prévenus à donner   des dommages-intérêts par état aux parties civiles ;   « Condamne les prévenus et les parties civiles aux   dépens, sauf le recours de ces dernières contre qui de   Voici le texte de l'arrêt rendu sur l'appel :   « La Cour, .   « Après en avoir délibéré conformément à la loi,   « Joint les causes,  a Et statuant,  « Sur l'appel interjeté par Crampon d'un jugement du   19 mars 1873 ; - ™ -, i   « Considérant que la demande soumise au Tribunal   n'était point une demande de mise en liberté provisoire,  mais tendait à ce qu'il plût au Tribunal décider que le  mandat d'arrêt décerné contre Crampon et mis à exécu- tion avait été décerné en violation des articles 115 et 12o   du Code d'instruction criminelle.   « Considérant que c'est à bon droit que le Tribunal a   décliné sa compétence pour confirmer ou annuler un  mandat d'arrêt décerné par le juge d'instruction, avant  son dessaisissement, sur les réquisitions du ministère   public ;   « Adoptant au surplus les motifs des premiers juges ;  « Confirme ;  « Sur les couclusions de Crampon, tendantes à la nul- lité de la citation qui lui a été notifiée le 15 janvierl873  pour comparaître à l'audience du 26 février suivant,  comme prévenu : 1° d'avoir, à Paris, en 1869 et 1870,  conjointement avec ses co-prévenus, à l'aide de ma- nœuvres frauduleuses pour persuader l'existence d'une  fausse entreprise, faire naître l'espérance d'un succès  chimérique, obtenu la remise d'une somme d'au moins  vingt millions de la part des souscripteurs du Transcon- tinental Memphis Pacific, et d'avoir, par ce moyen, es- croqué partie de la fortune d'autrui ; 2° d'avoir, au mê- me lieu et à la même époque, par publication faite de  mauvaise foi de faits faux, obtenu et tenté d'obtenir des  souscriptions et des versements, délits prévus par l'arti- cle 405 de Code pénal et par les articles lo et 45 de la   loi du 24 juillet 1867 ;   « Considérant que cette citation a été libellée confor-  mément à l'ordonnance de renvoi, ordonnance rendue à  la suite de nombreux actes d'instruction et d'interroga- toires détaillés subis par le prévenu;   « Que le prévenu a donc bien connu l'incrimination   sur laquelle il était appelé à se défendre, et que la cita- tion a pleinement satisfait aux prescriptions de l'article  18M du Code d'instruction criminelle;   « Dit qu'il n'y a lieu d'annuler la citation délivrée à   Crampon, non plus que la procédure ultérieure et le ju-  gement de condamnation ;  §4 « Sur. les conclusions de Crampon tendantes à faire  déclarer non recevable l'action des parties civiles autres  que Gray;   « Considérant que tous les porteurs de bonds ont in- contestablement le droit, comme lésés par le délit qui  fait l'objet de la prévention, d'intervenir individuellement  ou collectivement dans la poursuite pour demander la  réparation civile du préjudice ;   « Rejette lesdites conclusions et maintient toutes les   parties civiles dans l'instance ;   « Sur les conclusions de Gauldrée-Boileau tendant à  ce que l'affaire soit remise pour qu'il puisse faire venir   d'Amérique une expédition de l'arrêt de la Cour suprême  des Etats-Unis :   « Considérant que la production d'une expédition au-  thentique de cet arrêt est sans utilité dans la cause par  les motifs qui seront déduits en statuant sur le fond ;   « Dit qu'il n'y a lieu d'ajourner le jugement ;  « Statuant au fond, tant sur l'appel des prévenus et les   conclusions par eux prises, que sur l'appel interjeté à  minimâ par le ministère public au cours de l'audience  du 17 mai, et sur les conclusions des parties civiles ;   te Considérant que lss porteurs de bonds, en versant   leur argent, ont été exclusivement déterminés par les  garanties qui leur ont été promises ; qu'on leur a offert  et promis et qu'ils ont eu en vue non-seulement la ga- rantie spéciale d'une hypothèque sur des terrains déter- minés, d'une valeur annoncée comme dépassant plusieurs  fois, dès à présent, les sommes demandées, hypothèque  irrévocable, quels que fussent les événements, mais en- core et surtout la garantie qu'offraient, soit pour le paie- ment régulier des coupons, soit pour la négociation des  titres, soit pour l'exactitude du remboursement à venir,  le crédit et tout l'actif d'une compagnie puissante, repré- sentée notamment : comme reliant par l'ensemble de ses  lignes l'océan Atlantique à l'océan Pacifique ; comme  exploitant déjà avec de gros bénéfices 600 lieues de voies  ferlées à travers les contrées les plus riches ; comme  propriétaire de terrains d'une immense valeur à Norfolk  et à San-Diégo ; comme ayant été l'objet de la part du  gouvernement des Etats-Unis de faveurs toutes particu- lières et spécialement de garanties d'intérêts ; comme  ayant tous ses bonds négociés à la Bourse de New-York  aussi bien qu'à la Bourse de Paris ; comme étant patron- née par la haute industrie métallurgique française à la- quelle devait être intégralement versé le montant de l'em- prunt, en paiement d'une commande de matériel pour  essai, d'une trentaine de millions ;   « Considérant qu'il est aujourd'hui judiciairement  prouvé que l'hypothèque repose sur des terrains dont la  valeur ne peut être réalisée actuellement;   « Que cette hypothèque n'est pas irrévocable ; qu'elle   est, au contraire, subordonnée à l'achèvement des tra- vaux avant 1876, et qu'il n'est pas contesté que la com- pagnie, déclarée en faillite, est hors d'état d'échapper à  cette déchéance; _   « Que l'arrêt de la Cour suprême des Etats-Unis qui   aurait été rendu depuis le jugement et annulant la con- fiscation prononcée en 1869, n'a point relevé la compa- gnie de cette déchéance à venir, et qu'il a seulement  pour résultat, comme il a été dit au nom des prévenus,  en sauvant les porteurs de bonds d'une ruine absolue  immédiate, de leur ménager la facilité d'une transaction  plus ou moins réparatrice avec la compagnie qui sera  substituée à la compagnie du Memphis el Paso pour la  construction de la ligne concédée dans l'état du Texas;   « Considérant que toutes les autres garanties annoncées   et promises-étaient illusoires et chimériques; que la com- pagnie de Memphis el Paso ne possédait de concession  que dans l'Etat du Texas ; qu'elle n'avait fait encore que  quelques terrassements et n'exploitait aucune partie de sa  ligne; qu'elle était absolument dénuée de ressources et   « Considérant qu'en faisant croire que cette compagnie,   faussement dénommée le Transcontinental, était en pos- session de vastes entreprises d'un océan à l'autre et jouis- sait des plus solides et des plus nombreuses garanties,  l'on a persuadé l'existence de fausses entreprises et d'un  crédit imaginaire pour faire naître l'espérance d'un succès  chimérique ;   « Considérant que les souscripteurs de bonds n'ont été   ainsi trompés et n'ont été conduits à remettre des fonds  que par une série et un concours de machinations frau- duleuses consistant notamment dans l'usage imposteur  qui a été fait de marchés passés pour le matériel avec  des constructeurs français ; dans la nature et la combi- naison des autres moyens employés pour déjouer la pru- dence de la chambre syndicale et pour faire admettre les  bonds à la cote française ; dans des publications menson- gères organisées avec une grande puissance, ourdies avec  une rare habileté, et appuyées artificieusement par des  actes extérieurs et des circonstances propres à leur don-  « Considérant que Gauldrée-Boileau a activement et   sciemment concouru aux manœuvres frauduleuses ci-des-  ner créance ;   sus spécifiées;   « Qu'il résulte des documents de l'instruction et spé-  cialement de sa propre correspondance que, personnifiant  en quelque sorte l'agence de New-York, il a suivi toutes  les phases de l'affaire, donnant directement des instruc- tions à Probst et à Lissignol ;   « Que sachant les moyens employés pour surprendre la   « Poupinel à un an de prison et 3,000 francs d a-  dépourvue de crédit;   2, RCE";21 mai;COUR D'APPEL DE PARTS ch;http://www.enap.justice.fr/ARCHIVE/18730522.pdf;187305220
187305290;"« Le Tribunal,  « Attendu que, suivant acte passé devant M8 Petit,  notaire à Prunay-le-Gillon, le 18 avril 1866, enregistré  et transcrit au bureau des hypothèques de Chartres, le 2  juin 1866, le sieur Amédée-Clovis Gallopin a fait dona- tion pure et simple au profit du mineur Georges-Eloi  Gallopin, son fils, né de son mariage avec Palmyre-José- phine Chapiseau, décédée, des biens immeubles ci-après,   savoir :   « Sous la réserve par le donateur, à son profit et pen-  dant sa vie, de l'usufruit et jouissance des biens donnés;   « Et sous la condition imposée au donataire de ne  pouvoir demander aucun compte des biens et valeurs,  soit de la communauté des biens qui a existé entre les  époux Gallopin-Chapiseau, ses père et mère, soit de la  succession particulière de la dame Gallopin, sa mère,  desquels biens et valeurs le sieur Gallopin, donateur,  acquérait ainsi la pleine et libre propriété ;   « Attendu que cette donation a été acceptée dans l'acte   même de donation pour le mineur Gallopin, par Mlle  Aglaé-Augustine Chapiseau, sans profession, demeurant  en la commune de Prunay-le-Gillon, son aïeule mater- nelle ;   « Attendu qu'il n'existait légalement aucun lien de   parenté entre la mère du mineur Gallopin et la demoi- selle Aglaé-Augustine Chapiseau, et que, dans ces cir- constances, celle-ci ne pouvait accepter pour le mineur  Gallopin la donation dont s'agit ;   « Attendu qu'il suit de là que cette donation est nulle,   et que cette nullité est d'ordre public;   « Par ces motifs,   i Déclare nulle et de nul effet, par défaut d'accepta-  tion régulière, la donation entre vifs susénoncée ;   « Dit, en conséquence, que les biens faisant l'objet de  cette donation sont libres de toutes dettes et charges du  chef du mineur Gallopin, et que Gallopin et son fils  seront, vis-à-vis l'un de l'autre, au même et semblable  état qu'avant ladite donation;   « Condamne les défendeurs aux dépens. »";5 avril;COUR D'APPEL DE NANCY l™'ch;http://www.enap.justice.fr/ARCHIVE/18730529.pdf;187305290
187305291;"« La Cour,   « Donne défaut contre l'intimé, et pour le profit :  « Considérant que la donation consentie par Amédée-  Clovis Gallopin au profit de son fils mineur, suivant  acte reçu le 18 avril 1866 par Petit, notaire à Prunay- le-Gillon, a été acceptée pour ledit mineur par Aglaé- Augustine Chapiseau, son aïeule maternelle, conformé-  ment, est-il dit dans l'acte, à l'article 935 du Code ci-  vil ;   « Considérant que cette acceptation est régulière et   légale; qu'en effet, il résulte des actes produits que José- phine-Palmyre Chapiseau, décédée, femme de Amédée- Clovis Gallopin, et mère du mineur Gallopin, était la  fille naturelle reconnue de ladite Aglaé-Augustine Chapi- seau ; que, si la reconnaissance ne se rencontre pas dans  l'acte de naissance de Joséphine-Palmyre, elle a été faite  d'une manière expresse dans l'acte de mariage de celle- ci avec Amédée-Clovis Gallopin ; que, dans ce dernier  acte, reçu le 9 décembre 1859 par l'officier de l'état civil  de la commune de Prunay-le-Gillon, Aglaé-Augustine  Chapiseau est intervenue comme mère de la future  épouse, et a déclaré, en cette qualité, consentir à son  mariage; que cette déclaration, faite dans un acte au- thentique, satisfait pleinement au vœu de la loi, et cons- titue une reconnaissance régulière de la maternité; que  des dispositions des articles 759 et 760 du Code civil, il  ressort que la loi reconnaît l'existence d'un lien de pa-  j rentô entre le père ou la mère de l'enfant naturel pré-  Le maître, alors surtout que son domestique est un mi-  neur, peut être déclaré civilement responsable des bles- sures que celui-ci a occasionnées par son imprudence,  bien que le fait dommageable n'ait pas été un acte de  la fonction du domestique, mais lorsqu'il s'y rattache  par des circonstances de temps, de lieu et de service, et  que le maître a lui-même à s'imputer une imprudence  personnelle en n'empêchant pas l'acte de son domes- tique, dont il était en son pouvoir de prévenir la per- pétration.   Le 12 décembre 1871, Onésime Husson, garçon   de ferme du sieur Foliot, après s'être procuré un  fusil chez un voisin, avait balayé la neige dans la  rue du village de Delouze, au devant de la grange  de son maître, et avait répandu du grain sur l'espace  balayé ; puis, voulant faire feu sur les oiseaux qu'il  avait ainsi attirés, il atteignit la jeune Augustine  Rivière qui passait dans la rue. La charge porta dans  les yeux, et l'infortunée Augustine, après de longues  souffrances, devint aveugle.   Pour tirer ce coup de fusil si imprudent et si   malheureux, Onésime Husson avait interrompu le  travail auquel il se livrait dans la grange avec son  maître qu'il aidait à faire fonctionner une machine  à battre, sans que le maître, auquel les apprêts dont  on vient de parler n'avaient pu échapper, se fût op- posé à l'espèce de chasse à laquelle ils étaient des- tinés.   Ce maître, le sieur Foliot, actionné comme civi-  lement responsable avait été renvoyé de la de- mande par le motif que le dommage causé par  Onésime Husson ne l'avait pas été, suivant le texte  de l'article 1384 du Code civil, dans la fonction à  laquelle il était employé comme domestique par  Foliot.   Cette décision a été infirmée par l'arrêt suivant :   « En ce qui touche Onésime Husson ;   « Attendu qu'il résulte d'un jugement du Tribunal   correctionnel de Saint-Mihiel, en date du 19 janvier 1872  que le 12 décembre 1871, à Delouze, Onésime Husson,  alors serviteur à gages de Nicolas Foliot, maire de la  commune susdite, a causé à Augustine Rivière, involon - tairement, par maladresse et imprudence, des blessures  qui ont eu pour dernier résultat, après des douleurs pro- longées et très vives, la complète cécité de la victime ;   « Que dans l'appréciation de ce fait, les premiers juges   ne paraissent point avoir tenu un compte suffisant de  son extrême gravité, et que sur ce point déjà il convient  de réformer leur sentence, tout en continuant à prendre  en sérieuse considération l'exiguité des ressources dont le  défendeur au procès dispose aujourd'hui et disposera  plus tard;   « En ce qui touche Nicolas Foliot :   « Attendu qu'au moment où Augustine Rivière vint à   passer devant la grange de Nicolas Foliot et y aperçut  Onésime Husson, celui-ci bottelait la paille tombant d'une  machine à battre que son maître lui-même faisait fonc- tionner ;   « Que de ce travail en commun du maître et du servi-  teur, découle l'application nécessaire et d'autant plus   étroite du 3e § de l'article 1384 du Code ciyil que Oné-  sime Husson est mineur ;   « Que, sans doute, ce jeune homme, en blessant Au-  gustine Rivière, ne faisait pas un acte de ses fonctions   domestiques, mais qu'il importe peu, au point de vue de  la responsabilité du maître, que le fait dommageable n'ait  eu ni pour objet ni pour but les fonctions du serviteur ;  qu'il suffit qu'il s'y rattache d'une manière quelconque  par circonstances de temps, de lieu et de service ;   « Que, pour les renJre plus soigneux dans leurs choix   et plus attentifs dans leur surveillance, le législateur a   entendu se montrer si sévère à l'égard des maîtres, que  le fait, cause du dommage, une fois constitué, il ne leur   permet pas d'utilement établir qu'ils n'ont pu l'empê-  cher ;   c< Attendu, d'ailleurs, qu'ici, à la responsabilité du   niaître vient se joindre, de la part de Nicolas Foliot, la   responsabilité née d'une imprudence personnelle;   « Qu'il résulte, en effet, de la procédure correctionnelle   qu'Onésime Husson est un instant sorti de la grange où  il travaillait pour aller prendre chez un voisin le fusil   destiné, dans sa pensée, à tirer sur des moineaux et qui  devait, un peu plus tard, sans qu'il le voulût et sans qu'il   le sût, aveugler Augustine Rivière ;   « Que ce fusil, rapporté dans la grange et vraisembla-  blement place a portée de la main de celui qui prémé-  ditait de s'en servir, n'a pas du échapper aux regards de   Fohot, et que celui-ci l'ayant vu, a eu tort de le laisser  aux mains de son serviteur inexpérimenté ;   « Qu'à supposer au contraire, que Foliot ignorât la   présence dans sa grange de l'arme dont s'agit, cette igno- rance révélerait de sa part une incurie et un défaut d<>  prévoyance inexplicables et inexcusables, si on prend   BAI";5 avril;COUR D'APPEL DE NANCY l™'ch;http://www.enap.justice.fr/ARCHIVE/18730529.pdf;187305291
187305300;"« Le Tribunal,  « Ayant tel égard que de raison aux fins et conclu-  sions de Jullien, condamne Séraphin Collomp en paie- ment en sa faveur de la somme de 2,419 fr. 30 c. pour  solde de compte; déboute Jullien du surplus de sa de-  mande ; condamne Collomp aux dépens. »";4 avril;TRIBUNAL CIVIL DE MARSEILLE 2« ch,;http://www.enap.justice.fr/ARCHIVE/18730530.pdf;187305300
187306010;"« Le Tribunal,  « Reçoit en la forme Lebeau et Ce et la compagnie du   Chemin de fer du Nord, respectivement opposants aux   jugements par défaut contre eux rendus les 9 mars 1872   et 13 avril 1872 ;   « Vu la connexité, joint les causes, et statuant sur le   tout par un seul et même jugement ;   « Sur la demande principale de Moret et Payen contre   Lebeau et Cc :   « Attendu que Moret et Payen réclament à Lebeau et  C° 8,683 fr. 48 c,, représentant la dépréciation produite  par la mouille de trois caisses de velours que Lebeau et  Ce se sont chargés de transporter de Londres à Paris ;   « Que, pour se refuser au paiement de cette somme,   Lebeau et C"" excipent de ce qu'ils auraient décliné toute  responsabilité pour les délais de livraison, soutenant qu'à  l'époque où cette expédition a été faite, les quais de  Boulogne étaient, à la connaissance du commerce, encom- brés de marchandises; que le chemin de fer du Nord ne  fonctionnait pas ; qu'ils oht pris toutes les précautions  possibles pour garantir les marchandises déposées sur ces  quais ;   « Que Lebeau et Ce prétendent que tous ces faits au-  raient constitué un cas de force majeure qui devrait les  exonérer de toute responsabilité ;   « Mais, attendu qu'il ressort des pièces produites que   les marchandises dont s'agit ont été remises à Londres à  Lebeau et C°, le 28 juin 1871 ;   « Que, s'il n'est pas justifié d'une mention spéciale de   grande vitesse sur la pièce que Lebeau et Ce présentent  comme feuille d'expédition, une expédition faite l'avant  veille par Moret et Payen, avait été demandée par la  grande vitesse, moyen que les demandeurs emploient  d'ordinaire ;   « Attendu qu'il ressort de la correspondance que, le   14 juillet, Morèt et Payen ont réclamé leur marchandise  disant qu'elle aurait dû leur être expédiée en grande  vitesse ;   « Attendu que Lebeau et Ce l'ont remise le 17 au che-  min de fer du Nord, qui l'a rendue à Paris le 18 ; qu'ex- pédiée en douane, c'est encore par les voies de Lebeau  et C"" qu'elle devait être livrée à Moret et Payen, et que  ce n'est pas le 2 août qu'elle a été mise à leur dispo- sition ;   « Que, dans ces conditions, Lebeau et Ce ont à se re-  procher une faute des conséquences de laquelle ils doivent  être déclarés responsables ;   « Attendu qu'il ressort des documents soumis au Tri-  bunal que la dépréciation de la marchandise représente  8,683 fr. 48 c. ;   « Qu'il y a donc lieu d'obliger Lebeau et C9, au paie-  ment de ladite somme ;   « Sur la demande en garantie de Lebeau et Ce, contre   la compagnie du chemin de fer du Nord ;   « Attendu qu'il suit de ce qui précède qu'aucun retard   n'est imputable à la compagnie du Chemin de fer du  Nord, qui a transporté rapidement les colis dès qu'ils lui  ont été remis ;   « Par ces motifs,  « Jugeant en premier ressort ;  « Déboute Lebeau et Ce de leur opposition au jugement   dudit jour 9 mars 1872 ;   « Ordonne, en conséquence, que ce jugement sera exé-  cuté selon sa forme et teneur, nonobstant ladite opposi- tion ;   « Annule le jugement du 13 avril dernier ; fait défense   à Lebeau et Ce de l'exécuter, et statuant à nouveau ;   « Déclare Lebeau et Ce mal fondés en leur demande  en garantie contre la compagnie du Chemin de fer du  Nord ;   « Les en déboute,  « Et les condamne par les voies de droit en tous les   dépens ;   « Ordonne que le présent jugement sera exécuté selon   sa forme et teneur, et en cas d'appel par provision. »";24 avril;COUR D'APPEL DE PARIS 3e ch;http://www.enap.justice.fr/ARCHIVE/18730601.pdf;187306010
187306011;"« La Cour,  « Statuant sur les appels inttrjetés par Lebeau et C8  des jugements du Tribunal de commerce de la Seine des  9 mars et 17 juillet 1872 ;   « En ce qui touche l'appel de Lebeau et C8 contre Mo-  ret et Payen :   « Considérant qu'à la date des 27 et 28 juin 1871, les   intimés Moret et Payen ont remis à Lebeau et Ce trois  caisses contenant des soieries et velours de soie pour être  transportées de Londres à Paris i   « Que Lebeau et Ce, qui ont maison à Londres, à Bou- logne et à Paris, prenaient les marchandises à Londres  et contractaient l'obligation d'en soigner l'expédition en  les recevant au débarquement à Boulogne, et en les fai- sant transporter à Paris où elles étaient adressées à leur  maison rue du Faubourg-Saint-Denis, 108 ;   « Considérant que les trois caisses dont s'agit, débar- quées à Boulogne le 1er juillet 1871, sont restées sur les  quais jusqu'au 15 ou au 17 juillet; que c'est ce dernier  jour seulement que Lebeau et C8 les ont expédiées par  le chemin de fer du Nord sur lequel elles ont voyagé par  train direct dans un wagon couvert et sous le plomb de  la douane; qu'enfin arrivées à Paris le 18 juillet, elles  ont été immédiatement mises à la disposition de Lebeau  et Ce, ainsi qu'il résulte de l'émargement par ces der- niers du livre de factage, à la date dudit jour 18 juillet   1871, puis déposées en douane dans le magasin de la   compagnie affecté à ce service, d'où elles n'ont été reti- rées par les appelants que le 1er août;   « Considérant que les marchandises présentées le 2 août   par Lebeau et Ce au domicile de Moret et Payen et re- çues par ces derniers, mais seulement sous réserves d'a- varies, ont été l'objet de vérifications et constatations   opérées le 3 août par expert nommé par ordonnance de   n vit JE A ux   2, RUE";24 avril;COUR D'APPEL DE PARIS 3e ch;http://www.enap.justice.fr/ARCHIVE/18730601.pdf;187306011
