id;arrêt;date;juridiction;lien;id
187308232;« La Cour,   Ainsi décidé par l'arrêt suivant :   3 « Attendu que WiM«umii avant inlerjeté appel du  f jugement rendu le 21 août 4872 par le îrluunai uu CTC;26 juin;COUR D'APPEL DE LYON 2e ch;http://www.enap.justice.fr/ARCHIVE/18730823.pdf;187308232
187308240;"« La Cour,   « considérant que depuis le jugement et à une époque   contemporaine mais antérieure, des faits se sont produits   de la part de P..., qui sont présentés par sa femme comme   devant entraîner la séparation de corps par elle deman-  dée ; ■   « Qu'en effet P... a déposé à la date du 8 novembre   1871 une plainte en escroquerie contre sa femme ; qu'a-  près instruction faite au parquet de M. le procureur de   la République, elle a été reconnue sans fondement ;   « Qu'à la date du 27 octobre 1872 il a écrit une lettre   diffamatoire contre ""elle au propriétaire du magasin de... ;   qu'il lui a fait perdre la place qu'elle occupait dans cet   établissement et qu'il l'a ainsi privée du moyen de gagner   honorablement sa vie ;   « Considérant que ces faits sont prouvés ; qu'ils cons-  tituent l'un et l'autre une injure suffisamment grave pour   faire accueillir la demande de l'appelante ;   « Infirme :   « Déclare la femme P... séparée de corps de son mari ;   T L'autorise à conserver la garde de son enfant ;   « Condamne P... à payer à sa femme 30 francs par   mois pour les besoins de cet enfant, et le condamne aux   dépens de première instance et d'appel. »";10 juillet;COUR D'APPEL DE PARIS *j ch;http://www.enap.justice.fr/ARCHIVE/18730824.pdf;187308240
187308270;"« Le Tribunal,   « Reçoit Servajon opposant en la forme, au jugement   par défaut rendu contre lui en ce Tribunal, lè 27 mars  dernier, et statuant au fond sur le mérite de son opposi-  tion ; .   « Attendu que Vasseur, boulanger, rue Taitbout, n° 44,  prétend que Servajon, également boulanger, rue Pigalle,  58, aurait engagé la dame Caze, employée chez le de- mandeur depuis longtemps comme porteuse de pains, a  quitté sa maison pour entrer dans la sienne, dans le but  exclusif de lui indiquer ou de lui faire avoir la clientèle  de Vasseur ; que ce fait dépasse les bornes d'une con- currence permise et qu'il demande que Servajon soit tenu  de congédier la dame Cize et de cesser de servir, par  son entremise, ses propres clients, sous une contrainte de   100 francs par jour de retard, et, en outre, de lui payer   5,000 francs â titre de dommages-intérêts pour préjudice   éprouvé ;   « Attendu que la dame Caze est sortie volontairement   de la maison de Vasseur ; qu'aucun traité ne lui inter- disait de quitter son emploi chez le demandeur pour  prendre une place plus avantageuse dans une maison  exerçant la même industrie ; qu'en cherchant à amener  dans la nouvelle maison qui l'emploie une partie de la  clientèle qu'elle avait connue lorsqu'elle était au service  de Vasseur, elle n'a rien fait qui puisse donner ouverture  à une action contre le défendeur, du moment qu'il n'est  pas établi qu'elle s'est servi de moyens blâmables ; qu'en  cet état, il y a lieu de déclarer Vasseur mal fondé en   « Par ces motifs,  « Annule le jugement dulit jour, 27 mars dernier ;   fait défense à Vasseur de l'exécuter, et statuant à nou- veau déclare Vasseur mal fondé en toutes ses demandes,  fins et conclusions, l'en déboute, et condamne Vasseur   aux dépens. »";1er août;TRIBUNAL DE COMMERCE DE LÀ SEINE;http://www.enap.justice.fr/ARCHIVE/18730827.pdf;187308270
187308290;"« Le Tribunal,  « Donne défaut contre Depagniat, non comparant, ni   personne pour lui, et pour le profit;   « Attendu qu'il résulte des explications et des docu-  ments fournis au Tribunal que Depagniat est construc- teur de bâtiments et entrepreneur de travaux, créant   pour leur paiement des valeurs à échéances commer- ciales; qu'à tous ces titres, il est commerçant; qu'il est  en état de cessation de paiements ; qu'il y a lieu dès lors  de le déclarer en état de faillite ouverte ;   « Par ces motifs,   « Déclare d'office Depagniat, entrepreneur de bâti-  ments, demeurant à Paris, rue Condorcet, 28, en état de  faillite ouverte, etc. »";10 juillet;COUR D'APPEL DE PARIS 2e ch;http://www.enap.justice.fr/ARCHIVE/18730829.pdf;187308290
187308291;"« Le Tribunal,  t Attendu que, pour justifier son opposition, Depa-  gniat soutient qu'il ne serait; pas commerçant; que les  opérations qui consistent à acheter des terrains et à y  construire des maisons ne constituent pas des actes de  commerce, ne lui donnent pas la qualité de commerçant,  mais sont au contraire des opérations essentiellement ci- viles, et que c'est conséquement à tort qu'il aurait été  qualifié de commerçant et déclaré en faillite par le juge- ment auquel il fait opposition ;   « Mais attendu qu'il résulte des explications fournies   au Tribunal que, tout en achetant des terrains en son  nom propre pour y élever des maisons, Depagniat était,  quant opérations subséquentes, un véritable entrepreneur  de travaux ;   « Qu'en effet, les chantiers qu'il ouvrait pour l'édifica-  tion de ses travaux portaient l'indication de son nom,  comme le font les entrepreneurs ; que, comme ceux-ci,  il avait des bureaux et des commis, payait lui-même ses  ouvriers, achetait directement aux fournisseurs les pier- res, chaux, briques et autres matériaux nécessaires à ses  travaux, souscrivait pour leur paiement des effets de  commerce dont plusieurs ont été protestés et ont motivé  contre lui des condamnations prononcées par divers Tri- bunaux de commerce ;   « Qu'il est d'ailleurs constant que ces opérations ainsi   faites par Depagniat n'avaient été consommées qu'en vue  d'une réalisation immédiate, et non pas comme un pla- cement de capitaux ;   « Qu'elles avaient donc tous les caractères d'une en-  treprise commerciale ;   <x D'où il suit que c'est à bon droit que Depagniat a   élé qualifié commerçant et déclaré en itat de fail-  lite ;   « Par ces motifs,  « Déboute Depagniat de son opposition, etc. »";10 juillet;COUR D'APPEL DE PARIS 2e ch;http://www.enap.justice.fr/ARCHIVE/18730829.pdf;187308291
187308292;"« La Cour,  « Considérant que s'il est vrai que les opérations qui  consistent à acheter, construire et revendre pour son pro- pre compte des immeubles n'ont pas un caractère com-  mercial, il n'en est pas de même de la série des actes   auxquels s'est livré l'appelant en dehors des actes dont la  nature vient d'être relevée ;   « Que Depagniat s'est fait son propre entrepreneur gé-  néral ; qu'il avait son chantier sur ies murs duquel on  lisait : Depagniat, 28, rue Condorcet : qu'il avait un bu- reau et des commis ; qu'il employait des tacherons pour  l'exécution des travaux ; qu'il achetait personnellement  sa pierre, son plâtre et sa brique ; qu'il soldait ses dé- penses en effets de commerce lesquels, restés impayés,  ont donné lieu à des poursuites et à des condamnations  devant les Tribunaux de commerce ; que ces actes cons- tituent des actes de commerce soumettant Depagniat aux   dispositions de la législation commerciale ;   « Adoptant au surplus les motifs des premiers juges,   confirmé avec amende et dépens. »";10 juillet;COUR D'APPEL DE PARIS 2e ch;http://www.enap.justice.fr/ARCHIVE/18730829.pdf;187308292
187308293;"« La Cour,  « Dit qu'il a été bien appelé, mal jugé par le juge- ment du Tribunal de commerce de Lyon, du 14 juillet  1873, qui a déclaré valable le désistement de Briday et  consorts ;   « Infirmant, dit que Decour et Vincent sont fondés   à ne pas accepter ce désistement ; l'annule, en consé- quence ;   « Dit que l'instance à laquelle il se rapporte, subsiste   dans l'état où l'a mise l'arrêt de la Cour du 23 janvier  1873 ;   « Condamne Briday et consorts en tous les dépens de   première instance et d'appel ;   Ordonne la restitution de l'amende.   Même audience.   LIT";7 août;COUR D'APPEL DE LYON 2e ch;http://www.enap.justice.fr/ARCHIVE/18730829.pdf;187308293
187308294;"« La Cour,  « Attendu que par exploits des 9 et 17 septembre   1872, Decour, Vincent et Ce, gérants de la société du  Comptoir commercial dont le siège est à Lyon, ont assi- gné devant le Tribunal de commerce de Lyon, Briday,  Astier, Arnaud et Depay, Bamet en paiement du solde  des actions par eux souscrites à ladite société;   « Attendu que ceux-ci, tout eu concluant à leur ren-  voi dé cette demande ont, par acte signifié le 13 février  dernier, demandé rejonvenlionnellement lanullitéde ladite  société, et des actes par lesquels-elle à été constituée, mais  que par conclusions signifiées le 21 dudit mois de février   et reproduites au jugement Deccfur et- Ca, Ont repoussé   cette.demande recohYénUônnelle en faisant valoir que la   Ml 1/ItJEA ux   2, RUE";7 août;COUR D'APPEL DE LYON 2e ch;http://www.enap.justice.fr/ARCHIVE/18730829.pdf;187308294
187308295;"« La Cour dit que Curnier et Vibert sont rayés des   qualités de la présente instance et n'y doivent plus  ester ;   « Et, statuant à l'égard des autres parties, dit qu'if a   été mal jugé, bien appelé, confirme le jugement du Tri- bunal de commerce de Lyon, du 6 mars 1873, en ce  qu'il a retenu les demandes principales et reconvention- nelles formées devant lui, soit par Decour et Vincent  soit par Briday et consorts, aux dates ci-dessus rappe- lées, et en ce qu'il a ordonné une expertise sur ces de- mandes ;   « Emendant et évoquant en tant que de besoin, dit  que le Tribunal de commerce de Lyon, à raison de la  hstipendance et de la connexité, est dessaisi de ces de- mandes;   « Dit que les parties sont renvoyées devant le même   Tribunal, pour suivre lesdités actions, conjointement avec  celles sur lesquelles elles étaient précédemment en ins- tance, et sur lesquelles a statué l'arrêt de la Cour du  23 janvier dernier;   « Dit que les dépens de la présente instance faits de- vant le Tribunal et en appel, compris le coût du présent,  seront supportés demi par les appelants, demi par les  intimés ;   « Ordonne la restitution de l'amende. »";7 août;COUR D'APPEL DE LYON 2e ch;http://www.enap.justice.fr/ARCHIVE/18730829.pdf;187308295
187308300;"« Le Tribunal, \  '( Attendu que Frappart intervient dans 1 instance et |  déclare que les blés en evés par Drujon s ait la propriété f de Têtard, son gen Ire, qui est actuellement fermier de la  terre de Goussainville à son lieu et place; qu'en effet,   la feuille des impositions et les polices d'assurances pour    en   que  ceite terme sont au-nom de Têtard ;   « A tendu que cette intervention est régulière; que la   propriété des blés ne peut plus être sérieusement con-  testée ■   « Attendu que pendant le siège de Paris ces b'és ont   disparu; que Drujon reconuaît en avoir pris afin de sub- venir aux besoins d. s habitants de Goussainvibe ;   « At.endu que les explications de Drujon ne sont pas   admissibles; qu'il n'appartient à qui que ce soit de s em- patvr de la cliosj d'autrui pour en t ure des largesses;   que la Qualité de maire, in«oquée par Drujon, et qui fui  e\t contestée, ne saurait le couvrir; que les mesuras  qu'il a mises n'étaient pas commandées par une nécessité  urgente et impérieuse, ni pour éviter à la commune un  d ■sVtre- que tes habitants de Goussainville ne se sont  pis trouvés dans une situation plus critique que ceux des   c immunes cire 5 également euvahies |   >i.-pnovni.Miies également euvahies par I eu-  ac e ni légal ni nécessaire ; q   ni nécessaire ; qu'il a eu feu dans un inté-  Xfi particulier au profit de quelques habitant,, que Dtu-  J .a ne s'est pas trouvé sous Je coup  rn-jenre^qud doit indemniser Têtard des b.és qui! lui   le COU";7 août;"COUR D'APPEL DE PARIS 4"" ch";http://www.enap.justice.fr/ARCHIVE/18730830.pdf;187308300
187308301;« Le Tribunal,   a Attendu qu ■»;7 août;"COUR D'APPEL DE PARIS 4"" ch";http://www.enap.justice.fr/ARCHIVE/18730830.pdf;187308301
187308302;"« La Cour,  « Considérant que des saisies-arrêts ont été formées sur   Drujon entre les mains de divers p T Têtard, les 30 et 31  juillet 1872, en vertu d'un jugement contradictoire du  Tribunal civil de Pontoise du 18 juillet précédent ; qu'elles  lui ont été dénoncées le 7 août suivant avec assignation  en Vhlidi;é ;   « Considérant que le jugement contradictoire ci-dessus   visé n'a été signifia à avoué que le Ier octobre 1872, et à   domicile que le 4 octobre môme mois ; que la deman le    mainlevée des s;iisies-arrèts n'a été formée par Drujon    le 13 février 1873;   « Considérant qu'un jugement contradictoire constitue   un titre dont la réalité ne saurait être douteuse-, que la   Saisie-anêt n'est point une mesure d'exécution du juge- ment en vertu duquel e!le a été pratiquée, mais une me- sure conservatoire du droit conféré au crémeier par ce  jugement; que le créanuYr est dispensé de la discussion  contradictoire de son titre ou de son droit à la créance  au moment de la saisie-arrêt, pui>q <e l'article 6o9 du  Code de procédure civile se borne à exiger la simple énon- ciation du titre en tète des saisies-arrêts formées soit en  vertu d'actes authentiques, soit en venu d'actes privés;  que cette mesure ne préjudicie pis aux droits du sa si  qui, dans le cours de l'instance en va idité, est appelé à  discuter et les causes de cette saisie et la validité et la  régularité du titre;   « Considérant qu'en l'état, les saisies-arrêts pratiquées   par Téiard avant la signilication du jugement -en vertu  duquel elles etaieut faites ont bien procé té, et que c'est  à toit que les premiers juges en ont prononcé la main-  % RUE";7 août;"COUR D'APPEL DE PARIS 4"" ch";http://www.enap.justice.fr/ARCHIVE/18730830.pdf;187308302
187308303;"« Le Tribunal,   a Attendu que Lemoine, en louant dans la même mai-  son deux boutiques, l'une à la veuve Martin pour y tenir   un restaurant, l'autre aux érioux C.irrau pour y tenir un   café-restaurant, a formellem nt imposé à chai-un de ses  locataires l'obligation de rester dans la spécialité de leur  industrie ainsi déterminée ;   « Ait uidu que la limite de la spécialité doit être inter-  prétée par l'usage, contemporain-à la date du premier  bail de la veuve Martin, remontant à 1840, et dans lequel  il était dit que l'établissement du café-restaurant qui  prét-xbtait ne serait pas considéré comme un établisse- ment analogue au sien ;   « Attendu qu'à cette époque où les différentes branches   du commet ce parisien étaient plus séparées, les cafes- restaurants ne donnaient pas à diuer, sauf certaines ex- ceptions applicables à des maisons qui conservaient l'an- cien titre de cafés, sous lequel leur réputation s'élait  faite, mais qui en réalité étaient devenus de véritibies  restaurants, n'étant retenus dans la tendance de l'exten- sion par aucune prohibition conventionnelle ;   « Attendu que telle n'est pas la situation des époux  Carrau, tenus de se renfermer dans les limites assignées  par leur bail et de ne pas faire concurrenceà leur co-lo- cataire ;   « Attendu que, jusqu'aux faits signalés par la demande   la démarcation des industries avait été observée par les  propriétaires du café-restaurant, conformément à la dis- tinction ci-dessus établie, interprétant eux-mêmes la por- tée de leurs droite ;   « Attendu, eu fait, qu'il résulte des procès-verbaux de   constat des 11 mai et 27 juin 1871, que les époux Car- rau donnent habituellement à dîner et à déjeuner à la  ca'te et à prix fixe; qu'ils ont fait appel au public par  affiches et ecriteaux placés dans leur étab.issetnent, ainsi  transformé en restaurant, relativement aux déjeuners  qu'ils peuvent fournir ;   « Aitendu que le prix fixe est un élément de concur- rence au restaurant, insolite et contraire à la nature d'un  café-restaurant qui ne sert des aliments chauds qu'acces- soirement et accident-llement ;   « Attendu que l'infraction dénoncée par la demande   est donc constante et doit être réprimée ;   a Aitendu qu'il appai tenait au bailleur de veiller à   l'exécution du double bail par lui cousanti et qu'il a été  régulièrement assigné comme responsable des faits de ses  locataires faisant préjudice au demandeur ; que le préju- dice peut être évalué à 600 francs ;   « Sur la demande en garantie de Lemoine contre les   époux Carrau :   « Attendu que les défendeurs en garantie ont commis   la faute qui a motivé la demande principale et qu'ils  doivent garantir Jeur bailleur vis-à-vis de qui seulement  la veuve Martin avait actiou dirtete ;   « Par ces mot'fs,  « Fait défende à Carrau de servir aucun diner, de   donner des déjeun rs à prix fixe ;   « C mdamne Lemoine à payer à la veuve Martin la   somme de 600 francs, à raison du préjudice causé par  f infr iciion de Carrau ;   o Ordonne que, dans les vingt quatre heures de la si-  gnification du présent jugement, il Srra procédé à l'en- lèvement et à la suppression de tous écriieaux et affiches  contraires au\ droits dont s'agit sous une abstreiute de  10 bancs par chaque jour de retard, pendant un mois,   après quoi il sera statue;   cès-verbaux de constat;   a Condamne Lemome aux dépens, y compris les pro-  « Condamne les époux Carrau à garantir Lemoine des   condamnations ci-des us prononcées, en principal et  frais et aux dépens de la demande en garantie. »";8 juillet;COUR D'APPEL DE PARIS o* ch;http://www.enap.justice.fr/ARCHIVE/18730830.pdf;187308303
187308304;"« La Cour,  « Vu la connexité, joint les causes;  « En ce qui louche l'appel des époux   Lemoine;   Carrau contre   « Adoptant les motifs des premiers juges:  « En ce qui touche l'appel éventuel de Lemoine contre   « Adoptant les motifs des premiers juges ;  « En ce qui touche les conclusions additionnelles de   la veuve Martin ;   « Considérant qu'il est justifié par la veuve Martin  d'un préjudice par elle souffert depuis le jugement dont  ébï appel, et que la Cour, d'après lès clauses d'ap^récîa-  tion qu'elle possède, fixe à la somme de 300 fr.;   « Met les appellations au néant;   « Ordonne que le jugement dont est appel s^ra exé-  cuté selon sa forme et teneur ;   « Et, statuant sur les conclusions additionnelles de la   veuve Martiu :   « Condamne Lemoine, en sus des condamnations déjà   contre lui prononcéas, à payer à la v^uve Martin, la  somme de 300 francs, pour le préjudice à elle causé de- puis le jugement:   « Condamne les époux Carrau à garantir Lemoine de   la condamnation susénoncée;   « Condamne Lemoine à l'amende et aux dépens d'ap-  pel ;   « Condamne les époux Carrau en l'amende et aux dé- pens de leur appel et à garantir Lemoine de la coudam.  nation aux dépens ci-dessus prononcée. »";8 juillet;COUR D'APPEL DE PARIS o* ch;http://www.enap.justice.fr/ARCHIVE/18730830.pdf;187308304
187308305;"« Le Tribunal,  « Attendu que des articles 22, 438, 458 et 531 du Code   de commerce combinés, il résulte que les associes en nom  collectif étant tenus solidairement des engagements so- ciaux, la faillite de la société entraîne de plein droit celle  de chacun des associés ;   <■' Que, par jugement du Tribunal de commerce du 6  décembre 1867, les hères Delamontagne ont été déclarés  en faillite;   « Que, par jugement du 28 février 1868, le premier   jugement a été rendu applicable aux frères Delamontagne,   et a Blot, ayant fait le coanmerce sous la raison sociale :  Delamontagne frères et Bot;   « Qu'à la date du 19 juin ÏB72, le concordat de Léoa   Delamdûfegwa a été hoimoTdguB;   neuii ; q l'ils  eu quelque comifr  I « Ait' n lu que l'enlèvement   iont pas été affamés; qu'ils ont tou  mmuiiioatinn libre pôûr se ravitailler;   oni toujours   « Infirme, et statuant au principal :  « Déclare Dru,on mal fondé dans sa demande, l'en   des b es de fêtard est un   d iboute et le condamne aux dépens de première instance   levée ;   et d'appel. »";24 juillet;TRIBUNAL CIVIL DE LA SEINE ch;http://www.enap.justice.fr/ARCHIVE/18730830.pdf;187308305
187309010;"« Le Tribunal,   (l Attendu que le 24 juin 1871, Pélardy était occupé à   Nanteuil en compagnie de Lefebvre, garde champêtre, à  nettoyer une ruelle longeant le mur du jardin apparte-  nant à Guibert ;   « Attendu qu'à sept heures et demie du matin ce mur   s'écroula sur une longueur de 13 mètres, ensevelissant les   deux ouvriers sous les décombres ;   « Attendu que Lefebvre fut relevé avec quelques con-  tusions seulement, mais que Pélardy, au contraire, plus  malheureusement atteint avait le crâne ouvert, et trans- porté immédiatement à l'hospice, il y expira quelques  instants après ; que par suile de ce décès la famille Pé-  lardvest dans la plus grande détresse;   «""Attendu que ce mur n'était pas suffisant pour sou-  tenir les terres du jardin qu'il avait à,.supporter, qu'il   était vieux et bâti avec de mauvais matériaux et qu'il  n'était pas entretenu ; que Guibert est donc responsable   de cet accident;   « Attendu qu'une rente de 600 francs par an serait   eme juste réparation du préjudice causé à la \euve Pé-  îirdy par le décès ds son mari ;   « Par ces motifs, k^'-V* JI   « Condamne Guibert à payer à la veuve Pélardy, ès   noms, une rente annuelle, alimentaire et viagère de  600 francs payable par mois et d'avance à son domicile;   « Et condamne Guibert aux dépens. »";17 juillet;"COUR D'APPEL DE PARIS 4"" ch";http://www.enap.justice.fr/ARCHIVE/18730901.pdf;187309010
187309030;"« Le Tribunal ,  « Attendu que s'il est établi et reconnu d'ailleurs, par  les défendeurs eux-mêmes, que Napoléon Lemarrois était  débiteur d'une certaine somme, au moment de son décès,  envers Debrion, il résulte des documents produits, et no- tamment d'une lettre de Debrion, au valet de chambre  de Lemarrois, en date du 31 janvier 1868, laquelle sera  enregistrée avec le présent jugement, que Debrion ser-  vait habituellement d'intermédiaire entre Lemarrois et des   prêteurs d'argent qui lui faisaient des avances à des con-  ditions usuraires ;   « Attendu que par la lettre susénoncée, il est établi   que pour un prêt de trente-sept obligations des docks  du Havre, au cours de 302 francs, on exigeait de Le- marrois une reconnaissance de 18,030 francs, et qu'il  résulte de l'ensemble de la correspondance que ce genre  d'opérations est conforme aux habitudes de Lemarrois et   de ses prêteurs ;   « Que dans ces circonstances on ne peut admettre que  les billets produits au nom de Debrion etqui n'ont d'autre  cause que des prêts d'argent représentent des sommes  dues intégralement par leur souscripteur ;   « Qu'en prenant pour base d'appréciation les opéra-  tions révélées par les documents susénoncés, on est   amené à réduire la dette de Lemarrois à la somme de   50,000 francs;   « Par ces motifs,   « Donne acte à Léon Lemarrois de ce qu'il déclare re-  prendre au nom et comme tuteur du mineur Jacques  Lemarrois l'instance commencée entre Napoléon-Jules  Lemarrois, père dudit mineur et la veuve Debrion ;   « Condamne Lemarrois, ès noms, envers ladite femme,   au paiement de ladite somme de 50,000 francs, avec les   intérêts du jour des protêts des billets ;   « Déclare la veuve Debrion mal fondée dans le surplus   «le sa demande ;   « L'en déboute ; <  € Condamne Lemarrois, ès noms, aux dépens. »";17 juillet;COUR D'APPEL DE PARIS ¥ ch;http://www.enap.justice.fr/ARCHIVE/18730903.pdf;187309030
187309031;"« La Cour,  « Considérant que la séparation de corps a été pro-  noncée contre la femme L..., par jugement définitif du  Tribunal, qui lui a alloué une pension de 6,000 francs ;   « Que ladite femme L... ne peut plus demander autre   chose que cette pension, et notamment aucun droit  d'habitation dans le château, qui est le domicile du   m « Considérant que jusqu'à la fin de la liquidation de   la communauté, le mari en a seul l'administration, dans  laquelle il ne peut être entravé par la présence de sa  femme, à qui il a été fait défense de le hanter et   fréquenter ;   « Considérant dès lors qu'il n'y avait pas heu d or-  donner que la jouissance du château serait partagée ;   « Infirme ;  « Dit qu'il n'y avait lieu à référé ;  « Condamne la femme L... à l'amende et aux dépens. »";17 juillet;COUR D'APPEL DE PARIS ¥ ch;http://www.enap.justice.fr/ARCHIVE/18730903.pdf;187309031
