id;page;arrêt;date;juridiction;lien;id
18160137;238;LA COUR    Joint les appels  et statuant sur le tout   Considérant que la loi d'institution du jury ne lui confère de pouvoir que relativement à l'action publique et a la personne de l'accusé   que la declaration de non culpabilité ne pouvant être que le resultat de l'insuffisance des preuves à l'appui de l'accusation   ne peut produire   comme consequence nécessaire  la démonstration de la fausseté des faits  soit de la plainte  soit de la dénoncration au ministère public   que toutes dispositions ultérieures dans l'intérêt privé des parties et sur toutes demandes à fins civiles  sont de la compétence exclusive des juges  qu'ainsi il est reconnu en droit  et il a été jugé entre les parties  que la question des dommages et intérêts en faveur de l'accusé acquitté était toute entière à l'arbitrage des juges    Considerant que la réponse des jurés   dans les termes déterminés par la loi  devant être la même   soit parce que  le crime ne leur paraîtrait pas constant  soit parc» que l'accusé ne leur paraîtrait pas en être convaincu  l'acquittement ne peut établir comme vérite judiciaire  Et Décisions diverses  235  que le crime n'a pas été commis   que   notamment en matière de faux où les questions principales determinées par le Code présentent la même alternative  la declaration de non culpabilite par le jury laisse nécessairement incertaine l'existence ou la non existence du faux  et plus encore toutes les autres questions de fait et de droit relatives aux pièces arguées de faux  qu'ainsi il est reconnu en droit  comme conséquence nécessaire de la législation actuelle en matière criminelle  que les ordonnances d'acquittement n'ont l'autorité de la chose jugée que dans ce sens unique  que l'accusé acquitté ne peut être soumis de nouveau à une instruction criminelle pour le fait à raison duquel il a été acquitté   que les principes de la jurisprudence  ancienne sont sans application sous la législation actuelle  la raison de cette jurisprudence dérivant de la plénitude de la puissance qu'avaient alors les juges de juger tout à la fois le procès fait à l'accusé et le procès fait aux pièces  de statuer civilement et criminellement sur l'intérêt public et l'interêt privé de toutes les parties   Considérant que l'ordonnance d'acquittement de Reynier ne pouvant avoir la force de la chose jugée dans le procès civil ne avant l'accusation de faux  toutes exceptions ne fait et de droit peuvent être opposées contre le traite daté du 20 janvier 1806   que si les faits qui peuvent paraître dès à présent constans suffisent pour détruire la foi invoquée pour ce traité  toute instruction ultérieure  laissée a l'arbitrage des juges  serait surabondante et frustratoire   Considérant que l'état matériel du traité dont il s'agit démontre comme constant  en fait  quil énonçait origi  mûrement la rue Cisalpine  n° 4  comme lieu du domicile de Reynier  que depuis la demande  le mot Cisalpine a été surchargé du mot Courselle  et que du nombre 4 il a été fait le nombre 14 considérant que Reynier n'a demeuré rue Cisalpine  n°  4  que posterieu rement à l'année 1806  qu'ainsi l'énonciation primitive de ce domicile prouve que la date du 20 janvier 1806 a été supposée  que de cette premiere circonstance resulte la preuve de la supposition d'un paiement de 400 000 fr fait a cette époque  Considérant que l'état matériel du traité prétendu du 20 janvier 1806  fait reconnaître que l'appi obation d'écriture et la signature Michel étaient apposées avant que fussent ecrits les huit articles composant cet acte  que la première feuille au recto et au verso offre des lignes plus resserrées  et la deuxième  des lignes plus espacées pour aboutir à la signature et aux mots qui la précèdent    Considérant enfin que de cet état matériel de l'écrit  et de la réunion des faits  pièces et circonstances de la cause il résulte des presomptions graves  precises et concordantes de la supposition totale du traité sous la date du 20 janvier 1806  et qu'il est l'oeuvre du dol et de la fraude  a mis et met les appellations au néant  ordonne que ce dont est appel sortira son plein et entier effet  declare le présent arrêt commun avec les syndics de la faillite Boissiere  condamne Reynier et les syndics de la dite faillite  chacun à leur égard  en l'amende de  10 francs et aux dépens des causes d'appel et demandes  etc   ordonne que l'écrit sous la date du 20 janvier 1806 sera bâtonne et restera déposé au greffe   ; 28 février 1815.; Cour d'appel de Paris.;https://gallica.bnf.fr/ark:/12148/bpt6k61446389/f238.image;18160137
18160138;241;LA COUR    En ce qui touche l'appel interjeté par les parties de Moreau (heritiers Doscot)  du jugement du 7 août 1806  antérieur à la mise en activité du Code de procédure    Attendu que ce jugement  renfermant des dispositions préparaton es et interlocutoires  a pu être attaque après le délai de trois mois de la signification   Au principal  attendu que la donation faite par MarieVictoire Doscot à Pierre Jumel  son mari   dans son contrat de mariage du 14 frimaire an 5   de la jouissance en usufruit des biens qu'elle laisserait  est une libéralité éventuelle faite à cause de mort  laquelle ne peut être attaquée de nullité pour défaut d'insinuation   cette peine n'étant prononcée par les lois que pour les donations entre vifs non insinuées   Mais attendu que la libéralité faite par ladite Doscot à Pierre Jumel   est susceptible de la réduction légale prononcée par la loi du 17 nivose an 2  au profit des enfans existans au décès du donateur ou de la donatrice  que par l'effet de cette réserve  Pierre Victor Jumel a recueilli la succession de sa mère en totalité pour la nuepropriété   et en usufruit pour la moitié  l'autre moitié étant déféree à son père par la donation    En ce qui touche les fruits perçus   attendu que chaque héritier ou copartageant doit rapporter à la masse ce qu'il a touché  et faire raison de ce qui excède sa part et portion    En ce qui touche l'appel incident interjeté par les parties de Bourgois (Jumel père et fils )  du jugement du 7 août 1806  en ce qu'il reconnaît Simon Hude comme cessionnaire de Pierre Doscot  attendu que la condamnation à mort par contumace n'opère la mort civile qu'autant que le jugement a été suivi de l'exécution par effigie  et que les parties de Bourgois n'ont pas justifie de cette exécution   Par ces motifs  met les appellations et ce dont a été appelé au néant  émendant   ordonne que dans le partage de la succession de Marie Victoire Doscot  Pierre Jumel ne viendra que pour une moitie en usufruit   Le surplus des autres dispositions du jugement dont est appel sortissant son plein et entier effet  notamment en ce qu'il reconnaît Simon Hude comme cessionnaire de Pierre Doscot  Dépens compensés  etc   ; 10 mai 1815. ;Cour d'appel de Paris. ;https://gallica.bnf.fr/ark:/12148/bpt6k61446389/f241.image;18160138
18160139;242;LA COUR    Faisant droit sur l'appel interjeté par  la femme Dhaltz et son mari  audit nom  du jugement  rendu au tribunal civil de la Seine  le 20 août 1814    ensemble sur les autres demandes des parties   et adoptant  adoptant motifs des premiers juges  a mis et met l'appor   Et Décisions diverses  239  lation au néant  ordonne que ce dont est appel sortira son plein et entier effet  condamne la femme Dhaltz en J'amende et aux dépens  sur le surplus des demandes  fins et conclusions des parties  les met hors de Cour   ; 26 mai 1816.;Cour d'appel de Paris. ;https://gallica.bnf.fr/ark:/12148/bpt6k61446389/f242.image;18160139
18160140;243;LA COUR   Vu l'art  901 du Code civil  portant   » Pour faire une donation entre vifs ou on testament  » il faut être sain d'esprit  »  Attendu que l'article 504  du même Code  ne s'applique point aux dispositions à titre gratuit  et par conséquent n'est pas en opposition avec celui qui est ci devant transcrit  )  Attendu que l'énonciation du notaire dans l'acte tes ' tamentaire par lui reçu   que la testatrice était saine d'esprit  atteste bien son état apparent aux yeux du notaire  mais non l'état reel et habituel de la testatrice  et qu'alors la preuve testrmoniale de la démence peut être admise sans altérer la foi due aux actes des notaires  et sans qu'il soit besoin de prendre la voie de l'inscription de faux    Attendu que lorsqu'il s'agit de l'état des personnes  et sur tout de l'etat d'une personne décédée  dont la mémoire doit être plus particulièrement respectée de ses parens et héritiers  la preuve testimoniale ne peut être ordonnée qu'autant que les faits articulés sont graves  convenablement circonstanciés  et contenant les principales époques auxquelles ils se rapportent   Et vu que les faits  tels qu'ils sont proposés par Ozanne et son épouse  n'ont point ce caractère   Ordonne   avant faire droit  que les appelans seront tenus de signifier les faits dont ils demandent à faire preuve  avec les époques et les circonstances en tel cas requises  pour ensuite être statué ainsi qu'il appartiendra  dépens réservés   ; 3 mai 1816.;Cour royale de Rouen.;https://gallica.bnf.fr/ark:/12148/bpt6k61446389/f243.image;18160140
18160141;244;LA COUR    Vu le contrat de mariage des époux Hericher  fait sous leurs seules signatures privées  et sans assistance de parens  le 28 mars 1794  et enregistré à Caen le 21 mars 1815    Attendu que la donation contenue en l'art  4 de ce contrat ne peut être considérée comme une donation mutuelle ou à cause de mort  puisqu'elle ne contient point de dispositions réciproques   et que les choses données par la femme à son marine sont point subordonnées a l'événement du décès la donatrice   Attendu que la disposition dont il s'agit embrasse  tous les biens présens de la donatrice   en tant que la loi lui en permet de disposer  qu'elle investit actuellement l'époux donataire de la propriété des biens donnés sans aucune condition de survie  qu'à la vérité elle s'étend aussi aux biens à venir  mais que cette circonstance n'est d'aucune consideration  vu que l'objet de la réclamation des héritiers de la femme Hericher  ne porte que sur des biens dont elle était saisie à l'époque du 28 mars 1794  qu'ainsi la doration quant aux biens en question  est une véritable donation entrevifs dont le caractère est d'autant moins contestable que  par 1 art  5 du même contrat  la femme  en cas de predécés de son mari  ne s'est réservé que le simple usufruit des choses données   Vu  en droit  l'art 1er  de l'ordonnance de 1731  portant  etc    Attendu que le contrat de mariage contenant la donation entre vifs dont il s'agit est sous signature privée   Attendu qu'on ne peut même invoquer en sa faveur le degré de foi que la jurisprudence normande accordait aux contrats de mariage sous seing privé  qui étaient Souscrits de la signature des principaux parens  en outre celle des époux    La Cour  etc   réformant  déclare nulle et de nul effet la donation entre vifs faite par le contrat de mariage du 28 mars 1794  etc  ; 24 avril 1816.;Cour d'appel de Rouen. ;https://gallica.bnf.fr/ark:/12148/bpt6k61446389/f244.image;18160141
18160142;244;LA COUR   Attendu que le Code  de procédure civile portant qu'un jugement qui ordonne une enquête doit contenir nomination du commissaire devant qui l'enquête doit être faite  le délai pour faire enquête ne court de la signification du jugement  qu'autant que ce jugement est complet  aux termes du Code  par la nomination du commissaire  que  dans l'espèce  le jugement du 21 mai 1812  qui prescrit l'enquête  et auquel il a été acquiescé en cette partie  ne contenait pas nomination de commissaire  et qu'il n'a été supplée à cette imperfection que par le dernier jugement du 24 mai 1814  dont est présentement appel  et qui nomme pour commissaire le président du tribunal   qu'ainsi ce n'est que de la signification de ce dernier jugement que le delai a pu courir  faisant droit sur l'appel  met l'appellation au néant  ordonne que dont est appel sortira effet  '  ; 2 janvier 1815.; Cour d'appel de Paris. ;https://gallica.bnf.fr/ark:/12148/bpt6k61446389/f244.image;18160142
18160143;290;"   Attendu  en principe  général  qu'on ne peut appeler des différens jugemens rendus durant le cours de l'instruction d'une affaire  et avant le jugeaient définitif  qu'autant qu'ils préjugent le tond  que  sous ce premier rapport  l'appel interjeté de la décisiou du 50 novembre dernier  par laquelle la chambre dû conseil du tribunal de première instance de Colmar a refusé de mettre en liberté provisoire les prévenus Jean Meyer  Jean Louis Siffert  Xavier Mann et FrançoisXavier Frey  tous domiciliés à Ensisheim  et détenus dans la maison d'arrêt de Colmar  est non recevable dans la forme  par la raison que cette décision n'influe nullement sur le jugement définitif de condamnation ou d'absolution que le tribunal de police correctionnelle sera dans le cas de rendre par la suite   Attendu d'un autre côté  que l'article 114 du Code d'instruction criminelle  qui permet au prévenu  passible seulement d'une peine correctionnelle  de demander sa liberté provisoire  moyenaut caution de se représenter  confère  pour l'accorder  un droit purement facultatif à la chambre du conseil  et n'impose point aux magistrats l'obligation de déférer à cette demande   même contre leur opinion   qu'il résulte des dispositions textuelles de cet article  que la loi s'en rapporte entièrement à la prudence et à la sagesse de cette chambre  soit pour faire jouir le prevenu de la faveur d'une liberté provisoire  soit pour la lui refuser  que par conséquent présupposer des erreurs dans la décision de la chambre du conseil  et reconnaître au prevenu le droit de se pourvoir contre celte décision   et de la faire réformer par voie d'appel  serait évidemment détruire ce pouvoit discrétionnaire que la loi précise d'une manière si claire  en disant   « La chambre du conseil « pourra ordonner que le prévenu sera mis provisoire» ment en liberté  ""  Que vainement  objecterait on  le second paragraphe de l'art  114 du même Code   qui autorise le prévenu à demander sa liberté provisoire en tout état de cause  qu'il n'en résulte pas que la liberte provisoire refusée par la chambre du conseil  puisse être ensuite accordée par voie de réformation ou de révision  mais seulement que la chambre du conseil ne serait pas liée par un premier refus  et qu'elle pourrait accorder la liberté provisoire sur une nouvelle demande qui lui en serait faite que pareillement le prévenu qui aurait négligé de demander sa liberté provisoire  ou qui ne l'aurait pas obtenue à la chambre du conseil  pourrait la solliciter  devant le tribunal de police correctionnelle saisi de l'affaire après l'ordonnance de renvoi de la chambre du conseil  ou devant la Cour royale également saisie de l'affaire après le jugement dont l'appel serait interjeté  Attendu enfin que la Cour peut d'autant moins s'occuper de l'appel qui lui est déféré par les prévenus susnommés  qu'elle n'est point encore saisie de la plainte qui a été portée contre eux  que l'instruction de la procédure n'est ni achevée ni complétée  que toutes les pièces se trouvent devant les juges inférieurs  dont la décision sur le fond n'est point encore rendue  qu'ainsi la Cour est tout à la fois et hors d'état et sans pouvoir à l'effet d'apprécier la légitimité des motifs qui ont déterminé la chambre du conseil à rejeter la demande de mise en liberté provisoire qui lui a été présentée     Par ces motifs  déclare les appelans non recevables dans leur appel   "; 16 décembre 1814. ; Cour d'appel de Colmar. ;https://gallica.bnf.fr/ark:/12148/bpt6k61446389/f290.image;18160143
18160144;291;    Considérant que les trente huit barriques de vin de Bordeaux  expédiées pour le compte du sieur Dillemann  les 1er  et 7 novembre 1812  ne sont arrivées que les 4 et 11 mai suivant  quoiqu'elles aient dû parvenir dans les cent vingt jours  sous la peine de la perte du tiers des frais de transport  hors le cas de force majeure légalement constaté   que cette force majeure n'est pas établie par les dispositions reçues les 15 et 17 juillet 1813par le juge de paix de Bancaire  puisque  l'ayant été en l'absence de l'une des parties   et sans citation   elles sont   par là même  suspectes de suggestion  et qu'en les admettant il résulte encore une lacune de plus de douze jours    Considérant que les faits récemment posés sont vagues  et qu'abstraction faite de leur analogie avec ceux indiqués par les dépositions dont on a parlé   ils ne rendent pas raison du retard de neuf jours résultant de la station des vins à Châlons sur Saône depuis le 15 jusqu'au 24 avril 1815  que d'ailleurs l'intempérie de la saison avait été calculée dans la fixation des cent vingt jours  que d'après l'usage du commerce  les cas de force majeure doivent être dans le moment même  en quelque sorte   constatés par l'autorité locale  qu'ici les temps contraires ont dû forcer souvènt à relâcher  qu'ainsi la perte du tiers des frais de transport est encourue    Considérant que les appelans ont reconnu devoir les 60 fr  auxquels ont été évalués l'altération et la perte sur deux barriques    Met l'appellation au néant  etc   ; 6 janvier 1815. ; Cour d'appel de Colmar. ;https://gallica.bnf.fr/ark:/12148/bpt6k61446389/f291.image;18160144
18160145;291;    Considérant que la faculté accordée par l'art  1912 du Cod  civ   au créancier d'une rente constituée en perpétuel  d'exiger le remboursement de son capital à défaut de paiement des arrérages pendant deux années  est un droit nouveau que l'on ne doit pas étendre a un autre cas que celui pour lequel il a été fait  Considérant que d'après la combinaison de cet article avec les art  1909 et 1910 du même Code  qui se trouvent sous la rubrique du contrat de prêt à intérêt  il est évi   288 Lois  dent que celui qui peut ainsi être contraint au rachat est le debiteur d'une rente constituée en perpétuel à prix d'argent   Considérant que la rente due par les époux Le Danois  n'est nullement de cette nature  qu'elle a  au contraire   pour cause la cession qui leur a été faite d'un immeuble    Considérant que les règles particulières  tant à l'exécution qu'à l'inexécution d'un semblable contrat  ne sont pas celles déterminées par le tit  10 du Cod  civ   relatif au contrat de prêt  mais bien celles établies au titre 6 relatif au contrat de vente  que dans ce dernier titre  on ne trouve aucune disposition semblable à celle contenue dans l'art  1912     qu'il est bien vrai  qu'à défaut de paiement   l'intimé a pu commencer des poursuites en expropriation forcée contre les époux Le Danois   mais que du moment qu'ils ont offert de payer les arrérages échus qu'ils avaient été autorisés d'acquitter   le premier juge n'aurait pas dû décider qu'ils étaient tenus au râchat du capital  par cela seul qu'ils en avaient laissé écheoir deux années sans s'en libérer à la première sommation qui leur en avait été faite   Considérant cependant que les obéissances passées par les époux Le Danois  n'étaient pas  dans le principe  tout à fait complètes  qu'en effet  ils n'ont obéi à payer que les arrérages échus et les frais faits jusqu'à l'instant de leurs offres   tandis qu'ils devaient également offrit les interêts des arrérages  dont la demande leur avait été explicitement faite par le commandement du 9 mars 1814   Considérant que cette circonstance pouvait rigoureusement autoriser le premier juge à déclarer les offres insuffisantes  mais que ce n'était pas un motif pour juger que le capital était exigible   Infirme le jugement dont est appel au chef qui a déclaré le capital de la rente dont il s'agit exigble   ; 13 mars 1815.; Cour royale de Caen. ;https://gallica.bnf.fr/ark:/12148/bpt6k61446389/f291.image;18160145
18160146;292;LA COUR    Faisant droit sur l'appel interjeté par Armand Léonce Varanchon de Saint Geniez fils  du jugement rendu au tribunal civil du département de la Seine le 16 août dernier    Attendu que Varanchon père s'est absenté   et que son absence a duré plus de trente ans   que pendant ce temps il n'a exercé aucune poursuite   et qu'ainsi  son' action en paiement du legs est prescrite   a mis et met l'appellation  et ce dont est appel au néant  émendant  decharge Varanchon fils des condamnations contre lui prononcées  au principal   declare Varanchon pere purement et simplement non recevable dans ses demandes   ; 21 avril 1815. ;Cour d'appel de Paris. ;https://gallica.bnf.fr/ark:/12148/bpt6k61446389/f292.image;18160146
18160147;303;     Faisant droit sur l'appel interjeté par Laîné et femme  du jugement rendu au tribunal civil de la Seine  le 15 mars dernier   et adoptant les motifs das premiers juges  amis et met l'appellation au néant  Ordonne que ce dont est appel sortira son plein et entier effet   déclare le présent arrêt commun avec Hottermann  pour être exécuté avec lui  suivant sa forme et teneur   condamne Laîné et femme en l'amende et aux dépens  ; 22 juillet 1815. ; Cour d'appel de Paris;https://gallica.bnf.fr/ark:/12148/bpt6k61446389/f303.image;18160147
18160148;333;LA COUR    Considérant que l'obligation contractée par Cardme  a été par lui exécutée a l'égard du paiement des intérêts à chaque époque d'échéance  sans réclamer aucnne réduction sur ses intérêts     qu'à la vérité  la loi du 3 septembre 1807  dispose  dans son art  5  qu'il y aura lieu à la restitution des intérêts perçus au delà du taux de la loi  ou à l'imputation sur le capital qui fait l'objet du prêt  sur la demande qui en sera faite par le débiteur    mais que cette imputation et cette restitution ne doivent être faites que du jour où la demande en est formée  que s'il en était autrement  on ferait produire sans stipulation  comme sans demande des intérêts  à une somme mobilière qui n'en produit point de sa nature     que l'obligation de Cardme a été par lui volontairement contractée et exécutée  et que son effet n'a dû cesser que du jour où il a réclamé le bénéfice de la loi qui ordonne l'imputation des intérêts sur le capital  que ce serait donner un effet rétroactif à cette demande que de la reporter aux époques où Cardme prétend la faire remonter    que la veuve Moultson a passé des obéissances de réduction aussitôt que la demande lui en a été formée  et que par conséquent  c'est de ce moment seul que la réduction doit être opérée sur le capital   Par ces motifs  ordonne que l'imputation de la somme de 2220 fr   montant des intérêts excédant le taux légal  sera faite sur le capital a payer  sans égard aux prétent   prétent    1816  IIe  Part   Cah 9   lions de Gardme relativement à l'imputation annuelle  ; 18 janvier 1816.;Cour royale de Caen. ;https://gallica.bnf.fr/ark:/12148/bpt6k61446389/f333.image;18160148
