id;page;arrêt;date;juridiction;lien;id
181601;9;LA COUR     Vu les articles 165 et 166 du Code de commerce    Attendu que le demandeur et le défendeur étant Français   ainsi que sujets de l'empire français  nul doute qu'ils sont justiciables dans l'espère  d'après les lois de l'empire   que les articles precites ont evidemment voulu prevoir tons les  cas dans lesquels le porteur d'une lettre de change protestée aurait besoin d'un délai plus long pour la signification de ce protêt et l'exeicice de son action  que supposer que l'espece actuelle  savoir d'un porteur qui doit signifier le protêt et assigner  par devant son tribunal du continent français   le rédant résidant aux Echelles du Levant ait été omise ici et abandonnée aux principes généraux  c'est supposer une absurdité qui ne saurait jamais être attribuee au legislateur  car s'il est vrai que  maigre que le Code judiciaire  au neuvième alinéa de l'article 59  autorise ce Français résidant en France à assigner un Français résidant aux Echelles du Levant  au domicile du procureur impérial  nous saisir de l'affaire un tribunal de France  le premier n'aurait pas moins dans le même cas la faculté d'assigner  d'assigner aux Echelles du Levant  où les lois de l'empire sont en exercice entre Français  il doit être également vrai que le demandeur doit jouir d'un délai suffisant pour le faire  sans quoi le bénéfice porté par ledit article  neuvième alinéa  se changerait en obligation  ce qu'on ne voit nulle part établi ni par l'esprit ni par la lettre de la loi    Considérant qu'il est aisé d'appliquer à l'espèce en question lés dispositions précitées du Code de commerce   si l'on observe que l'art  165 a fixe au porteur le délai de quinze jours pour le seul cas où son cédant réside dans la distance de cinq myriamètres   donc cette disposition n'est plus applicable  si le cédant réside audelà de cette distance   et et certes ( fût on obligé   en fausse hypothèse  de l'assigner au domicile du procureur impérial)  on ne peut prétendre  que  par la résidence du cédant  le législateur ait jamais voulu entendrecelle du procureur impérial   que  si ces dispositions du Code de commerce n'ont pas nominativement parlé des Français résidans à l'étranger  mais vivant par pri   Lois  vilége sous le régime des lois françaises   on ne doit pas moins les classer ou dans le dernier alinéa de l'art  165  ou dans ceux de l'art  166   dés qu'ils sont expressément exclus de la règle générale de l'article 165   que rien n'empêche non plus qu'on les classe dans le sixième alinéa de l'art  166   parce que  si les Echelles du Levant ne sont point à proprement parler des possessions françaises situées hors de l'Europe  le Code n'y régit pas moins par ses lois ses sujets  que  dans le premier cas  l'intimé Gervino aurait eu  pour l'exercice de son action contre Carpaneto  un jour de plus de quinzaine à chaque deux myriamètres et demi de distance de Gènes à Tunis  par la route continentale au delà des premiers cinq myriamètres   que dans le second  ce délai aurait été d'un an  d'apres la disposition du troisième alinéa de l'article 166  qui donne six mois  et celle du septième alinéa qui double ce delai en temps de guerre maritime   que dans l'un et l'autre cas  la signification du protêt et les poursuites en justice auraient été faites par Gervino en temps utile   met l'appellation au néant  et ordonne que les jugemens du tribunal de commerce sortiront leur plein et entier effet  etc  ; 13 août 1812.; Cour de Gênes. ;https://gallica.bnf.fr/ark:/12148/bpt6k61446389/f9.image;181601
181602;11;LA COUR    Adoptant les motifs des premiers juges  a mis et met l'appellation au néant  ordonne que ce dont est appel sortira son plein et entier effet   ; 17 novembre 1815. ; Cour royale de Paris. ;https://gallica.bnf.fr/ark:/12148/bpt6k61446389/f11.image;181602
181603;12;Attendu que le faux annulle tous les actes dont il est la base  et ne peut être couvert par aucune fin de nonrecevoir  autre que celle qui résulterait de la chose formellement jugee sur inscription de faux     Vu la sommation et déclaration signifiées par d'Asnières  d'avoué à avoué  du 1er  de ce mois  sursit à faire droit sur l'appel  dépens réservés   ; 8 mai 1815.; Cour d'appel de Paris.;https://gallica.bnf.fr/ark:/12148/bpt6k61446389/f12.image;181603
181605;14;LA COUR    Admet les sieurs Deelerck à prouver que la dame Belvaux a assiste au barreau  MM  Vanaelbroeck et Delonge au plaidoyer du 9 pluviose an 10   ; 29 juin 1808. ;Cour d'appel de Bruxelles.;https://gallica.bnf.fr/ark:/12148/bpt6k61446389/f14.image;181605
181606;18;LA COUR     Adoptant les motifs des premiers juges   a mis et met l'appellation au néant   ordonne que ce dont est appel sortira son plein et entier effet   ; 31 août 1815. ; Deuxième chambre. ;https://gallica.bnf.fr/ark:/12148/bpt6k61446389/f18.image;181606
181608;21;LA COUR    Attendu que  d'après l'art 456 du Code de procedure civile   tout appel doit être signifié a personne ou domicile  à peine de nullité    déclare nul et de nul effet l'appel interjeté par Leroy Dunatois  le 9 juin 1809  des jugemens rendus au tribunal civil de Pontoise  les 4 mai precédent et 8 dudit mois de juin  et le condamne en l'amende   ; 16 janvier 1811. ; Cour d'appel de Paris. ;https://gallica.bnf.fr/ark:/12148/bpt6k61446389/f21.image;181608
181609;41;LA COUR     Considérant que   par le contrat de vente du 2 mars 1811  la veuve Ségard s'est reserve le droit de remere pendant deux ans  et que la veuve Groslevin   cessionnaire de la veuve Ségard  a exercé ce droit dans le terme de deux annees  puisqu'elle l'a fait le 27 février 1813    Considérant qu'il importe peu que le procès verbal d'offres de ce jour ait été fait par deux notaires ou par un huissier  puisque la loi n'exige pas d'offres régulières pour l'exercice de la faculté de réméré  pourvu qu'il en conste  et qu'ici elles sont d'autant plus constantes  en effet  que la veuve Boudville en a même signé le procèsverbal   Considérant que ce n'est que dans le cas où la veuve Boudville   qui d'abord s'était bornée à demander un délai de conseil  s'est refusée ensuite à accepter lesdites offres   que la veuve Groslevin a dû se pourvoir en justice pour les faire décréter  qu'il n'a pas été nécessaire que la demande en decrétement fût également intentée dans les deux ans  et que tout l'effet qu'a produit le retard apporté à cette demande  a été de laisser la veuve Boudville en possession des biens par elle achetés   jusqu'à ce que ces offres fussent décrétées et ensuite réalisées   Considérant néanmoins que  suivant l'article 3673 du Code civil  lorsque l'acquéreur du bien vendu sous la réserve du droit de rémére a laissé plusieurs héritiers   cette faculté ne peut être exercée contre chacun d'eux  que pour sa part  et qu'en conséquence elle ne peut avoir lieu   dans l'espèce  que contre la veuve Boudville   tant en son nom qu'en sa qualité de mère et tutrice de ses enfans mineurs  et non contre Jean Baptiste Joseph Boudville  fils aîné du premier mariage de l'acquéreur  à qui la veuve Groslevin n'a point fait d'offres de remboursement   ni déclaré  dans le terme de deux ans   que son intention était de rentrer dans son bien   Faisant droit a l'egard dudit Boudville fils  a mis et met l'appellation au neant  ordonne que ce dont a été appelé sortira effet   condamne l'appelante aux dépens de la cause d'appel   faisant droit à l'égard de ladite veuve Boudville   tant en son nom qu'en sa qualité de mère et tutrice de ses enfans  amis et met l'appellation et ce dont a été appelé au néant  émendant  la condamne  ès dits noms et qualite  a abandonner et délaisser a l'appelante les parts et portions qui devraient lui appartenir  et a ses enfans dans le bien dont il s'agit  en lui payant et remboursant  à due concurrence  tant le prix principal que les frais et loyaux coûts de la vente du 2 mars 1811   avec restitution des fruits de la part de ladite veuve Boudville  ès noms et qualité  à compter du jour dudit remboursement   et aux dépens  tant de la cause principale que celle d'appel   ordonne que l'amen de consignée sera restituée   ; 17 décembre 1814.; Cour d'appel de Douai... ;https://gallica.bnf.fr/ark:/12148/bpt6k61446389/f41.image;181609
1816010;43;LA COUR    Adoptant les motifs des premiers juges  met l'appellation au néant  avec amende et  dépens   ; 4 mars 1815. ; Cour royale de Colmar. ;https://gallica.bnf.fr/ark:/12148/bpt6k61446389/f43.image;1816010
1816011;44;Attendu qu'un titre d'huissier  étant dans la seule et libre disposition du prince  n'est pas susceptible d'être vendu    a mis et met l'appellation et ce dont est appel au néant   émendant  décharge Canonne des condamnations contre lui prononcées   au principal  faisant droit sur les conclusions du procureur général du roi  déclare le traité du 19 octobre 1814  dûment enregistré  nul et  de nul effet  déboute en conséquence la veuve Huguenin de sa demande  etc   ; 12 octobre 1815. ; Cour royale de Paris. ;https://gallica.bnf.fr/ark:/12148/bpt6k61446389/f44.image;1816011
1816012;44;LA COUR    Attendu que pour déterminer la nature d'un acte  il ne faut pas s'en tenir à la dénomination qui lui a ete donnee  mais bien rechercher dans l'acte même les caractères qu'il porte et l'intention qu'ont eue les parties  que dans l'espèce présente  en considérant l'acte par ses effets qui n'ont été fixés qu'à la mort au testateur  il n'y a pas de doute qu'il n'eût pu être fait dans la forme des testamens   mais que d'après l'article 947 du Code civil  il pouvait également valoir  quant au fond  sous la forme d'une donation entre vifs  lorsqu'il s'agissait de disposition entre epoux   ainsi  sous ce rapport  le donateur était parfaitement le maître de disposer sous l'une ou l'autre forme    Attendu que l'on remarque dans l'acte dont il s'agit l'acceptation de la dona aire et l'autorisation du mari pour accepter  formalité essentielle dans la donation entre vifs  aux termes de l'art  932 du même Code   tandis qu'au contraire  elle eût suffi pour vicier un testament  que l'on y voit encore un pouvoir pour faire transcrire le même acte  ce qui ne convient pas plus à une disposition testamentaire   a quoi l'on peut ajouter enfin l'emploi d'un seul notaire  assisté de deux temoins  pour recevoir l'acte   ce qui ne peut non plus avoir lieu que pour les donations entre vifs  et non pour les testamens    Attendu que la réunion de ces trois signes ne permet pas de douter que l'intention du donateur n'ait été de faire  et celle de la donataire d'accepter une donation entre vifs   d'où il suit que le contrat doit être consideré comme contenant un acte de cette nature  et produire par conséquent tout son effet  etant inattaquable  tant dans la forme quau fond  eu égard à la qualité des parties   met l'appellation et ce dont est appel au neant   amendant  etc   ; 27 août 1814.; Cour d'appel de Paris;https://gallica.bnf.fr/ark:/12148/bpt6k61446389/f44.image;1816012
1816013;47;    Considérant en fait  qu'il existe quatre héritiers de Marie Jeanne Bertin   dont trois sous benéfice d'inventaire et le quatrième  lbert  héritier pur et simple  Considerant que l'héritier bénéficiaire  est  comme l'heritier pur et simple  obligé de rapporter a la succession les donations faites par la défunte  conformement à l'article 843 du Code civil  qu'ainsi  la modification du bénefice d'inventaire est sans effet a l'égard des coheritiers entre eux    Considérant que le privilége donné à l'héritier bénéficiaire  par l'article 802  n'est relatif qu'aux creanciers de la succession   que la faculte d'abandonner aux creanciers les biens d'heredite  n'est pas la faculté de renoncer à la succession après l'avoir acceptée  encore bien que cet abandon ait des effets equivalens a ceux d'une renonciation   qu'y ayant concours d'heritiers  l'acceptation de la succession a lié irrévocablement les uns envers les autres  que l'un d'eux  une fois héritier  ne peut plus cesser de l'être  ni presenter comme un titre de creance la donation qu il a abdiquée  par son acceptation de la succession   que c'est lors du partage seulement  que les droits de chacun d'eux pourront être reglés  soit pour les prélèvemens  soit  pour les rapports   sans s'arrêter ni avoir égard à la renonciation de Chasseriaux  ni aux conclusions et demandes dudit Chasseriaux  relatives à ladite renonciation dont il est débouté  a mis et met l'appellation au neant ordonne que ce dont est appel sortira son plein et entier effet  etc   ; 26 décembre 1815. ; Cour royale de Paris ;https://gallica.bnf.fr/ark:/12148/bpt6k61446389/f47.image;1816013
1816014;48;LA COUR    Attendu  En ce qui touche la masse de la continuation de communauté  que le contrat de mariage  portant établissement de communauté  contient la clause que ce qui adviendra aux époux par succession  donation  legs ou autrement  leur sortira nature de propres   que le défaut d'inventaire après le décès de l'épouse ne donnant point lieu  suivant la coutume de Paris   à une nouvelle communauté  mais seulement à la continuation de la communauté  d'où résulte que les stipulations de propres sous lesquelles cette communauté avait été contractée doivent avoir leur effet pendant sa continuation    met l'appellation et le jugement dont est appel au néant  en ce qu'il ordonne que le mobilier provenant des successions échues pendant la continuation de la communauté sera compris dans le compte que le sieur Menier a rendu à sa fille   Ordonne que sur la masse partageable il sera fait prelèvement au profit de Menier père   de l'actif des deux successions par lui recueillies en 1806 et 1808  etc   ; 23 novembre 1815. ; Cour royale de Paris. ;https://gallica.bnf.fr/ark:/12148/bpt6k61446389/f48.image;1816014
1816015;49;LA COUR    Considérant  Que les époux Letellier et Dutheil n'ayant pris d'inscription qu'en 1811  ne peuvent préférer les créanciers Duronelle qui ont pris antérieurement des inscriptions    Considérant que le fieffataire des sieurs Letellier et Dutheil s'est soumis  lors de son contrat de fieffe   à une clause résolutoire    Que ceux ci n'ont pu être préjudiciés à invoquer le bénéfice dé cette clause par leur demande en collocation du capital de leur rente   s'étant réservé  lors de la contestation sur leur rang d'hypothèque  à faire valoir la clause résolutoire de leur contrat   Que cette demande a été formée en temps utile   puisque les parties étaient en instance sur l'ordre de la distribution du prix de l'immeuble exproprié  et que c'était à cet instant que les titres et moyens des parties devaient être examinés    Qu'elle ne fait aucun préjudice aux autres créanciers qui ont l'option de rembourser les époux Letellier  et Dntheil  et que la dame Cramer ne peut s'imputer qu'à elle même le tort qu'elle peut en éprouver   parcequ'avant de prêter ses fonds elle aurait dû s'assurer à quel titre et à quelles conditions le sieur Durouelle possédait    A mis et met l'appellation et ce dont est appel au néant  etc   déclare le contrat du 16 octobre 1769 résolu   renvoie les époux Letellier et les époux Dutheil en pleine propriété  possession et  jouissance de la masure et bâtimens  ayant appartenu à Durouelle  et adjugé à Cécile  si mieux n'aiment les intimés payer auxdits Letellier et Dutheil ce qui leur est dû  etc   ; 4 juillet 1815. ; Cour royale de Rouen. ;https://gallica.bnf.fr/ark:/12148/bpt6k61446389/f49.image;1816015
1816016;49;Attendu que Legris   vendeur originaire   avait incontestablement  en vertu de la clause résolutoire stipulée daus son contrat  le droit de se faire envoyer en possession à défaut de paiement    Qn'il a fait prononcer cet envoi en possession contre son acquéreur  et que dès lors le contrat de fieffe étant anéanti ex antiquâ causâ  l'objet fieffé devait entrer dans les mains du propriétaire   libre de toutes dettes et hypothèques postérieures    Attendu que le jugement qui résilie le contrat  n'est exécuté que par la prise de possession    que cette prise de possession n'est pas effectuée  et que dès lors les créanciers d'Agasse peuvent encore désintéresser Legris en le rendant indemne     que la dame et enfans Coignet  comme créanciers d'Agasse  avaient qualité  Lois  pour s'opposer à la prise de possession tentée par le sieur Legris   mais en le désintéressant entièrement    que les obéissances qu'ils ont passées sont insuffisantes  et que la question relative à la nullité de l'inscription de la dame et enfans Coignet  ne doit être agitée qu'à l'état d'ordre contradictoirement avec tous les créanciers   La Cour a mis et met l'appellation au néant   ordonne que ce dont est appel sortira effet  etc   ; 15 juillet 1315. ; Cour d'appel de Rouen. ;https://gallica.bnf.fr/ark:/12148/bpt6k61446389/f49.image;1816016
1816017;50;LA COUR    En adoptant les motifs mentionnés au jugement dont est appel  et considérant  au surplus  qu'au moyen de la dévolution qui s'est opérée au profit des créanciers  leurs droits ont été fixés irrévocablement  et que d'ailleurs Dumoutier n'a eu aucune part à la vente des tonnes dont il s'agit    A mis et met l'appellation au néant  ordonne que ledit jugement sortira effet  condamne les appelans (les administrateurs de la régie) en l'amende et aux dépens de la cause d'appel   ; 3 janvier 1815. ; Cour d'appel de Douai. ;https://gallica.bnf.fr/ark:/12148/bpt6k61446389/f50.image;1816017
1816018;52;LA COUR    Considérant que d'après les dispositions de la loi du 11 ventôse an 2  c'est au conseil de famille seul qu'appartient le droit de nommer un curateur aux militaires   absens pour le service de la patrie  qu'a la vente cette loi a été provoquee pour l'ouverture des successions au profit de ces militaires  mais que le but évident du legislateur a eté de veiller à la conservation de leurs intérêts   qu'ils ne peuvent soigner par eux mêmes    Considerant qu'un conseil de famille est plus à même de discuter les interêts d'un militaire absent  et de lui constituer un administrateur  gerant sa fortune  qu'un tribunal qui nomme un curateur sur le simple exposé d'une requête  signee d'un individu qui peut induire sa religion en erreur   Considérant que la loi précitée n'est point abrogée par les dispositions du Code civil  puisque  par un décret du 16 mars 1807  posterieur a la promulgation du Code  elle est mise en vigueur dans les departemens alors nouvellement reunis a la France   Considerant  au cas particulier  que Frédéric Kunfz  de la fortune duquel il s'agit  etait encore en état de minorité lors de son depart comme réquisi ionnaire   que ses biens etaient par consequent administres par son tuteur   qu'etant devenu majeur pendant son service militaire  cette administration devait se continuer par ce tuteur  et qu'au cas où celui ci aurait voulu rendre compte de sa gestion  il ne pouvait le faire qu'envers le curateur qui aurait eté nommé conformement aux dispositions de la loi du 11 ventôse an 2  mais qu'en aucun cas il ne pouvait se d mettre de son autorité privee  d'une gestion que la loi conservait dans ses mains  et qu'elle seule pouvait lui ôter   Considérant que   dans l'état actuel  soit que Kuntz revienne  soit qu'il ne revienne plus  il est également important de lui faire constituer un curateur du choix  de sa famille  parce que dans l'une comme dans l'autre hypothèse  les droits des parties seront mieux soignés par le choix que le conseil de famille est intéresse a faire   La Cour met l'appellation et ce dont est appel au néant  faisant droit sur les réquisitions du ministère public   ordonne qu'a la diligence des intimés il sera convoque instamment une assemblée de famille  paroevant le juge de paix des lieux   à l'effet d'y être procédé a la nomination d'un curateur a l'absent  conformement a la loi  etc   ; 5 mai 1815. ; Cour d'appel de Colmar. ;https://gallica.bnf.fr/ark:/12148/bpt6k61446389/f52.image;1816018
1816019;52;LA COUR    Vu l'article 2129 du Code civil    Attendu que par l'acte du cautionnement passe devant le notaire d'elbeuf  le 18 octobre 1812  Langlois qui s'est soumis comme caution solidaire au paiement de la dette de 680 francs  envers Grente  sous l'obligation de tous ses biens  presens et a venir  n'a néanmoins hypotheque a cette dette génerale  qu'un seul de ces immeubles  borné et designe au dit acte   Attendu qu'il resulte de l'obligation générale contactée par l'acte de cautionnement  qu en cas d insuf   Et Décisions diverses  49  fisance de l'immeuble hypothéqué  le cré ncier pourra t  aux termes de l'art 2209 du Code  poursuivre l'expropr ation des meub es qui ne lui etaie t pas hypotheques  mais il ne s'en suit pas qu'il eût le droit de requerir   et les juges le pouvoir d'ordonner l'extension de l'hypotheque conventionnelle et spéciale au delà des limites qui lui avaient ete assignees par le contrat   Attendu que le créancier pouvait encore former une action en condamnation  de la somme a lui res ant due  auquel cas il se serait procuré une hypotheque judiciaire  en vertu du jugement qui aurait prononcé cette condamnation   Attendu qu'au lieu d'avoir pris aucune des voies que la loi lui laissait ouvertes  le créancier a forme une action contraire a son titre et aux dispositions de l'art  2129 du Code ci devant transcrit   met l'appellation et ce nont est appel au neant   corrigeant et reformant  declare Grente non recevable dans son action telle qu'elle est intentee  etc   ; 24 mai 1815. ; Cour d'appel de Rouen;https://gallica.bnf.fr/ark:/12148/bpt6k61446389/f52.image;1816019
1816021;54;LA COUR     Vu l'art 747 du Code civil  et considerant qu'il demeure constant  par la reconnaissance du 6 août 1811  que le sieur Lemarchand père a donne 50 000 fr  à son fils pour son établissement   Que Guillaumme Bruno Lemarchand  donataire  est décédé sans postérité    Que son père  en vertu de l'article précité   est appele a succeder aux choses par lui donnees  lorsque les objets donnes se retrouvent en nature dans la succession    Que la loi exige seulement que les objets donnés se retrouvent eu nature  et non pas qu ils soient identiquement les mêmes  qu'autrement ce serait rendre illusoires les dispositions de l'article 747  lorsque les choses données consisteraient en une somme  soit en espèces métalliques  soit en effets commerciaux   puisque si un père donne des espèces métalliques ou des effets de commerce à son fils qui veut s'etablir  c'est dans l'intention que celui ci fasse usage des capitaux donnés  et que dès lors  si ce fils vient à mourir sans posterité  il est bien certain qu'on ne retrouvera pas dans sa succession les mêmes espèces métalliques ni les mêmes effets commerciaux qui lui avaient ete donnés   Que la chose donnée par le sieur Lemarchand père se  retrouve en nature dans la succession de Guillaumme Bruno Lemarchand son fils  tant en numeraire qu'en effets de commerce  obligations et contrats  et que  conformement audit art 747  il a droit d'y succeder a l'exclusion de tous autres   Que si l'on considère le fils comme ayant porté ou aliéné temporairement la chose a lui donnee  le donateur  aux termes de cet arti le   a le droit de recueillir ce qui est dû  et même à succéder à l'action en reprise que son fils pouvait avoir   Qu'il est avantageux  et même utile pour la morale et l'intérêt public  de favoriser de pareils avantages de la part des pères en faveur de leurs enfans   Que  dans le fait particulier   il est reconnu qu'il existe dans la succession de Guillaume Bruno Lemarchand  tant en mémoires qu'en effets de commerce   obligations et contrats  au moins une somme de 62 420 fr   sauf au sieur Lemarchand père a contribuer aux dettes pro modo emolumenti   A mis et met l'appellation et ce dont est appel au néant  corrigeant et réformant  ordonne que Lemarchand père succédera exclusivement aux 50 000 fr  par lui donnés à son fils Bruno  et trouves dans sa succession  en argent  effets et obligations  avec les interêts  du jour de l'ouverture de la succession  pour les effets et obligations qui en produisent  etc   ; 11 janvier 1816, ; Cour royale de Rouen. ;https://gallica.bnf.fr/ark:/12148/bpt6k61446389/f54.image;1816021
1816022;55;LA COUR    Attendu que la notification prescrite par l'art 877 du Code civil  pour rendre exécutoire contre l'heritier un titre à la charge du defunt  n'est point un acte qu'on puisse classer parmi les actes de poursuite qui forceraient l'heritier à prendre qualité avant les délais    Que la saisie exécution  faite le 10 septembre 1814  est postérieure a l'expiration desdits délais   Qu'il est constant que Dorlin habite les lieux où la saisie exécution a été etablie  et que ce fait est prouvé  non seulement par la déclaration de la portière  mais par la teneur même du proces verbal de saisie  dans lequel on trouve un grand nombre d'effets personnels à Dorlin  et marqués des lettres initiales de son nom    Faisant droit sur l'appel  met l'appellation et le jugement dont est appel au néant  émandant  décharge la femme Chaumin et son mari des condamnations contre eux prononcees   Au principal  sans s'arrêter aux demandes de Lecomte et Dorlin  dont ils sont deboutés   ordonne que les poursuites en commencées seront continuées   ordonne la restitution de l'amende   condamne Lecomte et Dorlin aux dépends des causes principale et d'appel  dont les appelans seront remboursés comme de leur créance  ; 19 decembre 1814. ; Cour d'appel de Paris. ;https://gallica.bnf.fr/ark:/12148/bpt6k61446389/f55.image;1816022
